"DESCRIPTION","DURATION IN MS","NAME","PARENT SUITE","START TIME","STATUS","STOP TIME","SUB SUITE","SUITE","TEST CLASS","TEST METHOD"
"Test cases for TestParseVersion","0","TestParseVersion","","Fri Apr 03 21:31:21 UTC 2026","passed","Fri Apr 03 21:31:21 UTC 2026","","Go Test","github.com/specterops/bloodhound/cmd/api/src/version/TestParseVersion","TestParseVersion"
"Test cases for TestResources_ListADComputerSQLAdmins","0","TestResources_ListADComputerSQLAdmins","","Fri Apr 03 21:31:10 UTC 2026","passed","Fri Apr 03 21:31:10 UTC 2026","","Go Test","github.com/specterops/bloodhound/cmd/api/src/api/v2/TestResources_ListADComputerSQLAdmins","TestResources_ListADComputerSQLAdmins"
"","203","navigates to previous history entry when warning dialog is cancelled","EarlyAccessFeatures","Fri Apr 03 21:37:52 UTC 2026","passed","Fri Apr 03 21:37:52 UTC 2026","","","",""
"Test cases for TestTextUnmarshalInt","0","TestTextUnmarshalInt","","Fri Apr 03 21:31:12 UTC 2026","passed","Fri Apr 03 21:31:12 UTC 2026","","Go Test","github.com/specterops/bloodhound/cmd/api/src/database/types/null/TestTextUnmarshalInt","TestTextUnmarshalInt"
"","143","enables returning a list of tags","the useAssetGroupTags utilities","Fri Apr 03 21:33:10 UTC 2026","passed","Fri Apr 03 21:33:10 UTC 2026","","","",""
"","566","renders the form for creating a new rule","Rule Form","Fri Apr 03 21:32:32 UTC 2026","passed","Fri Apr 03 21:32:33 UTC 2026","","","",""
"","278","toggles parent from all to none","SourceKindsCheckboxes","Fri Apr 03 21:34:17 UTC 2026","passed","Fri Apr 03 21:34:18 UTC 2026","","","",""
"Test cases for TestResources_GetDatabaseCompleteness","102","TestResources_GetDatabaseCompleteness","","Fri Apr 03 21:31:10 UTC 2026","passed","Fri Apr 03 21:31:10 UTC 2026","","Go Test","github.com/specterops/bloodhound/cmd/api/src/api/v2/TestResources_GetDatabaseCompleteness","TestResources_GetDatabaseCompleteness"
"Test cases for TestManagementResource_UpdateUser_ETAC","1702","TestManagementResource_UpdateUser_ETAC","","Fri Apr 03 21:31:34 UTC 2026","passed","Fri Apr 03 21:31:36 UTC 2026","","Go Test","github.com/specterops/bloodhound/cmd/api/src/api/v2/auth/TestManagementResource_UpdateUser_ETAC","TestManagementResource_UpdateUser_ETAC"
"Test cases for TestMarshalInt64Text","0","TestMarshalInt64Text","","Fri Apr 03 21:31:12 UTC 2026","passed","Fri Apr 03 21:31:12 UTC 2026","","Go Test","github.com/specterops/bloodhound/cmd/api/src/database/types/null/TestMarshalInt64Text","TestMarshalInt64Text"
"Test cases for TestArgon2_Digest","0","TestArgon2_Digest","","Fri Apr 03 21:31:25 UTC 2026","passed","Fri Apr 03 21:31:25 UTC 2026","","Go Test","github.com/specterops/bloodhound/packages/go/crypto/TestArgon2_Digest","TestArgon2_Digest"
"","136","disables the create user button and does not populate a table if the user lacks the permission","Users","Fri Apr 03 21:34:05 UTC 2026","passed","Fri Apr 03 21:34:05 UTC 2026","","","",""
"","74","calls onSort when clicked with a tooltip","ColumnHeaders","Fri Apr 03 21:34:50 UTC 2026","passed","Fri Apr 03 21:34:50 UTC 2026","","SortableHeader with Tooltip","",""
"Test cases for TestMarshalInt64","0","TestMarshalInt64","","Fri Apr 03 21:31:12 UTC 2026","passed","Fri Apr 03 21:31:12 UTC 2026","","Go Test","github.com/specterops/bloodhound/cmd/api/src/database/types/null/TestMarshalInt64","TestMarshalInt64"
"Test cases for TestInt64Equal","0","TestInt64Equal","","Fri Apr 03 21:31:12 UTC 2026","passed","Fri Apr 03 21:31:12 UTC 2026","","Go Test","github.com/specterops/bloodhound/cmd/api/src/database/types/null/TestInt64Equal","TestInt64Equal"
"Test cases for TestIntFrom","0","TestIntFrom","","Fri Apr 03 21:31:12 UTC 2026","passed","Fri Apr 03 21:31:12 UTC 2026","","Go Test","github.com/specterops/bloodhound/cmd/api/src/database/types/null/TestIntFrom","TestIntFrom"
"Test cases for TestParseIntQueryParameter","84","TestParseIntQueryParameter","","Fri Apr 03 21:31:10 UTC 2026","passed","Fri Apr 03 21:31:10 UTC 2026","","Go Test","github.com/specterops/bloodhound/cmd/api/src/api/v2/TestParseIntQueryParameter","TestParseIntQueryParameter"
"","589","has status filters","FileIngestFilterDialog","Fri Apr 03 21:33:01 UTC 2026","passed","Fri Apr 03 21:33:02 UTC 2026","","Status Select","",""
"","120","displays pinned columns and unselected columns in the dropdown","ManageColumnsComboBox","Fri Apr 03 21:33:17 UTC 2026","passed","Fri Apr 03 21:33:17 UTC 2026","","","",""
"","603","does not allow confirmation while dates are invalid","FileIngestFilterDialog","Fri Apr 03 21:33:04 UTC 2026","passed","Fri Apr 03 21:33:04 UTC 2026","","Date Range Inputs","",""
"Test cases for TestResources_UpdateAssetGroupSelectors_GetAssetGroupError","0","TestResources_UpdateAssetGroupSelectors_GetAssetGroupError","","Fri Apr 03 21:31:10 UTC 2026","passed","Fri Apr 03 21:31:10 UTC 2026","","Go Test","github.com/specterops/bloodhound/cmd/api/src/api/v2/TestResources_UpdateAssetGroupSelectors_GetAssetGroupError","TestResources_UpdateAssetGroupSelectors_GetAssetGroupError"
"","0","should handle an entity that has an empty name property","Evaluating the entity display name from a given entity","Fri Apr 03 21:33:28 UTC 2026","passed","Fri Apr 03 21:33:28 UTC 2026","","","",""
"","148","displays extensions in a table when data is available","ActiveExtensionsCard","Fri Apr 03 21:32:35 UTC 2026","passed","Fri Apr 03 21:32:35 UTC 2026","","","",""
"Test cases for TestCache_FillFifo","0","TestCache_FillFifo","","Fri Apr 03 21:31:25 UTC 2026","passed","Fri Apr 03 21:31:25 UTC 2026","","Go Test","github.com/specterops/bloodhound/packages/go/cache/TestCache_FillFifo","TestCache_FillFifo"
"","530","renders trigger button and dropdown items","TagToZoneLabel","Fri Apr 03 21:32:25 UTC 2026","passed","Fri Apr 03 21:32:25 UTC 2026","","","",""
"","576","should render an SavedQueryPermissions component","SavedQueryPermissions","Fri Apr 03 21:35:21 UTC 2026","passed","Fri Apr 03 21:35:21 UTC 2026","","","",""
"","374","sets a primarySearch=id and searchType=node when secondarySearch is falsey","ContextMenu","Fri Apr 03 21:37:40 UTC 2026","passed","Fri Apr 03 21:37:40 UTC 2026","","","",""
"","304","should render a TagToZoneLabelDialog component","TagToZoneLabelDialog","Fri Apr 03 21:34:56 UTC 2026","passed","Fri Apr 03 21:34:56 UTC 2026","","","",""
"Test cases for TestKeyEncoder_Key_Deterministic","0","TestKeyEncoder_Key_Deterministic","","Fri Apr 03 21:31:24 UTC 2026","passed","Fri Apr 03 21:31:24 UTC 2026","","Go Test","github.com/specterops/bloodhound/packages/go/analysis/delta/TestKeyEncoder_Key_Deterministic","TestKeyEncoder_Key_Deterministic"
"","0","Will ignore colons after the first and use them as part of the keyword search","Parsing the debounced input for type and keyword values","Fri Apr 03 21:35:24 UTC 2026","passed","Fri Apr 03 21:35:24 UTC 2026","","","",""
"","1382","handles delete by source kind","DatabaseManagement","Fri Apr 03 21:37:44 UTC 2026","passed","Fri Apr 03 21:37:45 UTC 2026","","","",""
"","293","sets the calendar date to match the valid","ManagedDatePicker - value","Fri Apr 03 21:34:46 UTC 2026","passed","Fri Apr 03 21:34:46 UTC 2026","","","",""
"","80","when `selectedItem` is provided, the combobox displays the icon","icon rendering","Fri Apr 03 21:33:34 UTC 2026","passed","Fri Apr 03 21:33:34 UTC 2026","","","",""
"","1028","should call onSubmit with password when reset password button clicked","PasswordResetForm","Fri Apr 03 21:34:32 UTC 2026","passed","Fri Apr 03 21:34:33 UTC 2026","","","",""
"","735","should render an update user form","UpdateUserDialog","Fri Apr 03 21:32:48 UTC 2026","passed","Fri Apr 03 21:32:49 UTC 2026","","","",""
"","115","should hide Environmental Targeted Access Control panel when showEnvironmentAccessControls prop is false","UpdateUserForm","Fri Apr 03 21:32:27 UTC 2026","passed","Fri Apr 03 21:32:27 UTC 2026","","","",""
"","264","clears value if input is empty","ManagedDatePicker - input","Fri Apr 03 21:34:46 UTC 2026","passed","Fri Apr 03 21:34:46 UTC 2026","","","",""
"Test cases for TestResources_ListADEntityLinkedGPOs","5","TestResources_ListADEntityLinkedGPOs","","Fri Apr 03 21:31:10 UTC 2026","passed","Fri Apr 03 21:31:10 UTC 2026","","Go Test","github.com/specterops/bloodhound/cmd/api/src/api/v2/TestResources_ListADEntityLinkedGPOs","TestResources_ListADEntityLinkedGPOs"
"Test cases for TestResources_PatchDomain","3","TestResources_PatchDomain","","Fri Apr 03 21:31:10 UTC 2026","passed","Fri Apr 03 21:31:10 UTC 2026","","Go Test","github.com/specterops/bloodhound/cmd/api/src/api/v2/TestResources_PatchDomain","TestResources_PatchDomain"
"Test cases for TestUnmarshalInt64Overflow","0","TestUnmarshalInt64Overflow","","Fri Apr 03 21:31:12 UTC 2026","passed","Fri Apr 03 21:31:12 UTC 2026","","Go Test","github.com/specterops/bloodhound/cmd/api/src/database/types/null/TestUnmarshalInt64Overflow","TestUnmarshalInt64Overflow"
"","7","returns the remaining amount of zones available for creation","useTagLimits","Fri Apr 03 21:32:44 UTC 2026","passed","Fri Apr 03 21:32:44 UTC 2026","","","",""
"Test cases for TestResources_ListADEntityControllers","0","TestResources_ListADEntityControllers","","Fri Apr 03 21:31:10 UTC 2026","passed","Fri Apr 03 21:31:10 UTC 2026","","Go Test","github.com/specterops/bloodhound/cmd/api/src/api/v2/TestResources_ListADEntityControllers","TestResources_ListADEntityControllers"
"Test cases for TestResources_ListRootCAPKIHierarchy","0","TestResources_ListRootCAPKIHierarchy","","Fri Apr 03 21:31:10 UTC 2026","passed","Fri Apr 03 21:31:10 UTC 2026","","Go Test","github.com/specterops/bloodhound/cmd/api/src/api/v2/TestResources_ListRootCAPKIHierarchy","TestResources_ListRootCAPKIHierarchy"
"TestMigrator_GenerateManifest tests the full integrity of a Manifest generatedfrom 3 different Source's:1) Correct number of total migrations detected.2) Correct number of versions detected.3) The VersionTable has all versions, in order.4) All versions have the correct number of migrations.5) Schema files generate v0.0.0 migrations.6) Migrations are ordered within each version, in the order the Source was defined.","1","TestMigrator_GenerateManifest","","Fri Apr 03 21:31:11 UTC 2026","passed","Fri Apr 03 21:31:11 UTC 2026","","Go Test","github.com/specterops/bloodhound/cmd/api/src/database/migration/TestMigrator_GenerateManifest","TestMigrator_GenerateManifest"
"Test cases for TestJSONFloat_MarshalJSON_NaN","0","TestJSONFloat_MarshalJSON_NaN","","Fri Apr 03 21:31:12 UTC 2026","passed","Fri Apr 03 21:31:12 UTC 2026","","Go Test","github.com/specterops/bloodhound/cmd/api/src/database/types/nan/TestJSONFloat_MarshalJSON_NaN","TestJSONFloat_MarshalJSON_NaN"
"","69","enables pulling an ordered list of tags by position ascending","the useAssetGroupTags utilities","Fri Apr 03 21:33:10 UTC 2026","passed","Fri Apr 03 21:33:10 UTC 2026","","","",""
"","56","hides loading state when data is available","SourceKindsCheckboxes","Fri Apr 03 21:34:16 UTC 2026","passed","Fri Apr 03 21:34:16 UTC 2026","","","",""
"","1","handles environment with impactValue at exact threshold boundaries","filterAndSearchEnvironments","Fri Apr 03 21:32:29 UTC 2026","passed","Fri Apr 03 21:32:29 UTC 2026","","edge cases","",""
"","0","should hide/expand search widget when user clicks minus/plus button","ExploreSearch rendering per tab","Fri Apr 03 21:38:16 UTC 2026","unknown","Fri Apr 03 21:38:16 UTC 2026","","","",""
"","20","sets autoDisplayTable to false if query type is composition","useExploreTableAutoDisplay","Fri Apr 03 21:35:57 UTC 2026","passed","Fri Apr 03 21:35:57 UTC 2026","","","",""
"Test cases for TestResources_ListPublishedToCAs","0","TestResources_ListPublishedToCAs","","Fri Apr 03 21:31:10 UTC 2026","passed","Fri Apr 03 21:31:10 UTC 2026","","Go Test","github.com/specterops/bloodhound/cmd/api/src/api/v2/TestResources_ListPublishedToCAs","TestResources_ListPublishedToCAs"
"","139","renders an input box","SearchBar","Fri Apr 03 21:36:51 UTC 2026","passed","Fri Apr 03 21:36:51 UTC 2026","","","",""
"","260","renders the Columns trigger button","ManageColumnsComboBox","Fri Apr 03 21:33:15 UTC 2026","passed","Fri Apr 03 21:33:15 UTC 2026","","","",""
"","30","returns undefined if environmentId searched for is not found","useAvailableEnvironments","Fri Apr 03 21:36:05 UTC 2026","passed","Fri Apr 03 21:36:05 UTC 2026","","useSelectedEnvironment","",""
"","61","when there is no ID in the URL the highest position tag ID is returned","usePZQueryParams","Fri Apr 03 21:35:08 UTC 2026","passed","Fri Apr 03 21:35:08 UTC 2026","","","",""
"Test cases for TestResources_GetPermissionsForSavedQuery","56","TestResources_GetPermissionsForSavedQuery","","Fri Apr 03 21:31:10 UTC 2026","passed","Fri Apr 03 21:31:10 UTC 2026","","Go Test","github.com/specterops/bloodhound/cmd/api/src/api/v2/TestResources_GetPermissionsForSavedQuery","TestResources_GetPermissionsForSavedQuery"
"","148","respects openIndex (default opened panel)","<DetailsAccordion />","Fri Apr 03 21:33:14 UTC 2026","passed","Fri Apr 03 21:33:15 UTC 2026","","","",""
"Test cases for TestSelfDestructingTempFile","0","TestSelfDestructingTempFile","","Fri Apr 03 21:30:59 UTC 2026","passed","Fri Apr 03 21:30:59 UTC 2026","","Go Test","github.com/specterops/bloodhound/cmd/api/src/api/TestSelfDestructingTempFile","TestSelfDestructingTempFile"
"","2661","should close the edge filtering dialog when user clicks cancel button","EdgeFilter","Fri Apr 03 21:34:38 UTC 2026","passed","Fri Apr 03 21:34:41 UTC 2026","","","",""
"","1","reports an API error when there is only statusText","handleError","Fri Apr 03 21:32:56 UTC 2026","passed","Fri Apr 03 21:32:56 UTC 2026","","","",""
"","1","returns query config when searchType is relationship and all required params are passed","useExploreGraph","Fri Apr 03 21:32:52 UTC 2026","passed","Fri Apr 03 21:32:52 UTC 2026","relationship search queries","exploreGraphQueryFactory","",""
"Test cases for TestDisenrollMFA_Admin_SuccessNoPasswordSSO","658","TestDisenrollMFA_Admin_SuccessNoPasswordSSO","","Fri Apr 03 21:31:40 UTC 2026","passed","Fri Apr 03 21:31:41 UTC 2026","","Go Test","github.com/specterops/bloodhound/cmd/api/src/api/v2/auth/TestDisenrollMFA_Admin_SuccessNoPasswordSSO","TestDisenrollMFA_Admin_SuccessNoPasswordSSO"
"","27","tag members refetches on environment change","the useAssetGroupTags utilities","Fri Apr 03 21:33:10 UTC 2026","passed","Fri Apr 03 21:33:10 UTC 2026","","","",""
"","84","List Display Roles Hook is Loading","useListDisplayRoles","Fri Apr 03 21:33:04 UTC 2026","passed","Fri Apr 03 21:33:04 UTC 2026","","","",""
"","13","renders without pulse animation by default","StatusIndicator","Fri Apr 03 21:36:54 UTC 2026","passed","Fri Apr 03 21:36:54 UTC 2026","","","",""
"","73","should not display api key management button","Api Keys","Fri Apr 03 21:33:48 UTC 2026","passed","Fri Apr 03 21:33:48 UTC 2026","","","",""
"Test cases for TestRequestWaitDuration_Negative","0","TestRequestWaitDuration_Negative","","Fri Apr 03 21:31:02 UTC 2026","passed","Fri Apr 03 21:31:02 UTC 2026","","Go Test","github.com/specterops/bloodhound/cmd/api/src/api/middleware/TestRequestWaitDuration_Negative","TestRequestWaitDuration_Negative"
"Test cases for TestInt64SetValid","0","TestInt64SetValid","","Fri Apr 03 21:31:12 UTC 2026","passed","Fri Apr 03 21:31:12 UTC 2026","","Go Test","github.com/specterops/bloodhound/cmd/api/src/database/types/null/TestInt64SetValid","TestInt64SetValid"
"","572","shows success notification after successful deletion","ActiveExtensionsCard","Fri Apr 03 21:32:39 UTC 2026","passed","Fri Apr 03 21:32:40 UTC 2026","","","",""
"","1","reports a Cypher-specific error when ruleType is SeedTypeCypher and seeds are required","handleError","Fri Apr 03 21:32:56 UTC 2026","passed","Fri Apr 03 21:32:56 UTC 2026","","","",""
"","396","shows a loading state","AssetGroupMenuItem","Fri Apr 03 21:33:25 UTC 2026","passed","Fri Apr 03 21:33:25 UTC 2026","","","",""
"","37","displays a loading message while fetching extensions","ActiveExtensionsCard","Fri Apr 03 21:32:35 UTC 2026","passed","Fri Apr 03 21:32:35 UTC 2026","","","",""
"","20","renders nothing if flag is enabled and enabled prop is not provided","FeatureFlag","Fri Apr 03 21:35:53 UTC 2026","passed","Fri Apr 03 21:35:53 UTC 2026","","","",""
"","808","clicking checkbox will remove error if present","DatabaseManagement","Fri Apr 03 21:37:40 UTC 2026","passed","Fri Apr 03 21:37:41 UTC 2026","","","",""
"","1","should recognize a common properties","validating a node property against the shared generated schema","Fri Apr 03 21:33:28 UTC 2026","passed","Fri Apr 03 21:33:28 UTC 2026","","","",""
"","1","returns a function that takes a key found in updatedParams and updates the searchParams with that matching value from updatedParams","searchParams","Fri Apr 03 21:35:29 UTC 2026","passed","Fri Apr 03 21:35:29 UTC 2026","","setSingleParamFactory","",""
"Test cases for TestResources_ListADGroupSessions","1","TestResources_ListADGroupSessions","","Fri Apr 03 21:31:10 UTC 2026","passed","Fri Apr 03 21:31:10 UTC 2026","","Go Test","github.com/specterops/bloodhound/cmd/api/src/api/v2/TestResources_ListADGroupSessions","TestResources_ListADGroupSessions"
"Test cases for TestManagementResource_ListSAMLProviders","14","TestManagementResource_ListSAMLProviders","","Fri Apr 03 21:31:44 UTC 2026","passed","Fri Apr 03 21:31:44 UTC 2026","","Go Test","github.com/specterops/bloodhound/cmd/api/src/api/v2/auth/TestManagementResource_ListSAMLProviders","TestManagementResource_ListSAMLProviders"
"","525","clears the applied filter","FileIngestFilterDialog","Fri Apr 03 21:33:02 UTC 2026","passed","Fri Apr 03 21:33:03 UTC 2026","","Status Select","",""
"Test cases for TestWriteErrorResponse_InvalidFormat","0","TestWriteErrorResponse_InvalidFormat","","Fri Apr 03 21:30:59 UTC 2026","passed","Fri Apr 03 21:30:59 UTC 2026","","Go Test","github.com/specterops/bloodhound/cmd/api/src/api/TestWriteErrorResponse_InvalidFormat","TestWriteErrorResponse_InvalidFormat"
"","191","renders the component with all info and switch off","CitrixRDPConfiguration","Fri Apr 03 21:33:38 UTC 2026","passed","Fri Apr 03 21:33:39 UTC 2026","","Initial render","",""
"Test cases for TestParsePreferHeaderWait","0","TestParsePreferHeaderWait","","Fri Apr 03 21:31:02 UTC 2026","passed","Fri Apr 03 21:31:02 UTC 2026","","Go Test","github.com/specterops/bloodhound/cmd/api/src/api/middleware/TestParsePreferHeaderWait","TestParsePreferHeaderWait"
"Test cases for TestUnmarshalTimeText","0","TestUnmarshalTimeText","","Fri Apr 03 21:31:12 UTC 2026","passed","Fri Apr 03 21:31:12 UTC 2026","","Go Test","github.com/specterops/bloodhound/cmd/api/src/database/types/null/TestUnmarshalTimeText","TestUnmarshalTimeText"
"Test cases for TestResources_SearchHandler_ETAC","1","TestResources_SearchHandler_ETAC","","Fri Apr 03 21:31:10 UTC 2026","passed","Fri Apr 03 21:31:10 UTC 2026","","Go Test","github.com/specterops/bloodhound/cmd/api/src/api/v2/TestResources_SearchHandler_ETAC","TestResources_SearchHandler_ETAC"
"Test cases for TestResources_CreateAssetGroup","0","TestResources_CreateAssetGroup","","Fri Apr 03 21:31:10 UTC 2026","passed","Fri Apr 03 21:31:10 UTC 2026","","Go Test","github.com/specterops/bloodhound/cmd/api/src/api/v2/TestResources_CreateAssetGroup","TestResources_CreateAssetGroup"
"","325","On unsuccessful upload, notifies with an error and displays a retry button","SchemaUploadDialog","Fri Apr 03 21:33:31 UTC 2026","passed","Fri Apr 03 21:33:31 UTC 2026","","","",""
"Test cases for TestBoolValueOrZero","0","TestBoolValueOrZero","","Fri Apr 03 21:31:12 UTC 2026","passed","Fri Apr 03 21:31:12 UTC 2026","","Go Test","github.com/specterops/bloodhound/cmd/api/src/database/types/null/TestBoolValueOrZero","TestBoolValueOrZero"
"Test cases for Test_TopLevel","1","Test_TopLevel","","Fri Apr 03 21:31:26 UTC 2026","passed","Fri Apr 03 21:31:26 UTC 2026","","Go Test","github.com/specterops/bloodhound/packages/go/schemagen/csgen/Test_TopLevel","Test_TopLevel"
"","229","shows ""Expired"" in red when the expiration date has already passed","UserTokenManagementDialog - API Expiration Date column","Fri Apr 03 21:33:19 UTC 2026","passed","Fri Apr 03 21:33:20 UTC 2026","","","",""
"","40","renders the title passed via title prop","ColumnHeaders","Fri Apr 03 21:34:49 UTC 2026","passed","Fri Apr 03 21:34:49 UTC 2026","","SortableHeader","",""
"Test cases for TestFetchTenants","0","TestFetchTenants","","Fri Apr 03 21:31:24 UTC 2026","passed","Fri Apr 03 21:31:24 UTC 2026","","Go Test","github.com/specterops/bloodhound/packages/go/analysis/azure/TestFetchTenants","TestFetchTenants"
"","59","Error handling for fetching edge information","EdgeObjectInformation","Fri Apr 03 21:35:06 UTC 2026","passed","Fri Apr 03 21:35:06 UTC 2026","","","",""
"Test cases for TestResources_ExportSavedQueries","28","TestResources_ExportSavedQueries","","Fri Apr 03 21:31:10 UTC 2026","passed","Fri Apr 03 21:31:10 UTC 2026","","Go Test","github.com/specterops/bloodhound/cmd/api/src/api/v2/TestResources_ExportSavedQueries","TestResources_ExportSavedQueries"
"","170","a timeout response from the server is handled","ExploreSearchCombobox with search timeout","Fri Apr 03 21:33:34 UTC 2026","passed","Fri Apr 03 21:33:34 UTC 2026","","","",""
"","0","should compute the length of a line segment","bezier","Fri Apr 03 21:37:54 UTC 2026","passed","Fri Apr 03 21:37:54 UTC 2026","","","",""
"Test cases for Test_runMaybeCachedEntityQuery","0","Test_runMaybeCachedEntityQuery","","Fri Apr 03 21:31:13 UTC 2026","passed","Fri Apr 03 21:31:13 UTC 2026","","Go Test","github.com/specterops/bloodhound/cmd/api/src/queries/Test_runMaybeCachedEntityQuery","Test_runMaybeCachedEntityQuery"
"","59","applies empty state height when no results","ActiveExtensionsCard","Fri Apr 03 21:32:37 UTC 2026","passed","Fri Apr 03 21:32:37 UTC 2026","","","",""
"","1","lastlogon, lastlogontimestamp","Handling value formatting for Active Directory entity properties lastlogon, lastlogontimestamp, whencreated, and pwdlastset","Fri Apr 03 21:33:28 UTC 2026","passed","Fri Apr 03 21:33:28 UTC 2026","","","",""
"Test cases for TestResources_ListSavedQueries","28","TestResources_ListSavedQueries","","Fri Apr 03 21:31:10 UTC 2026","passed","Fri Apr 03 21:31:10 UTC 2026","","Go Test","github.com/specterops/bloodhound/cmd/api/src/api/v2/TestResources_ListSavedQueries","TestResources_ListSavedQueries"
"","28","should display hidden node label for hidden node","EntityInfoHeader","Fri Apr 03 21:35:22 UTC 2026","passed","Fri Apr 03 21:35:22 UTC 2026","","","",""
"Test cases for TestSetValue","0","TestSetValue","","Fri Apr 03 21:31:11 UTC 2026","passed","Fri Apr 03 21:31:11 UTC 2026","","Go Test","github.com/specterops/bloodhound/cmd/api/src/config/TestSetValue","TestSetValue"
"","1188","allows switching between the Zones and Labels tabs","Zone Management","Fri Apr 03 21:36:22 UTC 2026","passed","Fri Apr 03 21:36:23 UTC 2026","","","",""
"","15","renders the tooltip icon when tooltipText prop is passed","ColumnHeaders","Fri Apr 03 21:34:49 UTC 2026","passed","Fri Apr 03 21:34:49 UTC 2026","","SortableHeader with Tooltip","",""
"","1513","handles posting a mutation","DatabaseManagement","Fri Apr 03 21:37:42 UTC 2026","passed","Fri Apr 03 21:37:44 UTC 2026","","","",""
"","24","should display a message to select an object","EntityInfoPanel","Fri Apr 03 21:36:05 UTC 2026","passed","Fri Apr 03 21:36:05 UTC 2026","","","",""
"Test cases for TestVersion_GreaterThan","0","TestVersion_GreaterThan","","Fri Apr 03 21:31:21 UTC 2026","passed","Fri Apr 03 21:31:21 UTC 2026","","Go Test","github.com/specterops/bloodhound/cmd/api/src/version/TestVersion_GreaterThan","TestVersion_GreaterThan"
"","428","should render","LoginViaSSOForm","Fri Apr 03 21:35:26 UTC 2026","passed","Fri Apr 03 21:35:26 UTC 2026","","","",""
"Test cases for TestManagementResource_DeleteUser_UserCannotSelfDelete","656","TestManagementResource_DeleteUser_UserCannotSelfDelete","","Fri Apr 03 21:31:31 UTC 2026","passed","Fri Apr 03 21:31:32 UTC 2026","","Go Test","github.com/specterops/bloodhound/cmd/api/src/api/v2/auth/TestManagementResource_DeleteUser_UserCannotSelfDelete","TestManagementResource_DeleteUser_UserCannotSelfDelete"
"","0","returns true when id is a environment aggregation type","isEnvironmentAggregation","Fri Apr 03 21:32:29 UTC 2026","passed","Fri Apr 03 21:32:29 UTC 2026","","","",""
"","2249","should open edge filtering dialog","EdgeFilter","Fri Apr 03 21:34:36 UTC 2026","passed","Fri Apr 03 21:34:38 UTC 2026","","","",""
"","158","should display ""Disable Multi-Factor Authentication"" button","Enable2FADialog","Fri Apr 03 21:35:40 UTC 2026","passed","Fri Apr 03 21:35:40 UTC 2026","","","",""
"Test cases for TestQueryParameterFilterParser_ParseQueryParameterFilter","2","TestQueryParameterFilterParser_ParseQueryParameterFilter","","Fri Apr 03 21:31:12 UTC 2026","passed","Fri Apr 03 21:31:12 UTC 2026","","Go Test","github.com/specterops/bloodhound/cmd/api/src/model/TestQueryParameterFilterParser_ParseQueryParameterFilter","TestQueryParameterFilterParser_ParseQueryParameterFilter"
"Test cases for TestManagementResource_UpdateUser_UserSelfModify","654","TestManagementResource_UpdateUser_UserSelfModify","","Fri Apr 03 21:31:29 UTC 2026","passed","Fri Apr 03 21:31:30 UTC 2026","","Go Test","github.com/specterops/bloodhound/cmd/api/src/api/v2/auth/TestManagementResource_UpdateUser_UserSelfModify","TestManagementResource_UpdateUser_UserSelfModify"
"Test cases for TestParseAGMembersFromNodes_","0","TestParseAGMembersFromNodes_","","Fri Apr 03 21:31:10 UTC 2026","passed","Fri Apr 03 21:31:10 UTC 2026","","Go Test","github.com/specterops/bloodhound/cmd/api/src/api/v2/TestParseAGMembersFromNodes_","TestParseAGMembersFromNodes_"
"","0","returns undefined if graphData is undefined or not a GraphResponse","getExploreTableData","Fri Apr 03 21:34:54 UTC 2026","passed","Fri Apr 03 21:34:54 UTC 2026","","","",""
