"DESCRIPTION","DURATION IN MS","NAME","PARENT SUITE","START TIME","STATUS","STOP TIME","SUB SUITE","SUITE","TEST CLASS","TEST METHOD"
"Test cases for TestGetLatestQueryParameter","0","TestGetLatestQueryParameter","","Fri Apr 03 21:31:10 UTC 2026","passed","Fri Apr 03 21:31:10 UTC 2026","","Go Test","github.com/specterops/bloodhound/cmd/api/src/api/v2/TestGetLatestQueryParameter","TestGetLatestQueryParameter"
"Test cases for Test_filterAndFormatSearchResults_filterEnvironments_tenantIDFail","0","Test_filterAndFormatSearchResults_filterEnvironments_tenantIDFail","","Fri Apr 03 21:31:10 UTC 2026","passed","Fri Apr 03 21:31:10 UTC 2026","","Go Test","github.com/specterops/bloodhound/cmd/api/src/api/v2/Test_filterAndFormatSearchResults_filterEnvironments_tenantIDFail","Test_filterAndFormatSearchResults_filterEnvironments_tenantIDFail"
"","0","should return false when there is no match","OperationsFilterPlugin","Fri Apr 03 21:37:07 UTC 2026","passed","Fri Apr 03 21:37:07 UTC 2026","","","",""
"","1","pwdlastset","Handling value formatting for Active Directory entity properties lastlogon, lastlogontimestamp, whencreated, and pwdlastset","Fri Apr 03 21:33:28 UTC 2026","passed","Fri Apr 03 21:33:28 UTC 2026","","","",""
"Test cases for TestMarshalBoolText","0","TestMarshalBoolText","","Fri Apr 03 21:31:12 UTC 2026","passed","Fri Apr 03 21:31:12 UTC 2026","","Go Test","github.com/specterops/bloodhound/cmd/api/src/database/types/null/TestMarshalBoolText","TestMarshalBoolText"
"Test cases for TestManagementResource_ListAuthTokens_DBError","0","TestManagementResource_ListAuthTokens_DBError","","Fri Apr 03 21:31:36 UTC 2026","passed","Fri Apr 03 21:31:36 UTC 2026","","Go Test","github.com/specterops/bloodhound/cmd/api/src/api/v2/auth/TestManagementResource_ListAuthTokens_DBError","TestManagementResource_ListAuthTokens_DBError"
"","24","selector members refetches on sort change","the useAssetGroupTags utilities","Fri Apr 03 21:33:10 UTC 2026","passed","Fri Apr 03 21:33:10 UTC 2026","","","",""
"Test cases for TestEncodingInterface","0","TestEncodingInterface","","Fri Apr 03 21:31:25 UTC 2026","passed","Fri Apr 03 21:31:25 UTC 2026","","Go Test","github.com/specterops/bloodhound/packages/go/bomenc/TestEncodingInterface","TestEncodingInterface"
"Test cases for TestManagementResource_ListRoles_SortingError","1","TestManagementResource_ListRoles_SortingError","","Fri Apr 03 21:31:16 UTC 2026","passed","Fri Apr 03 21:31:16 UTC 2026","","Go Test","github.com/specterops/bloodhound/cmd/api/src/api/v2/auth/TestManagementResource_ListRoles_SortingError","TestManagementResource_ListRoles_SortingError"
"","37","should highlight selected route","Main Nav Route Highlighting","Fri Apr 03 21:33:54 UTC 2026","passed","Fri Apr 03 21:33:54 UTC 2026","","","",""
"","274","on clicking switch shows modal and when clicking confirm closes it and switch changes to enabled","CitrixRDPConfiguration","Fri Apr 03 21:33:39 UTC 2026","passed","Fri Apr 03 21:33:39 UTC 2026","","Click on switch to enable","",""
"","932","handles adding to tier zero asset group","AssetGroupMenuItem","Fri Apr 03 21:37:30 UTC 2026","passed","Fri Apr 03 21:37:31 UTC 2026","","adding to an asset group","",""
"","107","should display the logged in user's email address","UserProfile","Fri Apr 03 21:33:46 UTC 2026","passed","Fri Apr 03 21:33:46 UTC 2026","","","",""
"Test cases for TestResources_ListADEntityDCOMRights","0","TestResources_ListADEntityDCOMRights","","Fri Apr 03 21:31:10 UTC 2026","passed","Fri Apr 03 21:31:10 UTC 2026","","Go Test","github.com/specterops/bloodhound/cmd/api/src/api/v2/TestResources_ListADEntityDCOMRights","TestResources_ListADEntityDCOMRights"
"","124","should display api key management button","Api Keys","Fri Apr 03 21:33:48 UTC 2026","passed","Fri Apr 03 21:33:48 UTC 2026","","","",""
"","141","renders a single item when items is an object","<DetailsAccordion />","Fri Apr 03 21:33:14 UTC 2026","passed","Fri Apr 03 21:33:14 UTC 2026","","","",""
"","217","a name value is required to submit the form","Rule Form","Fri Apr 03 21:32:36 UTC 2026","passed","Fri Apr 03 21:32:36 UTC 2026","","","",""
"","1","filters by multiple risk levels","filterAndSearchEnvironments","Fri Apr 03 21:32:29 UTC 2026","passed","Fri Apr 03 21:32:29 UTC 2026","","risk filters","",""
"","1","reports an Object ID-specific error when creating a rule and ruleType is SeedTypeObjectId and seeds are required","handleError","Fri Apr 03 21:32:56 UTC 2026","passed","Fri Apr 03 21:32:56 UTC 2026","","","",""
"Test cases for Test_ParseGraphSortParameters_Success","0","Test_ParseGraphSortParameters_Success","","Fri Apr 03 21:30:59 UTC 2026","passed","Fri Apr 03 21:30:59 UTC 2026","","Go Test","github.com/specterops/bloodhound/cmd/api/src/api/Test_ParseGraphSortParameters_Success","Test_ParseGraphSortParameters_Success"
"Test cases for TestUnmarshalInt","0","TestUnmarshalInt","","Fri Apr 03 21:31:12 UTC 2026","passed","Fri Apr 03 21:31:12 UTC 2026","","Go Test","github.com/specterops/bloodhound/cmd/api/src/database/types/null/TestUnmarshalInt","TestUnmarshalInt"
"","100","renders a filter button","FileIngestFilterDialog","Fri Apr 03 21:33:01 UTC 2026","passed","Fri Apr 03 21:33:01 UTC 2026","","","",""
"","5448","Typing in the search bar filters the results","ExploreTable","Fri Apr 03 21:32:14 UTC 2026","passed","Fri Apr 03 21:32:19 UTC 2026","","","",""
"Test cases for TestConvertComputerToNode","0","TestConvertComputerToNode","","Fri Apr 03 21:31:25 UTC 2026","passed","Fri Apr 03 21:31:25 UTC 2026","","Go Test","github.com/specterops/bloodhound/packages/go/ein/TestConvertComputerToNode","TestConvertComputerToNode"
"Test cases for TestMarshalString","0","TestMarshalString","","Fri Apr 03 21:31:12 UTC 2026","passed","Fri Apr 03 21:31:12 UTC 2026","","Go Test","github.com/specterops/bloodhound/cmd/api/src/database/types/null/TestMarshalString","TestMarshalString"
"","7","dismisses the ""no permission"" notification on unmount","useFinishedJobs","Fri Apr 03 21:34:24 UTC 2026","passed","Fri Apr 03 21:34:24 UTC 2026","","","",""
"","236","should render a nav element with logo, two lists, a version number and a powered by","MainNav","Fri Apr 03 21:33:54 UTC 2026","passed","Fri Apr 03 21:33:54 UTC 2026","","","",""
"","171","Verify Vault Reader count is the count returned by All Readers","EntityInfoDataTable","Fri Apr 03 21:33:06 UTC 2026","passed","Fri Apr 03 21:33:06 UTC 2026","","Node count for Vault Readers nested table","",""
"Test cases for TestResources_ProcessIngestTask","8","TestResources_ProcessIngestTask","","Fri Apr 03 21:31:10 UTC 2026","passed","Fri Apr 03 21:31:10 UTC 2026","","Go Test","github.com/specterops/bloodhound/cmd/api/src/api/v2/TestResources_ProcessIngestTask","TestResources_ProcessIngestTask"
"","1","should return the edge parts from the key","getEdgeDataFromKey","Fri Apr 03 21:38:09 UTC 2026","passed","Fri Apr 03 21:38:09 UTC 2026","","","",""
"Test cases for TestResources_PreviewSelectors","0","TestResources_PreviewSelectors","","Fri Apr 03 21:31:10 UTC 2026","passed","Fri Apr 03 21:31:10 UTC 2026","","Go Test","github.com/specterops/bloodhound/cmd/api/src/api/v2/TestResources_PreviewSelectors","TestResources_PreviewSelectors"
"","207","shows ""Select All"" when not all columns are selected","ManageColumnsComboBox","Fri Apr 03 21:33:15 UTC 2026","passed","Fri Apr 03 21:33:16 UTC 2026","","","",""
"","243","disables any available button toggles if the user lacks the permission","EarlyAccessFeatures","Fri Apr 03 21:37:53 UTC 2026","passed","Fri Apr 03 21:37:53 UTC 2026","","","",""
"Test cases for TestNewAuditLog_Error","0","TestNewAuditLog_Error","","Fri Apr 03 21:31:11 UTC 2026","passed","Fri Apr 03 21:31:11 UTC 2026","","Go Test","github.com/specterops/bloodhound/cmd/api/src/database/TestNewAuditLog_Error","TestNewAuditLog_Error"
"","278","sets a primarySearch=id and searchType=node when secondarySearch is falsey","ContextMenu","Fri Apr 03 21:33:11 UTC 2026","passed","Fri Apr 03 21:33:11 UTC 2026","","","",""
"","0","returns false if value is {}","searchParams","Fri Apr 03 21:35:29 UTC 2026","passed","Fri Apr 03 21:35:29 UTC 2026","","isEmptyParam","",""
"Test cases for TestCreateAssetGroupRequest_AuditData","0","TestCreateAssetGroupRequest_AuditData","","Fri Apr 03 21:31:10 UTC 2026","passed","Fri Apr 03 21:31:10 UTC 2026","","Go Test","github.com/specterops/bloodhound/cmd/api/src/api/v2/TestCreateAssetGroupRequest_AuditData","TestCreateAssetGroupRequest_AuditData"
"","51","renders the title passed via title prop","ColumnHeaders","Fri Apr 03 21:34:49 UTC 2026","passed","Fri Apr 03 21:34:49 UTC 2026","","BaseColumnHeader","",""
"Test cases for TestResources_DeleteExtension","78","TestResources_DeleteExtension","","Fri Apr 03 21:31:10 UTC 2026","passed","Fri Apr 03 21:31:10 UTC 2026","","Go Test","github.com/specterops/bloodhound/cmd/api/src/api/v2/TestResources_DeleteExtension","TestResources_DeleteExtension"
"Test cases for TestHandleDatabaseErrorNotFound","0","TestHandleDatabaseErrorNotFound","","Fri Apr 03 21:30:59 UTC 2026","passed","Fri Apr 03 21:30:59 UTC 2026","","Go Test","github.com/specterops/bloodhound/cmd/api/src/api/TestHandleDatabaseErrorNotFound","TestHandleDatabaseErrorNotFound"
"","0","returns fallback Cypher message when ruleType is undefined and seeds are required","getErrorMessage","Fri Apr 03 21:32:56 UTC 2026","passed","Fri Apr 03 21:32:56 UTC 2026","","","",""
"","146","buttons are disabled while loading","OneTimePasscodeForm","Fri Apr 03 21:36:11 UTC 2026","passed","Fri Apr 03 21:36:11 UTC 2026","","","",""
"Test cases for TestResources_ListADEntityControllables","0","TestResources_ListADEntityControllables","","Fri Apr 03 21:31:10 UTC 2026","passed","Fri Apr 03 21:31:10 UTC 2026","","Go Test","github.com/specterops/bloodhound/cmd/api/src/api/v2/TestResources_ListADEntityControllables","TestResources_ListADEntityControllables"
"Test cases for TestCreateUser_Failure","1","TestCreateUser_Failure","","Fri Apr 03 21:31:16 UTC 2026","passed","Fri Apr 03 21:31:16 UTC 2026","","Go Test","github.com/specterops/bloodhound/cmd/api/src/api/v2/auth/TestCreateUser_Failure","TestCreateUser_Failure"
"Helper to verify that encodeAnyValue handles standard types correctly","0","TestEncodeAnyValue","","Fri Apr 03 21:31:16 UTC 2026","passed","Fri Apr 03 21:31:16 UTC 2026","","Go Test","github.com/specterops/bloodhound/cmd/api/src/services/graphify/endpoint/TestEncodeAnyValue","TestEncodeAnyValue"
"","1607","shows an error message when unable to delete a rule","Rule Form","Fri Apr 03 21:32:34 UTC 2026","passed","Fri Apr 03 21:32:36 UTC 2026","","","",""
"","94","shows View in Explore if exploreUrl is supplied","Seed Selection Results","Fri Apr 03 21:33:10 UTC 2026","passed","Fri Apr 03 21:33:10 UTC 2026","","","",""
"","2531","should close the edge filtering dialog when user clicks apply button","EdgeFilter","Fri Apr 03 21:34:41 UTC 2026","passed","Fri Apr 03 21:34:44 UTC 2026","","","",""
"Test cases for Test_SetDependency","0","Test_SetDependency","","Fri Apr 03 21:31:25 UTC 2026","passed","Fri Apr 03 21:31:25 UTC 2026","","Go Test","github.com/specterops/bloodhound/packages/go/lab/Test_SetDependency","Test_SetDependency"
"Test cases for TestResources_UpdateSavedQuery_UpdateFailed","0","TestResources_UpdateSavedQuery_UpdateFailed","","Fri Apr 03 21:31:10 UTC 2026","passed","Fri Apr 03 21:31:10 UTC 2026","","Go Test","github.com/specterops/bloodhound/cmd/api/src/api/v2/TestResources_UpdateSavedQuery_UpdateFailed","TestResources_UpdateSavedQuery_UpdateFailed"
"","94","indicates the code container is scrollable when the code is unwrapped","CodeController","Fri Apr 03 21:36:46 UTC 2026","passed","Fri Apr 03 21:36:46 UTC 2026","","","",""
"","15","when there is no ID in the URL and no tags available, no ID is returned (it is undefined)","usePZQueryParams","Fri Apr 03 21:35:08 UTC 2026","passed","Fri Apr 03 21:35:08 UTC 2026","","","",""
"","6","applies animation class to the title","ProcessingIndicator","Fri Apr 03 21:37:04 UTC 2026","passed","Fri Apr 03 21:37:04 UTC 2026","","","",""
"Test cases for TestOpenGraphSchemaService_GetSchemaFindings","4","TestOpenGraphSchemaService_GetSchemaFindings","","Fri Apr 03 21:31:16 UTC 2026","passed","Fri Apr 03 21:31:16 UTC 2026","","Go Test","github.com/specterops/bloodhound/cmd/api/src/services/opengraphschema/TestOpenGraphSchemaService_GetSchemaFindings","TestOpenGraphSchemaService_GetSchemaFindings"
"","657","runs the query and calls dispatch to set the node results","PrivilegeZonesCypherEditor Search component for Zone Management","Fri Apr 03 21:35:55 UTC 2026","passed","Fri Apr 03 21:35:55 UTC 2026","","","",""
"","129","passes check if the user has a required permission","usePermissions","Fri Apr 03 21:33:40 UTC 2026","passed","Fri Apr 03 21:33:40 UTC 2026","","","",""
"","52","should on clicking remove call clearSelectedItem","EdgeInfoHeader","Fri Apr 03 21:35:39 UTC 2026","passed","Fri Apr 03 21:35:39 UTC 2026","","","",""
"","1","returns false when WebGL is not available in the current browser context","WebGL compatibility check","Fri Apr 03 21:37:10 UTC 2026","passed","Fri Apr 03 21:37:10 UTC 2026","","","",""
"","27","renders custom icon overlap correctly","NodeIcon","Fri Apr 03 21:36:23 UTC 2026","passed","Fri Apr 03 21:36:23 UTC 2026","","","",""
"Test cases for TestNewSIDSuffix","1","TestNewSIDSuffix","","Fri Apr 03 21:31:24 UTC 2026","passed","Fri Apr 03 21:31:24 UTC 2026","","Go Test","github.com/specterops/bloodhound/packages/go/analysis/ad/wellknown/TestNewSIDSuffix","TestNewSIDSuffix"
"Test cases for TestManagementResource_ListAuthTokens_InvalidFilterPredicate","0","TestManagementResource_ListAuthTokens_InvalidFilterPredicate","","Fri Apr 03 21:31:36 UTC 2026","passed","Fri Apr 03 21:31:36 UTC 2026","","Go Test","github.com/specterops/bloodhound/cmd/api/src/api/v2/auth/TestManagementResource_ListAuthTokens_InvalidFilterPredicate","TestManagementResource_ListAuthTokens_InvalidFilterPredicate"
"Test cases for TestManagementResource_OIDCLoginHandler","5","TestManagementResource_OIDCLoginHandler","","Fri Apr 03 21:31:44 UTC 2026","passed","Fri Apr 03 21:31:44 UTC 2026","","Go Test","github.com/specterops/bloodhound/cmd/api/src/api/v2/auth/TestManagementResource_OIDCLoginHandler","TestManagementResource_OIDCLoginHandler"
"","101","displays the value thats passed via children","CodeController","Fri Apr 03 21:36:45 UTC 2026","passed","Fri Apr 03 21:36:45 UTC 2026","","","",""
"","184","renders","EarlyAccessFeatureToggle","Fri Apr 03 21:38:02 UTC 2026","passed","Fri Apr 03 21:38:02 UTC 2026","","","",""
"","293","Displays a modal after clicking Analyze Now button and run analysis after clicking confirm","AnalyzeNowConfiguration","Fri Apr 03 21:33:59 UTC 2026","passed","Fri Apr 03 21:34:00 UTC 2026","","","",""
"","186","has the correct value for the links in the breadcrumbs","Create Update pages","Fri Apr 03 21:35:56 UTC 2026","passed","Fri Apr 03 21:35:56 UTC 2026","","","",""
"","12","allows you to cancel filter updates before applying them to the url and reset to the default filter state","usePathfindingFilters","Fri Apr 03 21:36:27 UTC 2026","passed","Fri Apr 03 21:36:27 UTC 2026","","","",""
"","0","EXTENDED ROUNDING when thresholds are set: abbreviates numbers larger than 1000 and should not round the tenth place digit","numberFormatting","Fri Apr 03 21:34:52 UTC 2026","passed","Fri Apr 03 21:34:52 UTC 2026","","","",""
"Test cases for TestIngestJobs_ValidFilters","0","TestIngestJobs_ValidFilters","","Fri Apr 03 21:31:12 UTC 2026","passed","Fri Apr 03 21:31:12 UTC 2026","","Go Test","github.com/specterops/bloodhound/cmd/api/src/model/TestIngestJobs_ValidFilters","TestIngestJobs_ValidFilters"
"","63","fails checks if the user does not have a matching permission","usePermissions","Fri Apr 03 21:33:40 UTC 2026","passed","Fri Apr 03 21:33:40 UTC 2026","","","",""
"Test cases for TestResources_GetAssetGroupTagMemberCountsByKind","0","TestResources_GetAssetGroupTagMemberCountsByKind","","Fri Apr 03 21:31:10 UTC 2026","passed","Fri Apr 03 21:31:10 UTC 2026","","Go Test","github.com/specterops/bloodhound/cmd/api/src/api/v2/TestResources_GetAssetGroupTagMemberCountsByKind","TestResources_GetAssetGroupTagMemberCountsByKind"
"","4","returns a date string only if passed a string with a matching key","Formatting strings via formatPrimive","Fri Apr 03 21:33:28 UTC 2026","passed","Fri Apr 03 21:33:28 UTC 2026","","","",""
"","112","renders enabled Zone tab and disabled Rule and Object tabs","Selected Details Tabs","Fri Apr 03 21:34:19 UTC 2026","passed","Fri Apr 03 21:34:19 UTC 2026","","Selected Details Tabs - Params present","",""
"Test cases for TestResources_ListADDomainInboundTrusts","0","TestResources_ListADDomainInboundTrusts","","Fri Apr 03 21:31:10 UTC 2026","passed","Fri Apr 03 21:31:10 UTC 2026","","Go Test","github.com/specterops/bloodhound/cmd/api/src/api/v2/TestResources_ListADDomainInboundTrusts","TestResources_ListADDomainInboundTrusts"
"","1012","renders the node in the entity panel when member is clicked","GroupManagement","Fri Apr 03 21:37:51 UTC 2026","passed","Fri Apr 03 21:37:52 UTC 2026","","","",""
"","17","will update the selected filters based on the values stored in query params when the initialize function is called","usePathfindingFilters","Fri Apr 03 21:36:27 UTC 2026","passed","Fri Apr 03 21:36:27 UTC 2026","","","",""
"Test cases for TestInvalidValueError","0","TestInvalidValueError","","Fri Apr 03 21:31:25 UTC 2026","passed","Fri Apr 03 21:31:25 UTC 2026","","Go Test","github.com/specterops/bloodhound/packages/go/cache/TestInvalidValueError","TestInvalidValueError"
"Test cases for TestInt64Scan","0","TestInt64Scan","","Fri Apr 03 21:31:12 UTC 2026","passed","Fri Apr 03 21:31:12 UTC 2026","","Go Test","github.com/specterops/bloodhound/cmd/api/src/database/types/null/TestInt64Scan","TestInt64Scan"
"","1933","Clicking header allows user to sort by column","ExploreTable","Fri Apr 03 21:32:11 UTC 2026","passed","Fri Apr 03 21:32:13 UTC 2026","","","",""
"Test cases for TestTrackerBuilder_Build_SortsKeysAndIDs","0","TestTrackerBuilder_Build_SortsKeysAndIDs","","Fri Apr 03 21:31:24 UTC 2026","passed","Fri Apr 03 21:31:24 UTC 2026","","Go Test","github.com/specterops/bloodhound/packages/go/analysis/delta/TestTrackerBuilder_Build_SortsKeysAndIDs","TestTrackerBuilder_Build_SortsKeysAndIDs"
"","2","filters by collected=true when ""yes"" filter is active","filterAndSearchEnvironments","Fri Apr 03 21:32:29 UTC 2026","passed","Fri Apr 03 21:32:29 UTC 2026","","collected filters","",""
"","341","should display a searchbox with a placeholder when rendered","AssetGroupEdit","Fri Apr 03 21:35:11 UTC 2026","passed","Fri Apr 03 21:35:11 UTC 2026","","","",""
"","168","should disable the create provider button and not display providers if the user lacks permission","SSOConfiguration","Fri Apr 03 21:33:27 UTC 2026","passed","Fri Apr 03 21:33:27 UTC 2026","","","",""
"","221","should render","NoDataDialog","Fri Apr 03 21:36:59 UTC 2026","passed","Fri Apr 03 21:37:00 UTC 2026","","","",""
"","406","displays a validation error","ManagedDatePicker - date validation","Fri Apr 03 21:34:45 UTC 2026","passed","Fri Apr 03 21:34:45 UTC 2026","","","",""
"Test cases for TestInt64FromPtr","0","TestInt64FromPtr","","Fri Apr 03 21:31:12 UTC 2026","passed","Fri Apr 03 21:31:12 UTC 2026","","Go Test","github.com/specterops/bloodhound/cmd/api/src/database/types/null/TestInt64FromPtr","TestInt64FromPtr"
"","1","handles unix time values by converting them to our standard date display format","Formatting number properties","Fri Apr 03 21:33:28 UTC 2026","passed","Fri Apr 03 21:33:28 UTC 2026","","","",""
"","450","calls setFilters when the Confirm button is clicked","Privilege Zones History Filter Dialog","Fri Apr 03 21:34:27 UTC 2026","passed","Fri Apr 03 21:34:28 UTC 2026","","","",""
"","20","returns a prefer wait in the header when db config timeout limit setting is disabled and state of is disable query limit is true","useExploreGraph","Fri Apr 03 21:32:52 UTC 2026","passed","Fri Apr 03 21:32:52 UTC 2026","userSettings","exploreGraphQueryFactory","",""
"","283","calls the onReset prop when the crop button is clicked","GraphControls","Fri Apr 03 21:32:56 UTC 2026","passed","Fri Apr 03 21:32:57 UTC 2026","","Resetting graph","",""
"","815","disables the confirm button until user types required text","Tag Form","Fri Apr 03 21:32:18 UTC 2026","passed","Fri Apr 03 21:32:18 UTC 2026","","","",""
"","187","displays loading state","SourceKindsCheckboxes","Fri Apr 03 21:34:16 UTC 2026","passed","Fri Apr 03 21:34:16 UTC 2026","","","",""
"Test cases for TestResources_UpdateSavedQuery_OwnPublicQuery_Success","0","TestResources_UpdateSavedQuery_OwnPublicQuery_Success","","Fri Apr 03 21:31:10 UTC 2026","passed","Fri Apr 03 21:31:10 UTC 2026","","Go Test","github.com/specterops/bloodhound/cmd/api/src/api/v2/TestResources_UpdateSavedQuery_OwnPublicQuery_Success","TestResources_UpdateSavedQuery_OwnPublicQuery_Success"
"Test cases for TestSavedQueries_IsString","0","TestSavedQueries_IsString","","Fri Apr 03 21:31:12 UTC 2026","passed","Fri Apr 03 21:31:12 UTC 2026","","Go Test","github.com/specterops/bloodhound/cmd/api/src/model/TestSavedQueries_IsString","TestSavedQueries_IsString"
"","60","stores the state of a search term without modifying the query params","useCypherSearch","Fri Apr 03 21:36:35 UTC 2026","passed","Fri Apr 03 21:36:35 UTC 2026","","","",""
"","411","should render","OneTimePasscodeForm","Fri Apr 03 21:36:10 UTC 2026","passed","Fri Apr 03 21:36:10 UTC 2026","","","",""
"Test cases for TestTimeExactEqual","1","TestTimeExactEqual","","Fri Apr 03 21:31:12 UTC 2026","passed","Fri Apr 03 21:31:12 UTC 2026","","Go Test","github.com/specterops/bloodhound/cmd/api/src/database/types/null/TestTimeExactEqual","TestTimeExactEqual"
"","754","calls the passed in select handler when clicking the Confirm button","Glyph Select Dialog","Fri Apr 03 21:36:39 UTC 2026","passed","Fri Apr 03 21:36:40 UTC 2026","","","",""
"","272","should not render list items for domains that are not collected","Context Selector","Fri Apr 03 21:33:49 UTC 2026","passed","Fri Apr 03 21:33:49 UTC 2026","","","",""
"Test cases for TestOpenGraphSchemaService_ListExtensions","4","TestOpenGraphSchemaService_ListExtensions","","Fri Apr 03 21:31:16 UTC 2026","passed","Fri Apr 03 21:31:16 UTC 2026","","Go Test","github.com/specterops/bloodhound/cmd/api/src/services/opengraphschema/TestOpenGraphSchemaService_ListExtensions","TestOpenGraphSchemaService_ListExtensions"
"Test cases for TestMarshalTime","0","TestMarshalTime","","Fri Apr 03 21:31:12 UTC 2026","passed","Fri Apr 03 21:31:12 UTC 2026","","Go Test","github.com/specterops/bloodhound/cmd/api/src/database/types/null/TestMarshalTime","TestMarshalTime"
"","574","renders the form for creating a new zone","Tag Form","Fri Apr 03 21:32:14 UTC 2026","passed","Fri Apr 03 21:32:15 UTC 2026","","","",""
"Test cases for TestGetScheme","0","TestGetScheme","","Fri Apr 03 21:31:02 UTC 2026","passed","Fri Apr 03 21:31:02 UTC 2026","","Go Test","github.com/specterops/bloodhound/cmd/api/src/api/middleware/TestGetScheme","TestGetScheme"
"","760","dark mode should persist between logging in and out","redux store","Fri Apr 03 21:38:05 UTC 2026","passed","Fri Apr 03 21:38:05 UTC 2026","","","",""
"","50","returns when zone limit is reached","useTagLimits","Fri Apr 03 21:32:44 UTC 2026","passed","Fri Apr 03 21:32:44 UTC 2026","","","",""
"","2","determines glyphs with the tier_managent_engine feature flag disabled","getNodeGlyphs","Fri Apr 03 21:37:43 UTC 2026","passed","Fri Apr 03 21:37:43 UTC 2026","","","",""
"Test cases for TestResources_ListAssetGroupCollections","0","TestResources_ListAssetGroupCollections","","Fri Apr 03 21:31:10 UTC 2026","passed","Fri Apr 03 21:31:10 UTC 2026","","Go Test","github.com/specterops/bloodhound/cmd/api/src/api/v2/TestResources_ListAssetGroupCollections","TestResources_ListAssetGroupCollections"
"Test cases for TestActivateMFA_Success","653","TestActivateMFA_Success","","Fri Apr 03 21:31:43 UTC 2026","passed","Fri Apr 03 21:31:44 UTC 2026","","Go Test","github.com/specterops/bloodhound/cmd/api/src/api/v2/auth/TestActivateMFA_Success","TestActivateMFA_Success"
"Test cases for Test_ParseSortParameters","0","Test_ParseSortParameters","","Fri Apr 03 21:30:59 UTC 2026","passed","Fri Apr 03 21:30:59 UTC 2026","","Go Test","github.com/specterops/bloodhound/cmd/api/src/api/Test_ParseSortParameters","Test_ParseSortParameters"
"Test cases for TestManagementResource_ListRoles_PredicateMismatchWithColumn","0","TestManagementResource_ListRoles_PredicateMismatchWithColumn","","Fri Apr 03 21:31:16 UTC 2026","passed","Fri Apr 03 21:31:16 UTC 2026","","Go Test","github.com/specterops/bloodhound/cmd/api/src/api/v2/auth/TestManagementResource_ListRoles_PredicateMismatchWithColumn","TestManagementResource_ListRoles_PredicateMismatchWithColumn"
"","1518","should call the setCypherQuery handler when the value in the editor changes","CypherSearch","Fri Apr 03 21:34:35 UTC 2026","passed","Fri Apr 03 21:34:37 UTC 2026","","","",""
"","371","renders an edit form for the selected asset group when a user has graph write permissions","GroupManagement","Fri Apr 03 21:37:50 UTC 2026","passed","Fri Apr 03 21:37:50 UTC 2026","","","",""
"Test cases for TestResources_ListExtensions","79","TestResources_ListExtensions","","Fri Apr 03 21:31:10 UTC 2026","passed","Fri Apr 03 21:31:10 UTC 2026","","Go Test","github.com/specterops/bloodhound/cmd/api/src/api/v2/TestResources_ListExtensions","TestResources_ListExtensions"
"","184","a null response from the server is handled","ExploreSearchCombobox with null response","Fri Apr 03 21:33:34 UTC 2026","passed","Fri Apr 03 21:33:34 UTC 2026","","","",""
