"DESCRIPTION","DURATION IN MS","NAME","PARENT SUITE","START TIME","STATUS","STOP TIME","SUB SUITE","SUITE","TEST CLASS","TEST METHOD"
"","723","should render inputs, labels, and action buttons","UpsertSAMLProviderForm","Fri Apr 03 21:35:48 UTC 2026","passed","Fri Apr 03 21:35:48 UTC 2026","","","",""
"","80","disables the JSON button if the JSON is empty","GraphControls","Fri Apr 03 21:32:59 UTC 2026","passed","Fri Apr 03 21:32:59 UTC 2026","","Exporting json","",""
"","1","determines glyphs with the tier_managent_engine feature flag enabled","getNodeGlyphs","Fri Apr 03 21:37:43 UTC 2026","passed","Fri Apr 03 21:37:43 UTC 2026","","","",""
"Test cases for TestResources_ListCAPKIHierarchy","1","TestResources_ListCAPKIHierarchy","","Fri Apr 03 21:31:10 UTC 2026","passed","Fri Apr 03 21:31:10 UTC 2026","","Go Test","github.com/specterops/bloodhound/cmd/api/src/api/v2/TestResources_ListCAPKIHierarchy","TestResources_ListCAPKIHierarchy"
"Test cases for TestArgon2Digest_String","0","TestArgon2Digest_String","","Fri Apr 03 21:31:25 UTC 2026","passed","Fri Apr 03 21:31:25 UTC 2026","","Go Test","github.com/specterops/bloodhound/packages/go/crypto/TestArgon2Digest_String","TestArgon2Digest_String"
"","734","dispatches an action to add the associated node","Rule Object Select","Fri Apr 03 21:35:35 UTC 2026","passed","Fri Apr 03 21:35:36 UTC 2026","","","",""
"","293","sets a primarySearch=id and searchType=pathfinding when secondarySearch is truthy","ContextMenu","Fri Apr 03 21:37:40 UTC 2026","passed","Fri Apr 03 21:37:41 UTC 2026","","","",""
"Test cases for TestRoleMembers","1","TestRoleMembers","","Fri Apr 03 21:31:24 UTC 2026","passed","Fri Apr 03 21:31:24 UTC 2026","","Go Test","github.com/specterops/bloodhound/packages/go/analysis/azure/TestRoleMembers","TestRoleMembers"
"Test cases for TestMap","0","TestMap","","Fri Apr 03 21:31:26 UTC 2026","passed","Fri Apr 03 21:31:26 UTC 2026","","Go Test","github.com/specterops/bloodhound/packages/go/slicesext/TestMap","TestMap"
"","239","handles chevron click event","CommonSearches","Fri Apr 03 21:33:23 UTC 2026","passed","Fri Apr 03 21:33:24 UTC 2026","","","",""
"","411","should display ""Configure Multi-Factor Authentication"" title","Enable2FADialog","Fri Apr 03 21:34:50 UTC 2026","passed","Fri Apr 03 21:34:51 UTC 2026","","","",""
"","183","calls exportToJson util when valid non a empty object is passed as the jsonData prop","GraphControls","Fri Apr 03 21:32:59 UTC 2026","passed","Fri Apr 03 21:32:59 UTC 2026","","Exporting json","",""
"","37","does not render the analysis toggle when multi tier analysis enabled is false","Tag Form","Fri Apr 03 21:32:16 UTC 2026","passed","Fri Apr 03 21:32:16 UTC 2026","","","",""
"","297","should render","SSOProviderTable","Fri Apr 03 21:35:34 UTC 2026","passed","Fri Apr 03 21:35:35 UTC 2026","","","",""
"Test cases for TestFloatPointer","0","TestFloatPointer","","Fri Apr 03 21:31:12 UTC 2026","passed","Fri Apr 03 21:31:12 UTC 2026","","Go Test","github.com/specterops/bloodhound/cmd/api/src/database/types/null/TestFloatPointer","TestFloatPointer"
"","0","fails for password without digits","testPassword","Fri Apr 03 21:37:02 UTC 2026","passed","Fri Apr 03 21:37:02 UTC 2026","","","",""
"","259","fires click handlers","ConfirmDeleteQueryDialog","Fri Apr 03 21:36:55 UTC 2026","passed","Fri Apr 03 21:36:56 UTC 2026","","","",""
"Test cases for TestGC_Name","0","TestGC_Name","","Fri Apr 03 21:31:11 UTC 2026","passed","Fri Apr 03 21:31:11 UTC 2026","","Go Test","github.com/specterops/bloodhound/cmd/api/src/daemons/gc/TestGC_Name","TestGC_Name"
"","302","displays expected results when searching by label","SearchCurrentNodes","Fri Apr 03 21:35:04 UTC 2026","passed","Fri Apr 03 21:35:04 UTC 2026","","","",""
"Test cases for TestWriteAndValidateJSON_NormalizationError","3","TestWriteAndValidateJSON_NormalizationError","","Fri Apr 03 21:31:17 UTC 2026","passed","Fri Apr 03 21:31:17 UTC 2026","","Go Test","github.com/specterops/bloodhound/cmd/api/src/services/upload/TestWriteAndValidateJSON_NormalizationError","TestWriteAndValidateJSON_NormalizationError"
"","6","returns true when WebGL is available in the current browser context","WebGL compatibility check","Fri Apr 03 21:37:10 UTC 2026","passed","Fri Apr 03 21:37:10 UTC 2026","","","",""
"Test cases for TestUnmarshalNonIntegerNumber","0","TestUnmarshalNonIntegerNumber","","Fri Apr 03 21:31:12 UTC 2026","passed","Fri Apr 03 21:31:12 UTC 2026","","Go Test","github.com/specterops/bloodhound/cmd/api/src/database/types/null/TestUnmarshalNonIntegerNumber","TestUnmarshalNonIntegerNumber"
"","3517","The password reset dialog is opened when switching a user from SAML based authentication to username/password based authentication","Users","Fri Apr 03 21:34:01 UTC 2026","passed","Fri Apr 03 21:34:05 UTC 2026","","","",""
"","164","displays appropriate text when there are no matches for search term","SearchCurrentNodes","Fri Apr 03 21:35:03 UTC 2026","passed","Fri Apr 03 21:35:04 UTC 2026","","","",""
"","1","reports when API error response has errors array","handleError","Fri Apr 03 21:32:56 UTC 2026","passed","Fri Apr 03 21:32:56 UTC 2026","","","",""
"Test cases for TestResources_CypherQuery","118","TestResources_CypherQuery","","Fri Apr 03 21:31:10 UTC 2026","passed","Fri Apr 03 21:31:10 UTC 2026","","Go Test","github.com/specterops/bloodhound/cmd/api/src/api/v2/TestResources_CypherQuery","TestResources_CypherQuery"
"Test cases for TestWriteBinaryResponse","0","TestWriteBinaryResponse","","Fri Apr 03 21:30:59 UTC 2026","passed","Fri Apr 03 21:30:59 UTC 2026","","Go Test","github.com/specterops/bloodhound/cmd/api/src/api/TestWriteBinaryResponse","TestWriteBinaryResponse"
"Test cases for Test_UseHooks","0","Test_UseHooks","","Fri Apr 03 21:31:25 UTC 2026","passed","Fri Apr 03 21:31:25 UTC 2026","","Go Test","github.com/specterops/bloodhound/packages/go/lab/Test_UseHooks","Test_UseHooks"
"Test cases for TestFilterStructSlice","0","TestFilterStructSlice","","Fri Apr 03 21:30:59 UTC 2026","passed","Fri Apr 03 21:30:59 UTC 2026","","Go Test","github.com/specterops/bloodhound/cmd/api/src/api/TestFilterStructSlice","TestFilterStructSlice"
"Test cases for TestResources_ListADGroupMembership","3","TestResources_ListADGroupMembership","","Fri Apr 03 21:31:10 UTC 2026","passed","Fri Apr 03 21:31:10 UTC 2026","","Go Test","github.com/specterops/bloodhound/cmd/api/src/api/v2/TestResources_ListADGroupMembership","TestResources_ListADGroupMembership"
"","7","updates key in state","useObjectState","Fri Apr 03 21:36:16 UTC 2026","passed","Fri Apr 03 21:36:16 UTC 2026","","","",""
"","30","whencreated","Handling value formatting for Active Directory entity properties lastlogon, lastlogontimestamp, whencreated, and pwdlastset","Fri Apr 03 21:33:28 UTC 2026","passed","Fri Apr 03 21:33:28 UTC 2026","","","",""
"Copyright 2021 The Go Authors. All rights reserved.TestConcat was ripped from go1.22 source and should be replaced with the stdlib implementation when we move to 1.22Original source: https:","0","TestConcat_too_large","","Fri Apr 03 21:31:26 UTC 2026","passed","Fri Apr 03 21:31:26 UTC 2026","","Go Test","github.com/specterops/bloodhound/packages/go/slicesext/TestConcat_too_large","TestConcat_too_large"
"Test cases for TestToolContainer_GetScheduledAnalysisConfiguration_Errors","3","TestToolContainer_GetScheduledAnalysisConfiguration_Errors","","Fri Apr 03 21:31:03 UTC 2026","passed","Fri Apr 03 21:31:03 UTC 2026","","Go Test","github.com/specterops/bloodhound/cmd/api/src/api/tools/TestToolContainer_GetScheduledAnalysisConfiguration_Errors","TestToolContainer_GetScheduledAnalysisConfiguration_Errors"
"","0","returns paramValue as EnvironmentAggregation if paramValue is active-directory","useEnvironmentParams","Fri Apr 03 21:37:01 UTC 2026","passed","Fri Apr 03 21:37:01 UTC 2026","","parseEnvironmentAggregation","",""
"Test cases for TestResources_ListADEntityConstrainedDelegationRights","0","TestResources_ListADEntityConstrainedDelegationRights","","Fri Apr 03 21:31:10 UTC 2026","passed","Fri Apr 03 21:31:10 UTC 2026","","Go Test","github.com/specterops/bloodhound/cmd/api/src/api/v2/TestResources_ListADEntityConstrainedDelegationRights","TestResources_ListADEntityConstrainedDelegationRights"
"Test cases for TestUnique","0","TestUnique","","Fri Apr 03 21:31:26 UTC 2026","passed","Fri Apr 03 21:31:26 UTC 2026","","Go Test","github.com/specterops/bloodhound/packages/go/slicesext/TestUnique","TestUnique"
"","82","initializes the categories with just the built-in defaults when edge endpoint returns nothing","useEdgeCategories","Fri Apr 03 21:33:38 UTC 2026","passed","Fri Apr 03 21:33:38 UTC 2026","","","",""
"","209","renders an interactive version when preview is set to false","PrivilegeZonesCypherEditor Search component for Zone Management","Fri Apr 03 21:35:55 UTC 2026","passed","Fri Apr 03 21:35:55 UTC 2026","","","",""
"Test cases for TestIntScan","0","TestIntScan","","Fri Apr 03 21:31:12 UTC 2026","passed","Fri Apr 03 21:31:12 UTC 2026","","Go Test","github.com/specterops/bloodhound/cmd/api/src/database/types/null/TestIntScan","TestIntScan"
"Test cases for TestParseAGMembersFromNodes_MissingNodeProperties","1","TestParseAGMembersFromNodes_MissingNodeProperties","","Fri Apr 03 21:31:10 UTC 2026","passed","Fri Apr 03 21:31:10 UTC 2026","","Go Test","github.com/specterops/bloodhound/cmd/api/src/api/v2/TestParseAGMembersFromNodes_MissingNodeProperties","TestParseAGMembersFromNodes_MissingNodeProperties"
"Test cases for TestExpireUserAuthSecret_Success","0","TestExpireUserAuthSecret_Success","","Fri Apr 03 21:31:16 UTC 2026","passed","Fri Apr 03 21:31:16 UTC 2026","","Go Test","github.com/specterops/bloodhound/cmd/api/src/api/v2/auth/TestExpireUserAuthSecret_Success","TestExpireUserAuthSecret_Success"
"Test cases for TestManagementResource_ListRoles_DBError","0","TestManagementResource_ListRoles_DBError","","Fri Apr 03 21:31:16 UTC 2026","passed","Fri Apr 03 21:31:16 UTC 2026","","Go Test","github.com/specterops/bloodhound/cmd/api/src/api/v2/auth/TestManagementResource_ListRoles_DBError","TestManagementResource_ListRoles_DBError"
"Test cases for TestPermissionsCheckAll","4","TestPermissionsCheckAll","","Fri Apr 03 21:31:02 UTC 2026","passed","Fri Apr 03 21:31:02 UTC 2026","","Go Test","github.com/specterops/bloodhound/cmd/api/src/api/middleware/TestPermissionsCheckAll","TestPermissionsCheckAll"
"Test cases for TestIsValidEmail","0","TestIsValidEmail","","Fri Apr 03 21:31:18 UTC 2026","passed","Fri Apr 03 21:31:18 UTC 2026","","Go Test","github.com/specterops/bloodhound/cmd/api/src/utils/TestIsValidEmail","TestIsValidEmail"
"","63","enables filtering out for tags that are treated as Labels (including Owned)","the useAssetGroupTags utilities","Fri Apr 03 21:33:10 UTC 2026","passed","Fri Apr 03 21:33:10 UTC 2026","","","",""
"","29","should highlight main nav route when navigating to child route","Main Nav Route Highlighting","Fri Apr 03 21:33:54 UTC 2026","passed","Fri Apr 03 21:33:54 UTC 2026","","","",""
"Test cases for TestContextMiddleware_InvalidWaitLessThanZero","0","TestContextMiddleware_InvalidWaitLessThanZero","","Fri Apr 03 21:31:02 UTC 2026","passed","Fri Apr 03 21:31:02 UTC 2026","","Go Test","github.com/specterops/bloodhound/cmd/api/src/api/middleware/TestContextMiddleware_InvalidWaitLessThanZero","TestContextMiddleware_InvalidWaitLessThanZero"
"Test cases for TestNormalizeToUTF8","0","TestNormalizeToUTF8","","Fri Apr 03 21:31:25 UTC 2026","passed","Fri Apr 03 21:31:25 UTC 2026","","Go Test","github.com/specterops/bloodhound/packages/go/bomenc/TestNormalizeToUTF8","TestNormalizeToUTF8"
"Test cases for TestNewAuditLog","0","TestNewAuditLog","","Fri Apr 03 21:31:11 UTC 2026","passed","Fri Apr 03 21:31:11 UTC 2026","","Go Test","github.com/specterops/bloodhound/cmd/api/src/database/TestNewAuditLog","TestNewAuditLog"
"Test cases for TestHandleDatabaseError","0","TestHandleDatabaseError","","Fri Apr 03 21:30:59 UTC 2026","passed","Fri Apr 03 21:30:59 UTC 2026","","Go Test","github.com/specterops/bloodhound/cmd/api/src/api/TestHandleDatabaseError","TestHandleDatabaseError"
"","1","filters by moderate risk level","filterAndSearchEnvironments","Fri Apr 03 21:32:29 UTC 2026","passed","Fri Apr 03 21:32:29 UTC 2026","","risk filters","",""
"","2","returns undefined if graphData is undefined","normalizeGraphDataForSigma","Fri Apr 03 21:38:08 UTC 2026","passed","Fri Apr 03 21:38:08 UTC 2026","","","",""
"","712","should open save dialog on keyboard press alt+S","CypherSearch","Fri Apr 03 21:34:38 UTC 2026","passed","Fri Apr 03 21:34:39 UTC 2026","","","",""
"Test cases for TestDetectBOMEncoding","0","TestDetectBOMEncoding","","Fri Apr 03 21:31:25 UTC 2026","passed","Fri Apr 03 21:31:25 UTC 2026","","Go Test","github.com/specterops/bloodhound/packages/go/bomenc/TestDetectBOMEncoding","TestDetectBOMEncoding"
"Test cases for TestManagementResource_ListAuthTokens_UserIDFilter","1","TestManagementResource_ListAuthTokens_UserIDFilter","","Fri Apr 03 21:31:36 UTC 2026","passed","Fri Apr 03 21:31:36 UTC 2026","","Go Test","github.com/specterops/bloodhound/cmd/api/src/api/v2/auth/TestManagementResource_ListAuthTokens_UserIDFilter","TestManagementResource_ListAuthTokens_UserIDFilter"
"","304","should render an SavedQueryPermissions component","SaveQueryDialog","Fri Apr 03 21:32:18 UTC 2026","passed","Fri Apr 03 21:32:18 UTC 2026","","","",""
"Test cases for TestFloatValueOrZero","0","TestFloatValueOrZero","","Fri Apr 03 21:31:12 UTC 2026","passed","Fri Apr 03 21:31:12 UTC 2026","","Go Test","github.com/specterops/bloodhound/cmd/api/src/database/types/null/TestFloatValueOrZero","TestFloatValueOrZero"
"Test cases for TestNodeNamePrefix_String","0","TestNodeNamePrefix_String","","Fri Apr 03 21:31:24 UTC 2026","passed","Fri Apr 03 21:31:24 UTC 2026","","Go Test","github.com/specterops/bloodhound/packages/go/analysis/ad/wellknown/TestNodeNamePrefix_String","TestNodeNamePrefix_String"
"","8","uses the discardQueryParams prop to discard all query params on the redirect","AppNavigate","Fri Apr 03 21:35:46 UTC 2026","passed","Fri Apr 03 21:35:46 UTC 2026","","","",""
"","10","dismisses a notification","AppNotifications","Fri Apr 03 21:35:44 UTC 2026","passed","Fri Apr 03 21:35:44 UTC 2026","","","",""
"","146","fires editQuery in context provider","ListItemActionMenu","Fri Apr 03 21:35:30 UTC 2026","passed","Fri Apr 03 21:35:30 UTC 2026","","","",""
"Test cases for TestRoleAssignments_NodeHasRole","0","TestRoleAssignments_NodeHasRole","","Fri Apr 03 21:31:24 UTC 2026","passed","Fri Apr 03 21:31:24 UTC 2026","","Go Test","github.com/specterops/bloodhound/packages/go/analysis/azure/TestRoleAssignments_NodeHasRole","TestRoleAssignments_NodeHasRole"
"","585","opens nested sections and updates URL params correctly","EntityInfoDataTable","Fri Apr 03 21:33:05 UTC 2026","passed","Fri Apr 03 21:33:06 UTC 2026","","Node count for nested table that counts all sections","",""
"","738","renders a button and a menu","CreateMenu","Fri Apr 03 21:33:35 UTC 2026","passed","Fri Apr 03 21:33:36 UTC 2026","","oidc_support feature flag enabled","",""
"Test cases for TestHasSequence","0","TestHasSequence","","Fri Apr 03 21:31:25 UTC 2026","passed","Fri Apr 03 21:31:25 UTC 2026","","Go Test","github.com/specterops/bloodhound/packages/go/bomenc/TestHasSequence","TestHasSequence"
"","616","adds node to asset group tag with confirmation","AssetGroupMenuItem","Fri Apr 03 21:33:26 UTC 2026","passed","Fri Apr 03 21:33:26 UTC 2026","","","",""
"","187","renders the form for editing an existing label","Tag Form","Fri Apr 03 21:32:15 UTC 2026","passed","Fri Apr 03 21:32:15 UTC 2026","","","",""
"","1","EXTENDED ROUNDING when thresholds are set: abbreviates hundred-thousands, millions, billions, trillions as expected","numberFormatting","Fri Apr 03 21:34:52 UTC 2026","passed","Fri Apr 03 21:34:52 UTC 2026","","","",""
"","129","button displays ""Enabled"" when flag is enabled","EarlyAccessFeatureToggle","Fri Apr 03 21:38:02 UTC 2026","passed","Fri Apr 03 21:38:02 UTC 2026","","","",""
"","1","handles null or empty madeBy","createHistoryParams","Fri Apr 03 21:36:03 UTC 2026","passed","Fri Apr 03 21:36:03 UTC 2026","","","",""
"Test cases for TestResources_ListADComputerSessions","0","TestResources_ListADComputerSessions","","Fri Apr 03 21:31:10 UTC 2026","passed","Fri Apr 03 21:31:10 UTC 2026","","Go Test","github.com/specterops/bloodhound/cmd/api/src/api/v2/TestResources_ListADComputerSessions","TestResources_ListADComputerSessions"
"Test cases for TestDatabase_checkError_OtherError","1","TestDatabase_checkError_OtherError","","Fri Apr 03 21:31:11 UTC 2026","passed","Fri Apr 03 21:31:11 UTC 2026","","Go Test","github.com/specterops/bloodhound/cmd/api/src/database/TestDatabase_checkError_OtherError","TestDatabase_checkError_OtherError"
"Test cases for TestFloatEqual","0","TestFloatEqual","","Fri Apr 03 21:31:12 UTC 2026","passed","Fri Apr 03 21:31:12 UTC 2026","","Go Test","github.com/specterops/bloodhound/cmd/api/src/database/types/null/TestFloatEqual","TestFloatEqual"
"","96","initializes the list with all filters checked by default","usePathfindingFilters","Fri Apr 03 21:36:27 UTC 2026","passed","Fri Apr 03 21:36:27 UTC 2026","","","",""
"","445","should call onSubmit with one time passcode when check code button clicked","OneTimePasscodeForm","Fri Apr 03 21:36:10 UTC 2026","passed","Fri Apr 03 21:36:11 UTC 2026","","","",""
"Test cases for TestManagementResource_OIDCCallbackHandler","14","TestManagementResource_OIDCCallbackHandler","","Fri Apr 03 21:31:44 UTC 2026","passed","Fri Apr 03 21:31:44 UTC 2026","","Go Test","github.com/specterops/bloodhound/cmd/api/src/api/v2/auth/TestManagementResource_OIDCCallbackHandler","TestManagementResource_OIDCCallbackHandler"
"Test cases for TestRequiredValidator","0","TestRequiredValidator","","Fri Apr 03 21:31:21 UTC 2026","passed","Fri Apr 03 21:31:21 UTC 2026","","Go Test","github.com/specterops/bloodhound/cmd/api/src/utils/validation/TestRequiredValidator","TestRequiredValidator"
"","829","should not allow the input to exceed the allowed length","UpdateUserForm","Fri Apr 03 21:32:22 UTC 2026","passed","Fri Apr 03 21:32:23 UTC 2026","","","",""
"","327","should display a ""Configure Multi-Factor Authentication"" modal","UserProfile","Fri Apr 03 21:33:47 UTC 2026","passed","Fri Apr 03 21:33:48 UTC 2026","","""Multi-Factor Authentication"" switch","",""
"Test cases for TestTypes_Scan_InvalidInput","0","TestTypes_Scan_InvalidInput","","Fri Apr 03 21:31:12 UTC 2026","passed","Fri Apr 03 21:31:12 UTC 2026","","Go Test","github.com/specterops/bloodhound/cmd/api/src/database/types/TestTypes_Scan_InvalidInput","TestTypes_Scan_InvalidInput"
"","49","renders section when no errors occur","EntityInfoCollapsibleSection","Fri Apr 03 21:36:32 UTC 2026","passed","Fri Apr 03 21:36:32 UTC 2026","","","",""
"Test cases for TestServeHTTP_Success","0","TestServeHTTP_Success","","Fri Apr 03 21:31:02 UTC 2026","passed","Fri Apr 03 21:31:02 UTC 2026","","Go Test","github.com/specterops/bloodhound/cmd/api/src/api/middleware/TestServeHTTP_Success","TestServeHTTP_Success"
"","142","shows the direct object and expanded object list when results are present for both","Seed Selection Results","Fri Apr 03 21:33:10 UTC 2026","passed","Fri Apr 03 21:33:10 UTC 2026","","","",""
"Test cases for TestTimeFrom","0","TestTimeFrom","","Fri Apr 03 21:31:12 UTC 2026","passed","Fri Apr 03 21:31:12 UTC 2026","","Go Test","github.com/specterops/bloodhound/cmd/api/src/database/types/null/TestTimeFrom","TestTimeFrom"
"","8","when password is expired and on password reset page, no redirect occurs","AuthenticatedRoute","Fri Apr 03 21:37:59 UTC 2026","passed","Fri Apr 03 21:37:59 UTC 2026","","","",""
"","1","combines collected and risk filters","filterAndSearchEnvironments","Fri Apr 03 21:32:29 UTC 2026","passed","Fri Apr 03 21:32:29 UTC 2026","","combined filters","",""
"Test cases for Test_signedRequestDate","0","Test_signedRequestDate","","Fri Apr 03 21:31:02 UTC 2026","passed","Fri Apr 03 21:31:02 UTC 2026","","Go Test","github.com/specterops/bloodhound/cmd/api/src/api/middleware/Test_signedRequestDate","Test_signedRequestDate"
"Test cases for TestGetOrderForNeo4jQuery","0","TestGetOrderForNeo4jQuery","","Fri Apr 03 21:31:18 UTC 2026","passed","Fri Apr 03 21:31:18 UTC 2026","","Go Test","github.com/specterops/bloodhound/cmd/api/src/utils/TestGetOrderForNeo4jQuery","TestGetOrderForNeo4jQuery"
"","1848","should clear out the sso provider id from submission data when the authentication method is changed","UpdateUserDialog","Fri Apr 03 21:32:52 UTC 2026","passed","Fri Apr 03 21:32:54 UTC 2026","","","",""
"Test cases for Test_NewSpecWithHooks","0","Test_NewSpecWithHooks","","Fri Apr 03 21:31:25 UTC 2026","passed","Fri Apr 03 21:31:25 UTC 2026","","Go Test","github.com/specterops/bloodhound/packages/go/lab/Test_NewSpecWithHooks","Test_NewSpecWithHooks"
"Test cases for TestConvertContainerToNode_InheritanceHashes","1","TestConvertContainerToNode_InheritanceHashes","","Fri Apr 03 21:31:25 UTC 2026","passed","Fri Apr 03 21:31:25 UTC 2026","","Go Test","github.com/specterops/bloodhound/packages/go/ein/TestConvertContainerToNode_InheritanceHashes","TestConvertContainerToNode_InheritanceHashes"
"","380","Should call handler when a member is clicked","AssetGroupMemberList","Fri Apr 03 21:36:15 UTC 2026","passed","Fri Apr 03 21:36:16 UTC 2026","","","",""
"","101","renders enabled Zone and Object tabs and disabled Rule tab","Selected Details Tabs","Fri Apr 03 21:34:20 UTC 2026","passed","Fri Apr 03 21:34:20 UTC 2026","","Selected Details Tabs - Params present","",""
"Test cases for TestParseUserIP_RemoteAddrOnly","0","TestParseUserIP_RemoteAddrOnly","","Fri Apr 03 21:31:02 UTC 2026","passed","Fri Apr 03 21:31:02 UTC 2026","","Go Test","github.com/specterops/bloodhound/cmd/api/src/api/middleware/TestParseUserIP_RemoteAddrOnly","TestParseUserIP_RemoteAddrOnly"
"Test cases for TestDomainSelectors_TestIsSortable","0","TestDomainSelectors_TestIsSortable","","Fri Apr 03 21:31:12 UTC 2026","passed","Fri Apr 03 21:31:12 UTC 2026","","Go Test","github.com/specterops/bloodhound/cmd/api/src/model/TestDomainSelectors_TestIsSortable","TestDomainSelectors_TestIsSortable"
"","67","returns the full environment for the environmentid passed","useAvailableEnvironments","Fri Apr 03 21:36:05 UTC 2026","passed","Fri Apr 03 21:36:05 UTC 2026","","useSelectedEnvironment","",""
"","238","should fire ""onClose"" once","UserTokenManagementDialog","Fri Apr 03 21:33:18 UTC 2026","passed","Fri Apr 03 21:33:18 UTC 2026","","when user clicks ""Close"" button","",""
"Test cases for Test_filterAndFormatSearchResults_default","0","Test_filterAndFormatSearchResults_default","","Fri Apr 03 21:31:10 UTC 2026","passed","Fri Apr 03 21:31:10 UTC 2026","","Go Test","github.com/specterops/bloodhound/cmd/api/src/api/v2/Test_filterAndFormatSearchResults_default","Test_filterAndFormatSearchResults_default"
"","25","returns initialValue when the key is absent from localStorage","useLocalStorage","Fri Apr 03 21:33:56 UTC 2026","passed","Fri Apr 03 21:33:56 UTC 2026","","initial value","",""
"","1","should recognize azure properties","validating a node property against the shared generated schema","Fri Apr 03 21:33:28 UTC 2026","passed","Fri Apr 03 21:33:28 UTC 2026","","","",""
"","24","returns Rule Object counts when there is a Tag and a Rule selected (tagId and ruleId are in path params)","useObjectCounts","Fri Apr 03 21:36:35 UTC 2026","passed","Fri Apr 03 21:36:35 UTC 2026","","","",""
"Test cases for TestFloatFrom","0","TestFloatFrom","","Fri Apr 03 21:31:12 UTC 2026","passed","Fri Apr 03 21:31:12 UTC 2026","","Go Test","github.com/specterops/bloodhound/cmd/api/src/database/types/null/TestFloatFrom","TestFloatFrom"
"","273","Selecting an edge with a Computer target node that does not have haslaps enabled shows correct Windows Abuse text","EdgeInfoContent","Fri Apr 03 21:32:34 UTC 2026","passed","Fri Apr 03 21:32:35 UTC 2026","","","",""
"","1","returns default error message for unknown API messages","getErrorMessage","Fri Apr 03 21:32:56 UTC 2026","passed","Fri Apr 03 21:32:56 UTC 2026","","","",""
"","101","should display a total count of asset group members","AssetGroupEdit","Fri Apr 03 21:35:11 UTC 2026","passed","Fri Apr 03 21:35:11 UTC 2026","","","",""
"","1102","shows a table with partially completed jobs","FileIngestTable","Fri Apr 03 21:34:30 UTC 2026","passed","Fri Apr 03 21:34:32 UTC 2026","","","",""
"Test cases for TestPredefinedSIDSuffixes","1","TestPredefinedSIDSuffixes","","Fri Apr 03 21:31:24 UTC 2026","passed","Fri Apr 03 21:31:24 UTC 2026","","Go Test","github.com/specterops/bloodhound/packages/go/analysis/ad/wellknown/TestPredefinedSIDSuffixes","TestPredefinedSIDSuffixes"
"Test cases for TestResources_GetAssetGroupSelectorMemberCountsByKind","6","TestResources_GetAssetGroupSelectorMemberCountsByKind","","Fri Apr 03 21:31:10 UTC 2026","passed","Fri Apr 03 21:31:10 UTC 2026","","Go Test","github.com/specterops/bloodhound/cmd/api/src/api/v2/TestResources_GetAssetGroupSelectorMemberCountsByKind","TestResources_GetAssetGroupSelectorMemberCountsByKind"
"Test cases for Test_ConvertAzureRoleManagementPolicyAssignment","0","Test_ConvertAzureRoleManagementPolicyAssignment","","Fri Apr 03 21:31:25 UTC 2026","passed","Fri Apr 03 21:31:25 UTC 2026","","Go Test","github.com/specterops/bloodhound/packages/go/ein/Test_ConvertAzureRoleManagementPolicyAssignment","Test_ConvertAzureRoleManagementPolicyAssignment"
"Test cases for TestResources_UpdateSavedQuery_InvalidBody","0","TestResources_UpdateSavedQuery_InvalidBody","","Fri Apr 03 21:31:10 UTC 2026","passed","Fri Apr 03 21:31:10 UTC 2026","","Go Test","github.com/specterops/bloodhound/cmd/api/src/api/v2/TestResources_UpdateSavedQuery_InvalidBody","TestResources_UpdateSavedQuery_InvalidBody"
