"DESCRIPTION","DURATION IN MS","NAME","PARENT SUITE","START TIME","STATUS","STOP TIME","SUB SUITE","SUITE","TEST CLASS","TEST METHOD"
"","101","highlights the selectedLayout when isExploreLayoutSelected is true","GraphControls","Wed Jun 10 19:23:23 UTC 2026","passed","Wed Jun 10 19:23:24 UTC 2026","","Selecting a layout","",""
"","4","returns a date string only if passed a string with a matching key","Formatting strings via formatPrimive","Wed Jun 10 19:25:06 UTC 2026","passed","Wed Jun 10 19:25:06 UTC 2026","","","",""
"","737","does not allow confirmation while dates are invalid","FileIngestFilterDialog","Wed Jun 10 19:24:43 UTC 2026","passed","Wed Jun 10 19:24:44 UTC 2026","","Date Range Inputs","",""
"Test cases for TestManagementResource_ListAuthTokens_DBError","0","TestManagementResource_ListAuthTokens_DBError","","Wed Jun 10 19:22:13 UTC 2026","passed","Wed Jun 10 19:22:13 UTC 2026","","Go Test","github.com/specterops/bloodhound/cmd/api/src/api/v2/auth/TestManagementResource_ListAuthTokens_DBError","TestManagementResource_ListAuthTokens_DBError"
"","0","fails for password without digits","testPassword","Wed Jun 10 19:28:16 UTC 2026","passed","Wed Jun 10 19:28:16 UTC 2026","","","",""
"","62","sets autoDisplayTable to true if query returns nodes only, searchType = cypher, and and enabled is true","useExploreTableAutoDisplay","Wed Jun 10 19:27:12 UTC 2026","passed","Wed Jun 10 19:27:12 UTC 2026","","","",""
"Test cases for TestUnique","1","TestUnique","","Wed Jun 10 19:22:18 UTC 2026","passed","Wed Jun 10 19:22:18 UTC 2026","","Go Test","github.com/specterops/bloodhound/packages/go/slicesext/TestUnique","TestUnique"
"Test cases for TestTenantRoles","0","TestTenantRoles","","Wed Jun 10 19:22:16 UTC 2026","passed","Wed Jun 10 19:22:16 UTC 2026","","Go Test","github.com/specterops/bloodhound/packages/go/analysis/azure/TestTenantRoles","TestTenantRoles"
"Test cases for TestTrackerBuilder_Build_SortsKeysAndIDs","0","TestTrackerBuilder_Build_SortsKeysAndIDs","","Wed Jun 10 19:22:16 UTC 2026","passed","Wed Jun 10 19:22:16 UTC 2026","","Go Test","github.com/specterops/bloodhound/packages/go/analysis/post/TestTrackerBuilder_Build_SortsKeysAndIDs","TestTrackerBuilder_Build_SortsKeysAndIDs"
"","485","runs the query and calls dispatch to set the node results","PrivilegeZonesCypherEditor Search component for Zone Management","Wed Jun 10 19:27:11 UTC 2026","passed","Wed Jun 10 19:27:11 UTC 2026","","","",""
"Test cases for TestSignRequestAtInternalError","0","TestSignRequestAtInternalError","","Wed Jun 10 19:22:11 UTC 2026","passed","Wed Jun 10 19:22:11 UTC 2026","","Go Test","github.com/specterops/bloodhound/cmd/api/src/api/TestSignRequestAtInternalError","TestSignRequestAtInternalError"
"Test cases for TestResources_ListAuditLogs_SkipAndOffset","0","TestResources_ListAuditLogs_SkipAndOffset","","Wed Jun 10 19:22:13 UTC 2026","passed","Wed Jun 10 19:22:13 UTC 2026","","Go Test","github.com/specterops/bloodhound/cmd/api/src/api/v2/TestResources_ListAuditLogs_SkipAndOffset","TestResources_ListAuditLogs_SkipAndOffset"
"Test cases for Test_NewSpecWithHooks","1","Test_NewSpecWithHooks","","Wed Jun 10 19:22:17 UTC 2026","passed","Wed Jun 10 19:22:17 UTC 2026","","Go Test","github.com/specterops/bloodhound/packages/go/lab/Test_NewSpecWithHooks","Test_NewSpecWithHooks"
"Test cases for TestIntFromPtr","0","TestIntFromPtr","","Wed Jun 10 19:22:13 UTC 2026","passed","Wed Jun 10 19:22:13 UTC 2026","","Go Test","github.com/specterops/bloodhound/cmd/api/src/database/types/null/TestIntFromPtr","TestIntFromPtr"
"Test cases for TestResources_DeleteExtension","66","TestResources_DeleteExtension","","Wed Jun 10 19:22:13 UTC 2026","passed","Wed Jun 10 19:22:13 UTC 2026","","Go Test","github.com/specterops/bloodhound/cmd/api/src/api/v2/TestResources_DeleteExtension","TestResources_DeleteExtension"
"","2","does not overwrite an existing localStorage value with initialValue","useLocalStorage","Wed Jun 10 19:25:30 UTC 2026","passed","Wed Jun 10 19:25:30 UTC 2026","","initial value","",""
"","894","does not show a warning for using labels associated with tags in label forms (also shows correct View in Explore link)","Rule Form","Wed Jun 10 19:23:30 UTC 2026","passed","Wed Jun 10 19:23:31 UTC 2026","","","",""
"","0","An unknown error occurred when fetching the data","Getting the text for the disabled item display for a search when there are no results","Wed Jun 10 19:26:39 UTC 2026","passed","Wed Jun 10 19:26:39 UTC 2026","","Error states","",""
"Test cases for TestResources_ListADEntityControllers","1","TestResources_ListADEntityControllers","","Wed Jun 10 19:22:13 UTC 2026","passed","Wed Jun 10 19:22:13 UTC 2026","","Go Test","github.com/specterops/bloodhound/cmd/api/src/api/v2/TestResources_ListADEntityControllers","TestResources_ListADEntityControllers"
"","22","displays a status label","StatusIndicator","Wed Jun 10 19:28:09 UTC 2026","passed","Wed Jun 10 19:28:09 UTC 2026","","","",""
"Test cases for TestStringSetValid","0","TestStringSetValid","","Wed Jun 10 19:22:13 UTC 2026","passed","Wed Jun 10 19:22:13 UTC 2026","","Go Test","github.com/specterops/bloodhound/cmd/api/src/database/types/null/TestStringSetValid","TestStringSetValid"
"","72","applies the given filters","useFinishedJobs","Wed Jun 10 19:25:41 UTC 2026","passed","Wed Jun 10 19:25:41 UTC 2026","","","",""
"Test cases for TestMarshalBool","0","TestMarshalBool","","Wed Jun 10 19:22:13 UTC 2026","passed","Wed Jun 10 19:22:13 UTC 2026","","Go Test","github.com/specterops/bloodhound/cmd/api/src/database/types/null/TestMarshalBool","TestMarshalBool"
"Test cases for TestAssetGroupMembers_Filter_Equals","0","TestAssetGroupMembers_Filter_Equals","","Wed Jun 10 19:22:11 UTC 2026","passed","Wed Jun 10 19:22:11 UTC 2026","","Go Test","github.com/specterops/bloodhound/cmd/api/src/api/TestAssetGroupMembers_Filter_Equals","TestAssetGroupMembers_Filter_Equals"
"Test cases for TestResources_GetFlags","0","TestResources_GetFlags","","Wed Jun 10 19:22:13 UTC 2026","passed","Wed Jun 10 19:22:13 UTC 2026","","Go Test","github.com/specterops/bloodhound/cmd/api/src/api/v2/TestResources_GetFlags","TestResources_GetFlags"
"","1","calculates skip correctly for pageParam > 1","createHistoryParams","Wed Jun 10 19:27:22 UTC 2026","passed","Wed Jun 10 19:27:22 UTC 2026","","","",""
"Test cases for TestStringPointer","0","TestStringPointer","","Wed Jun 10 19:22:13 UTC 2026","passed","Wed Jun 10 19:22:13 UTC 2026","","Go Test","github.com/specterops/bloodhound/cmd/api/src/database/types/null/TestStringPointer","TestStringPointer"
"Test cases for TestExtractIngestFilesExpandsZIPIntoTempDirectory","0","TestExtractIngestFilesExpandsZIPIntoTempDirectory","","Wed Jun 10 19:22:14 UTC 2026","passed","Wed Jun 10 19:22:14 UTC 2026","","Go Test","github.com/specterops/bloodhound/cmd/api/src/services/graphify/TestExtractIngestFilesExpandsZIPIntoTempDirectory","TestExtractIngestFilesExpandsZIPIntoTempDirectory"
"","0","returns Object ID message when ruleType is SeedTypeObjectId and seeds are required","getErrorMessage","Wed Jun 10 19:24:35 UTC 2026","passed","Wed Jun 10 19:24:35 UTC 2026","","","",""
"Test cases for TestResources_EndIngestJob","87","TestResources_EndIngestJob","","Wed Jun 10 19:22:13 UTC 2026","passed","Wed Jun 10 19:22:13 UTC 2026","","Go Test","github.com/specterops/bloodhound/cmd/api/src/api/v2/TestResources_EndIngestJob","TestResources_EndIngestJob"
"","18","dedupes edges before adding them to the graph","Explore utils","Wed Jun 10 19:29:05 UTC 2026","passed","Wed Jun 10 19:29:05 UTC 2026","","initGraph","",""
"","691","handles adding to tier zero asset group","AssetGroupMenuItem","Wed Jun 10 19:28:43 UTC 2026","passed","Wed Jun 10 19:28:44 UTC 2026","","adding to an asset group","",""
"Test cases for TestManagementResource_EnrollMFA","2","TestManagementResource_EnrollMFA","","Wed Jun 10 19:22:13 UTC 2026","passed","Wed Jun 10 19:22:13 UTC 2026","","Go Test","github.com/specterops/bloodhound/cmd/api/src/api/v2/auth/TestManagementResource_EnrollMFA","TestManagementResource_EnrollMFA"
"","108","Calls the `Base` endpoint for a LocalUser type node","EntityObjectInformation","Wed Jun 10 19:26:00 UTC 2026","passed","Wed Jun 10 19:26:00 UTC 2026","","","",""
"Test cases for TestGC_Start","1","TestGC_Start","","Wed Jun 10 19:22:13 UTC 2026","passed","Wed Jun 10 19:22:13 UTC 2026","","Go Test","github.com/specterops/bloodhound/cmd/api/src/daemons/gc/TestGC_Start","TestGC_Start"
"Test cases for TestManagementResource_ListAuthTokens_InvalidColumn","0","TestManagementResource_ListAuthTokens_InvalidColumn","","Wed Jun 10 19:22:13 UTC 2026","passed","Wed Jun 10 19:22:13 UTC 2026","","Go Test","github.com/specterops/bloodhound/cmd/api/src/api/v2/auth/TestManagementResource_ListAuthTokens_InvalidColumn","TestManagementResource_ListAuthTokens_InvalidColumn"
"Test cases for TestContextMiddlewareBypassDisabled","0","TestContextMiddlewareBypassDisabled","","Wed Jun 10 19:22:11 UTC 2026","passed","Wed Jun 10 19:22:11 UTC 2026","","Go Test","github.com/specterops/bloodhound/cmd/api/src/api/middleware/TestContextMiddlewareBypassDisabled","TestContextMiddlewareBypassDisabled"
"","502","when a search result is clicked it calls `handleNodeSelected`","ExploreSearchCombobox","Wed Jun 10 19:25:13 UTC 2026","passed","Wed Jun 10 19:25:13 UTC 2026","","","",""
"","7","resets to descending sort when sorting a different column","useSortParams","Wed Jun 10 19:26:41 UTC 2026","passed","Wed Jun 10 19:26:41 UTC 2026","","","",""
"","3","returns empty arrays when kinds data has empty arrays","graphSchema","Wed Jun 10 19:27:46 UTC 2026","passed","Wed Jun 10 19:27:46 UTC 2026","","","",""
"","7397","filter selections are rolled back if user closes modal with the cancel button","EdgeFilter","Wed Jun 10 19:25:58 UTC 2026","passed","Wed Jun 10 19:26:06 UTC 2026","","","",""
"","135","calls onConfirm when confirm button clicked","EarlyAccessFeaturesWarningDialog","Wed Jun 10 19:29:28 UTC 2026","passed","Wed Jun 10 19:29:29 UTC 2026","","","",""
"","252","The API key management option should appear in profile page if the user is configured for SAML login","UserProfile with SSO User","Wed Jun 10 19:25:23 UTC 2026","passed","Wed Jun 10 19:25:23 UTC 2026","","","",""
"Test cases for TestRoleAssignments_NodeHasRole","0","TestRoleAssignments_NodeHasRole","","Wed Jun 10 19:22:16 UTC 2026","passed","Wed Jun 10 19:22:16 UTC 2026","","Go Test","github.com/specterops/bloodhound/packages/go/analysis/azure/TestRoleAssignments_NodeHasRole","TestRoleAssignments_NodeHasRole"
"","104","renders enabled prop when flag is enabled","FeatureFlag","Wed Jun 10 19:27:15 UTC 2026","passed","Wed Jun 10 19:27:15 UTC 2026","","","",""
"Test cases for TestResources_ListAuditLogs_PredicateMismatchWithColumn","0","TestResources_ListAuditLogs_PredicateMismatchWithColumn","","Wed Jun 10 19:22:13 UTC 2026","passed","Wed Jun 10 19:22:13 UTC 2026","","Go Test","github.com/specterops/bloodhound/cmd/api/src/api/v2/TestResources_ListAuditLogs_PredicateMismatchWithColumn","TestResources_ListAuditLogs_PredicateMismatchWithColumn"
"","59","applies accent styling to headers when accent is true","<DetailsAccordion />","Wed Jun 10 19:24:58 UTC 2026","passed","Wed Jun 10 19:24:58 UTC 2026","","","",""
"","153","does not show ""<10 Days to Expire"" warning when token expires in more than 10 days","UserTokenManagementDialog - API Expiration Date column","Wed Jun 10 19:24:52 UTC 2026","passed","Wed Jun 10 19:24:52 UTC 2026","","","",""
"","631","displays current password error messages when current password is empty","PasswordDialog","Wed Jun 10 19:23:46 UTC 2026","passed","Wed Jun 10 19:23:47 UTC 2026","","","",""
"Test cases for TestManagementResource_ListRoles_InvalidFilterPredicate","0","TestManagementResource_ListRoles_InvalidFilterPredicate","","Wed Jun 10 19:22:13 UTC 2026","passed","Wed Jun 10 19:22:13 UTC 2026","","Go Test","github.com/specterops/bloodhound/cmd/api/src/api/v2/auth/TestManagementResource_ListRoles_InvalidFilterPredicate","TestManagementResource_ListRoles_InvalidFilterPredicate"
"","165","renders with a selected icon","Glyph Select Dialog","Wed Jun 10 19:27:54 UTC 2026","passed","Wed Jun 10 19:27:54 UTC 2026","","","",""
"","2","determines glyphs with the tier_managent_engine feature flag disabled","getNodeGlyphs","Wed Jun 10 19:29:05 UTC 2026","passed","Wed Jun 10 19:29:05 UTC 2026","","","",""
"","1680","should add an option and display the changelog when it is clicked","AssetGroupEdit","Wed Jun 10 19:26:36 UTC 2026","passed","Wed Jun 10 19:26:38 UTC 2026","","","",""
"","5","returns true if value is undefined","searchParams","Wed Jun 10 19:26:46 UTC 2026","passed","Wed Jun 10 19:26:46 UTC 2026","","isEmptyParam","",""
"Test cases for TestDatabase_checkError_NotFound","0","TestDatabase_checkError_NotFound","","Wed Jun 10 19:22:13 UTC 2026","passed","Wed Jun 10 19:22:13 UTC 2026","","Go Test","github.com/specterops/bloodhound/cmd/api/src/database/TestDatabase_checkError_NotFound","TestDatabase_checkError_NotFound"
"Test cases for TestManagementResource_UpdateUser_LookupActiveSessionsError","0","TestManagementResource_UpdateUser_LookupActiveSessionsError","","Wed Jun 10 19:22:13 UTC 2026","passed","Wed Jun 10 19:22:13 UTC 2026","","Go Test","github.com/specterops/bloodhound/cmd/api/src/api/v2/auth/TestManagementResource_UpdateUser_LookupActiveSessionsError","TestManagementResource_UpdateUser_LookupActiveSessionsError"
"","2","returns undefined for headers when db config timeout limit setting is disabled and state of is disable query limit is false","useExploreGraph","Wed Jun 10 19:24:26 UTC 2026","passed","Wed Jun 10 19:24:26 UTC 2026","userSettings","exploreGraphQueryFactory","",""
"","313","on clicking switch shows modal and when clicking cancel closes it and switch stays disabled","CitrixRDPConfiguration","Wed Jun 10 19:25:17 UTC 2026","passed","Wed Jun 10 19:25:18 UTC 2026","","Click on switch to enable","",""
"Test cases for TestResources_DeleteSavedQueryPermissions","0","TestResources_DeleteSavedQueryPermissions","","Wed Jun 10 19:22:13 UTC 2026","passed","Wed Jun 10 19:22:13 UTC 2026","","Go Test","github.com/specterops/bloodhound/cmd/api/src/api/v2/TestResources_DeleteSavedQueryPermissions","TestResources_DeleteSavedQueryPermissions"
"","104","displays a warning when there is a problem fetching the list of collectors","DownloadCollectors","Wed Jun 10 19:29:02 UTC 2026","passed","Wed Jun 10 19:29:02 UTC 2026","","","",""
"","62","passes checks if the user has multiple required permissions","usePermissions","Wed Jun 10 19:25:17 UTC 2026","passed","Wed Jun 10 19:25:17 UTC 2026","","","",""
"","219","should display ""Create Token"" button","UserTokenManagementDialog","Wed Jun 10 19:24:51 UTC 2026","passed","Wed Jun 10 19:24:51 UTC 2026","","","",""
"","219","renders with the Export and Delete buttons disabled","QuerySearchFilter","Wed Jun 10 19:26:24 UTC 2026","passed","Wed Jun 10 19:26:24 UTC 2026","","","",""
"Test cases for TestManagementResource_DeleteUser_UserNotFound","0","TestManagementResource_DeleteUser_UserNotFound","","Wed Jun 10 19:22:13 UTC 2026","passed","Wed Jun 10 19:22:13 UTC 2026","","Go Test","github.com/specterops/bloodhound/cmd/api/src/api/v2/auth/TestManagementResource_DeleteUser_UserNotFound","TestManagementResource_DeleteUser_UserNotFound"
"Test cases for Test_ParseGraphSortParameters_InvalidSortColumn","0","Test_ParseGraphSortParameters_InvalidSortColumn","","Wed Jun 10 19:22:11 UTC 2026","passed","Wed Jun 10 19:22:11 UTC 2026","","Go Test","github.com/specterops/bloodhound/cmd/api/src/api/Test_ParseGraphSortParameters_InvalidSortColumn","Test_ParseGraphSortParameters_InvalidSortColumn"
"Test cases for TestIngestJobs_ValidFilters","0","TestIngestJobs_ValidFilters","","Wed Jun 10 19:22:14 UTC 2026","passed","Wed Jun 10 19:22:14 UTC 2026","","Go Test","github.com/specterops/bloodhound/cmd/api/src/model/TestIngestJobs_ValidFilters","TestIngestJobs_ValidFilters"
"","1","returns a comma separated number when provided with a number > 999","numberFormatting","Wed Jun 10 19:26:07 UTC 2026","passed","Wed Jun 10 19:26:07 UTC 2026","","","",""
"Test cases for TestResources_ListADOUContainedGroups","1","TestResources_ListADOUContainedGroups","","Wed Jun 10 19:22:13 UTC 2026","passed","Wed Jun 10 19:22:13 UTC 2026","","Go Test","github.com/specterops/bloodhound/cmd/api/src/api/v2/TestResources_ListADOUContainedGroups","TestResources_ListADOUContainedGroups"
"","1033","shows indeterminate states when some graph data is selected","GraphDataCheckboxes","Wed Jun 10 19:24:23 UTC 2026","passed","Wed Jun 10 19:24:24 UTC 2026","","","",""
"","1","lastlogon, lastlogontimestamp","Handling value formatting for Active Directory entity properties lastlogon, lastlogontimestamp, whencreated, and pwdlastset","Wed Jun 10 19:25:06 UTC 2026","passed","Wed Jun 10 19:25:06 UTC 2026","","","",""
"Test cases for TestResources_ListADEntityAdminRights","0","TestResources_ListADEntityAdminRights","","Wed Jun 10 19:22:13 UTC 2026","passed","Wed Jun 10 19:22:13 UTC 2026","","Go Test","github.com/specterops/bloodhound/cmd/api/src/api/v2/TestResources_ListADEntityAdminRights","TestResources_ListADEntityAdminRights"
"","85","should display the logged in user's email address","UserProfile","Wed Jun 10 19:25:24 UTC 2026","passed","Wed Jun 10 19:25:24 UTC 2026","","","",""
"","3","should recognize azure properties","validating a node property against the shared generated schema","Wed Jun 10 19:25:06 UTC 2026","passed","Wed Jun 10 19:25:06 UTC 2026","","","",""
"","4","does not put polite messages in the assertive region","AnnouncementProvider","Wed Jun 10 19:26:30 UTC 2026","passed","Wed Jun 10 19:26:30 UTC 2026","","","",""
"Test cases for TestResources_UpdateAssetGroupTag","0","TestResources_UpdateAssetGroupTag","","Wed Jun 10 19:22:13 UTC 2026","passed","Wed Jun 10 19:22:13 UTC 2026","","Go Test","github.com/specterops/bloodhound/cmd/api/src/api/v2/TestResources_UpdateAssetGroupTag","TestResources_UpdateAssetGroupTag"
"Test cases for TestWriteAndValidateJSON","6","TestWriteAndValidateJSON","","Wed Jun 10 19:22:15 UTC 2026","passed","Wed Jun 10 19:22:15 UTC 2026","","Go Test","github.com/specterops/bloodhound/cmd/api/src/services/upload/TestWriteAndValidateJSON","TestWriteAndValidateJSON"
"Test cases for Test_filterAndFormatSearchResults_includeOpenGraphNodes","0","Test_filterAndFormatSearchResults_includeOpenGraphNodes","","Wed Jun 10 19:22:13 UTC 2026","passed","Wed Jun 10 19:22:13 UTC 2026","","Go Test","github.com/specterops/bloodhound/cmd/api/src/api/v2/Test_filterAndFormatSearchResults_includeOpenGraphNodes","Test_filterAndFormatSearchResults_includeOpenGraphNodes"
"","0","escapes a backslash","escapeCypherString","Wed Jun 10 19:28:10 UTC 2026","passed","Wed Jun 10 19:28:10 UTC 2026","","","",""
"Test cases for TestManagementResource_GetSelf","0","TestManagementResource_GetSelf","","Wed Jun 10 19:22:13 UTC 2026","passed","Wed Jun 10 19:22:13 UTC 2026","","Go Test","github.com/specterops/bloodhound/cmd/api/src/api/v2/auth/TestManagementResource_GetSelf","TestManagementResource_GetSelf"
"","197","should display ""Disable Multi-Factor Authentication?"" title","Enable2FADialog","Wed Jun 10 19:26:51 UTC 2026","passed","Wed Jun 10 19:26:51 UTC 2026","","","",""
"","208","handles chevron click event","CommonSearches","Wed Jun 10 19:25:04 UTC 2026","passed","Wed Jun 10 19:25:04 UTC 2026","","","",""
"","498","should not allow leading or trailing empty spaces","CreateUserForm","Wed Jun 10 19:23:40 UTC 2026","passed","Wed Jun 10 19:23:40 UTC 2026","","","",""
"Test cases for TestManagementResource_DeleteUser_BadUserID","0","TestManagementResource_DeleteUser_BadUserID","","Wed Jun 10 19:22:13 UTC 2026","passed","Wed Jun 10 19:22:13 UTC 2026","","Go Test","github.com/specterops/bloodhound/cmd/api/src/api/v2/auth/TestManagementResource_DeleteUser_BadUserID","TestManagementResource_DeleteUser_BadUserID"
"","0","returns false if value is {}","searchParams","Wed Jun 10 19:26:46 UTC 2026","passed","Wed Jun 10 19:26:46 UTC 2026","","isEmptyParam","",""
"","325","should display correctly","DeleteConfirmationDialog","Wed Jun 10 19:27:46 UTC 2026","passed","Wed Jun 10 19:27:46 UTC 2026","","","",""
"","63","populates the node search field when the 'primarySearch' query param is set","useNodeSearch","Wed Jun 10 19:27:22 UTC 2026","passed","Wed Jun 10 19:27:22 UTC 2026","","","",""
"","200","fires runQuery in context provider","ListItemActionMenu","Wed Jun 10 19:26:46 UTC 2026","passed","Wed Jun 10 19:26:47 UTC 2026","","","",""
"Test cases for TestInt64Equal","0","TestInt64Equal","","Wed Jun 10 19:22:13 UTC 2026","passed","Wed Jun 10 19:22:13 UTC 2026","","Go Test","github.com/specterops/bloodhound/cmd/api/src/database/types/null/TestInt64Equal","TestInt64Equal"
"","473","renders icons as expected","DropdownSelector","Wed Jun 10 19:26:58 UTC 2026","passed","Wed Jun 10 19:26:58 UTC 2026","","","",""
"","824","disables the confirm button until user types required text","Tag Form","Wed Jun 10 19:23:08 UTC 2026","passed","Wed Jun 10 19:23:09 UTC 2026","","","",""
"","103","highlights the table option instead of selectedLayout when table is selected on a cypher query","GraphControls","Wed Jun 10 19:23:24 UTC 2026","passed","Wed Jun 10 19:23:24 UTC 2026","","Table view selection state","",""
"Test cases for TestGetPageParamsForGraphQuery","0","TestGetPageParamsForGraphQuery","","Wed Jun 10 19:22:16 UTC 2026","passed","Wed Jun 10 19:22:16 UTC 2026","","Go Test","github.com/specterops/bloodhound/cmd/api/src/utils/TestGetPageParamsForGraphQuery","TestGetPageParamsForGraphQuery"
"Test cases for TestResources_GetEnterpriseCAEntityInfo","208","TestResources_GetEnterpriseCAEntityInfo","","Wed Jun 10 19:22:13 UTC 2026","passed","Wed Jun 10 19:22:13 UTC 2026","","Go Test","github.com/specterops/bloodhound/cmd/api/src/api/v2/TestResources_GetEnterpriseCAEntityInfo","TestResources_GetEnterpriseCAEntityInfo"
"","0","uses the correct entity name in the Object ID message","getErrorMessage","Wed Jun 10 19:24:35 UTC 2026","passed","Wed Jun 10 19:24:35 UTC 2026","","","",""
"Test cases for TestRewriter_Enter_NoShortcut_PreservesKinds","0","TestRewriter_Enter_NoShortcut_PreservesKinds","","Wed Jun 10 19:22:14 UTC 2026","passed","Wed Jun 10 19:22:14 UTC 2026","","Go Test","github.com/specterops/bloodhound/cmd/api/src/queries/TestRewriter_Enter_NoShortcut_PreservesKinds","TestRewriter_Enter_NoShortcut_PreservesKinds"
"","242","Toggles node and edge labels on/off depending on their existing state","GraphControls","Wed Jun 10 19:23:23 UTC 2026","passed","Wed Jun 10 19:23:23 UTC 2026","","Toggling labels","",""
"","35","applies empty state height when no results","ActiveExtensionsCard","Wed Jun 10 19:23:32 UTC 2026","passed","Wed Jun 10 19:23:32 UTC 2026","","","",""
"","0","will return a list of values","Formatting list properties","Wed Jun 10 19:25:06 UTC 2026","passed","Wed Jun 10 19:25:06 UTC 2026","","","",""
"Test cases for TestIntIsZero","0","TestIntIsZero","","Wed Jun 10 19:22:13 UTC 2026","passed","Wed Jun 10 19:22:13 UTC 2026","","Go Test","github.com/specterops/bloodhound/cmd/api/src/database/types/null/TestIntIsZero","TestIntIsZero"
"Test cases for TestCacheEntryDigester_DigestEndpoint_DefaultObjectID","0","TestCacheEntryDigester_DigestEndpoint_DefaultObjectID","","Wed Jun 10 19:22:14 UTC 2026","passed","Wed Jun 10 19:22:14 UTC 2026","","Go Test","github.com/specterops/bloodhound/cmd/api/src/services/graphify/endpoint/TestCacheEntryDigester_DigestEndpoint_DefaultObjectID","TestCacheEntryDigester_DigestEndpoint_DefaultObjectID"
"","482","does not display must be new password error messages when current password is not required","PasswordDialog","Wed Jun 10 19:23:48 UTC 2026","passed","Wed Jun 10 19:23:48 UTC 2026","","","",""
"Test cases for TestResources_GetAssetGroupTagSelectors","4","TestResources_GetAssetGroupTagSelectors","","Wed Jun 10 19:22:13 UTC 2026","passed","Wed Jun 10 19:22:13 UTC 2026","","Go Test","github.com/specterops/bloodhound/cmd/api/src/api/v2/TestResources_GetAssetGroupTagSelectors","TestResources_GetAssetGroupTagSelectors"
"","11","uses the discardQueryParams prop to discard all query params on the redirect","AppNavigate","Wed Jun 10 19:27:02 UTC 2026","passed","Wed Jun 10 19:27:02 UTC 2026","","","",""
"","0","escapes a single quote","escapeCypherString","Wed Jun 10 19:28:10 UTC 2026","passed","Wed Jun 10 19:28:10 UTC 2026","","","",""
"","0","returns the difference between the node and the position","getNodeOffset","Wed Jun 10 19:29:28 UTC 2026","passed","Wed Jun 10 19:29:28 UTC 2026","","","",""
"Test cases for TestManagementResource_ListRoles_InvalidColumn","0","TestManagementResource_ListRoles_InvalidColumn","","Wed Jun 10 19:22:13 UTC 2026","passed","Wed Jun 10 19:22:13 UTC 2026","","Go Test","github.com/specterops/bloodhound/cmd/api/src/api/v2/auth/TestManagementResource_ListRoles_InvalidColumn","TestManagementResource_ListRoles_InvalidColumn"
"Test cases for Test_GetAssetGroupMembersByTag","3","Test_GetAssetGroupMembersByTag","","Wed Jun 10 19:22:13 UTC 2026","passed","Wed Jun 10 19:22:13 UTC 2026","","Go Test","github.com/specterops/bloodhound/cmd/api/src/api/v2/Test_GetAssetGroupMembersByTag","Test_GetAssetGroupMembersByTag"
"Test cases for TestActivateMFA_Failure","0","TestActivateMFA_Failure","","Wed Jun 10 19:22:13 UTC 2026","passed","Wed Jun 10 19:22:13 UTC 2026","","Go Test","github.com/specterops/bloodhound/cmd/api/src/api/v2/auth/TestActivateMFA_Failure","TestActivateMFA_Failure"
"","1","floors DateTime objects to the nearest minute","floorToNearestMinute","Wed Jun 10 19:27:34 UTC 2026","passed","Wed Jun 10 19:27:34 UTC 2026","","","",""
"Test cases for TestNormalizeEinNodeProperties","0","TestNormalizeEinNodeProperties","","Wed Jun 10 19:22:14 UTC 2026","passed","Wed Jun 10 19:22:14 UTC 2026","","Go Test","github.com/specterops/bloodhound/cmd/api/src/services/graphify/TestNormalizeEinNodeProperties","TestNormalizeEinNodeProperties"
