"DESCRIPTION","DURATION IN MS","NAME","PARENT SUITE","START TIME","STATUS","STOP TIME","SUB SUITE","SUITE","TEST CLASS","TEST METHOD"
"","0","reports a Cypher-specific error when ruleType is SeedTypeCypher and seeds are required","handleError","Wed Jun 10 19:24:35 UTC 2026","passed","Wed Jun 10 19:24:35 UTC 2026","","","",""
"","28","should display the checkbox group title","Checkbox group","Wed Jun 10 19:28:02 UTC 2026","passed","Wed Jun 10 19:28:02 UTC 2026","","","",""
"","2220","should render search input","Pathfinding","Wed Jun 10 19:23:41 UTC 2026","passed","Wed Jun 10 19:23:43 UTC 2026","","","",""
"","43","sets input text to value","ManagedDatePicker - value","Wed Jun 10 19:26:03 UTC 2026","passed","Wed Jun 10 19:26:03 UTC 2026","","","",""
"","0","Fetching the data timed out","Getting the text for the disabled item display for a search when there are no results","Wed Jun 10 19:26:39 UTC 2026","passed","Wed Jun 10 19:26:39 UTC 2026","","Error states","",""
"","1","EXTENDED ROUNDING when thresholds are set: does not abbreviate numbers < 10000","numberFormatting","Wed Jun 10 19:26:07 UTC 2026","passed","Wed Jun 10 19:26:07 UTC 2026","","","",""
"","1","determines glyphs with the tier_managent_engine feature flag enabled","getNodeGlyphs","Wed Jun 10 19:29:05 UTC 2026","passed","Wed Jun 10 19:29:05 UTC 2026","","","",""
"","7","should render a Field when the provided value is -0","Field","Wed Jun 10 19:27:43 UTC 2026","passed","Wed Jun 10 19:27:43 UTC 2026","","","",""
"","783","dispatches an action to add the associated node","Rule Object Select","Wed Jun 10 19:26:56 UTC 2026","passed","Wed Jun 10 19:26:57 UTC 2026","","","",""
"Test cases for TestManagementResource_ListAuthTokens_UserIDFilter","0","TestManagementResource_ListAuthTokens_UserIDFilter","","Wed Jun 10 19:22:13 UTC 2026","passed","Wed Jun 10 19:22:13 UTC 2026","","Go Test","github.com/specterops/bloodhound/cmd/api/src/api/v2/auth/TestManagementResource_ListAuthTokens_UserIDFilter","TestManagementResource_ListAuthTokens_UserIDFilter"
"Test cases for TestBoolPointer","0","TestBoolPointer","","Wed Jun 10 19:22:13 UTC 2026","passed","Wed Jun 10 19:22:13 UTC 2026","","Go Test","github.com/specterops/bloodhound/cmd/api/src/database/types/null/TestBoolPointer","TestBoolPointer"
"Test cases for TestParseUserIP_RemoteAddrOnly","0","TestParseUserIP_RemoteAddrOnly","","Wed Jun 10 19:22:11 UTC 2026","passed","Wed Jun 10 19:22:11 UTC 2026","","Go Test","github.com/specterops/bloodhound/cmd/api/src/api/middleware/TestParseUserIP_RemoteAddrOnly","TestParseUserIP_RemoteAddrOnly"
"","296","displays no search results message when search yields no matches","ActiveExtensionsCard","Wed Jun 10 19:23:32 UTC 2026","passed","Wed Jun 10 19:23:32 UTC 2026","","","",""
"","617","should render the cypher search controls when user clicks on cypher tab","ExploreSearch rendering per tab","Wed Jun 10 19:28:52 UTC 2026","passed","Wed Jun 10 19:28:53 UTC 2026","","","",""
"","384","renders an empty message for the entity panel before a node is selected","GroupManagement","Wed Jun 10 19:29:11 UTC 2026","passed","Wed Jun 10 19:29:12 UTC 2026","","","",""
"Test cases for TestParseUUID","0","TestParseUUID","","Wed Jun 10 19:22:16 UTC 2026","passed","Wed Jun 10 19:22:16 UTC 2026","","Go Test","github.com/specterops/bloodhound/cmd/api/src/utils/TestParseUUID","TestParseUUID"
"","2118","Clicking header allows user to sort by column","ExploreTable","Wed Jun 10 19:23:03 UTC 2026","passed","Wed Jun 10 19:23:05 UTC 2026","","","",""
"","0","Input does not contain a type","Parsing the debounced input for type and keyword values","Wed Jun 10 19:26:39 UTC 2026","passed","Wed Jun 10 19:26:39 UTC 2026","","","",""
"Test cases for TestResources_ListADGPOAffectedTierZero","2","TestResources_ListADGPOAffectedTierZero","","Wed Jun 10 19:22:13 UTC 2026","passed","Wed Jun 10 19:22:13 UTC 2026","","Go Test","github.com/specterops/bloodhound/cmd/api/src/api/v2/TestResources_ListADGPOAffectedTierZero","TestResources_ListADGPOAffectedTierZero"
"","107","enables the user actions menu for a user with the administrator role","User Actions Menu","Wed Jun 10 19:25:53 UTC 2026","passed","Wed Jun 10 19:25:53 UTC 2026","","Button Menu State","",""
"","299","shows a loading state","AssetGroupMenuItem","Wed Jun 10 19:25:07 UTC 2026","passed","Wed Jun 10 19:25:07 UTC 2026","","","",""
"Test cases for TestResources_GetRootCAEntityInfo","208","TestResources_GetRootCAEntityInfo","","Wed Jun 10 19:22:13 UTC 2026","passed","Wed Jun 10 19:22:13 UTC 2026","","Go Test","github.com/specterops/bloodhound/cmd/api/src/api/v2/TestResources_GetRootCAEntityInfo","TestResources_GetRootCAEntityInfo"
"Test cases for TestBoolIsZero","0","TestBoolIsZero","","Wed Jun 10 19:22:13 UTC 2026","passed","Wed Jun 10 19:22:13 UTC 2026","","Go Test","github.com/specterops/bloodhound/cmd/api/src/database/types/null/TestBoolIsZero","TestBoolIsZero"
"","0","returns paramValue as EnvironmentAggregation for unknown values (custom types)","useEnvironmentParams","Wed Jun 10 19:28:17 UTC 2026","passed","Wed Jun 10 19:28:17 UTC 2026","","parseEnvironmentAggregation","",""
"Test cases for TestManagementResource_SanitizeAndGetRoles","4","TestManagementResource_SanitizeAndGetRoles","","Wed Jun 10 19:22:13 UTC 2026","passed","Wed Jun 10 19:22:13 UTC 2026","","Go Test","github.com/specterops/bloodhound/cmd/api/src/api/v2/auth/TestManagementResource_SanitizeAndGetRoles","TestManagementResource_SanitizeAndGetRoles"
"Test cases for Test_runMaybeCachedEntityQuery","1","Test_runMaybeCachedEntityQuery","","Wed Jun 10 19:22:14 UTC 2026","passed","Wed Jun 10 19:22:14 UTC 2026","","Go Test","github.com/specterops/bloodhound/cmd/api/src/queries/Test_runMaybeCachedEntityQuery","Test_runMaybeCachedEntityQuery"
"Test cases for TestUnifiedGraph_AddPathSet","0","TestUnifiedGraph_AddPathSet","","Wed Jun 10 19:22:14 UTC 2026","passed","Wed Jun 10 19:22:14 UTC 2026","","Go Test","github.com/specterops/bloodhound/cmd/api/src/model/TestUnifiedGraph_AddPathSet","TestUnifiedGraph_AddPathSet"
"","1055","should call onSubmit with password when reset password button clicked","PasswordResetForm","Wed Jun 10 19:25:50 UTC 2026","passed","Wed Jun 10 19:25:51 UTC 2026","","","",""
"","385","sets the calendar date to match the valid","ManagedDatePicker - value","Wed Jun 10 19:26:03 UTC 2026","passed","Wed Jun 10 19:26:04 UTC 2026","","","",""
"","231","sums nested section node counts","EntityInfoDataTable","Wed Jun 10 19:24:44 UTC 2026","passed","Wed Jun 10 19:24:45 UTC 2026","","Node count for nested table that counts all sections","",""
"","626","reflects the persisted selected layout in the controls menu","GraphView","Wed Jun 10 19:28:51 UTC 2026","passed","Wed Jun 10 19:28:52 UTC 2026","","Layout selection and de-selection","",""
"","221","calls onToggleEdgeLabels when click show all edge labels","GraphControls","Wed Jun 10 19:23:22 UTC 2026","passed","Wed Jun 10 19:23:22 UTC 2026","","Toggling labels","",""
"Test cases for TestFetchTenants","0","TestFetchTenants","","Wed Jun 10 19:22:16 UTC 2026","passed","Wed Jun 10 19:22:16 UTC 2026","","Go Test","github.com/specterops/bloodhound/packages/go/analysis/azure/TestFetchTenants","TestFetchTenants"
"","75","renders an input box","SearchBar","Wed Jun 10 19:28:06 UTC 2026","passed","Wed Jun 10 19:28:06 UTC 2026","","","",""
"Test cases for TestCacheEntryDigester_DigestEndpoint_JSONMarshalError","0","TestCacheEntryDigester_DigestEndpoint_JSONMarshalError","","Wed Jun 10 19:22:14 UTC 2026","passed","Wed Jun 10 19:22:14 UTC 2026","","Go Test","github.com/specterops/bloodhound/cmd/api/src/services/graphify/endpoint/TestCacheEntryDigester_DigestEndpoint_JSONMarshalError","TestCacheEntryDigester_DigestEndpoint_JSONMarshalError"
"","0","`undefined` input is provided","Parsing the debounced input for type and keyword values","Wed Jun 10 19:26:39 UTC 2026","passed","Wed Jun 10 19:26:39 UTC 2026","","","",""
"Test cases for TestMap","0","TestMap","","Wed Jun 10 19:22:18 UTC 2026","passed","Wed Jun 10 19:22:18 UTC 2026","","Go Test","github.com/specterops/bloodhound/packages/go/slicesext/TestMap","TestMap"
"Copyright 2021 The Go Authors. All rights reserved.TestConcat was ripped from go1.22 source and should be replaced with the stdlib implementation when we move to 1.22Original source: https:","0","TestConcat","","Wed Jun 10 19:22:18 UTC 2026","passed","Wed Jun 10 19:22:18 UTC 2026","","Go Test","github.com/specterops/bloodhound/packages/go/slicesext/TestConcat","TestConcat"
"","239","calls setExploreParams with searchType and relationshipQueryItemId when selecting a composition accordion","EdgeInfoContent","Wed Jun 10 19:23:34 UTC 2026","passed","Wed Jun 10 19:23:34 UTC 2026","","EdgeInfoContent support for Deep Linking","",""
"","111","renders details for a selected zone","DynamicDetails","Wed Jun 10 19:25:28 UTC 2026","passed","Wed Jun 10 19:25:28 UTC 2026","","","",""
"Test cases for TestHasValidRolesForETAC","0","TestHasValidRolesForETAC","","Wed Jun 10 19:22:13 UTC 2026","passed","Wed Jun 10 19:22:13 UTC 2026","","Go Test","github.com/specterops/bloodhound/cmd/api/src/api/v2/auth/TestHasValidRolesForETAC","TestHasValidRolesForETAC"
"Test cases for TestHandleDatabaseError","0","TestHandleDatabaseError","","Wed Jun 10 19:22:11 UTC 2026","passed","Wed Jun 10 19:22:11 UTC 2026","","Go Test","github.com/specterops/bloodhound/cmd/api/src/api/TestHandleDatabaseError","TestHandleDatabaseError"
"","29","upon selecting just a destination node, updates the URL with a searchType of 'node' and secondarySearch of the node's objectid","usePathfindingSearch","Wed Jun 10 19:25:48 UTC 2026","passed","Wed Jun 10 19:25:48 UTC 2026","","","",""
"","3601","closes explore search tab menu and clears selected item when a cypher query returns multiple nodes","CypherSearch","Wed Jun 10 19:23:59 UTC 2026","passed","Wed Jun 10 19:24:03 UTC 2026","","Minimize explorer page elements when multiple nodes are returned","",""
"TestOpenGraphSchemaService_UpsertGraphSchemaExtension -","1","TestOpenGraphSchemaService_UpsertGraphSchemaExtension","","Wed Jun 10 19:22:15 UTC 2026","passed","Wed Jun 10 19:22:15 UTC 2026","","Go Test","github.com/specterops/bloodhound/cmd/api/src/services/opengraphschema/TestOpenGraphSchemaService_UpsertGraphSchemaExtension","TestOpenGraphSchemaService_UpsertGraphSchemaExtension"
"","417","opens nested sections and updates URL params correctly","EntityInfoDataTable","Wed Jun 10 19:24:45 UTC 2026","passed","Wed Jun 10 19:24:45 UTC 2026","","Node count for nested table that counts all sections","",""
"","188","should fire Cancel once with false","DeleteConfirmationDialog","Wed Jun 10 19:27:46 UTC 2026","passed","Wed Jun 10 19:27:46 UTC 2026","","","",""
"Test cases for TestWriteBinaryResponse","0","TestWriteBinaryResponse","","Wed Jun 10 19:22:11 UTC 2026","passed","Wed Jun 10 19:22:11 UTC 2026","","Go Test","github.com/specterops/bloodhound/cmd/api/src/api/TestWriteBinaryResponse","TestWriteBinaryResponse"
"Test cases for TestResources_UpdateSavedQuery_AdminPublicQuery_Success","0","TestResources_UpdateSavedQuery_AdminPublicQuery_Success","","Wed Jun 10 19:22:13 UTC 2026","passed","Wed Jun 10 19:22:13 UTC 2026","","Go Test","github.com/specterops/bloodhound/cmd/api/src/api/v2/TestResources_UpdateSavedQuery_AdminPublicQuery_Success","TestResources_UpdateSavedQuery_AdminPublicQuery_Success"
"Test cases for TestCache_GuardedSet","0","TestCache_GuardedSet","","Wed Jun 10 19:22:17 UTC 2026","passed","Wed Jun 10 19:22:17 UTC 2026","","Go Test","github.com/specterops/bloodhound/packages/go/cache/TestCache_GuardedSet","TestCache_GuardedSet"
"","196","calls exportToJson util when valid non a empty object is passed as the jsonData prop","GraphControls","Wed Jun 10 19:23:24 UTC 2026","passed","Wed Jun 10 19:23:25 UTC 2026","","Exporting json","",""
"","1214","filling in the name value allows updating the rule and navigates back to the details page","Rule Form","Wed Jun 10 19:23:27 UTC 2026","passed","Wed Jun 10 19:23:29 UTC 2026","","","",""
"","14","sets autoDisplayTable to false if query type is relationship","useExploreTableAutoDisplay","Wed Jun 10 19:27:12 UTC 2026","passed","Wed Jun 10 19:27:12 UTC 2026","","","",""
"","213","renders correctly with requiresCurrentPassword true","PasswordDialog","Wed Jun 10 19:23:44 UTC 2026","passed","Wed Jun 10 19:23:44 UTC 2026","","","",""
"","0","should return an empty map when no tags or paths match","opsFilter","Wed Jun 10 19:27:16 UTC 2026","passed","Wed Jun 10 19:27:16 UTC 2026","","","",""
"Test cases for TestAddWhereClauseToNeo4jQuery_NoWhereClause","0","TestAddWhereClauseToNeo4jQuery_NoWhereClause","","Wed Jun 10 19:22:13 UTC 2026","passed","Wed Jun 10 19:22:13 UTC 2026","","Go Test","github.com/specterops/bloodhound/cmd/api/src/api/v2/TestAddWhereClauseToNeo4jQuery_NoWhereClause","TestAddWhereClauseToNeo4jQuery_NoWhereClause"
"Test cases for TestBuildSQLSort","2","TestBuildSQLSort","","Wed Jun 10 19:22:11 UTC 2026","passed","Wed Jun 10 19:22:11 UTC 2026","","Go Test","github.com/specterops/bloodhound/cmd/api/src/api/TestBuildSQLSort","TestBuildSQLSort"
"Test cases for TestResources_RequestAnalysis","148","TestResources_RequestAnalysis","","Wed Jun 10 19:22:13 UTC 2026","passed","Wed Jun 10 19:22:13 UTC 2026","","Go Test","github.com/specterops/bloodhound/cmd/api/src/api/v2/TestResources_RequestAnalysis","TestResources_RequestAnalysis"
"","1","succeeds for valid password with unicode characters","testPassword","Wed Jun 10 19:28:16 UTC 2026","passed","Wed Jun 10 19:28:16 UTC 2026","","","",""
"","360","should call ""onSave"" one time","Enable2FADialog","Wed Jun 10 19:26:52 UTC 2026","passed","Wed Jun 10 19:26:52 UTC 2026","user clicks ""Disable Multi-Factor Authentication"" button","user enters valid password","",""
"Test cases for TestAuditLogin_UserNotFound","0","TestAuditLogin_UserNotFound","","Wed Jun 10 19:22:11 UTC 2026","passed","Wed Jun 10 19:22:11 UTC 2026","","Go Test","github.com/specterops/bloodhound/cmd/api/src/api/TestAuditLogin_UserNotFound","TestAuditLogin_UserNotFound"
"","317","displays 0 when a given sections returns empty, and sums the rest of the sections correctly","EntityInfoDataTableGraphed","Wed Jun 10 19:25:22 UTC 2026","passed","Wed Jun 10 19:25:22 UTC 2026","","Node count for nested table that counts all sections","",""
"Test cases for TestAssetGroupMembers_SortBy","0","TestAssetGroupMembers_SortBy","","Wed Jun 10 19:22:11 UTC 2026","passed","Wed Jun 10 19:22:11 UTC 2026","","Go Test","github.com/specterops/bloodhound/cmd/api/src/api/TestAssetGroupMembers_SortBy","TestAssetGroupMembers_SortBy"
"","0","handles only escapable characters","escapeCypherString","Wed Jun 10 19:28:10 UTC 2026","passed","Wed Jun 10 19:28:10 UTC 2026","","","",""
"","775","renders a filter search and platform dropdown menu","CommonSearches","Wed Jun 10 19:25:02 UTC 2026","passed","Wed Jun 10 19:25:03 UTC 2026","","","",""
"Test cases for Test_SetNodeProperties","0","Test_SetNodeProperties","","Wed Jun 10 19:22:13 UTC 2026","passed","Wed Jun 10 19:22:13 UTC 2026","","Go Test","github.com/specterops/bloodhound/cmd/api/src/api/v2/Test_SetNodeProperties","Test_SetNodeProperties"
"Test cases for Test_SetApplicationConfiguration","1","Test_SetApplicationConfiguration","","Wed Jun 10 19:22:13 UTC 2026","passed","Wed Jun 10 19:22:13 UTC 2026","","Go Test","github.com/specterops/bloodhound/cmd/api/src/api/v2/Test_SetApplicationConfiguration","Test_SetApplicationConfiguration"
"","122","initializes search tab to the exploreSearchTab on initial render","ExploreSearch sets searchType on tab changing","Wed Jun 10 19:28:55 UTC 2026","passed","Wed Jun 10 19:28:55 UTC 2026","","","",""
"","12","does not render when selector is default","Delete Selector Button rendering","Wed Jun 10 19:27:57 UTC 2026","passed","Wed Jun 10 19:27:57 UTC 2026","","","",""
"","69","populates the source and destination node fields when query params are passed","usePathfindingSearch","Wed Jun 10 19:25:48 UTC 2026","passed","Wed Jun 10 19:25:48 UTC 2026","","","",""
"Test cases for TestJSONFloat_MarshalJSON_NaN","1","TestJSONFloat_MarshalJSON_NaN","","Wed Jun 10 19:22:13 UTC 2026","passed","Wed Jun 10 19:22:13 UTC 2026","","Go Test","github.com/specterops/bloodhound/cmd/api/src/database/types/nan/TestJSONFloat_MarshalJSON_NaN","TestJSONFloat_MarshalJSON_NaN"
"","4","returns true if arrays are referentially equal","areArraysSimilar","Wed Jun 10 19:27:56 UTC 2026","passed","Wed Jun 10 19:27:56 UTC 2026","","","",""
"","0","should return true when value partially matches term","compareTerm","Wed Jun 10 19:27:16 UTC 2026","passed","Wed Jun 10 19:27:16 UTC 2026","","","",""
"","943","should call onSave when Save button is clicked and form input is valid","CreateUserDialog","Wed Jun 10 19:23:55 UTC 2026","passed","Wed Jun 10 19:23:56 UTC 2026","","","",""
"","325","renders analyze now section","AnalyzeNowConfiguration","Wed Jun 10 19:25:30 UTC 2026","passed","Wed Jun 10 19:25:30 UTC 2026","","","",""
"","545","displays correct content based on platform filter AD","CommonSearches","Wed Jun 10 19:25:04 UTC 2026","passed","Wed Jun 10 19:25:04 UTC 2026","","","",""
"Test cases for TestResources_CreateAssetGroupTagSelector","4","TestResources_CreateAssetGroupTagSelector","","Wed Jun 10 19:22:13 UTC 2026","passed","Wed Jun 10 19:22:13 UTC 2026","","Go Test","github.com/specterops/bloodhound/cmd/api/src/api/v2/TestResources_CreateAssetGroupTagSelector","TestResources_CreateAssetGroupTagSelector"
"Test cases for TestReconcile","0","TestReconcile","","Wed Jun 10 19:22:13 UTC 2026","passed","Wed Jun 10 19:22:13 UTC 2026","","Go Test","github.com/specterops/bloodhound/cmd/api/src/database/TestReconcile","TestReconcile"
"","4970","edges are displayed in alphabetical order","Pathfinding","Wed Jun 10 19:24:31 UTC 2026","passed","Wed Jun 10 19:24:36 UTC 2026","","","",""
"Test cases for TestUpdateAssetGroupRequest_AuditData","0","TestUpdateAssetGroupRequest_AuditData","","Wed Jun 10 19:22:13 UTC 2026","passed","Wed Jun 10 19:22:13 UTC 2026","","Go Test","github.com/specterops/bloodhound/cmd/api/src/api/v2/TestUpdateAssetGroupRequest_AuditData","TestUpdateAssetGroupRequest_AuditData"
"","71","disables the upload file button when the user does not have the opengraph write permission","SchemaUploadDialog","Wed Jun 10 19:24:31 UTC 2026","passed","Wed Jun 10 19:24:31 UTC 2026","","","",""
"","6","dispatches a storage event with null newValue when the key is removed","useLocalStorage","Wed Jun 10 19:25:30 UTC 2026","passed","Wed Jun 10 19:25:30 UTC 2026","","storage event synchronisation","",""
"Test cases for TestResources_GetGroupEntityInfo","1","TestResources_GetGroupEntityInfo","","Wed Jun 10 19:22:13 UTC 2026","passed","Wed Jun 10 19:22:13 UTC 2026","","Go Test","github.com/specterops/bloodhound/cmd/api/src/api/v2/TestResources_GetGroupEntityInfo","TestResources_GetGroupEntityInfo"
"","18","renders custom icon overlap correctly","NodeIcon","Wed Jun 10 19:27:38 UTC 2026","passed","Wed Jun 10 19:27:38 UTC 2026","","","",""
"Test cases for TestResources_ListAuditLogs","1","TestResources_ListAuditLogs","","Wed Jun 10 19:22:13 UTC 2026","passed","Wed Jun 10 19:22:13 UTC 2026","","Go Test","github.com/specterops/bloodhound/cmd/api/src/api/v2/TestResources_ListAuditLogs","TestResources_ListAuditLogs"
"Test cases for TestGenerateQRCodeBase64","0","TestGenerateQRCodeBase64","","Wed Jun 10 19:22:13 UTC 2026","passed","Wed Jun 10 19:22:13 UTC 2026","","Go Test","github.com/specterops/bloodhound/cmd/api/src/auth/TestGenerateQRCodeBase64","TestGenerateQRCodeBase64"
"Test cases for TestResources_SearchAssetGroupTagHistory","112","TestResources_SearchAssetGroupTagHistory","","Wed Jun 10 19:22:13 UTC 2026","passed","Wed Jun 10 19:22:13 UTC 2026","","Go Test","github.com/specterops/bloodhound/cmd/api/src/api/v2/TestResources_SearchAssetGroupTagHistory","TestResources_SearchAssetGroupTagHistory"
"Test cases for TestResources_ListAssetGroupCollections","2","TestResources_ListAssetGroupCollections","","Wed Jun 10 19:22:13 UTC 2026","passed","Wed Jun 10 19:22:13 UTC 2026","","Go Test","github.com/specterops/bloodhound/cmd/api/src/api/v2/TestResources_ListAssetGroupCollections","TestResources_ListAssetGroupCollections"
"","0","returns false if arrays have different length","areArraysSimilar","Wed Jun 10 19:27:56 UTC 2026","passed","Wed Jun 10 19:27:56 UTC 2026","","","",""
"","396","should display CreateUserTokenDialog","UserTokenManagementDialog","Wed Jun 10 19:24:51 UTC 2026","passed","Wed Jun 10 19:24:51 UTC 2026","","when user clicks ""Create Token"" button","",""
"","59","passes data to testing component","SavedQueriesProvider","Wed Jun 10 19:27:59 UTC 2026","passed","Wed Jun 10 19:27:59 UTC 2026","","","",""
"","290","should not call onSubmit when input is invalid and Submit button is clicked","UpsertSAMLProviderForm","Wed Jun 10 19:27:07 UTC 2026","passed","Wed Jun 10 19:27:07 UTC 2026","","","",""
"","363","Close button click causes the callback function to be called","ExploreTable","Wed Jun 10 19:23:07 UTC 2026","passed","Wed Jun 10 19:23:07 UTC 2026","","","",""
"","63","renders Tier Zero text by default when no Zone Selector is available and on a Zone page","TagSelector","Wed Jun 10 19:26:28 UTC 2026","passed","Wed Jun 10 19:26:28 UTC 2026","","","",""
"","4","shows the collection methods for the given job","toCollected","Wed Jun 10 19:27:51 UTC 2026","passed","Wed Jun 10 19:27:51 UTC 2026","","","",""
"Test cases for TestContextMiddleware","0","TestContextMiddleware","","Wed Jun 10 19:22:11 UTC 2026","passed","Wed Jun 10 19:22:11 UTC 2026","","Go Test","github.com/specterops/bloodhound/cmd/api/src/api/middleware/TestContextMiddleware","TestContextMiddleware"
"","1","adds email filter if madeBy contains ""@""","createHistoryParams","Wed Jun 10 19:27:22 UTC 2026","passed","Wed Jun 10 19:27:22 UTC 2026","","","",""
"Test cases for TestMatches_Success","0","TestMatches_Success","","Wed Jun 10 19:22:14 UTC 2026","passed","Wed Jun 10 19:22:14 UTC 2026","","Go Test","github.com/specterops/bloodhound/cmd/api/src/model/TestMatches_Success","TestMatches_Success"
"","291","should render the pathfinding search controls when searchType is pathfinding","ExploreSearch rendering per tab","Wed Jun 10 19:28:52 UTC 2026","passed","Wed Jun 10 19:28:52 UTC 2026","","","",""
"Test cases for TestUnmarshalString","0","TestUnmarshalString","","Wed Jun 10 19:22:13 UTC 2026","passed","Wed Jun 10 19:22:13 UTC 2026","","Go Test","github.com/specterops/bloodhound/cmd/api/src/database/types/null/TestUnmarshalString","TestUnmarshalString"
"Test cases for TestManagementResource_ListAuthTokens_Admin","0","TestManagementResource_ListAuthTokens_Admin","","Wed Jun 10 19:22:13 UTC 2026","passed","Wed Jun 10 19:22:13 UTC 2026","","Go Test","github.com/specterops/bloodhound/cmd/api/src/api/v2/auth/TestManagementResource_ListAuthTokens_Admin","TestManagementResource_ListAuthTokens_Admin"
"Test cases for TestResources_SearchHandler","0","TestResources_SearchHandler","","Wed Jun 10 19:22:13 UTC 2026","passed","Wed Jun 10 19:22:13 UTC 2026","","Go Test","github.com/specterops/bloodhound/cmd/api/src/api/v2/TestResources_SearchHandler","TestResources_SearchHandler"
"","2","stores a boolean value in localStorage","useLocalStorage","Wed Jun 10 19:25:30 UTC 2026","passed","Wed Jun 10 19:25:30 UTC 2026","","setValue","",""
"Test cases for TestArgon2_Digest","0","TestArgon2_Digest","","Wed Jun 10 19:22:17 UTC 2026","passed","Wed Jun 10 19:22:17 UTC 2026","","Go Test","github.com/specterops/bloodhound/packages/go/crypto/TestArgon2_Digest","TestArgon2_Digest"
"","84","should on clicking collapse all remove expandedPanelSections param from url and set isObjectInfoPanelOpen in context to false","EdgeInfoHeader","Wed Jun 10 19:26:51 UTC 2026","passed","Wed Jun 10 19:26:51 UTC 2026","","","",""
"","1298","sets input text on date click","ManagedDatePicker - date validation","Wed Jun 10 19:26:01 UTC 2026","passed","Wed Jun 10 19:26:02 UTC 2026","","","",""
"","156","renders the component with all info and switch off","CitrixRDPConfiguration","Wed Jun 10 19:25:17 UTC 2026","passed","Wed Jun 10 19:25:17 UTC 2026","","Initial render","",""
"","8","returns the remaining amount of zones available for creation","useTagLimits","Wed Jun 10 19:23:48 UTC 2026","passed","Wed Jun 10 19:23:48 UTC 2026","","","",""
"Test cases for TestGetAzureDataQualityStats_Success","0","TestGetAzureDataQualityStats_Success","","Wed Jun 10 19:22:13 UTC 2026","passed","Wed Jun 10 19:22:13 UTC 2026","","Go Test","github.com/specterops/bloodhound/cmd/api/src/api/v2/TestGetAzureDataQualityStats_Success","TestGetAzureDataQualityStats_Success"
"Test cases for TestGetMFAActivationStatus_Success","0","TestGetMFAActivationStatus_Success","","Wed Jun 10 19:22:13 UTC 2026","passed","Wed Jun 10 19:22:13 UTC 2026","","Go Test","github.com/specterops/bloodhound/cmd/api/src/api/v2/auth/TestGetMFAActivationStatus_Success","TestGetMFAActivationStatus_Success"
"","536","should close the dialog when the Cancel button is clicked","Privilege Zones History Filter Dialog","Wed Jun 10 19:25:40 UTC 2026","passed","Wed Jun 10 19:25:40 UTC 2026","","","",""
"","214","should render an SavedQueryPermissions component","SaveQueryDialog","Wed Jun 10 19:23:07 UTC 2026","passed","Wed Jun 10 19:23:07 UTC 2026","","","",""
"","227","filters extensions based on search input","ActiveExtensionsCard","Wed Jun 10 19:23:32 UTC 2026","passed","Wed Jun 10 19:23:32 UTC 2026","","","",""
"","522","displays correct content based on platform filter Azure","CommonSearches","Wed Jun 10 19:25:03 UTC 2026","passed","Wed Jun 10 19:25:04 UTC 2026","","","",""
"Test cases for TestArgon2_ParseDigest","0","TestArgon2_ParseDigest","","Wed Jun 10 19:22:17 UTC 2026","passed","Wed Jun 10 19:22:17 UTC 2026","","Go Test","github.com/specterops/bloodhound/packages/go/crypto/TestArgon2_ParseDigest","TestArgon2_ParseDigest"
