"DESCRIPTION","DURATION IN MS","NAME","PARENT SUITE","START TIME","STATUS","STOP TIME","SUB SUITE","SUITE","TEST CLASS","TEST METHOD"
"","102","renders Empty when items is undefined and Empty is provided","<DetailsAccordion />","Tue Mar 10 20:37:53 UTC 2026","passed","Tue Mar 10 20:37:53 UTC 2026","","","",""
"","2526","should close the edge filtering dialog when user clicks cancel button","EdgeFilter","Tue Mar 10 20:39:04 UTC 2026","passed","Tue Mar 10 20:39:06 UTC 2026","","","",""
"Test cases for TestResources_CreateSavedQuery_EmptyBody","0","TestResources_CreateSavedQuery_EmptyBody","","Tue Mar 10 20:36:00 UTC 2026","passed","Tue Mar 10 20:36:00 UTC 2026","","Go Test","github.com/specterops/bloodhound/cmd/api/src/api/v2/TestResources_CreateSavedQuery_EmptyBody","TestResources_CreateSavedQuery_EmptyBody"
"","759","disables confirm button until extension name is typed correctly","ActiveExtensionsCard","Tue Mar 10 20:37:20 UTC 2026","passed","Tue Mar 10 20:37:20 UTC 2026","","","",""
"","112","returns a nodes array","useEdgeInfoItems","Tue Mar 10 20:39:41 UTC 2026","passed","Tue Mar 10 20:39:41 UTC 2026","","","",""
"","319","should render an SavedQueryPermissions component","SaveQueryDialog","Tue Mar 10 20:37:03 UTC 2026","passed","Tue Mar 10 20:37:03 UTC 2026","","","",""
"","1","returns graphData as is if it doesnt match the GraphResponse interface","normalizeGraphDataForSigma","Tue Mar 10 20:42:29 UTC 2026","passed","Tue Mar 10 20:42:29 UTC 2026","","","",""
"","86","should call onCancel when cancel button clicked","LoginViaSSOForm","Tue Mar 10 20:39:52 UTC 2026","passed","Tue Mar 10 20:39:52 UTC 2026","","","",""
"","9","constructs correct URLSearchParams with all filters","createHistoryParams","Tue Mar 10 20:40:25 UTC 2026","passed","Tue Mar 10 20:40:25 UTC 2026","","","",""
"","0","does not abbreviate numbers < 1000","numberFormatting","Tue Mar 10 20:41:11 UTC 2026","passed","Tue Mar 10 20:41:11 UTC 2026","","","",""
"Test cases for TestParseOptionalBool","0","TestParseOptionalBool","","Tue Mar 10 20:35:52 UTC 2026","passed","Tue Mar 10 20:35:52 UTC 2026","","Go Test","github.com/specterops/bloodhound/cmd/api/src/api/TestParseOptionalBool","TestParseOptionalBool"
"","69","renders the title","ProcessingIndicator","Tue Mar 10 20:41:24 UTC 2026","passed","Tue Mar 10 20:41:24 UTC 2026","","","",""
"Test cases for TestManagementResource_ListPermissions_PredicateMismatchWithColumn","0","TestManagementResource_ListPermissions_PredicateMismatchWithColumn","","Tue Mar 10 20:36:05 UTC 2026","passed","Tue Mar 10 20:36:05 UTC 2026","","Go Test","github.com/specterops/bloodhound/cmd/api/src/api/v2/auth/TestManagementResource_ListPermissions_PredicateMismatchWithColumn","TestManagementResource_ListPermissions_PredicateMismatchWithColumn"
"","808","should call onSave when Save button is clicked and form input is valid","CreateUserDialog","Tue Mar 10 20:37:29 UTC 2026","passed","Tue Mar 10 20:37:30 UTC 2026","","","",""
"Test cases for TestParseAGMembersFromNodes_","0","TestParseAGMembersFromNodes_","","Tue Mar 10 20:35:59 UTC 2026","passed","Tue Mar 10 20:35:59 UTC 2026","","Go Test","github.com/specterops/bloodhound/cmd/api/src/api/v2/TestParseAGMembersFromNodes_","TestParseAGMembersFromNodes_"
"","134","should render all of the options as checkboxes","Checkbox group","Tue Mar 10 20:41:09 UTC 2026","passed","Tue Mar 10 20:41:09 UTC 2026","","","",""
"","941","Explore URL Accounts for irregular characters in cypher query","Rule Form","Tue Mar 10 20:37:22 UTC 2026","passed","Tue Mar 10 20:37:23 UTC 2026","","","",""
"Test cases for TestQueries_BuildEntityQueryParams_DataTypeCount","0","TestQueries_BuildEntityQueryParams_DataTypeCount","","Tue Mar 10 20:36:08 UTC 2026","passed","Tue Mar 10 20:36:08 UTC 2026","","Go Test","github.com/specterops/bloodhound/cmd/api/src/queries/TestQueries_BuildEntityQueryParams_DataTypeCount","TestQueries_BuildEntityQueryParams_DataTypeCount"
"","383","Displays a modal after clicking Analyze Now button and run analysis after clicking confirm","AnalyzeNowConfiguration","Tue Mar 10 20:38:25 UTC 2026","passed","Tue Mar 10 20:38:26 UTC 2026","","","",""
"","203","Close button click causes the callback function to be called","ExploreTable","Tue Mar 10 20:36:58 UTC 2026","passed","Tue Mar 10 20:36:59 UTC 2026","","","",""
"","574","should display Environmental Targeted Access Control panel when showEnvironmentAccessControls prop is true and read-only role is selected","CreateUserForm","Tue Mar 10 20:37:36 UTC 2026","passed","Tue Mar 10 20:37:37 UTC 2026","","","",""
"","0","accepts a sort and compare function","areArraysSimilar","Tue Mar 10 20:41:03 UTC 2026","passed","Tue Mar 10 20:41:03 UTC 2026","","","",""
"Test cases for TestSavedQueries_IsSortable","0","TestSavedQueries_IsSortable","","Tue Mar 10 20:36:06 UTC 2026","passed","Tue Mar 10 20:36:06 UTC 2026","","Go Test","github.com/specterops/bloodhound/cmd/api/src/model/TestSavedQueries_IsSortable","TestSavedQueries_IsSortable"
"","61","enables filtering out for tags that are treated as Labels (including Owned)","the useAssetGroupTags utilities","Tue Mar 10 20:37:51 UTC 2026","passed","Tue Mar 10 20:37:51 UTC 2026","","","",""
"","570","runs the query and calls dispatch to set the node results","PrivilegeZonesCypherEditor Search component for Zone Management","Tue Mar 10 20:40:19 UTC 2026","passed","Tue Mar 10 20:40:20 UTC 2026","","","",""
"Test cases for TestResources_GetAIACAEntityInfo","237","TestResources_GetAIACAEntityInfo","","Tue Mar 10 20:36:00 UTC 2026","passed","Tue Mar 10 20:36:00 UTC 2026","","Go Test","github.com/specterops/bloodhound/cmd/api/src/api/v2/TestResources_GetAIACAEntityInfo","TestResources_GetAIACAEntityInfo"
"","152","renders a graph view","GraphView","Tue Mar 10 20:42:09 UTC 2026","passed","Tue Mar 10 20:42:09 UTC 2026","","","",""
"Test cases for TestAddOrderByToNeo4jQuery_WithOrderByClause","0","TestAddOrderByToNeo4jQuery_WithOrderByClause","","Tue Mar 10 20:36:00 UTC 2026","passed","Tue Mar 10 20:36:00 UTC 2026","","Go Test","github.com/specterops/bloodhound/cmd/api/src/api/v2/TestAddOrderByToNeo4jQuery_WithOrderByClause","TestAddOrderByToNeo4jQuery_WithOrderByClause"
"Test cases for TestEncodingEquality","0","TestEncodingEquality","","Tue Mar 10 20:36:26 UTC 2026","passed","Tue Mar 10 20:36:26 UTC 2026","","Go Test","github.com/specterops/bloodhound/packages/go/bomenc/TestEncodingEquality","TestEncodingEquality"
"","515","displays current password error messages when current password is empty","PasswordDialog","Tue Mar 10 20:37:27 UTC 2026","passed","Tue Mar 10 20:37:28 UTC 2026","","","",""
"","0","returns null if paramValue is ''","useEnvironmentParams","Tue Mar 10 20:41:21 UTC 2026","passed","Tue Mar 10 20:41:21 UTC 2026","","parseEnvironmentAggregation","",""
"Test cases for TestCreateUser_Failure","1","TestCreateUser_Failure","","Tue Mar 10 20:36:05 UTC 2026","passed","Tue Mar 10 20:36:05 UTC 2026","","Go Test","github.com/specterops/bloodhound/cmd/api/src/api/v2/auth/TestCreateUser_Failure","TestCreateUser_Failure"
"Test cases for Test_filterNodesToSearchResult_filterEnvironments_tenantIDFail","0","Test_filterNodesToSearchResult_filterEnvironments_tenantIDFail","","Tue Mar 10 20:36:08 UTC 2026","passed","Tue Mar 10 20:36:08 UTC 2026","","Go Test","github.com/specterops/bloodhound/cmd/api/src/queries/Test_filterNodesToSearchResult_filterEnvironments_tenantIDFail","Test_filterNodesToSearchResult_filterEnvironments_tenantIDFail"
"Test cases for TestResources_DeleteAssetGroupSelector","0","TestResources_DeleteAssetGroupSelector","","Tue Mar 10 20:36:00 UTC 2026","passed","Tue Mar 10 20:36:00 UTC 2026","","Go Test","github.com/specterops/bloodhound/cmd/api/src/api/v2/TestResources_DeleteAssetGroupSelector","TestResources_DeleteAssetGroupSelector"
"","294","AZRole information panel will not display a section for PIM Assignments","EntityInfoContent","Tue Mar 10 20:39:08 UTC 2026","passed","Tue Mar 10 20:39:08 UTC 2026","","","",""
"Test cases for TestSet","0","TestSet","","Tue Mar 10 20:36:28 UTC 2026","passed","Tue Mar 10 20:36:28 UTC 2026","","Go Test","github.com/specterops/bloodhound/packages/go/lab/internal/TestSet","TestSet"
"","189","clears value if input is empty","ManagedDatePicker - input","Tue Mar 10 20:39:10 UTC 2026","passed","Tue Mar 10 20:39:10 UTC 2026","","","",""
"","1","returns empty array when combined filters match nothing","filterAndSearchEnvironments","Tue Mar 10 20:37:13 UTC 2026","passed","Tue Mar 10 20:37:13 UTC 2026","","combined filters","",""
"","1475","renders","DatabaseManagement","Tue Mar 10 20:41:58 UTC 2026","passed","Tue Mar 10 20:42:00 UTC 2026","","","",""
"","0","An unknown error occurred when fetching the data","Getting the text for the disabled item display for a search when there are no results","Tue Mar 10 20:39:25 UTC 2026","passed","Tue Mar 10 20:39:25 UTC 2026","","Error states","",""
"Test cases for TestResources_ListADEntityConstrainedDelegationRights","0","TestResources_ListADEntityConstrainedDelegationRights","","Tue Mar 10 20:36:00 UTC 2026","passed","Tue Mar 10 20:36:00 UTC 2026","","Go Test","github.com/specterops/bloodhound/cmd/api/src/api/v2/TestResources_ListADEntityConstrainedDelegationRights","TestResources_ListADEntityConstrainedDelegationRights"
"","28","renders a preview version by default","PrivilegeZonesCypherEditor Search component for Zone Management","Tue Mar 10 20:40:19 UTC 2026","passed","Tue Mar 10 20:40:19 UTC 2026","","","",""
"Test cases for TestSignRequestTeeFailure","0","TestSignRequestTeeFailure","","Tue Mar 10 20:35:52 UTC 2026","passed","Tue Mar 10 20:35:52 UTC 2026","","Go Test","github.com/specterops/bloodhound/cmd/api/src/api/TestSignRequestTeeFailure","TestSignRequestTeeFailure"
"","76","should render a label and version number when expanded","MainNav","Tue Mar 10 20:37:41 UTC 2026","passed","Tue Mar 10 20:37:41 UTC 2026","","","",""
"Test cases for TestContextMiddleware_InvalidWaitLessThanZero","0","TestContextMiddleware_InvalidWaitLessThanZero","","Tue Mar 10 20:35:53 UTC 2026","passed","Tue Mar 10 20:35:53 UTC 2026","","Go Test","github.com/specterops/bloodhound/cmd/api/src/api/middleware/TestContextMiddleware_InvalidWaitLessThanZero","TestContextMiddleware_InvalidWaitLessThanZero"
"","575","should not allow the input to exceed the allowed length","CreateUserForm","Tue Mar 10 20:37:35 UTC 2026","passed","Tue Mar 10 20:37:36 UTC 2026","","","",""
"Test cases for TestIntIsZero","0","TestIntIsZero","","Tue Mar 10 20:36:05 UTC 2026","passed","Tue Mar 10 20:36:05 UTC 2026","","Go Test","github.com/specterops/bloodhound/cmd/api/src/database/types/null/TestIntIsZero","TestIntIsZero"
"","131","renders enabled prop when flag is enabled","FeatureFlag","Tue Mar 10 20:40:18 UTC 2026","passed","Tue Mar 10 20:40:18 UTC 2026","","","",""
"","1","returns query config when searchType is relationship and all required params are passed","useExploreGraph","Tue Mar 10 20:38:47 UTC 2026","passed","Tue Mar 10 20:38:47 UTC 2026","relationship search queries","exploreGraphQueryFactory","",""
"Test cases for TestResources_CypherQuery","146","TestResources_CypherQuery","","Tue Mar 10 20:36:00 UTC 2026","passed","Tue Mar 10 20:36:00 UTC 2026","","Go Test","github.com/specterops/bloodhound/cmd/api/src/api/v2/TestResources_CypherQuery","TestResources_CypherQuery"
"Test cases for TestWriteResponseWrapperWithPagination","0","TestWriteResponseWrapperWithPagination","","Tue Mar 10 20:35:52 UTC 2026","passed","Tue Mar 10 20:35:52 UTC 2026","","Go Test","github.com/specterops/bloodhound/cmd/api/src/api/TestWriteResponseWrapperWithPagination","TestWriteResponseWrapperWithPagination"
"","43","renders Tier Zero text by default when no Zone Selector is available and on a Zone page","TagSelector","Tue Mar 10 20:39:40 UTC 2026","passed","Tue Mar 10 20:39:40 UTC 2026","","","",""
"","795","displays must be new password error messages when current password is the same as new password","PasswordDialog","Tue Mar 10 20:37:28 UTC 2026","passed","Tue Mar 10 20:37:29 UTC 2026","","","",""
"Test cases for TestGetLimitParamForGraphQuery","0","TestGetLimitParamForGraphQuery","","Tue Mar 10 20:36:20 UTC 2026","passed","Tue Mar 10 20:36:20 UTC 2026","","Go Test","github.com/specterops/bloodhound/cmd/api/src/utils/TestGetLimitParamForGraphQuery","TestGetLimitParamForGraphQuery"
"","0","should return true when tag partially matches term","OperationsFilterPlugin","Tue Mar 10 20:41:27 UTC 2026","passed","Tue Mar 10 20:41:27 UTC 2026","","","",""
"","64","enables pulling an ordered list of tags by position ascending","the useAssetGroupTags utilities","Tue Mar 10 20:37:51 UTC 2026","passed","Tue Mar 10 20:37:51 UTC 2026","","","",""
"","0","returns undefined if graphData is null or not a GraphResponse","getExploreTableData","Tue Mar 10 20:39:23 UTC 2026","passed","Tue Mar 10 20:39:23 UTC 2026","","","",""
"Test cases for TestDisenrollMFA_Admin_SuccessNoPasswordSSO","858","TestDisenrollMFA_Admin_SuccessNoPasswordSSO","","Tue Mar 10 20:36:31 UTC 2026","passed","Tue Mar 10 20:36:31 UTC 2026","","Go Test","github.com/specterops/bloodhound/cmd/api/src/api/v2/auth/TestDisenrollMFA_Admin_SuccessNoPasswordSSO","TestDisenrollMFA_Admin_SuccessNoPasswordSSO"
"Test cases for TestResources_GetAssetGroup","0","TestResources_GetAssetGroup","","Tue Mar 10 20:36:00 UTC 2026","passed","Tue Mar 10 20:36:00 UTC 2026","","Go Test","github.com/specterops/bloodhound/cmd/api/src/api/v2/TestResources_GetAssetGroup","TestResources_GetAssetGroup"
"","334","should not allow leading or trailing empty spaces","UpdateUserForm","Tue Mar 10 20:37:08 UTC 2026","passed","Tue Mar 10 20:37:08 UTC 2026","","","",""
"","187","filters extensions based on search input","ActiveExtensionsCard","Tue Mar 10 20:37:18 UTC 2026","passed","Tue Mar 10 20:37:19 UTC 2026","","","",""
"","1","returns query config when searchType is composition and all required params are passed","useExploreGraph","Tue Mar 10 20:38:47 UTC 2026","passed","Tue Mar 10 20:38:47 UTC 2026","composition search queries","exploreGraphQueryFactory","",""
"Test cases for TestWriteAndValidateJSON","4","TestWriteAndValidateJSON","","Tue Mar 10 20:36:12 UTC 2026","passed","Tue Mar 10 20:36:12 UTC 2026","","Go Test","github.com/specterops/bloodhound/cmd/api/src/services/upload/TestWriteAndValidateJSON","TestWriteAndValidateJSON"
"","503","clears the applied filter","FileIngestFilterDialog","Tue Mar 10 20:37:44 UTC 2026","passed","Tue Mar 10 20:37:45 UTC 2026","","Status Select","",""
"Test cases for TestManagementResource_ServeMetadata","12","TestManagementResource_ServeMetadata","","Tue Mar 10 20:36:36 UTC 2026","passed","Tue Mar 10 20:36:36 UTC 2026","","Go Test","github.com/specterops/bloodhound/cmd/api/src/api/v2/auth/TestManagementResource_ServeMetadata","TestManagementResource_ServeMetadata"
"","443","changes the text from ""Disabled"" to ""Enabled"" when the Rule Status switch is toggled","Rule Form","Tue Mar 10 20:37:16 UTC 2026","passed","Tue Mar 10 20:37:17 UTC 2026","","","",""
"","126","calls clickHandler when a line item is clicked","PrebuiltSearchList","Tue Mar 10 20:39:50 UTC 2026","passed","Tue Mar 10 20:39:50 UTC 2026","","","",""
"Test cases for TestManagementResource_GetPermission","30436","TestManagementResource_GetPermission","","Tue Mar 10 20:36:05 UTC 2026","passed","Tue Mar 10 20:36:36 UTC 2026","","Go Test","github.com/specterops/bloodhound/cmd/api/src/api/v2/auth/TestManagementResource_GetPermission","TestManagementResource_GetPermission"
"Test cases for TestCacheEntryDigester_DigestEndpoint_JSONMarshalError","0","TestCacheEntryDigester_DigestEndpoint_JSONMarshalError","","Tue Mar 10 20:36:10 UTC 2026","passed","Tue Mar 10 20:36:10 UTC 2026","","Go Test","github.com/specterops/bloodhound/cmd/api/src/services/graphify/endpoint/TestCacheEntryDigester_DigestEndpoint_JSONMarshalError","TestCacheEntryDigester_DigestEndpoint_JSONMarshalError"
"","12","makes no count request when neither a Tag or Rule is selected (tagId and ruleId are undefined from path params","useObjectCounts","Tue Mar 10 20:40:58 UTC 2026","passed","Tue Mar 10 20:40:58 UTC 2026","","","",""
"Test cases for TestFormatDatabaseErrorNotFound","0","TestFormatDatabaseErrorNotFound","","Tue Mar 10 20:35:52 UTC 2026","passed","Tue Mar 10 20:35:52 UTC 2026","","Go Test","github.com/specterops/bloodhound/cmd/api/src/api/TestFormatDatabaseErrorNotFound","TestFormatDatabaseErrorNotFound"
"Test cases for TestResources_ListCAPKIHierarchy","0","TestResources_ListCAPKIHierarchy","","Tue Mar 10 20:36:00 UTC 2026","passed","Tue Mar 10 20:36:00 UTC 2026","","Go Test","github.com/specterops/bloodhound/cmd/api/src/api/v2/TestResources_ListCAPKIHierarchy","TestResources_ListCAPKIHierarchy"
"","351","should disable Cancel and Save buttons while isLoading is true","UpdateUserDialog","Tue Mar 10 20:37:35 UTC 2026","passed","Tue Mar 10 20:37:35 UTC 2026","","","",""
"Test cases for Test_ParseAndValidate","6","Test_ParseAndValidate","","Tue Mar 10 20:36:27 UTC 2026","passed","Tue Mar 10 20:36:27 UTC 2026","","Go Test","github.com/specterops/bloodhound/packages/go/chow/ingestvalidator/Test_ParseAndValidate","Test_ParseAndValidate"
"","198","Verify Vault Reader count is the count returned by All Readers","EntityInfoDataTable","Tue Mar 10 20:38:15 UTC 2026","passed","Tue Mar 10 20:38:15 UTC 2026","","Node count for Vault Readers nested table","",""
"Test cases for FuzzFoldr","0","FuzzFoldr","","Tue Mar 10 20:36:29 UTC 2026","passed","Tue Mar 10 20:36:29 UTC 2026","","Go Test","github.com/specterops/bloodhound/packages/go/slicesext/FuzzFoldr","FuzzFoldr"
"","0","reports a Cypher-specific error when ruleType is SeedTypeCypher and seeds are required","handleError","Tue Mar 10 20:37:44 UTC 2026","passed","Tue Mar 10 20:37:44 UTC 2026","","","",""
"","391","calls setFilters when the Confirm button is clicked","Privilege Zones History Filter Dialog","Tue Mar 10 20:38:53 UTC 2026","passed","Tue Mar 10 20:38:53 UTC 2026","","","",""
"Test cases for TestTimeSetValid","0","TestTimeSetValid","","Tue Mar 10 20:36:05 UTC 2026","passed","Tue Mar 10 20:36:05 UTC 2026","","Go Test","github.com/specterops/bloodhound/cmd/api/src/database/types/null/TestTimeSetValid","TestTimeSetValid"
"","0","returns true if value is null","searchParams","Tue Mar 10 20:39:54 UTC 2026","passed","Tue Mar 10 20:39:54 UTC 2026","","isEmptyParam","",""
"","0","should return an object denoting that the property is not in the schema when it is unrecognized","validating a node property against the shared generated schema","Tue Mar 10 20:38:01 UTC 2026","passed","Tue Mar 10 20:38:01 UTC 2026","","","",""
"","64","populates the source and destination node fields when query params are passed","usePathfindingSearch","Tue Mar 10 20:38:59 UTC 2026","passed","Tue Mar 10 20:38:59 UTC 2026","","","",""
"","349","renders an edit form for the selected asset group when a user has graph write permissions","GroupManagement","Tue Mar 10 20:42:11 UTC 2026","passed","Tue Mar 10 20:42:11 UTC 2026","","","",""
"","1304","should display all available SSO providers","CreateUserDialog","Tue Mar 10 20:37:30 UTC 2026","passed","Tue Mar 10 20:37:32 UTC 2026","","","",""
"Test cases for TestRoleAssignments_NodesWithRole","0","TestRoleAssignments_NodesWithRole","","Tue Mar 10 20:36:26 UTC 2026","passed","Tue Mar 10 20:36:26 UTC 2026","","Go Test","github.com/specterops/bloodhound/packages/go/analysis/azure/TestRoleAssignments_NodesWithRole","TestRoleAssignments_NodesWithRole"
"","445","should render list of available SSO providers","LoginViaSSOForm","Tue Mar 10 20:39:51 UTC 2026","passed","Tue Mar 10 20:39:52 UTC 2026","","","",""
"","0","returns the difference between the node and the position","getNodeOffset","Tue Mar 10 20:42:30 UTC 2026","passed","Tue Mar 10 20:42:30 UTC 2026","","","",""
"Test cases for TestResources_GetAssetGroupMemberCount_DBError","0","TestResources_GetAssetGroupMemberCount_DBError","","Tue Mar 10 20:36:00 UTC 2026","passed","Tue Mar 10 20:36:00 UTC 2026","","Go Test","github.com/specterops/bloodhound/cmd/api/src/api/v2/TestResources_GetAssetGroupMemberCount_DBError","TestResources_GetAssetGroupMemberCount_DBError"
"Test cases for TestInt64FromPtr","0","TestInt64FromPtr","","Tue Mar 10 20:36:05 UTC 2026","passed","Tue Mar 10 20:36:05 UTC 2026","","Go Test","github.com/specterops/bloodhound/cmd/api/src/database/types/null/TestInt64FromPtr","TestInt64FromPtr"
"Test cases for TestHeaderMatches","0","TestHeaderMatches","","Tue Mar 10 20:36:20 UTC 2026","passed","Tue Mar 10 20:36:20 UTC 2026","","Go Test","github.com/specterops/bloodhound/cmd/api/src/utils/TestHeaderMatches","TestHeaderMatches"
"Test cases for TestSIDSuffix_PrependPrefix","0","TestSIDSuffix_PrependPrefix","","Tue Mar 10 20:36:24 UTC 2026","passed","Tue Mar 10 20:36:24 UTC 2026","","Go Test","github.com/specterops/bloodhound/packages/go/analysis/ad/wellknown/TestSIDSuffix_PrependPrefix","TestSIDSuffix_PrependPrefix"
"Test cases for TestAddWhereClauseToNeo4jQuery_WithWhereClause","0","TestAddWhereClauseToNeo4jQuery_WithWhereClause","","Tue Mar 10 20:36:00 UTC 2026","passed","Tue Mar 10 20:36:00 UTC 2026","","Go Test","github.com/specterops/bloodhound/cmd/api/src/api/v2/TestAddWhereClauseToNeo4jQuery_WithWhereClause","TestAddWhereClauseToNeo4jQuery_WithWhereClause"
"Test cases for TestResources_ListAssetGroups","1","TestResources_ListAssetGroups","","Tue Mar 10 20:36:00 UTC 2026","passed","Tue Mar 10 20:36:00 UTC 2026","","Go Test","github.com/specterops/bloodhound/cmd/api/src/api/v2/TestResources_ListAssetGroups","TestResources_ListAssetGroups"
"","444","clicking cancel on the form takes the user back to the details page the user was on previously","Rule Form","Tue Mar 10 20:37:18 UTC 2026","passed","Tue Mar 10 20:37:19 UTC 2026","","","",""
"","705","should call onSubmit when input is valid and Submit button is clicked","UpsertSAMLProviderForm","Tue Mar 10 20:40:14 UTC 2026","passed","Tue Mar 10 20:40:15 UTC 2026","","","",""
"TestMigrator_GenerateManifest tests the full integrity of a Manifest generatedfrom 3 different Source's:1) Correct number of total migrations detected.2) Correct number of versions detected.3) The VersionTable has all versions, in order.4) All versions have the correct number of migrations.5) Schema files generate v0.0.0 migrations.6) Migrations are ordered within each version, in the order the Source was defined.","1","TestMigrator_GenerateManifest","","Tue Mar 10 20:36:05 UTC 2026","passed","Tue Mar 10 20:36:05 UTC 2026","","Go Test","github.com/specterops/bloodhound/cmd/api/src/database/migration/TestMigrator_GenerateManifest","TestMigrator_GenerateManifest"
"","2","should return null if the edge key does not have enough information","getEdgeDataFromKey","Tue Mar 10 20:42:30 UTC 2026","passed","Tue Mar 10 20:42:30 UTC 2026","","","",""
"Test cases for TestMarshalFloatText","0","TestMarshalFloatText","","Tue Mar 10 20:36:05 UTC 2026","passed","Tue Mar 10 20:36:05 UTC 2026","","Go Test","github.com/specterops/bloodhound/cmd/api/src/database/types/null/TestMarshalFloatText","TestMarshalFloatText"
"","219","shows an error state","AssetGroupMenuItem","Tue Mar 10 20:37:59 UTC 2026","passed","Tue Mar 10 20:37:59 UTC 2026","","","",""
"","530","calls onSave without current password when requireCurrentPassword is false","PasswordDialog","Tue Mar 10 20:37:30 UTC 2026","passed","Tue Mar 10 20:37:30 UTC 2026","","","",""
"Test cases for TestFlatMap","0","TestFlatMap","","Tue Mar 10 20:36:29 UTC 2026","passed","Tue Mar 10 20:36:29 UTC 2026","","Go Test","github.com/specterops/bloodhound/packages/go/slicesext/TestFlatMap","TestFlatMap"
"Test cases for TestResources_CancelAnalysisRequest","181","TestResources_CancelAnalysisRequest","","Tue Mar 10 20:36:00 UTC 2026","passed","Tue Mar 10 20:36:00 UTC 2026","","Go Test","github.com/specterops/bloodhound/cmd/api/src/api/v2/TestResources_CancelAnalysisRequest","TestResources_CancelAnalysisRequest"
"","185","Displays a notification when analysis has been requested successfully","AnalyzeNowConfiguration","Tue Mar 10 20:38:26 UTC 2026","passed","Tue Mar 10 20:38:26 UTC 2026","","","",""
"Test cases for TestBuildErrorResponseInternalServerError","0","TestBuildErrorResponseInternalServerError","","Tue Mar 10 20:35:52 UTC 2026","passed","Tue Mar 10 20:35:52 UTC 2026","","Go Test","github.com/specterops/bloodhound/cmd/api/src/api/TestBuildErrorResponseInternalServerError","TestBuildErrorResponseInternalServerError"
"Test cases for Test_CheckAccessToEnvironments","136","Test_CheckAccessToEnvironments","","Tue Mar 10 20:36:00 UTC 2026","passed","Tue Mar 10 20:36:00 UTC 2026","","Go Test","github.com/specterops/bloodhound/cmd/api/src/api/v2/Test_CheckAccessToEnvironments","Test_CheckAccessToEnvironments"
"Test cases for TestManagementResource_ListRoles_SortingError","0","TestManagementResource_ListRoles_SortingError","","Tue Mar 10 20:36:05 UTC 2026","passed","Tue Mar 10 20:36:05 UTC 2026","","Go Test","github.com/specterops/bloodhound/cmd/api/src/api/v2/auth/TestManagementResource_ListRoles_SortingError","TestManagementResource_ListRoles_SortingError"
"","3","prevents Sigma defaults events","preventAllDefaults","Tue Mar 10 20:42:34 UTC 2026","passed","Tue Mar 10 20:42:34 UTC 2026","","","",""
"Test cases for TestResources_UpdateSavedQuery_Admin_NonPublicQuery","0","TestResources_UpdateSavedQuery_Admin_NonPublicQuery","","Tue Mar 10 20:36:00 UTC 2026","passed","Tue Mar 10 20:36:00 UTC 2026","","Go Test","github.com/specterops/bloodhound/cmd/api/src/api/v2/TestResources_UpdateSavedQuery_Admin_NonPublicQuery","TestResources_UpdateSavedQuery_Admin_NonPublicQuery"
"","1","filters by critical risk level","filterAndSearchEnvironments","Tue Mar 10 20:37:13 UTC 2026","passed","Tue Mar 10 20:37:13 UTC 2026","","risk filters","",""
