"DESCRIPTION","DURATION IN MS","NAME","PARENT SUITE","START TIME","STATUS","STOP TIME","SUB SUITE","SUITE","TEST CLASS","TEST METHOD"
"Test cases for TestManagementResource_UpdateUser_DuplicateEmailError","0","TestManagementResource_UpdateUser_DuplicateEmailError","","Tue Mar 10 20:36:14 UTC 2026","passed","Tue Mar 10 20:36:14 UTC 2026","","Go Test","github.com/specterops/bloodhound/cmd/api/src/api/v2/auth/TestManagementResource_UpdateUser_DuplicateEmailError","TestManagementResource_UpdateUser_DuplicateEmailError"
"","0","returns the distance between two coordinates","getDistanceBetween","Tue Mar 10 20:42:30 UTC 2026","passed","Tue Mar 10 20:42:30 UTC 2026","","","",""
"","161","disables the create user button and does not populate a table if the user lacks the permission","Users","Tue Mar 10 20:38:32 UTC 2026","passed","Tue Mar 10 20:38:32 UTC 2026","","","",""
"","0","reports an API error when Cypher is not run first","handleError","Tue Mar 10 20:37:44 UTC 2026","passed","Tue Mar 10 20:37:44 UTC 2026","","","",""
"Test cases for TestResources_ListADOUContainedGroups","0","TestResources_ListADOUContainedGroups","","Tue Mar 10 20:36:00 UTC 2026","passed","Tue Mar 10 20:36:00 UTC 2026","","Go Test","github.com/specterops/bloodhound/cmd/api/src/api/v2/TestResources_ListADOUContainedGroups","TestResources_ListADOUContainedGroups"
"","449","renders headers","CommonSearches","Tue Mar 10 20:37:56 UTC 2026","passed","Tue Mar 10 20:37:57 UTC 2026","","","",""
"Test cases for TestResources_DeleteAssetGroupTagSelector","0","TestResources_DeleteAssetGroupTagSelector","","Tue Mar 10 20:36:00 UTC 2026","passed","Tue Mar 10 20:36:00 UTC 2026","","Go Test","github.com/specterops/bloodhound/cmd/api/src/api/v2/TestResources_DeleteAssetGroupTagSelector","TestResources_DeleteAssetGroupTagSelector"
"","2","Edge is created with correct structure including points array","copySigmaEdgesToGraphlibGraph","Tue Mar 10 20:42:22 UTC 2026","passed","Tue Mar 10 20:42:22 UTC 2026","","","",""
"","160","opens and closes the dialog with the cancel button","Tag Form","Tue Mar 10 20:37:03 UTC 2026","passed","Tue Mar 10 20:37:03 UTC 2026","","","",""
"","302","should call the checkbox filter function when clicking on a checkbox input","Checkbox group","Tue Mar 10 20:41:09 UTC 2026","passed","Tue Mar 10 20:41:09 UTC 2026","","","",""
"","162","renders with the Export and Delete buttons disabled","QuerySearchFilter","Tue Mar 10 20:39:34 UTC 2026","passed","Tue Mar 10 20:39:34 UTC 2026","","","",""
"Test cases for TestParseDomainTrusts_TrustAttributes","0","TestParseDomainTrusts_TrustAttributes","","Tue Mar 10 20:36:28 UTC 2026","passed","Tue Mar 10 20:36:28 UTC 2026","","Go Test","github.com/specterops/bloodhound/packages/go/ein/TestParseDomainTrusts_TrustAttributes","TestParseDomainTrusts_TrustAttributes"
"","9","should render when search string at the end of the text","HighlightedText","Tue Mar 10 20:40:40 UTC 2026","passed","Tue Mar 10 20:40:40 UTC 2026","","","",""
"Test cases for TestService","0","TestService","","Tue Mar 10 20:36:08 UTC 2026","passed","Tue Mar 10 20:36:08 UTC 2026","","Go Test","github.com/specterops/bloodhound/cmd/api/src/services/dogtags/TestService","TestService"
"Test cases for TestManagementResource_ListAuthTokens_Admin","0","TestManagementResource_ListAuthTokens_Admin","","Tue Mar 10 20:36:24 UTC 2026","passed","Tue Mar 10 20:36:24 UTC 2026","","Go Test","github.com/specterops/bloodhound/cmd/api/src/api/v2/auth/TestManagementResource_ListAuthTokens_Admin","TestManagementResource_ListAuthTokens_Admin"
"Test cases for TestCORSMiddleware","0","TestCORSMiddleware","","Tue Mar 10 20:35:53 UTC 2026","passed","Tue Mar 10 20:35:53 UTC 2026","","Go Test","github.com/specterops/bloodhound/cmd/api/src/api/middleware/TestCORSMiddleware","TestCORSMiddleware"
"Test cases for Test_UseFixture","1","Test_UseFixture","","Tue Mar 10 20:36:28 UTC 2026","passed","Tue Mar 10 20:36:28 UTC 2026","","Go Test","github.com/specterops/bloodhound/packages/go/lab/Test_UseFixture","Test_UseFixture"
"","92","renders when all data is available and rule is not default","Delete Selector Button rendering","Tue Mar 10 20:41:04 UTC 2026","passed","Tue Mar 10 20:41:04 UTC 2026","","","",""
"Test cases for TestManagementResource_ListUsers_InvalidColumn","0","TestManagementResource_ListUsers_InvalidColumn","","Tue Mar 10 20:36:05 UTC 2026","passed","Tue Mar 10 20:36:05 UTC 2026","","Go Test","github.com/specterops/bloodhound/cmd/api/src/api/v2/auth/TestManagementResource_ListUsers_InvalidColumn","TestManagementResource_ListUsers_InvalidColumn"
"Test cases for TestDefaultRateLimitMiddleware","1","TestDefaultRateLimitMiddleware","","Tue Mar 10 20:35:53 UTC 2026","passed","Tue Mar 10 20:35:53 UTC 2026","","Go Test","github.com/specterops/bloodhound/cmd/api/src/api/middleware/TestDefaultRateLimitMiddleware","TestDefaultRateLimitMiddleware"
"Test cases for TestResources_UpdateAssetGroup","0","TestResources_UpdateAssetGroup","","Tue Mar 10 20:36:00 UTC 2026","passed","Tue Mar 10 20:36:00 UTC 2026","","Go Test","github.com/specterops/bloodhound/cmd/api/src/api/v2/TestResources_UpdateAssetGroup","TestResources_UpdateAssetGroup"
"","101","renders Label as first tab and is also the initially selected on first render in Labels View/Tab","Selected Details Tabs","Tue Mar 10 20:38:32 UTC 2026","passed","Tue Mar 10 20:38:33 UTC 2026","","Selected Details Tabs - Params present","",""
"Test cases for TestGetMFAActivationStatus_Failure","0","TestGetMFAActivationStatus_Failure","","Tue Mar 10 20:36:34 UTC 2026","passed","Tue Mar 10 20:36:34 UTC 2026","","Go Test","github.com/specterops/bloodhound/cmd/api/src/api/v2/auth/TestGetMFAActivationStatus_Failure","TestGetMFAActivationStatus_Failure"
"","0","Origin label and sizing are used when specified","copySigmaNodesToGraphlibGraph","Tue Mar 10 20:42:22 UTC 2026","passed","Tue Mar 10 20:42:22 UTC 2026","","","",""
"","752","should not call onSubmit when expired password matches current password when reset password button clicked","PasswordResetForm","Tue Mar 10 20:39:01 UTC 2026","passed","Tue Mar 10 20:39:02 UTC 2026","","","",""
"","152","renders count for a selected zone if prop is set","DynamicDetails","Tue Mar 10 20:38:23 UTC 2026","passed","Tue Mar 10 20:38:23 UTC 2026","","","",""
"Test cases for TestDurationValidator","0","TestDurationValidator","","Tue Mar 10 20:36:21 UTC 2026","passed","Tue Mar 10 20:36:21 UTC 2026","","Go Test","github.com/specterops/bloodhound/cmd/api/src/utils/validation/TestDurationValidator","TestDurationValidator"
"Test cases for TestUnmarshalInt64OverflowToInt64","0","TestUnmarshalInt64OverflowToInt64","","Tue Mar 10 20:36:05 UTC 2026","passed","Tue Mar 10 20:36:05 UTC 2026","","Go Test","github.com/specterops/bloodhound/cmd/api/src/database/types/null/TestUnmarshalInt64OverflowToInt64","TestUnmarshalInt64OverflowToInt64"
"","42","sets autoDisplayTable to false if query returns edges","useExploreTableAutoDisplay","Tue Mar 10 20:40:22 UTC 2026","passed","Tue Mar 10 20:40:22 UTC 2026","","","",""
"","712","opens and closes the filter","FileIngestFilterDialog","Tue Mar 10 20:37:42 UTC 2026","passed","Tue Mar 10 20:37:43 UTC 2026","","","",""
"","0","fails for password shorter than 12 characters","testPassword","Tue Mar 10 20:41:23 UTC 2026","passed","Tue Mar 10 20:41:23 UTC 2026","","","",""
"Test cases for TestChangeCache","1","TestChangeCache","","Tue Mar 10 20:36:02 UTC 2026","passed","Tue Mar 10 20:36:02 UTC 2026","","Go Test","github.com/specterops/bloodhound/cmd/api/src/daemons/changelog/TestChangeCache","TestChangeCache"
"","795","clicking checkbox will remove error if present","DatabaseManagement","Tue Mar 10 20:42:00 UTC 2026","passed","Tue Mar 10 20:42:01 UTC 2026","","","",""
"","218","clicking an enabled header toggles content (single mode)","<DetailsAccordion />","Tue Mar 10 20:37:54 UTC 2026","passed","Tue Mar 10 20:37:55 UTC 2026","","","",""
"","173","should render action list item that handles a function","MainNav","Tue Mar 10 20:37:41 UTC 2026","passed","Tue Mar 10 20:37:41 UTC 2026","","","",""
"Test cases for TestNormalizeEinNodeProperties","1","TestNormalizeEinNodeProperties","","Tue Mar 10 20:36:10 UTC 2026","passed","Tue Mar 10 20:36:10 UTC 2026","","Go Test","github.com/specterops/bloodhound/cmd/api/src/services/graphify/TestNormalizeEinNodeProperties","TestNormalizeEinNodeProperties"
"","260","Verify Vault Reader count is the count returned by All Readers","EntityInfoDataTableGraphed","Tue Mar 10 20:38:15 UTC 2026","passed","Tue Mar 10 20:38:15 UTC 2026","","Node count for Vault Readers nested table","",""
"Test cases for TestResources_ListAvailableEnvironments","2","TestResources_ListAvailableEnvironments","","Tue Mar 10 20:36:00 UTC 2026","passed","Tue Mar 10 20:36:00 UTC 2026","","Go Test","github.com/specterops/bloodhound/cmd/api/src/api/v2/TestResources_ListAvailableEnvironments","TestResources_ListAvailableEnvironments"
"Test cases for TestBoolFrom","0","TestBoolFrom","","Tue Mar 10 20:36:05 UTC 2026","passed","Tue Mar 10 20:36:05 UTC 2026","","Go Test","github.com/specterops/bloodhound/cmd/api/src/database/types/null/TestBoolFrom","TestBoolFrom"
"","2","The data is loading","Getting the text for the disabled item display for a search when there are no results","Tue Mar 10 20:39:25 UTC 2026","passed","Tue Mar 10 20:39:25 UTC 2026","","Loading states","",""
"Test cases for TestResources_ListAssetGroupCollections","0","TestResources_ListAssetGroupCollections","","Tue Mar 10 20:36:00 UTC 2026","passed","Tue Mar 10 20:36:00 UTC 2026","","Go Test","github.com/specterops/bloodhound/cmd/api/src/api/v2/TestResources_ListAssetGroupCollections","TestResources_ListAssetGroupCollections"
"","25","should filter properties that we do not want to display in the entity panel","ObjectInfoFields","Tue Mar 10 20:40:54 UTC 2026","passed","Tue Mar 10 20:40:54 UTC 2026","","","",""
"Test cases for TestFloatIsZero","0","TestFloatIsZero","","Tue Mar 10 20:36:05 UTC 2026","passed","Tue Mar 10 20:36:05 UTC 2026","","Go Test","github.com/specterops/bloodhound/cmd/api/src/database/types/null/TestFloatIsZero","TestFloatIsZero"
"","171","opens when keyboard shortcut is pressed","GraphControls","Tue Mar 10 20:37:41 UTC 2026","passed","Tue Mar 10 20:37:41 UTC 2026","","Searching current results","",""
"Test cases for TestManagementResource_ListAuthTokens_SortingError","0","TestManagementResource_ListAuthTokens_SortingError","","Tue Mar 10 20:36:24 UTC 2026","passed","Tue Mar 10 20:36:24 UTC 2026","","Go Test","github.com/specterops/bloodhound/cmd/api/src/api/v2/auth/TestManagementResource_ListAuthTokens_SortingError","TestManagementResource_ListAuthTokens_SortingError"
"","15","renders the tooltip icon when tooltipText prop is passed","ColumnHeaders","Tue Mar 10 20:39:18 UTC 2026","passed","Tue Mar 10 20:39:18 UTC 2026","","SortableHeader with Tooltip","",""
"","11030","checking a subcategory updates all children (edge types) in its group","Pathfinding","Tue Mar 10 20:38:38 UTC 2026","passed","Tue Mar 10 20:38:49 UTC 2026","","","",""
"","557","sets exploreSearchTab param to node when the user clicks the `Search` tab","ExploreSearch sets searchType on tab changing","Tue Mar 10 20:41:53 UTC 2026","passed","Tue Mar 10 20:41:53 UTC 2026","","","",""
"","0","No type was provided and no results were available","Getting the text for the disabled item display for a search when there are no results","Tue Mar 10 20:39:25 UTC 2026","passed","Tue Mar 10 20:39:25 UTC 2026","","Empty data states","",""
"","886","shows tooltip text on hover","ColumnHeaders","Tue Mar 10 20:39:18 UTC 2026","passed","Tue Mar 10 20:39:19 UTC 2026","","SortableHeader with Tooltip","",""
"","219","sums nested section node counts","EntityInfoDataTable","Tue Mar 10 20:38:14 UTC 2026","passed","Tue Mar 10 20:38:14 UTC 2026","","Node count for nested table that counts all sections","",""
"","0","Fetching the data timed out","Getting the text for the disabled item display for a search when there are no results","Tue Mar 10 20:39:25 UTC 2026","passed","Tue Mar 10 20:39:25 UTC 2026","","Error states","",""
"","257","sets a primarySearch=id and searchType=pathfinding when secondarySearch is truthy","ContextMenu","Tue Mar 10 20:42:01 UTC 2026","passed","Tue Mar 10 20:42:01 UTC 2026","","","",""
"","61","renders delete buttons for each extension","ActiveExtensionsCard","Tue Mar 10 20:37:18 UTC 2026","passed","Tue Mar 10 20:37:18 UTC 2026","","","",""
"","5","does not render when selector is default","Delete Selector Button rendering","Tue Mar 10 20:41:04 UTC 2026","passed","Tue Mar 10 20:41:04 UTC 2026","","","",""
"Test cases for TestResources_GetShortestPath","13","TestResources_GetShortestPath","","Tue Mar 10 20:36:00 UTC 2026","passed","Tue Mar 10 20:36:00 UTC 2026","","Go Test","github.com/specterops/bloodhound/cmd/api/src/api/v2/TestResources_GetShortestPath","TestResources_GetShortestPath"
"","8","removes a notification","AppNotifications","Tue Mar 10 20:40:09 UTC 2026","passed","Tue Mar 10 20:40:09 UTC 2026","","","",""
"","31","tag members refetches on sort change","the useAssetGroupTags utilities","Tue Mar 10 20:37:51 UTC 2026","passed","Tue Mar 10 20:37:51 UTC 2026","","","",""
"","23","whencreated","Handling value formatting for Active Directory entity properties lastlogon, lastlogontimestamp, whencreated, and pwdlastset","Tue Mar 10 20:38:01 UTC 2026","passed","Tue Mar 10 20:38:01 UTC 2026","","","",""
"Test cases for TestResources_UpdateAssetGroupSelectors_SuccessT0","0","TestResources_UpdateAssetGroupSelectors_SuccessT0","","Tue Mar 10 20:36:00 UTC 2026","passed","Tue Mar 10 20:36:00 UTC 2026","","Go Test","github.com/specterops/bloodhound/cmd/api/src/api/v2/TestResources_UpdateAssetGroupSelectors_SuccessT0","TestResources_UpdateAssetGroupSelectors_SuccessT0"
"Test cases for Test_PrimaryNodeKind","0","Test_PrimaryNodeKind","","Tue Mar 10 20:36:28 UTC 2026","passed","Tue Mar 10 20:36:28 UTC 2026","","Go Test","github.com/specterops/bloodhound/packages/go/graphschema/Test_PrimaryNodeKind","Test_PrimaryNodeKind"
"Test cases for TestResources_UpdateSavedQuery_AdminPublicQuery_Success","0","TestResources_UpdateSavedQuery_AdminPublicQuery_Success","","Tue Mar 10 20:36:00 UTC 2026","passed","Tue Mar 10 20:36:00 UTC 2026","","Go Test","github.com/specterops/bloodhound/cmd/api/src/api/v2/TestResources_UpdateSavedQuery_AdminPublicQuery_Success","TestResources_UpdateSavedQuery_AdminPublicQuery_Success"
"","4045","should clear state when logout action is dispatched","redux store","Tue Mar 10 20:42:23 UTC 2026","passed","Tue Mar 10 20:42:27 UTC 2026","","","",""
"Test cases for TestUpdateAssetGroupRequest_AuditData","0","TestUpdateAssetGroupRequest_AuditData","","Tue Mar 10 20:36:00 UTC 2026","passed","Tue Mar 10 20:36:00 UTC 2026","","Go Test","github.com/specterops/bloodhound/cmd/api/src/api/v2/TestUpdateAssetGroupRequest_AuditData","TestUpdateAssetGroupRequest_AuditData"
"","7","renders without pulse animation by default","StatusIndicator","Tue Mar 10 20:41:15 UTC 2026","passed","Tue Mar 10 20:41:15 UTC 2026","","","",""
"","0","returns true when id is a environment aggregation type","isEnvironmentAggregation","Tue Mar 10 20:37:13 UTC 2026","passed","Tue Mar 10 20:37:13 UTC 2026","","","",""
"Test cases for TestResources_ListPublishedToCAs","1","TestResources_ListPublishedToCAs","","Tue Mar 10 20:36:00 UTC 2026","passed","Tue Mar 10 20:36:00 UTC 2026","","Go Test","github.com/specterops/bloodhound/cmd/api/src/api/v2/TestResources_ListPublishedToCAs","TestResources_ListPublishedToCAs"
"","19","does not add a query param if the search term is empty","useNodeSearch","Tue Mar 10 20:40:29 UTC 2026","passed","Tue Mar 10 20:40:29 UTC 2026","","","",""
"Test cases for TestResources_CreateCustomNodeKindsTest","143","TestResources_CreateCustomNodeKindsTest","","Tue Mar 10 20:36:00 UTC 2026","passed","Tue Mar 10 20:36:00 UTC 2026","","Go Test","github.com/specterops/bloodhound/cmd/api/src/api/v2/TestResources_CreateCustomNodeKindsTest","TestResources_CreateCustomNodeKindsTest"
"","2043","Kebab menu click causes the callback function to be called with the correct parameters","ExploreTable","Tue Mar 10 20:37:04 UTC 2026","passed","Tue Mar 10 20:37:06 UTC 2026","","","",""
"","281","calls openSAMLProviderDialog when SAML Provider menu item is clicked","CreateMenu","Tue Mar 10 20:38:04 UTC 2026","passed","Tue Mar 10 20:38:04 UTC 2026","","oidc_support feature flag enabled","",""
"","1943","when user performs a pathfinding search, and then clicks the swap button, the start and destination inputs are swapped","Pathfinding: interaction","Tue Mar 10 20:38:39 UTC 2026","passed","Tue Mar 10 20:38:41 UTC 2026","","","",""
"","0","returns paramValue as EnvironmentAggregation if paramValue is all","useEnvironmentParams","Tue Mar 10 20:41:21 UTC 2026","passed","Tue Mar 10 20:41:21 UTC 2026","","parseEnvironmentAggregation","",""
"Test cases for TestArgon2_ParseDigest","0","TestArgon2_ParseDigest","","Tue Mar 10 20:36:27 UTC 2026","passed","Tue Mar 10 20:36:27 UTC 2026","","Go Test","github.com/specterops/bloodhound/packages/go/crypto/TestArgon2_ParseDigest","TestArgon2_ParseDigest"
"Test cases for TestInt64From","0","TestInt64From","","Tue Mar 10 20:36:05 UTC 2026","passed","Tue Mar 10 20:36:05 UTC 2026","","Go Test","github.com/specterops/bloodhound/cmd/api/src/database/types/null/TestInt64From","TestInt64From"
"","0","`undefined` input is provided","Parsing the debounced input for type and keyword values","Tue Mar 10 20:39:25 UTC 2026","passed","Tue Mar 10 20:39:25 UTC 2026","","","",""
"Test cases for TestResources_ListRootCAPKIHierarchy","2","TestResources_ListRootCAPKIHierarchy","","Tue Mar 10 20:36:00 UTC 2026","passed","Tue Mar 10 20:36:00 UTC 2026","","Go Test","github.com/specterops/bloodhound/cmd/api/src/api/v2/TestResources_ListRootCAPKIHierarchy","TestResources_ListRootCAPKIHierarchy"
"","101","should call onCancel when return to login button clicked","OneTimePasscodeForm","Tue Mar 10 20:40:37 UTC 2026","passed","Tue Mar 10 20:40:37 UTC 2026","","","",""
"Test cases for TestError","0","TestError","","Tue Mar 10 20:35:52 UTC 2026","passed","Tue Mar 10 20:35:52 UTC 2026","","Go Test","github.com/specterops/bloodhound/cmd/api/src/api/TestError","TestError"
"Test cases for TestManagementResource_DeleteUser_GetUserError","0","TestManagementResource_DeleteUser_GetUserError","","Tue Mar 10 20:36:18 UTC 2026","passed","Tue Mar 10 20:36:18 UTC 2026","","Go Test","github.com/specterops/bloodhound/cmd/api/src/api/v2/auth/TestManagementResource_DeleteUser_GetUserError","TestManagementResource_DeleteUser_GetUserError"
"","0","pwdlastset","Handling value formatting for Active Directory entity properties lastlogon, lastlogontimestamp, whencreated, and pwdlastset","Tue Mar 10 20:38:01 UTC 2026","passed","Tue Mar 10 20:38:01 UTC 2026","","","",""
"","160","calls handleInitialEnvironment with the highest impactValue as the initial environment","useInitialEnvironment","Tue Mar 10 20:40:14 UTC 2026","passed","Tue Mar 10 20:40:14 UTC 2026","","","",""
"","0","should appropriately handle edges that contain underscores","getEdgeDataFromKey","Tue Mar 10 20:42:30 UTC 2026","passed","Tue Mar 10 20:42:30 UTC 2026","","","",""
"","91","should display ""Password"" input","Enable2FADialog","Tue Mar 10 20:40:04 UTC 2026","passed","Tue Mar 10 20:40:04 UTC 2026","","","",""
"Test cases for TestManagementResource_ListUsers_SortingError","1","TestManagementResource_ListUsers_SortingError","","Tue Mar 10 20:36:05 UTC 2026","passed","Tue Mar 10 20:36:05 UTC 2026","","Go Test","github.com/specterops/bloodhound/cmd/api/src/api/v2/auth/TestManagementResource_ListUsers_SortingError","TestManagementResource_ListUsers_SortingError"
"Test cases for TestRoleAssignments_UsersWithoutRoles","1","TestRoleAssignments_UsersWithoutRoles","","Tue Mar 10 20:36:26 UTC 2026","passed","Tue Mar 10 20:36:26 UTC 2026","","Go Test","github.com/specterops/bloodhound/packages/go/analysis/azure/TestRoleAssignments_UsersWithoutRoles","TestRoleAssignments_UsersWithoutRoles"
"","1","lastlogon, lastlogontimestamp","Handling value formatting for Active Directory entity properties lastlogon, lastlogontimestamp, whencreated, and pwdlastset","Tue Mar 10 20:38:01 UTC 2026","passed","Tue Mar 10 20:38:01 UTC 2026","","","",""
"Test cases for TestBuildErrorResponseUnauthorized","0","TestBuildErrorResponseUnauthorized","","Tue Mar 10 20:35:52 UTC 2026","passed","Tue Mar 10 20:35:52 UTC 2026","","Go Test","github.com/specterops/bloodhound/cmd/api/src/api/TestBuildErrorResponseUnauthorized","TestBuildErrorResponseUnauthorized"
"","5","returns all environments when no filters are active","filterAndSearchEnvironments","Tue Mar 10 20:37:13 UTC 2026","passed","Tue Mar 10 20:37:13 UTC 2026","","with no filters applied","",""
"Test cases for TestManagementResource_UpdateSAMLProviderRequest","12","TestManagementResource_UpdateSAMLProviderRequest","","Tue Mar 10 20:36:36 UTC 2026","passed","Tue Mar 10 20:36:36 UTC 2026","","Go Test","github.com/specterops/bloodhound/cmd/api/src/api/v2/auth/TestManagementResource_UpdateSAMLProviderRequest","TestManagementResource_UpdateSAMLProviderRequest"
"","16","renders an error fallback when flag is not found","FeatureFlag","Tue Mar 10 20:40:18 UTC 2026","passed","Tue Mar 10 20:40:18 UTC 2026","","","",""
"Test cases for TestLoginExpiry","0","TestLoginExpiry","","Tue Mar 10 20:36:36 UTC 2026","passed","Tue Mar 10 20:36:36 UTC 2026","","Go Test","github.com/specterops/bloodhound/cmd/api/src/api/v2/auth/TestLoginExpiry","TestLoginExpiry"
"","99","renders with a selected icon","Glyph Select Dialog","Tue Mar 10 20:41:00 UTC 2026","passed","Tue Mar 10 20:41:01 UTC 2026","","","",""
"","0","returns undefined if graphData is %s or not a GraphResponse","getExploreTableData","Tue Mar 10 20:39:23 UTC 2026","passed","Tue Mar 10 20:39:23 UTC 2026","","","",""
"","801","should not call onSubmit when password does not match confirmation password when reset password button clicked","PasswordResetForm","Tue Mar 10 20:39:00 UTC 2026","passed","Tue Mar 10 20:39:00 UTC 2026","","","",""
"","868","shows a warning for using labels associated with tags in zone forms","Rule Form","Tue Mar 10 20:37:20 UTC 2026","passed","Tue Mar 10 20:37:21 UTC 2026","","","",""
"","861","should not have less characters than the minimum requirement","CreateUserForm","Tue Mar 10 20:37:34 UTC 2026","passed","Tue Mar 10 20:37:35 UTC 2026","","","",""
"","14","displays CaretUp icon when the sortOrder is asc","ColumnHeaders","Tue Mar 10 20:39:18 UTC 2026","passed","Tue Mar 10 20:39:18 UTC 2026","","SortableHeader","",""
"","34","calculates the running time of a job and converts to a human readable format","getSimpleDuration","Tue Mar 10 20:40:42 UTC 2026","passed","Tue Mar 10 20:40:42 UTC 2026","","","",""
"Test cases for TestGC_Name","0","TestGC_Name","","Tue Mar 10 20:36:04 UTC 2026","passed","Tue Mar 10 20:36:04 UTC 2026","","Go Test","github.com/specterops/bloodhound/cmd/api/src/daemons/gc/TestGC_Name","TestGC_Name"
"Test cases for TestDomainSelectors_TestIsSortable","0","TestDomainSelectors_TestIsSortable","","Tue Mar 10 20:36:06 UTC 2026","passed","Tue Mar 10 20:36:06 UTC 2026","","Go Test","github.com/specterops/bloodhound/cmd/api/src/model/TestDomainSelectors_TestIsSortable","TestDomainSelectors_TestIsSortable"
"","228","should fire ""onClose"" once","UserTokenManagementDialog","Tue Mar 10 20:39:59 UTC 2026","passed","Tue Mar 10 20:40:00 UTC 2026","","when user clicks ""Close"" button","",""
"","417","On successful upload, displays a completion of 100% and adds a ""Complete"" button that closes the dialog","SchemaUploadDialog","Tue Mar 10 20:39:13 UTC 2026","passed","Tue Mar 10 20:39:13 UTC 2026","","","",""
"","191","should not call onSubmit when input is invalid and Submit button is clicked","UpsertSAMLProviderForm","Tue Mar 10 20:40:14 UTC 2026","passed","Tue Mar 10 20:40:14 UTC 2026","","","",""
"","414","should not call onSave when Save button is clicked and form input is invalid","UpdateUserDialog","Tue Mar 10 20:37:32 UTC 2026","passed","Tue Mar 10 20:37:32 UTC 2026","","","",""
"","107","does not show View in Explore if in object rule type","Seed Selection Results","Tue Mar 10 20:37:50 UTC 2026","passed","Tue Mar 10 20:37:50 UTC 2026","","","",""
"","448","renders correctly with requiresCurrentPassword false","PasswordDialog","Tue Mar 10 20:37:24 UTC 2026","passed","Tue Mar 10 20:37:25 UTC 2026","","","",""
"","827","open and closes dialog","DatabaseManagement","Tue Mar 10 20:42:01 UTC 2026","passed","Tue Mar 10 20:42:02 UTC 2026","","","",""
"Test cases for TestDisenrollMFA_Admin_FailureIncorrectPassword","2399","TestDisenrollMFA_Admin_FailureIncorrectPassword","","Tue Mar 10 20:36:31 UTC 2026","passed","Tue Mar 10 20:36:34 UTC 2026","","Go Test","github.com/specterops/bloodhound/cmd/api/src/api/v2/auth/TestDisenrollMFA_Admin_FailureIncorrectPassword","TestDisenrollMFA_Admin_FailureIncorrectPassword"
"Test cases for TestManagementResource_PutUserAuthSecret","5584","TestManagementResource_PutUserAuthSecret","","Tue Mar 10 20:35:59 UTC 2026","passed","Tue Mar 10 20:36:05 UTC 2026","","Go Test","github.com/specterops/bloodhound/cmd/api/src/api/v2/auth/TestManagementResource_PutUserAuthSecret","TestManagementResource_PutUserAuthSecret"
"Test cases for TestParseHeaderValues","0","TestParseHeaderValues","","Tue Mar 10 20:35:53 UTC 2026","passed","Tue Mar 10 20:35:53 UTC 2026","","Go Test","github.com/specterops/bloodhound/cmd/api/src/api/middleware/TestParseHeaderValues","TestParseHeaderValues"
"Test cases for TestDefineSID","0","TestDefineSID","","Tue Mar 10 20:36:24 UTC 2026","passed","Tue Mar 10 20:36:24 UTC 2026","","Go Test","github.com/specterops/bloodhound/packages/go/analysis/ad/wellknown/TestDefineSID","TestDefineSID"
