"DESCRIPTION","DURATION IN MS","NAME","PARENT SUITE","START TIME","STATUS","STOP TIME","SUB SUITE","SUITE","TEST CLASS","TEST METHOD"
"","3","rounds down fractional minutes/days","getSimpleDuration","Wed Apr 08 22:39:33 UTC 2026","passed","Wed Apr 08 22:39:33 UTC 2026","","","",""
"","2","updates state when an external storage event is fired for the same key","useLocalStorage","Wed Apr 08 22:37:12 UTC 2026","passed","Wed Apr 08 22:37:12 UTC 2026","","storage event synchronisation","",""
"","1097","should display all available SSO providers","UpdateUserDialog","Wed Apr 08 22:36:06 UTC 2026","passed","Wed Apr 08 22:36:07 UTC 2026","","","",""
"Test cases for TestInt64ValueOrZero","0","TestInt64ValueOrZero","","Wed Apr 08 22:34:40 UTC 2026","passed","Wed Apr 08 22:34:40 UTC 2026","","Go Test","github.com/specterops/bloodhound/cmd/api/src/database/types/null/TestInt64ValueOrZero","TestInt64ValueOrZero"
"","1738","renders a table if the query has NO node edges","GraphView","Wed Apr 08 22:41:02 UTC 2026","passed","Wed Apr 08 22:41:04 UTC 2026","","","",""
"","102","should not display the ETAC role-based filtering badge when filtering is disabled","Zone Management","Wed Apr 08 22:39:06 UTC 2026","passed","Wed Apr 08 22:39:06 UTC 2026","","","",""
"","36","displays a loading message while fetching extensions","ActiveExtensionsCard","Wed Apr 08 22:35:50 UTC 2026","passed","Wed Apr 08 22:35:50 UTC 2026","","","",""
"Test cases for TestWriteResultJson","0","TestWriteResultJson","","Wed Apr 08 22:35:01 UTC 2026","passed","Wed Apr 08 22:35:01 UTC 2026","","Go Test","github.com/specterops/bloodhound/cmd/api/src/utils/TestWriteResultJson","TestWriteResultJson"
"","26","returns undefined if environmentId searched for is not found","useAvailableEnvironments","Wed Apr 08 22:39:22 UTC 2026","passed","Wed Apr 08 22:39:22 UTC 2026","","useSelectedEnvironment","",""
"Test cases for TestDatabase_GetAssetGroupTag","0","TestDatabase_GetAssetGroupTag","","Wed Apr 08 22:34:36 UTC 2026","passed","Wed Apr 08 22:34:36 UTC 2026","","Go Test","github.com/specterops/bloodhound/cmd/api/src/api/v2/TestDatabase_GetAssetGroupTag","TestDatabase_GetAssetGroupTag"
"Test cases for Test_cacheQueryResult","0","Test_cacheQueryResult","","Wed Apr 08 22:34:42 UTC 2026","passed","Wed Apr 08 22:34:42 UTC 2026","","Go Test","github.com/specterops/bloodhound/cmd/api/src/queries/Test_cacheQueryResult","Test_cacheQueryResult"
"","101","disables items via itemDisabled and hides the chevron icon visually","<DetailsAccordion />","Wed Apr 08 22:36:29 UTC 2026","passed","Wed Apr 08 22:36:30 UTC 2026","","","",""
"","961","shows a warning for using labels associated with tags in zone forms","Rule Form","Wed Apr 08 22:35:54 UTC 2026","passed","Wed Apr 08 22:35:55 UTC 2026","","","",""
"","288","renders an error message without throwing a TypeError","EntityInfoCollapsibleSection","Wed Apr 08 22:39:45 UTC 2026","passed","Wed Apr 08 22:39:45 UTC 2026","","","",""
"Test cases for TestResources_ListAuditLogs_SortingError","1","TestResources_ListAuditLogs_SortingError","","Wed Apr 08 22:34:36 UTC 2026","passed","Wed Apr 08 22:34:36 UTC 2026","","Go Test","github.com/specterops/bloodhound/cmd/api/src/api/v2/TestResources_ListAuditLogs_SortingError","TestResources_ListAuditLogs_SortingError"
"","54","does not render when ruleId is empty","Delete Selector Button rendering","Wed Apr 08 22:39:55 UTC 2026","passed","Wed Apr 08 22:39:55 UTC 2026","","","",""
"","251","calls onToggleEdgeLabels when click show all edge labels","GraphControls","Wed Apr 08 22:36:13 UTC 2026","passed","Wed Apr 08 22:36:13 UTC 2026","","Toggling labels","",""
"","6","uses the discardQueryParams prop to discard all query params on the redirect","AppNavigate","Wed Apr 08 22:39:00 UTC 2026","passed","Wed Apr 08 22:39:00 UTC 2026","","","",""
"","165","upon selecting a source node, updates the URL with a searchType of 'node' and primarySearch of the node's objectid","useNodeSearch","Wed Apr 08 22:39:15 UTC 2026","passed","Wed Apr 08 22:39:15 UTC 2026","","","",""
"","362","renders total rules and accordion sections","RulesAccordion","Wed Apr 08 22:38:13 UTC 2026","passed","Wed Apr 08 22:38:14 UTC 2026","","","",""
"Test cases for TestFloatSetValid","0","TestFloatSetValid","","Wed Apr 08 22:34:40 UTC 2026","passed","Wed Apr 08 22:34:40 UTC 2026","","Go Test","github.com/specterops/bloodhound/cmd/api/src/database/types/null/TestFloatSetValid","TestFloatSetValid"
"Test cases for TestHandleDatabaseErrorNotFound","0","TestHandleDatabaseErrorNotFound","","Wed Apr 08 22:34:26 UTC 2026","passed","Wed Apr 08 22:34:26 UTC 2026","","Go Test","github.com/specterops/bloodhound/cmd/api/src/api/TestHandleDatabaseErrorNotFound","TestHandleDatabaseErrorNotFound"
"Test cases for TestUnmarshalTimeJSON","0","TestUnmarshalTimeJSON","","Wed Apr 08 22:34:40 UTC 2026","passed","Wed Apr 08 22:34:40 UTC 2026","","Go Test","github.com/specterops/bloodhound/cmd/api/src/database/types/null/TestUnmarshalTimeJSON","TestUnmarshalTimeJSON"
"Test cases for TestQueries_BuildEntityQueryParams","0","TestQueries_BuildEntityQueryParams","","Wed Apr 08 22:34:42 UTC 2026","passed","Wed Apr 08 22:34:42 UTC 2026","","Go Test","github.com/specterops/bloodhound/cmd/api/src/queries/TestQueries_BuildEntityQueryParams","TestQueries_BuildEntityQueryParams"
"","92","renders a dash when actor is BloodHoundString","NoteCell component","Wed Apr 08 22:38:54 UTC 2026","passed","Wed Apr 08 22:38:54 UTC 2026","","","",""
"","62","correctly handles the hygiene ID with value 0 by not omitting it in the params value even though 0 is falsey","usePZQueryParams","Wed Apr 08 22:38:23 UTC 2026","passed","Wed Apr 08 22:38:23 UTC 2026","","","",""
"","197","renders with a title","BloodHoundConfiguration","Wed Apr 08 22:41:27 UTC 2026","passed","Wed Apr 08 22:41:27 UTC 2026","","","",""
"Test cases for TestResources_ListADIssuancePolicyLinkedCertTemplates","153","TestResources_ListADIssuancePolicyLinkedCertTemplates","","Wed Apr 08 22:34:36 UTC 2026","passed","Wed Apr 08 22:34:37 UTC 2026","","Go Test","github.com/specterops/bloodhound/cmd/api/src/api/v2/TestResources_ListADIssuancePolicyLinkedCertTemplates","TestResources_ListADIssuancePolicyLinkedCertTemplates"
"","168","upon selecting just a source node, updates the URL with a searchType of 'node' and primarySearch of the node's objectid","usePathfindingSearch","Wed Apr 08 22:37:42 UTC 2026","passed","Wed Apr 08 22:37:42 UTC 2026","","","",""
"","639","should initiate data loading when an item is selected","Simple Environment Selector","Wed Apr 08 22:37:05 UTC 2026","passed","Wed Apr 08 22:37:05 UTC 2026","","","",""
"","3359","Sort arrow is visible and direction is correct","ExploreTable","Wed Apr 08 22:35:41 UTC 2026","passed","Wed Apr 08 22:35:44 UTC 2026","","","",""
"","705","calls onSave when valid form inputs are provided","PasswordDialog","Wed Apr 08 22:36:03 UTC 2026","passed","Wed Apr 08 22:36:03 UTC 2026","","","",""
"","863","should call onSave when Save button is clicked and form input is valid","UpdateUserDialog","Wed Apr 08 22:36:04 UTC 2026","passed","Wed Apr 08 22:36:05 UTC 2026","","","",""
"","169","displays appropriate text when there are no matches for search term","SearchCurrentNodes","Wed Apr 08 22:38:19 UTC 2026","passed","Wed Apr 08 22:38:19 UTC 2026","","","",""
"","399","should not call onSave when Save button is clicked and form input is invalid","UpdateUserDialog","Wed Apr 08 22:36:04 UTC 2026","passed","Wed Apr 08 22:36:04 UTC 2026","","","",""
"Test cases for TestManagementResource_SanitizeAndGetRoles","0","TestManagementResource_SanitizeAndGetRoles","","Wed Apr 08 22:35:22 UTC 2026","passed","Wed Apr 08 22:35:22 UTC 2026","","Go Test","github.com/specterops/bloodhound/cmd/api/src/api/v2/auth/TestManagementResource_SanitizeAndGetRoles","TestManagementResource_SanitizeAndGetRoles"
"Test cases for TestResources_ListADComputerDCOMUsers","2","TestResources_ListADComputerDCOMUsers","","Wed Apr 08 22:34:36 UTC 2026","passed","Wed Apr 08 22:34:36 UTC 2026","","Go Test","github.com/specterops/bloodhound/cmd/api/src/api/v2/TestResources_ListADComputerDCOMUsers","TestResources_ListADComputerDCOMUsers"
"","543","displays a Upload Files button","FileIngest","Wed Apr 08 22:39:25 UTC 2026","passed","Wed Apr 08 22:39:26 UTC 2026","","","",""
"Test cases for TestAssetGroupMembers_BuildFilteringConditional_Error","0","TestAssetGroupMembers_BuildFilteringConditional_Error","","Wed Apr 08 22:34:26 UTC 2026","passed","Wed Apr 08 22:34:26 UTC 2026","","Go Test","github.com/specterops/bloodhound/cmd/api/src/api/TestAssetGroupMembers_BuildFilteringConditional_Error","TestAssetGroupMembers_BuildFilteringConditional_Error"
"","1","handles environment with impactValue at exact threshold boundaries","filterAndSearchEnvironments","Wed Apr 08 22:35:44 UTC 2026","passed","Wed Apr 08 22:35:44 UTC 2026","","edge cases","",""
"","0","should return false when there is no match","OperationsFilterPlugin","Wed Apr 08 22:40:20 UTC 2026","passed","Wed Apr 08 22:40:20 UTC 2026","","","",""
"Test cases for TestManagementResource_EnrollMFA","4375","TestManagementResource_EnrollMFA","","Wed Apr 08 22:35:07 UTC 2026","passed","Wed Apr 08 22:35:11 UTC 2026","","Go Test","github.com/specterops/bloodhound/cmd/api/src/api/v2/auth/TestManagementResource_EnrollMFA","TestManagementResource_EnrollMFA"
"","401","The reset password and two-factor authentication options should not appear in profile page if the user is configured for SAML login","UserProfile with SSO User","Wed Apr 08 22:37:00 UTC 2026","passed","Wed Apr 08 22:37:01 UTC 2026","","","",""
"","11","navigates to the specified route with global params intact when triggered by a splat route","AppNavigate","Wed Apr 08 22:39:00 UTC 2026","passed","Wed Apr 08 22:39:00 UTC 2026","","","",""
"","338","disables checkboxes by default","SourceKindsCheckboxes","Wed Apr 08 22:37:33 UTC 2026","passed","Wed Apr 08 22:37:33 UTC 2026","","","",""
"Test cases for TestResources_GetShortestPath_ETAC","29","TestResources_GetShortestPath_ETAC","","Wed Apr 08 22:34:37 UTC 2026","passed","Wed Apr 08 22:34:37 UTC 2026","","Go Test","github.com/specterops/bloodhound/cmd/api/src/api/v2/TestResources_GetShortestPath_ETAC","TestResources_GetShortestPath_ETAC"
"","67","returns the full environment for the environmentid passed","useAvailableEnvironments","Wed Apr 08 22:39:22 UTC 2026","passed","Wed Apr 08 22:39:22 UTC 2026","","useSelectedEnvironment","",""
"","0","returns false when id is not an environment aggregation","isEnvironmentAggregation","Wed Apr 08 22:35:44 UTC 2026","passed","Wed Apr 08 22:35:44 UTC 2026","","","",""
"Test cases for TestOpenGraphSchemaService_GetSchemaFindings","0","TestOpenGraphSchemaService_GetSchemaFindings","","Wed Apr 08 22:34:44 UTC 2026","passed","Wed Apr 08 22:34:44 UTC 2026","","Go Test","github.com/specterops/bloodhound/cmd/api/src/services/opengraphschema/TestOpenGraphSchemaService_GetSchemaFindings","TestOpenGraphSchemaService_GetSchemaFindings"
"","563","clears applied filters when clicking the Clear button","Privilege Zones History Filter Dialog","Wed Apr 08 22:37:42 UTC 2026","passed","Wed Apr 08 22:37:43 UTC 2026","","","",""
"Test cases for FuzzFoldlLazy","0","FuzzFoldlLazy","","Wed Apr 08 22:35:16 UTC 2026","passed","Wed Apr 08 22:35:16 UTC 2026","","Go Test","github.com/specterops/bloodhound/packages/go/slicesext/FuzzFoldlLazy","FuzzFoldlLazy"
"","873","should render with a full list of multiple tenants and domains","Simple Environment Selector","Wed Apr 08 22:37:04 UTC 2026","passed","Wed Apr 08 22:37:05 UTC 2026","","","",""
"Test cases for TestResources_ListADDomainForeignGPOControllers","1","TestResources_ListADDomainForeignGPOControllers","","Wed Apr 08 22:34:36 UTC 2026","passed","Wed Apr 08 22:34:36 UTC 2026","","Go Test","github.com/specterops/bloodhound/cmd/api/src/api/v2/TestResources_ListADDomainForeignGPOControllers","TestResources_ListADDomainForeignGPOControllers"
"","164","renders the glyph form input when the editing a zone that is not the highest privileged","Tag Form","Wed Apr 08 22:35:31 UTC 2026","passed","Wed Apr 08 22:35:31 UTC 2026","","","",""
"","164","a name value is required to submit the form","Tag Form","Wed Apr 08 22:35:31 UTC 2026","passed","Wed Apr 08 22:35:31 UTC 2026","","","",""
"Test cases for TestManagementResource_ListAuthTokens_UserIDFilter","4","TestManagementResource_ListAuthTokens_UserIDFilter","","Wed Apr 08 22:35:07 UTC 2026","passed","Wed Apr 08 22:35:07 UTC 2026","","Go Test","github.com/specterops/bloodhound/cmd/api/src/api/v2/auth/TestManagementResource_ListAuthTokens_UserIDFilter","TestManagementResource_ListAuthTokens_UserIDFilter"
"Test cases for TestResources_ListRootCAPKIHierarchy","4","TestResources_ListRootCAPKIHierarchy","","Wed Apr 08 22:34:36 UTC 2026","passed","Wed Apr 08 22:34:36 UTC 2026","","Go Test","github.com/specterops/bloodhound/cmd/api/src/api/v2/TestResources_ListRootCAPKIHierarchy","TestResources_ListRootCAPKIHierarchy"
"Test cases for TestConvertAzureRoleEligibilityScheduleInstanceToRel","0","TestConvertAzureRoleEligibilityScheduleInstanceToRel","","Wed Apr 08 22:35:02 UTC 2026","passed","Wed Apr 08 22:35:02 UTC 2026","","Go Test","github.com/specterops/bloodhound/packages/go/ein/TestConvertAzureRoleEligibilityScheduleInstanceToRel","TestConvertAzureRoleEligibilityScheduleInstanceToRel"
"","0","returns true if both arrays are empty","areArraysSimilar","Wed Apr 08 22:39:54 UTC 2026","passed","Wed Apr 08 22:39:54 UTC 2026","","","",""
"Test cases for TestUnmarshalInt64","0","TestUnmarshalInt64","","Wed Apr 08 22:34:40 UTC 2026","passed","Wed Apr 08 22:34:40 UTC 2026","","Go Test","github.com/specterops/bloodhound/cmd/api/src/database/types/null/TestUnmarshalInt64","TestUnmarshalInt64"
"TestMigrator_GenerateManifest tests the full integrity of a Manifest generatedfrom 3 different Source's:1) Correct number of total migrations detected.2) Correct number of versions detected.3) The VersionTable has all versions, in order.4) All versions have the correct number of migrations.5) Schema files generate v0.0.0 migrations.6) Migrations are ordered within each version, in the order the Source was defined.","0","TestMigrator_GenerateManifest","","Wed Apr 08 22:34:40 UTC 2026","passed","Wed Apr 08 22:34:40 UTC 2026","","Go Test","github.com/specterops/bloodhound/cmd/api/src/database/migration/TestMigrator_GenerateManifest","TestMigrator_GenerateManifest"
"","116","displays an error message while fetching fails","ActiveExtensionsCard","Wed Apr 08 22:35:50 UTC 2026","passed","Wed Apr 08 22:35:50 UTC 2026","","","",""
"","331","renders the popup content with run, edit/share, and delete when the menu trigger","ListItemActionMenu","Wed Apr 08 22:38:43 UTC 2026","passed","Wed Apr 08 22:38:43 UTC 2026","","","",""
"Test cases for TestCache_Set","0","TestCache_Set","","Wed Apr 08 22:35:02 UTC 2026","passed","Wed Apr 08 22:35:02 UTC 2026","","Go Test","github.com/specterops/bloodhound/packages/go/cache/TestCache_Set","TestCache_Set"
"","64","displays the checkbox as checked if the filter params value is 'true'","AssetGroupEdit","Wed Apr 08 22:36:50 UTC 2026","passed","Wed Apr 08 22:36:50 UTC 2026","","Custom Member checkbox filter","",""
"Test cases for Test_convertGraphExtensionPayloadToGraphExtension","0","Test_convertGraphExtensionPayloadToGraphExtension","","Wed Apr 08 22:34:36 UTC 2026","passed","Wed Apr 08 22:34:36 UTC 2026","","Go Test","github.com/specterops/bloodhound/cmd/api/src/api/v2/Test_convertGraphExtensionPayloadToGraphExtension","Test_convertGraphExtensionPayloadToGraphExtension"
"Test cases for TestResources_ListADDomainContainedGPOs","3","TestResources_ListADDomainContainedGPOs","","Wed Apr 08 22:34:36 UTC 2026","passed","Wed Apr 08 22:34:36 UTC 2026","","Go Test","github.com/specterops/bloodhound/cmd/api/src/api/v2/TestResources_ListADDomainContainedGPOs","TestResources_ListADDomainContainedGPOs"
"","422","should not have less characters than the minimum requirement","UpdateUserForm","Wed Apr 08 22:35:38 UTC 2026","passed","Wed Apr 08 22:35:39 UTC 2026","","","",""
"Test cases for TestWriteResultRawJson","0","TestWriteResultRawJson","","Wed Apr 08 22:35:01 UTC 2026","passed","Wed Apr 08 22:35:01 UTC 2026","","Go Test","github.com/specterops/bloodhound/cmd/api/src/utils/TestWriteResultRawJson","TestWriteResultRawJson"
"","17","should filter properties that we do not want to display in the entity panel","ObjectInfoFields","Wed Apr 08 22:39:44 UTC 2026","passed","Wed Apr 08 22:39:44 UTC 2026","","","",""
"","282","should render","NoDataDialog","Wed Apr 08 22:40:12 UTC 2026","passed","Wed Apr 08 22:40:13 UTC 2026","","","",""
"Test cases for TestManagementResource_ListRoles_Filtered","0","TestManagementResource_ListRoles_Filtered","","Wed Apr 08 22:34:43 UTC 2026","passed","Wed Apr 08 22:34:43 UTC 2026","","Go Test","github.com/specterops/bloodhound/cmd/api/src/api/v2/auth/TestManagementResource_ListRoles_Filtered","TestManagementResource_ListRoles_Filtered"
"Test cases for TestFilter","0","TestFilter","","Wed Apr 08 22:35:16 UTC 2026","passed","Wed Apr 08 22:35:16 UTC 2026","","Go Test","github.com/specterops/bloodhound/packages/go/slicesext/TestFilter","TestFilter"
"","44","stores the state of a search term without modifying the query params","useCypherSearch","Wed Apr 08 22:39:48 UTC 2026","passed","Wed Apr 08 22:39:48 UTC 2026","","","",""
"","59","excludes API edges that are associated with one of our built-in schema types","useEdgeCategories","Wed Apr 08 22:36:54 UTC 2026","passed","Wed Apr 08 22:36:54 UTC 2026","","","",""
"Test cases for TestManagementResource_ListPermissions_InvalidFilterPredicate","0","TestManagementResource_ListPermissions_InvalidFilterPredicate","","Wed Apr 08 22:34:43 UTC 2026","passed","Wed Apr 08 22:34:43 UTC 2026","","Go Test","github.com/specterops/bloodhound/cmd/api/src/api/v2/auth/TestManagementResource_ListPermissions_InvalidFilterPredicate","TestManagementResource_ListPermissions_InvalidFilterPredicate"
"","66","passes checks if the user has multiple required permissions","usePermissions","Wed Apr 08 22:36:55 UTC 2026","passed","Wed Apr 08 22:36:55 UTC 2026","","","",""
"","402","should render","LoginViaSSOForm","Wed Apr 08 22:38:40 UTC 2026","passed","Wed Apr 08 22:38:40 UTC 2026","","","",""
"Test cases for TestFloatPointer","0","TestFloatPointer","","Wed Apr 08 22:34:40 UTC 2026","passed","Wed Apr 08 22:34:40 UTC 2026","","Go Test","github.com/specterops/bloodhound/cmd/api/src/database/types/null/TestFloatPointer","TestFloatPointer"
"","395","toggles sort order when clicking sortable header","ObjectsAccordion","Wed Apr 08 22:39:17 UTC 2026","passed","Wed Apr 08 22:39:18 UTC 2026","","","",""
"","35","the queries in the list only include nodes and edges that are defined in our schema","common search list","Wed Apr 08 22:39:52 UTC 2026","passed","Wed Apr 08 22:39:52 UTC 2026","","","",""
"Test cases for TestStringEqual","0","TestStringEqual","","Wed Apr 08 22:34:40 UTC 2026","passed","Wed Apr 08 22:34:40 UTC 2026","","Go Test","github.com/specterops/bloodhound/cmd/api/src/database/types/null/TestStringEqual","TestStringEqual"
"","170","shows the empty form message when Object Rule Form is empty","Seed Selection Results","Wed Apr 08 22:36:25 UTC 2026","passed","Wed Apr 08 22:36:25 UTC 2026","","","",""
"Test cases for TestResources_UpdateAssetGroupSelectors_GetAssetGroupError","0","TestResources_UpdateAssetGroupSelectors_GetAssetGroupError","","Wed Apr 08 22:34:36 UTC 2026","passed","Wed Apr 08 22:34:36 UTC 2026","","Go Test","github.com/specterops/bloodhound/cmd/api/src/api/v2/TestResources_UpdateAssetGroupSelectors_GetAssetGroupError","TestResources_UpdateAssetGroupSelectors_GetAssetGroupError"
"Test cases for TestResources_ListAuditLogs_Filtered","0","TestResources_ListAuditLogs_Filtered","","Wed Apr 08 22:34:37 UTC 2026","passed","Wed Apr 08 22:34:37 UTC 2026","","Go Test","github.com/specterops/bloodhound/cmd/api/src/api/v2/TestResources_ListAuditLogs_Filtered","TestResources_ListAuditLogs_Filtered"
"","122","continue button is disabled when no SSO provider has been selected","LoginViaSSOForm","Wed Apr 08 22:38:41 UTC 2026","passed","Wed Apr 08 22:38:41 UTC 2026","","","",""
"","175","shows ""API Expiration Date"" column header when expiration is enabled","UserTokenManagementDialog - API Expiration Date column","Wed Apr 08 22:36:35 UTC 2026","passed","Wed Apr 08 22:36:36 UTC 2026","","","",""
"Test cases for Test_NewSpecWithHooks","0","Test_NewSpecWithHooks","","Wed Apr 08 22:35:03 UTC 2026","passed","Wed Apr 08 22:35:03 UTC 2026","","Go Test","github.com/specterops/bloodhound/packages/go/lab/Test_NewSpecWithHooks","Test_NewSpecWithHooks"
"","44","renders section when no errors occur","EntityInfoCollapsibleSection","Wed Apr 08 22:39:45 UTC 2026","passed","Wed Apr 08 22:39:45 UTC 2026","","","",""
"","20","renders the LabelSelector when available and on a Label page","TagSelector","Wed Apr 08 22:38:26 UTC 2026","passed","Wed Apr 08 22:38:26 UTC 2026","","","",""
"","867","should hide Environmental Targeted Access Control panel when showEnvironmentAccessControls prop is true and power user role is selected","UpdateUserForm","Wed Apr 08 22:35:40 UTC 2026","passed","Wed Apr 08 22:35:41 UTC 2026","","","",""
"Test cases for TestIntFromPtr","0","TestIntFromPtr","","Wed Apr 08 22:34:40 UTC 2026","passed","Wed Apr 08 22:34:40 UTC 2026","","Go Test","github.com/specterops/bloodhound/cmd/api/src/database/types/null/TestIntFromPtr","TestIntFromPtr"
"","433","handles a selection as expected","DropdownSelector","Wed Apr 08 22:38:59 UTC 2026","passed","Wed Apr 08 22:38:59 UTC 2026","","","",""
"","16","sets autoDisplayTable to false if query type is composition","useExploreTableAutoDisplay","Wed Apr 08 22:39:13 UTC 2026","passed","Wed Apr 08 22:39:13 UTC 2026","","","",""
"Test cases for TestMarshalFloatText","0","TestMarshalFloatText","","Wed Apr 08 22:34:40 UTC 2026","passed","Wed Apr 08 22:34:40 UTC 2026","","Go Test","github.com/specterops/bloodhound/cmd/api/src/database/types/null/TestMarshalFloatText","TestMarshalFloatText"
"","45","should display a badge when role based filtering is true and show filter banner is true","EntityInfoPanel","Wed Apr 08 22:39:21 UTC 2026","passed","Wed Apr 08 22:39:21 UTC 2026","","","",""
"Test cases for TestTimeIsZero","0","TestTimeIsZero","","Wed Apr 08 22:34:40 UTC 2026","passed","Wed Apr 08 22:34:40 UTC 2026","","Go Test","github.com/specterops/bloodhound/cmd/api/src/database/types/null/TestTimeIsZero","TestTimeIsZero"
"Test cases for TestAddOrderByToNeo4jQuery_NoOrderByClause","0","TestAddOrderByToNeo4jQuery_NoOrderByClause","","Wed Apr 08 22:34:37 UTC 2026","passed","Wed Apr 08 22:34:37 UTC 2026","","Go Test","github.com/specterops/bloodhound/cmd/api/src/api/v2/TestAddOrderByToNeo4jQuery_NoOrderByClause","TestAddOrderByToNeo4jQuery_NoOrderByClause"
"Test cases for TestGetLatestQueryParameter","0","TestGetLatestQueryParameter","","Wed Apr 08 22:34:36 UTC 2026","passed","Wed Apr 08 22:34:36 UTC 2026","","Go Test","github.com/specterops/bloodhound/cmd/api/src/api/v2/TestGetLatestQueryParameter","TestGetLatestQueryParameter"
"","11","does not return when zone limit is not reached","useTagLimits","Wed Apr 08 22:35:58 UTC 2026","passed","Wed Apr 08 22:35:58 UTC 2026","","","",""
"Test cases for TestManagementResource_ListPermissions_SortingError","0","TestManagementResource_ListPermissions_SortingError","","Wed Apr 08 22:34:43 UTC 2026","passed","Wed Apr 08 22:34:43 UTC 2026","","Go Test","github.com/specterops/bloodhound/cmd/api/src/api/v2/auth/TestManagementResource_ListPermissions_SortingError","TestManagementResource_ListPermissions_SortingError"
"Test cases for TestManagementResource_OIDCCallbackHandler","14","TestManagementResource_OIDCCallbackHandler","","Wed Apr 08 22:35:22 UTC 2026","passed","Wed Apr 08 22:35:22 UTC 2026","","Go Test","github.com/specterops/bloodhound/cmd/api/src/api/v2/auth/TestManagementResource_OIDCCallbackHandler","TestManagementResource_OIDCCallbackHandler"
"","363","renders a snackbar notification in the dom and tests autoHideDuration","AppNotifications","Wed Apr 08 22:38:58 UTC 2026","passed","Wed Apr 08 22:38:58 UTC 2026","","","",""
"","200","displays the label for each result","SearchCurrentNodes","Wed Apr 08 22:38:19 UTC 2026","passed","Wed Apr 08 22:38:19 UTC 2026","","","",""
"","0","returns false if value is 'array'","searchParams","Wed Apr 08 22:38:43 UTC 2026","passed","Wed Apr 08 22:38:43 UTC 2026","","isEmptyParam","",""
"Test cases for TestCache_FillFifo","0","TestCache_FillFifo","","Wed Apr 08 22:35:02 UTC 2026","passed","Wed Apr 08 22:35:02 UTC 2026","","Go Test","github.com/specterops/bloodhound/packages/go/cache/TestCache_FillFifo","TestCache_FillFifo"
"","703","should render a SaveQueryDialog","SaveQueryDialog","Wed Apr 08 22:35:29 UTC 2026","passed","Wed Apr 08 22:35:30 UTC 2026","","","",""
"Test cases for TestInt64Scan","0","TestInt64Scan","","Wed Apr 08 22:34:40 UTC 2026","passed","Wed Apr 08 22:34:40 UTC 2026","","Go Test","github.com/specterops/bloodhound/cmd/api/src/database/types/null/TestInt64Scan","TestInt64Scan"
"","13","disables the upload button and does not populate a table if the user lacks the permission","File Upload","Wed Apr 08 22:37:41 UTC 2026","passed","Wed Apr 08 22:37:41 UTC 2026","","","",""
"Test cases for TestResources_GetCertTemplateEntityInfo","228","TestResources_GetCertTemplateEntityInfo","","Wed Apr 08 22:34:36 UTC 2026","passed","Wed Apr 08 22:34:37 UTC 2026","","Go Test","github.com/specterops/bloodhound/cmd/api/src/api/v2/TestResources_GetCertTemplateEntityInfo","TestResources_GetCertTemplateEntityInfo"
"Test cases for TestManagementResource_GetSAMLProvider","13","TestManagementResource_GetSAMLProvider","","Wed Apr 08 22:35:22 UTC 2026","passed","Wed Apr 08 22:35:22 UTC 2026","","Go Test","github.com/specterops/bloodhound/cmd/api/src/api/v2/auth/TestManagementResource_GetSAMLProvider","TestManagementResource_GetSAMLProvider"
