"DESCRIPTION","DURATION IN MS","NAME","PARENT SUITE","START TIME","STATUS","STOP TIME","SUB SUITE","SUITE","TEST CLASS","TEST METHOD"
"","3381","Kebab menu click causes the callback function to be called with the correct parameters","ExploreTable","Wed Jun 24 23:12:35 UTC 2026","passed","Wed Jun 24 23:12:38 UTC 2026","","","",""
"","133","should render all of the options as checkboxes","Checkbox group","Wed Jun 24 23:17:32 UTC 2026","passed","Wed Jun 24 23:17:32 UTC 2026","","","",""
"","131","upon selecting just a source node, updates the URL with a searchType of 'node' and primarySearch of the node's objectid","usePathfindingSearch","Wed Jun 24 23:15:10 UTC 2026","passed","Wed Jun 24 23:15:10 UTC 2026","","","",""
"Test cases for TestGenericClone","0","TestGenericClone","","Wed Jun 24 23:11:26 UTC 2026","passed","Wed Jun 24 23:11:26 UTC 2026","","Go Test","github.com/specterops/bloodhound/cmd/api/src/utils/TestGenericClone","TestGenericClone"
"Test cases for TestRegister_PanicsOnNilRouter","0","TestRegister_PanicsOnNilRouter","","Wed Jun 24 23:11:39 UTC 2026","passed","Wed Jun 24 23:11:39 UTC 2026","","Go Test","github.com/specterops/bloodhound/server/modules/TestRegister_PanicsOnNilRouter","TestRegister_PanicsOnNilRouter"
"","18","live regions have aria-atomic set to true","AnnouncementProvider","Wed Jun 24 23:15:38 UTC 2026","passed","Wed Jun 24 23:15:38 UTC 2026","","","",""
"","213","renders with the Export and Delete buttons disabled","QuerySearchFilter","Wed Jun 24 23:15:52 UTC 2026","passed","Wed Jun 24 23:15:52 UTC 2026","","","",""
"","0","returns default error message for unknown API messages","getErrorMessage","Wed Jun 24 23:13:54 UTC 2026","passed","Wed Jun 24 23:13:54 UTC 2026","","","",""
"","113","should on clicking collapse all remove expandedPanelSections param from url and set isObjectInfoPanelOpen in context to false","EntityInfoHeader","Wed Jun 24 23:16:07 UTC 2026","passed","Wed Jun 24 23:16:07 UTC 2026","","","",""
"","652","should display Environmental Targeted Access Control panel when showEnvironmentAccessControls prop is true and user role is selected","UpdateUserForm","Wed Jun 24 23:12:32 UTC 2026","passed","Wed Jun 24 23:12:32 UTC 2026","","","",""
"Test cases for TestManagementResource_DeleteUser_DeleteUserError","1033","TestManagementResource_DeleteUser_DeleteUserError","","Wed Jun 24 23:11:36 UTC 2026","passed","Wed Jun 24 23:11:37 UTC 2026","","Go Test","github.com/specterops/bloodhound/cmd/api/src/api/v2/auth/TestManagementResource_DeleteUser_DeleteUserError","TestManagementResource_DeleteUser_DeleteUserError"
"","9","safely handles removing nonexistent key","useObjectState","Wed Jun 24 23:17:03 UTC 2026","passed","Wed Jun 24 23:17:03 UTC 2026","","","",""
"Test cases for TestResources_UpdateSavedQuery_ErrorFetchingPublicStatus","0","TestResources_UpdateSavedQuery_ErrorFetchingPublicStatus","","Wed Jun 24 23:11:13 UTC 2026","passed","Wed Jun 24 23:11:13 UTC 2026","","Go Test","github.com/specterops/bloodhound/cmd/api/src/api/v2/TestResources_UpdateSavedQuery_ErrorFetchingPublicStatus","TestResources_UpdateSavedQuery_ErrorFetchingPublicStatus"
"","915","should display generate/revoke api tokens button","User Actions Menu","Wed Jun 24 23:15:18 UTC 2026","passed","Wed Jun 24 23:15:19 UTC 2026","","Api Keys","",""
"","20","does not add a query param if the search term is empty","useNodeSearch","Wed Jun 24 23:16:49 UTC 2026","passed","Wed Jun 24 23:16:49 UTC 2026","","","",""
"","195","calls setExploreParams with only the expandedSection label when selecting any accordion that is not composition","EdgeInfoContent","Wed Jun 24 23:12:55 UTC 2026","passed","Wed Jun 24 23:12:55 UTC 2026","","EdgeInfoContent support for Deep Linking","",""
"","241","fires runQuery in context provider","ListItemActionMenu","Wed Jun 24 23:16:15 UTC 2026","passed","Wed Jun 24 23:16:15 UTC 2026","","","",""
"","1430","handles copying the name","CopyMenuItem","Wed Jun 24 23:17:46 UTC 2026","passed","Wed Jun 24 23:17:47 UTC 2026","","","",""
"Test cases for TestNewDefaultFileServices_ReturnsError","1","TestNewDefaultFileServices_ReturnsError","","Wed Jun 24 23:11:22 UTC 2026","passed","Wed Jun 24 23:11:22 UTC 2026","","Go Test","github.com/specterops/bloodhound/cmd/api/src/services/storage/TestNewDefaultFileServices_ReturnsError","TestNewDefaultFileServices_ReturnsError"
"","24","returns the OpenGraph environmentInfo when environmentAggregation param is not a known type","useAvailableEnvironments","Wed Jun 24 23:15:15 UTC 2026","passed","Wed Jun 24 23:15:15 UTC 2026","","useSelectedEnvironment","",""
"Test cases for TestResources_ListADComputerRDPUsers","0","TestResources_ListADComputerRDPUsers","","Wed Jun 24 23:11:13 UTC 2026","passed","Wed Jun 24 23:11:13 UTC 2026","","Go Test","github.com/specterops/bloodhound/cmd/api/src/api/v2/TestResources_ListADComputerRDPUsers","TestResources_ListADComputerRDPUsers"
"Test cases for TestNewAuditLog_Error","2","TestNewAuditLog_Error","","Wed Jun 24 23:11:16 UTC 2026","passed","Wed Jun 24 23:11:16 UTC 2026","","Go Test","github.com/specterops/bloodhound/cmd/api/src/database/TestNewAuditLog_Error","TestNewAuditLog_Error"
"Test cases for TestNewService","0","TestNewService","","Wed Jun 24 23:11:38 UTC 2026","passed","Wed Jun 24 23:11:38 UTC 2026","","Go Test","github.com/specterops/bloodhound/server/featureflags/internal/services/TestNewService","TestNewService"
"","0","returns Object ID message when ruleType is SeedTypeObjectId and seeds are required","getErrorMessage","Wed Jun 24 23:13:54 UTC 2026","passed","Wed Jun 24 23:13:54 UTC 2026","","","",""
"","2541","hides the password field and removes the requirement when logged in with SSO","Users","Wed Jun 24 23:14:09 UTC 2026","passed","Wed Jun 24 23:14:11 UTC 2026","","","",""
"","62","enables correctly returning the tag associated with Tier Zero (position value of 1) from the list of tags","the useAssetGroupTags utilities","Wed Jun 24 23:14:20 UTC 2026","passed","Wed Jun 24 23:14:20 UTC 2026","","","",""
"","17","selector members refetches on sort change","the useAssetGroupTags utilities","Wed Jun 24 23:14:20 UTC 2026","passed","Wed Jun 24 23:14:20 UTC 2026","","","",""
"","0","returns Cypher message when ruleType is SeedTypeCypher and seeds are required","getErrorMessage","Wed Jun 24 23:13:54 UTC 2026","passed","Wed Jun 24 23:13:54 UTC 2026","","","",""
"","24","should highlight selected route","Main Nav Route Highlighting","Wed Jun 24 23:14:54 UTC 2026","passed","Wed Jun 24 23:14:54 UTC 2026","","","",""
"","710","dispatches an action to add the associated node","Rule Object Select","Wed Jun 24 23:16:20 UTC 2026","passed","Wed Jun 24 23:16:20 UTC 2026","","","",""
"","4934","collapse all button collapses all sections","Pathfinding","Wed Jun 24 23:13:36 UTC 2026","passed","Wed Jun 24 23:13:41 UTC 2026","","","",""
"Test cases for TestParseLimitQueryParameter","0","TestParseLimitQueryParameter","","Wed Jun 24 23:11:13 UTC 2026","passed","Wed Jun 24 23:11:13 UTC 2026","","Go Test","github.com/specterops/bloodhound/cmd/api/src/api/v2/TestParseLimitQueryParameter","TestParseLimitQueryParameter"
"Test cases for TestResources_UpdateSavedQuery_OwnPublicQuery_Success","0","TestResources_UpdateSavedQuery_OwnPublicQuery_Success","","Wed Jun 24 23:11:13 UTC 2026","passed","Wed Jun 24 23:11:13 UTC 2026","","Go Test","github.com/specterops/bloodhound/cmd/api/src/api/v2/TestResources_UpdateSavedQuery_OwnPublicQuery_Success","TestResources_UpdateSavedQuery_OwnPublicQuery_Success"
"","1","does not add optional filters if not present","createHistoryParams","Wed Jun 24 23:16:55 UTC 2026","passed","Wed Jun 24 23:16:55 UTC 2026","","","",""
"Test cases for TestWritePaginated","1","TestWritePaginated","","Wed Jun 24 23:11:33 UTC 2026","passed","Wed Jun 24 23:11:33 UTC 2026","","Go Test","github.com/specterops/bloodhound/packages/go/responses/TestWritePaginated","TestWritePaginated"
"","1","handles empty search string","filterAndSearchEnvironments","Wed Jun 24 23:12:48 UTC 2026","passed","Wed Jun 24 23:12:48 UTC 2026","","search filter","",""
"Test cases for TestDomainSelectors_TestIsSortable","0","TestDomainSelectors_TestIsSortable","","Wed Jun 24 23:11:17 UTC 2026","passed","Wed Jun 24 23:11:17 UTC 2026","","Go Test","github.com/specterops/bloodhound/cmd/api/src/model/TestDomainSelectors_TestIsSortable","TestDomainSelectors_TestIsSortable"
"","95","should should reflect the checked state for public query","SavedQueryPermissions","Wed Jun 24 23:16:07 UTC 2026","passed","Wed Jun 24 23:16:07 UTC 2026","","","",""
"","1","calls transformToFlatGraphResponse when graphData matches GraphResponse interface","normalizeGraphDataForSigma","Wed Jun 24 23:18:59 UTC 2026","passed","Wed Jun 24 23:18:59 UTC 2026","","","",""
"Test cases for TestResources_UpdateSavedQuery_NoQueryMatch","0","TestResources_UpdateSavedQuery_NoQueryMatch","","Wed Jun 24 23:11:13 UTC 2026","passed","Wed Jun 24 23:11:13 UTC 2026","","Go Test","github.com/specterops/bloodhound/cmd/api/src/api/v2/TestResources_UpdateSavedQuery_NoQueryMatch","TestResources_UpdateSavedQuery_NoQueryMatch"
"","0","returns empty array when environments is undefined","filterAndSearchEnvironments","Wed Jun 24 23:12:48 UTC 2026","passed","Wed Jun 24 23:12:48 UTC 2026","","with empty environments","",""
"Test cases for TestResources_DeleteSavedQuery_DeleteError","0","TestResources_DeleteSavedQuery_DeleteError","","Wed Jun 24 23:11:13 UTC 2026","passed","Wed Jun 24 23:11:13 UTC 2026","","Go Test","github.com/specterops/bloodhound/cmd/api/src/api/v2/TestResources_DeleteSavedQuery_DeleteError","TestResources_DeleteSavedQuery_DeleteError"
"","0","returns paramValue as EnvironmentAggregation for unknown values (custom types)","useEnvironmentParams","Wed Jun 24 23:17:49 UTC 2026","passed","Wed Jun 24 23:17:49 UTC 2026","","parseEnvironmentAggregation","",""
"","320","filters extensions based on search input","ActiveExtensionsCard","Wed Jun 24 23:12:42 UTC 2026","passed","Wed Jun 24 23:12:42 UTC 2026","","","",""
"Test cases for TestManagementResource_ListRoles_InvalidColumn","0","TestManagementResource_ListRoles_InvalidColumn","","Wed Jun 24 23:11:18 UTC 2026","passed","Wed Jun 24 23:11:18 UTC 2026","","Go Test","github.com/specterops/bloodhound/cmd/api/src/api/v2/auth/TestManagementResource_ListRoles_InvalidColumn","TestManagementResource_ListRoles_InvalidColumn"
"","76","applies accent styling to headers when accent is true","<DetailsAccordion />","Wed Jun 24 23:14:21 UTC 2026","passed","Wed Jun 24 23:14:21 UTC 2026","","","",""
"","65","renders three animated dots","ProcessingIndicator","Wed Jun 24 23:17:53 UTC 2026","passed","Wed Jun 24 23:17:53 UTC 2026","","","",""
"Test cases for Test_FixtureTeardown","0","Test_FixtureTeardown","","Wed Jun 24 23:11:32 UTC 2026","passed","Wed Jun 24 23:11:32 UTC 2026","","Go Test","github.com/specterops/bloodhound/packages/go/lab/Test_FixtureTeardown","Test_FixtureTeardown"
"Test cases for TestResources_ListADUserSessions","3","TestResources_ListADUserSessions","","Wed Jun 24 23:11:13 UTC 2026","passed","Wed Jun 24 23:11:13 UTC 2026","","Go Test","github.com/specterops/bloodhound/cmd/api/src/api/v2/TestResources_ListADUserSessions","TestResources_ListADUserSessions"
"","0","An unknown error occurred when fetching the data","Getting the text for the disabled item display for a search when there are no results","Wed Jun 24 23:16:44 UTC 2026","passed","Wed Jun 24 23:16:44 UTC 2026","","Error states","",""
"Test cases for TestInt64FromPtr","0","TestInt64FromPtr","","Wed Jun 24 23:11:16 UTC 2026","passed","Wed Jun 24 23:11:16 UTC 2026","","Go Test","github.com/specterops/bloodhound/cmd/api/src/database/types/null/TestInt64FromPtr","TestInt64FromPtr"
"TestGooseMigrationFilenamesUseCurrentVersionPrefix is utilized to ensure that all migration files are named accordingto the set naming convention.","14","TestGooseMigrationFilenamesUseCurrentVersionPrefix","","Wed Jun 24 23:11:16 UTC 2026","passed","Wed Jun 24 23:11:16 UTC 2026","","Go Test","github.com/specterops/bloodhound/cmd/api/src/database/migration/TestGooseMigrationFilenamesUseCurrentVersionPrefix","TestGooseMigrationFilenamesUseCurrentVersionPrefix"
"Test cases for TestBOMEncoding","0","TestBOMEncoding","","Wed Jun 24 23:11:31 UTC 2026","passed","Wed Jun 24 23:11:31 UTC 2026","","Go Test","github.com/specterops/bloodhound/packages/go/bomenc/TestBOMEncoding","TestBOMEncoding"
"Test cases for TestSupportsETACMiddleware","0","TestSupportsETACMiddleware","","Wed Jun 24 23:11:05 UTC 2026","passed","Wed Jun 24 23:11:05 UTC 2026","","Go Test","github.com/specterops/bloodhound/cmd/api/src/api/middleware/TestSupportsETACMiddleware","TestSupportsETACMiddleware"
"","12","prefixes each edge_kind with a colon for relationshipTypes","graphSchema","Wed Jun 24 23:17:16 UTC 2026","passed","Wed Jun 24 23:17:16 UTC 2026","","","",""
"Test cases for TestInt64From","0","TestInt64From","","Wed Jun 24 23:11:16 UTC 2026","passed","Wed Jun 24 23:11:16 UTC 2026","","Go Test","github.com/specterops/bloodhound/cmd/api/src/database/types/null/TestInt64From","TestInt64From"
"","92","shows View in Explore if exploreUrl is supplied","Seed Selection Results","Wed Jun 24 23:14:16 UTC 2026","passed","Wed Jun 24 23:14:16 UTC 2026","","","",""
"Test cases for TestSetValue","0","TestSetValue","","Wed Jun 24 23:11:14 UTC 2026","passed","Wed Jun 24 23:11:14 UTC 2026","","Go Test","github.com/specterops/bloodhound/cmd/api/src/config/TestSetValue","TestSetValue"
"","263","toggles sort order when clicking sortable header","ObjectsAccordion","Wed Jun 24 23:15:46 UTC 2026","passed","Wed Jun 24 23:15:46 UTC 2026","","","",""
"Test cases for TestInt64Equal","0","TestInt64Equal","","Wed Jun 24 23:11:16 UTC 2026","passed","Wed Jun 24 23:11:16 UTC 2026","","Go Test","github.com/specterops/bloodhound/cmd/api/src/database/types/null/TestInt64Equal","TestInt64Equal"
"","132","renders the card with title and search input","ActiveExtensionsCard","Wed Jun 24 23:12:41 UTC 2026","passed","Wed Jun 24 23:12:41 UTC 2026","","","",""
"Test cases for TestResources_ListAuditLogs_InvalidPredicate","0","TestResources_ListAuditLogs_InvalidPredicate","","Wed Jun 24 23:11:13 UTC 2026","passed","Wed Jun 24 23:11:13 UTC 2026","","Go Test","github.com/specterops/bloodhound/cmd/api/src/api/v2/TestResources_ListAuditLogs_InvalidPredicate","TestResources_ListAuditLogs_InvalidPredicate"
"","0","reports an Object ID-specific error when creating a rule and ruleType is SeedTypeObjectId and seeds are required","handleError","Wed Jun 24 23:13:54 UTC 2026","passed","Wed Jun 24 23:13:54 UTC 2026","","","",""
"Test cases for TestRewriter_Enter_AllAttackPathsShortcut_ReplacesKinds","0","TestRewriter_Enter_AllAttackPathsShortcut_ReplacesKinds","","Wed Jun 24 23:11:18 UTC 2026","passed","Wed Jun 24 23:11:18 UTC 2026","","Go Test","github.com/specterops/bloodhound/cmd/api/src/queries/TestRewriter_Enter_AllAttackPathsShortcut_ReplacesKinds","TestRewriter_Enter_AllAttackPathsShortcut_ReplacesKinds"
"Test cases for TestWriteErrorResponse_V2","0","TestWriteErrorResponse_V2","","Wed Jun 24 23:11:02 UTC 2026","passed","Wed Jun 24 23:11:02 UTC 2026","","Go Test","github.com/specterops/bloodhound/cmd/api/src/api/TestWriteErrorResponse_V2","TestWriteErrorResponse_V2"
"Test cases for TestGC_Name","0","TestGC_Name","","Wed Jun 24 23:11:14 UTC 2026","passed","Wed Jun 24 23:11:14 UTC 2026","","Go Test","github.com/specterops/bloodhound/cmd/api/src/daemons/gc/TestGC_Name","TestGC_Name"
"Test cases for TestIsErrorResponse","0","TestIsErrorResponse","","Wed Jun 24 23:11:02 UTC 2026","passed","Wed Jun 24 23:11:02 UTC 2026","","Go Test","github.com/specterops/bloodhound/cmd/api/src/api/TestIsErrorResponse","TestIsErrorResponse"
"Test cases for TestResources_CreateSavedQuery","0","TestResources_CreateSavedQuery","","Wed Jun 24 23:11:13 UTC 2026","passed","Wed Jun 24 23:11:13 UTC 2026","","Go Test","github.com/specterops/bloodhound/cmd/api/src/api/v2/TestResources_CreateSavedQuery","TestResources_CreateSavedQuery"
"","2","writes initialValue to localStorage when the key is absent","useLocalStorage","Wed Jun 24 23:14:55 UTC 2026","passed","Wed Jun 24 23:14:55 UTC 2026","","initial value","",""
"Test cases for TestRegister_PanicsOnNilPool","0","TestRegister_PanicsOnNilPool","","Wed Jun 24 23:11:39 UTC 2026","passed","Wed Jun 24 23:11:39 UTC 2026","","Go Test","github.com/specterops/bloodhound/server/modules/TestRegister_PanicsOnNilPool","TestRegister_PanicsOnNilPool"
"","177","renders enabled Zone and Object tabs and disabled Rule tab","Selected Details Tabs","Wed Jun 24 23:15:02 UTC 2026","passed","Wed Jun 24 23:15:02 UTC 2026","","Selected Details Tabs - Params present","",""
"","77","should render a button with the passed in display text","GraphButton","Wed Jun 24 23:17:54 UTC 2026","passed","Wed Jun 24 23:17:54 UTC 2026","","","",""
"","373","toggles a source kind on with all nested graph data options","GraphDataCheckboxes","Wed Jun 24 23:13:44 UTC 2026","passed","Wed Jun 24 23:13:45 UTC 2026","","","",""
"","302","renders an error message without throwing a TypeError","EntityInfoCollapsibleSection","Wed Jun 24 23:17:18 UTC 2026","passed","Wed Jun 24 23:17:18 UTC 2026","","","",""
"","10","keeps callbacks stable across renders","useObjectState","Wed Jun 24 23:17:03 UTC 2026","passed","Wed Jun 24 23:17:03 UTC 2026","","","",""
"","264","shows a loading state","FileIngestTable","Wed Jun 24 23:13:25 UTC 2026","passed","Wed Jun 24 23:13:25 UTC 2026","","","",""
"","2","should recognize azure properties","validating a node property against the shared generated schema","Wed Jun 24 23:14:31 UTC 2026","passed","Wed Jun 24 23:14:31 UTC 2026","","","",""
"Test cases for TestMap","0","TestMap","","Wed Jun 24 23:11:32 UTC 2026","passed","Wed Jun 24 23:11:32 UTC 2026","","Go Test","github.com/specterops/bloodhound/packages/go/lab/internal/TestMap","TestMap"
"","196","enables the create user button when the user is admin role","Users","Wed Jun 24 23:13:58 UTC 2026","passed","Wed Jun 24 23:13:58 UTC 2026","","","",""
"Test cases for TestParseLimitQueryParameter_BadFormat","0","TestParseLimitQueryParameter_BadFormat","","Wed Jun 24 23:11:13 UTC 2026","passed","Wed Jun 24 23:11:13 UTC 2026","","Go Test","github.com/specterops/bloodhound/cmd/api/src/api/v2/TestParseLimitQueryParameter_BadFormat","TestParseLimitQueryParameter_BadFormat"
"Test cases for TestResources_ListADEntityLinkedGPOs","0","TestResources_ListADEntityLinkedGPOs","","Wed Jun 24 23:11:13 UTC 2026","passed","Wed Jun 24 23:11:13 UTC 2026","","Go Test","github.com/specterops/bloodhound/cmd/api/src/api/v2/TestResources_ListADEntityLinkedGPOs","TestResources_ListADEntityLinkedGPOs"
"","0","reports an Object ID-specific error when editing a rule and ruleType is SeedTypeObjectId and seeds are required","handleError","Wed Jun 24 23:13:54 UTC 2026","passed","Wed Jun 24 23:13:54 UTC 2026","","","",""
"TestCacheEntryDigester_DigestEndpoint_MatchByProperty tests the sorting and hashinglogic when MatchBy is set to MatchByProperty.","1","TestCacheEntryDigester_DigestEndpoint_MatchByProperty","","Wed Jun 24 23:11:21 UTC 2026","passed","Wed Jun 24 23:11:21 UTC 2026","","Go Test","github.com/specterops/bloodhound/cmd/api/src/services/graphify/endpoint/TestCacheEntryDigester_DigestEndpoint_MatchByProperty","TestCacheEntryDigester_DigestEndpoint_MatchByProperty"
"Test cases for TestSignRequestValuesUnsupportedHMACMethod","0","TestSignRequestValuesUnsupportedHMACMethod","","Wed Jun 24 23:11:02 UTC 2026","passed","Wed Jun 24 23:11:02 UTC 2026","","Go Test","github.com/specterops/bloodhound/cmd/api/src/api/TestSignRequestValuesUnsupportedHMACMethod","TestSignRequestValuesUnsupportedHMACMethod"
"Test cases for TestManagementResource_ListRoles_InvalidFilterPredicate","0","TestManagementResource_ListRoles_InvalidFilterPredicate","","Wed Jun 24 23:11:18 UTC 2026","passed","Wed Jun 24 23:11:18 UTC 2026","","Go Test","github.com/specterops/bloodhound/cmd/api/src/api/v2/auth/TestManagementResource_ListRoles_InvalidFilterPredicate","TestManagementResource_ListRoles_InvalidFilterPredicate"
"Test cases for TestFloatFromPtr","0","TestFloatFromPtr","","Wed Jun 24 23:11:16 UTC 2026","passed","Wed Jun 24 23:11:16 UTC 2026","","Go Test","github.com/specterops/bloodhound/cmd/api/src/database/types/null/TestFloatFromPtr","TestFloatFromPtr"
"Test cases for TestRoleAssignments_NodeHasRole","0","TestRoleAssignments_NodeHasRole","","Wed Jun 24 23:11:31 UTC 2026","passed","Wed Jun 24 23:11:31 UTC 2026","","Go Test","github.com/specterops/bloodhound/packages/go/analysis/azure/TestRoleAssignments_NodeHasRole","TestRoleAssignments_NodeHasRole"
"Helper to verify that encodeAnyValue handles standard types correctly","1","TestEncodeAnyValue","","Wed Jun 24 23:11:21 UTC 2026","passed","Wed Jun 24 23:11:21 UTC 2026","","Go Test","github.com/specterops/bloodhound/cmd/api/src/services/graphify/endpoint/TestEncodeAnyValue","TestEncodeAnyValue"
"Test cases for TestRoleMembers","0","TestRoleMembers","","Wed Jun 24 23:11:31 UTC 2026","passed","Wed Jun 24 23:11:31 UTC 2026","","Go Test","github.com/specterops/bloodhound/packages/go/analysis/azure/TestRoleMembers","TestRoleMembers"
"Test cases for TestResources_ListADEntityAdminRights","0","TestResources_ListADEntityAdminRights","","Wed Jun 24 23:11:13 UTC 2026","passed","Wed Jun 24 23:11:13 UTC 2026","","Go Test","github.com/specterops/bloodhound/cmd/api/src/api/v2/TestResources_ListADEntityAdminRights","TestResources_ListADEntityAdminRights"
"","226","renders the form for editing an existing label","Tag Form","Wed Jun 24 23:12:22 UTC 2026","passed","Wed Jun 24 23:12:23 UTC 2026","","","",""
"Test cases for TestIntFromPtr","0","TestIntFromPtr","","Wed Jun 24 23:11:16 UTC 2026","passed","Wed Jun 24 23:11:16 UTC 2026","","Go Test","github.com/specterops/bloodhound/cmd/api/src/database/types/null/TestIntFromPtr","TestIntFromPtr"
"","138","continue button is disabled when no SSO provider has been selected","LoginViaSSOForm","Wed Jun 24 23:16:10 UTC 2026","passed","Wed Jun 24 23:16:10 UTC 2026","","","",""
"Test cases for TestCache_Set","0","TestCache_Set","","Wed Jun 24 23:11:31 UTC 2026","passed","Wed Jun 24 23:11:31 UTC 2026","","Go Test","github.com/specterops/bloodhound/packages/go/cache/TestCache_Set","TestCache_Set"
"","1319","should disable save button while input is empty","SaveQueryDialog","Wed Jun 24 23:12:22 UTC 2026","passed","Wed Jun 24 23:12:23 UTC 2026","","","",""
"","168","should call onCancel when return to login button clicked","PasswordResetForm","Wed Jun 24 23:15:20 UTC 2026","passed","Wed Jun 24 23:15:20 UTC 2026","","","",""
"","1","prevents MouseCoords events","preventAllDefaults","Wed Jun 24 23:19:04 UTC 2026","passed","Wed Jun 24 23:19:04 UTC 2026","","","",""
"","441","calls openSAMLProviderDialog when SAML Provider menu item is clicked","CreateMenu","Wed Jun 24 23:14:39 UTC 2026","passed","Wed Jun 24 23:14:39 UTC 2026","","oidc_support feature flag enabled","",""
"Test cases for TestNormalizeEinNodeProperties","1","TestNormalizeEinNodeProperties","","Wed Jun 24 23:11:21 UTC 2026","passed","Wed Jun 24 23:11:21 UTC 2026","","Go Test","github.com/specterops/bloodhound/cmd/api/src/services/graphify/TestNormalizeEinNodeProperties","TestNormalizeEinNodeProperties"
"","3","stores a number value in localStorage","useLocalStorage","Wed Jun 24 23:14:55 UTC 2026","passed","Wed Jun 24 23:14:55 UTC 2026","","setValue","",""
"Test cases for TestEnsureServerDirectoriesCreatesRequiredDirectories","2","TestEnsureServerDirectoriesCreatesRequiredDirectories","","Wed Jun 24 23:11:13 UTC 2026","passed","Wed Jun 24 23:11:13 UTC 2026","","Go Test","github.com/specterops/bloodhound/cmd/api/src/bootstrap/TestEnsureServerDirectoriesCreatesRequiredDirectories","TestEnsureServerDirectoriesCreatesRequiredDirectories"
"","0","Will treat what is to the left of the first colon as a search filter if it matches an existing kind","parseKeywordAndTypeValue","Wed Jun 24 23:17:38 UTC 2026","passed","Wed Jun 24 23:17:38 UTC 2026","","","",""
"","559","navigates to object details when clicking an object row","ObjectsAccordion","Wed Jun 24 23:15:46 UTC 2026","passed","Wed Jun 24 23:15:46 UTC 2026","","","",""
"Test cases for Test_filterAndFormatSearchResults","0","Test_filterAndFormatSearchResults","","Wed Jun 24 23:11:13 UTC 2026","passed","Wed Jun 24 23:11:13 UTC 2026","","Go Test","github.com/specterops/bloodhound/cmd/api/src/api/v2/Test_filterAndFormatSearchResults","Test_filterAndFormatSearchResults"
"Test cases for TestGraphQuery_PrepareCypherQuery","57","TestGraphQuery_PrepareCypherQuery","","Wed Jun 24 23:11:18 UTC 2026","passed","Wed Jun 24 23:11:18 UTC 2026","","Go Test","github.com/specterops/bloodhound/cmd/api/src/queries/TestGraphQuery_PrepareCypherQuery","TestGraphQuery_PrepareCypherQuery"
"Test cases for Test_runMaybeCachedEntityQuery","0","Test_runMaybeCachedEntityQuery","","Wed Jun 24 23:11:18 UTC 2026","passed","Wed Jun 24 23:11:18 UTC 2026","","Go Test","github.com/specterops/bloodhound/cmd/api/src/queries/Test_runMaybeCachedEntityQuery","Test_runMaybeCachedEntityQuery"
"","312","displays an autofocused text input","SearchCurrentNodes","Wed Jun 24 23:15:49 UTC 2026","passed","Wed Jun 24 23:15:49 UTC 2026","","","",""
"","569","should accept passwords with unicode punctuation characters","CreateUserForm","Wed Jun 24 23:13:02 UTC 2026","passed","Wed Jun 24 23:13:02 UTC 2026","","","",""
"Test cases for TestDisenrollMFA_Admin_SuccessNoPasswordSSO","644","TestDisenrollMFA_Admin_SuccessNoPasswordSSO","","Wed Jun 24 23:11:46 UTC 2026","passed","Wed Jun 24 23:11:46 UTC 2026","","Go Test","github.com/specterops/bloodhound/cmd/api/src/api/v2/auth/TestDisenrollMFA_Admin_SuccessNoPasswordSSO","TestDisenrollMFA_Admin_SuccessNoPasswordSSO"
"","3980","checking a single edge type updates its parent and grandparent","Pathfinding","Wed Jun 24 23:13:32 UTC 2026","passed","Wed Jun 24 23:13:36 UTC 2026","","","",""
