"DESCRIPTION","DURATION IN MS","NAME","PARENT SUITE","START TIME","STATUS","STOP TIME","SUB SUITE","SUITE","TEST CLASS","TEST METHOD"
"Test cases for TestResources_UpdateSavedQuery_NoQueryMatch","0","TestResources_UpdateSavedQuery_NoQueryMatch","","Wed Apr 22 18:49:22 UTC 2026","passed","Wed Apr 22 18:49:22 UTC 2026","","Go Test","github.com/specterops/bloodhound/cmd/api/src/api/v2/TestResources_UpdateSavedQuery_NoQueryMatch","TestResources_UpdateSavedQuery_NoQueryMatch"
"Test cases for TestResources_ListADDomainContainedUsers","0","TestResources_ListADDomainContainedUsers","","Wed Apr 22 18:49:22 UTC 2026","passed","Wed Apr 22 18:49:22 UTC 2026","","Go Test","github.com/specterops/bloodhound/cmd/api/src/api/v2/TestResources_ListADDomainContainedUsers","TestResources_ListADDomainContainedUsers"
"Test cases for TestManagementResource_ListRoles_DBError","1","TestManagementResource_ListRoles_DBError","","Wed Apr 22 18:49:28 UTC 2026","passed","Wed Apr 22 18:49:28 UTC 2026","","Go Test","github.com/specterops/bloodhound/cmd/api/src/api/v2/auth/TestManagementResource_ListRoles_DBError","TestManagementResource_ListRoles_DBError"
"","10","should recognize a common properties","validating a node property against the shared generated schema","Wed Apr 22 18:52:02 UTC 2026","passed","Wed Apr 22 18:52:02 UTC 2026","","","",""
"Test cases for Test_ParseGraphSortParameters_InvalidSortColumn","0","Test_ParseGraphSortParameters_InvalidSortColumn","","Wed Apr 22 18:49:13 UTC 2026","passed","Wed Apr 22 18:49:13 UTC 2026","","Go Test","github.com/specterops/bloodhound/cmd/api/src/api/Test_ParseGraphSortParameters_InvalidSortColumn","Test_ParseGraphSortParameters_InvalidSortColumn"
"","1727","should display search results when the user enters text","AssetGroupEdit","Wed Apr 22 18:53:31 UTC 2026","passed","Wed Apr 22 18:53:33 UTC 2026","","","",""
"Test cases for TestAddOrderByToNeo4jQuery_NoOrderByClause","0","TestAddOrderByToNeo4jQuery_NoOrderByClause","","Wed Apr 22 18:49:22 UTC 2026","passed","Wed Apr 22 18:49:22 UTC 2026","","Go Test","github.com/specterops/bloodhound/cmd/api/src/api/v2/TestAddOrderByToNeo4jQuery_NoOrderByClause","TestAddOrderByToNeo4jQuery_NoOrderByClause"
"","504","should not allow the input to exceed the allowed length","CreateUserForm","Wed Apr 22 18:51:25 UTC 2026","passed","Wed Apr 22 18:51:25 UTC 2026","","","",""
"","375","should render","LoginViaSSOForm","Wed Apr 22 18:53:43 UTC 2026","passed","Wed Apr 22 18:53:43 UTC 2026","","","",""
"Test cases for TestRoleAssignments_NodesWithRole","0","TestRoleAssignments_NodesWithRole","","Wed Apr 22 18:49:44 UTC 2026","passed","Wed Apr 22 18:49:44 UTC 2026","","Go Test","github.com/specterops/bloodhound/packages/go/analysis/azure/TestRoleAssignments_NodesWithRole","TestRoleAssignments_NodesWithRole"
"","1375","filling in the name value allows updating the rule and navigates back to the details page","Rule Form","Wed Apr 22 18:50:38 UTC 2026","passed","Wed Apr 22 18:50:39 UTC 2026","","","",""
"","208","removes a node from an asset group tag","AssetGroupMenuItem","Wed Apr 22 18:52:03 UTC 2026","passed","Wed Apr 22 18:52:03 UTC 2026","","","",""
"","893","should hide Environmental Targeted Access Control panel when showEnvironmentAccessControls prop is true and power user role is selected","UpdateUserForm","Wed Apr 22 18:50:27 UTC 2026","passed","Wed Apr 22 18:50:27 UTC 2026","","","",""
"Test cases for TestResources_ListUsersMinimal","3","TestResources_ListUsersMinimal","","Wed Apr 22 18:50:05 UTC 2026","passed","Wed Apr 22 18:50:05 UTC 2026","","Go Test","github.com/specterops/bloodhound/cmd/api/src/api/v2/auth/TestResources_ListUsersMinimal","TestResources_ListUsersMinimal"
"Test cases for TestResources_ListADGPOAffectedComputers","0","TestResources_ListADGPOAffectedComputers","","Wed Apr 22 18:49:22 UTC 2026","passed","Wed Apr 22 18:49:22 UTC 2026","","Go Test","github.com/specterops/bloodhound/cmd/api/src/api/v2/TestResources_ListADGPOAffectedComputers","TestResources_ListADGPOAffectedComputers"
"","566","does not display must be new password error messages when current password is not required","PasswordDialog","Wed Apr 22 18:50:52 UTC 2026","passed","Wed Apr 22 18:50:53 UTC 2026","","","",""
"","1639","handles posting a mutation","DatabaseManagement","Wed Apr 22 18:55:54 UTC 2026","passed","Wed Apr 22 18:55:55 UTC 2026","","","",""
"","15","returns azure environmentInfo when environmentAggregation param is azure","useAvailableEnvironments","Wed Apr 22 18:52:48 UTC 2026","passed","Wed Apr 22 18:52:48 UTC 2026","","useSelectedEnvironment","",""
"","4840","does not close explore search tab menu or entity info panel when search returns one node","CypherSearch","Wed Apr 22 18:51:14 UTC 2026","passed","Wed Apr 22 18:51:18 UTC 2026","","Minimize explorer page elements when multiple nodes are returned","",""
"Test cases for TestManagementResource_ListPermissions_InvalidFilterPredicate","0","TestManagementResource_ListPermissions_InvalidFilterPredicate","","Wed Apr 22 18:49:28 UTC 2026","passed","Wed Apr 22 18:49:28 UTC 2026","","Go Test","github.com/specterops/bloodhound/cmd/api/src/api/v2/auth/TestManagementResource_ListPermissions_InvalidFilterPredicate","TestManagementResource_ListPermissions_InvalidFilterPredicate"
"Test cases for TestTracker_ConcurrentHasEdge","0","TestTracker_ConcurrentHasEdge","","Wed Apr 22 18:49:44 UTC 2026","passed","Wed Apr 22 18:49:44 UTC 2026","","Go Test","github.com/specterops/bloodhound/packages/go/analysis/post/TestTracker_ConcurrentHasEdge","TestTracker_ConcurrentHasEdge"
"Test cases for TestTextUnmarshalInt64","0","TestTextUnmarshalInt64","","Wed Apr 22 18:49:25 UTC 2026","passed","Wed Apr 22 18:49:25 UTC 2026","","Go Test","github.com/specterops/bloodhound/cmd/api/src/database/types/null/TestTextUnmarshalInt64","TestTextUnmarshalInt64"
"","9","should not render a Field when the provided value is """"","Field","Wed Apr 22 18:54:48 UTC 2026","passed","Wed Apr 22 18:54:48 UTC 2026","","","",""
"Test cases for TestParseSkipQueryParameter_BadFormat","0","TestParseSkipQueryParameter_BadFormat","","Wed Apr 22 18:49:22 UTC 2026","passed","Wed Apr 22 18:49:22 UTC 2026","","Go Test","github.com/specterops/bloodhound/cmd/api/src/api/v2/TestParseSkipQueryParameter_BadFormat","TestParseSkipQueryParameter_BadFormat"
"","1","determines glyphs with the tier_managent_engine feature flag enabled","getNodeGlyphs","Wed Apr 22 18:56:06 UTC 2026","passed","Wed Apr 22 18:56:06 UTC 2026","","","",""
"Test cases for TestFlatMap","1","TestFlatMap","","Wed Apr 22 18:49:57 UTC 2026","passed","Wed Apr 22 18:49:57 UTC 2026","","Go Test","github.com/specterops/bloodhound/packages/go/slicesext/TestFlatMap","TestFlatMap"
"Test cases for TestResources_GetEdgeComposition","58","TestResources_GetEdgeComposition","","Wed Apr 22 18:49:22 UTC 2026","passed","Wed Apr 22 18:49:22 UTC 2026","","Go Test","github.com/specterops/bloodhound/cmd/api/src/api/v2/TestResources_GetEdgeComposition","TestResources_GetEdgeComposition"
"","109","shows the direct object and expanded object list when results are present for both","Seed Selection Results","Wed Apr 22 18:51:49 UTC 2026","passed","Wed Apr 22 18:51:49 UTC 2026","","","",""
"","664","should display Environmental Targeted Access Control panel when showEnvironmentAccessControls prop is true and user role is selected","UpdateUserForm","Wed Apr 22 18:50:26 UTC 2026","passed","Wed Apr 22 18:50:27 UTC 2026","","","",""
"Test cases for Test_parseLatestVersion","0","Test_parseLatestVersion","","Wed Apr 22 18:50:00 UTC 2026","passed","Wed Apr 22 18:50:00 UTC 2026","","Go Test","github.com/specterops/bloodhound/packages/go/stbernard/git/Test_parseLatestVersion","Test_parseLatestVersion"
"","91","hides loading state when data is available","GraphDataCheckboxes","Wed Apr 22 18:51:13 UTC 2026","passed","Wed Apr 22 18:51:13 UTC 2026","","","",""
"","14","the ID value reflects the URL when it is available","usePZQueryParams","Wed Apr 22 18:53:27 UTC 2026","passed","Wed Apr 22 18:53:27 UTC 2026","","","",""
"Test cases for TestIntIsZero","0","TestIntIsZero","","Wed Apr 22 18:49:25 UTC 2026","passed","Wed Apr 22 18:49:25 UTC 2026","","Go Test","github.com/specterops/bloodhound/cmd/api/src/database/types/null/TestIntIsZero","TestIntIsZero"
"Test cases for TestRRuleValidator","0","TestRRuleValidator","","Wed Apr 22 18:49:44 UTC 2026","passed","Wed Apr 22 18:49:44 UTC 2026","","Go Test","github.com/specterops/bloodhound/cmd/api/src/utils/validation/TestRRuleValidator","TestRRuleValidator"
"Test cases for TestHasSequence","0","TestHasSequence","","Wed Apr 22 18:49:45 UTC 2026","passed","Wed Apr 22 18:49:45 UTC 2026","","Go Test","github.com/specterops/bloodhound/packages/go/bomenc/TestHasSequence","TestHasSequence"
"","550","changes the text from ""Disabled"" to ""Enabled"" when the Rule Status switch is toggled","Rule Form","Wed Apr 22 18:50:35 UTC 2026","passed","Wed Apr 22 18:50:36 UTC 2026","","","",""
"Test cases for TestResources_OpenGraphSchemaIngest","1","TestResources_OpenGraphSchemaIngest","","Wed Apr 22 18:49:22 UTC 2026","passed","Wed Apr 22 18:49:22 UTC 2026","","Go Test","github.com/specterops/bloodhound/cmd/api/src/api/v2/TestResources_OpenGraphSchemaIngest","TestResources_OpenGraphSchemaIngest"
"Test cases for TestNewAuditLog_BadAuthContext","0","TestNewAuditLog_BadAuthContext","","Wed Apr 22 18:49:24 UTC 2026","passed","Wed Apr 22 18:49:24 UTC 2026","","Go Test","github.com/specterops/bloodhound/cmd/api/src/database/TestNewAuditLog_BadAuthContext","TestNewAuditLog_BadAuthContext"
"Test cases for TestManagementResource_ListRoles_SortingError","0","TestManagementResource_ListRoles_SortingError","","Wed Apr 22 18:49:28 UTC 2026","passed","Wed Apr 22 18:49:28 UTC 2026","","Go Test","github.com/specterops/bloodhound/cmd/api/src/api/v2/auth/TestManagementResource_ListRoles_SortingError","TestManagementResource_ListRoles_SortingError"
"","214","renders an interactive version when preview is set to false","PrivilegeZonesCypherEditor Search component for Zone Management","Wed Apr 22 18:54:18 UTC 2026","passed","Wed Apr 22 18:54:18 UTC 2026","","","",""
"","320","has user filters","FileIngestFilterDialog","Wed Apr 22 18:51:43 UTC 2026","passed","Wed Apr 22 18:51:43 UTC 2026","","User Select","",""
"","136","renders error message on error","ObjectCountPanel","Wed Apr 22 18:54:45 UTC 2026","passed","Wed Apr 22 18:54:45 UTC 2026","","","",""
"","286","The reset password and two-factor authentication options should not appear in profile page if the user is configured for SAML login","UserProfile with SSO User","Wed Apr 22 18:52:19 UTC 2026","passed","Wed Apr 22 18:52:19 UTC 2026","","","",""
"","13","renders Owned text by default when no Label Selector is available and on a Label page","TagSelector","Wed Apr 22 18:53:31 UTC 2026","passed","Wed Apr 22 18:53:31 UTC 2026","","","",""
"Test cases for TestURLJoinPathEscapesSlashes","0","TestURLJoinPathEscapesSlashes","","Wed Apr 22 18:49:13 UTC 2026","passed","Wed Apr 22 18:49:13 UTC 2026","","Go Test","github.com/specterops/bloodhound/cmd/api/src/api/TestURLJoinPathEscapesSlashes","TestURLJoinPathEscapesSlashes"
"","787","should not have less characters than the minimum requirement","CreateUserForm","Wed Apr 22 18:51:24 UTC 2026","passed","Wed Apr 22 18:51:25 UTC 2026","","","",""
"","186","calls exportToJson util when valid non a empty object is passed as the jsonData prop","GraphControls","Wed Apr 22 18:51:31 UTC 2026","passed","Wed Apr 22 18:51:31 UTC 2026","","Exporting json","",""
"Test cases for TestIngestionCoordinator_FlushBuffer","1","TestIngestionCoordinator_FlushBuffer","","Wed Apr 22 18:49:24 UTC 2026","passed","Wed Apr 22 18:49:24 UTC 2026","","Go Test","github.com/specterops/bloodhound/cmd/api/src/daemons/changelog/TestIngestionCoordinator_FlushBuffer","TestIngestionCoordinator_FlushBuffer"
"Test cases for TestSetValue","1","TestSetValue","","Wed Apr 22 18:49:23 UTC 2026","passed","Wed Apr 22 18:49:23 UTC 2026","","Go Test","github.com/specterops/bloodhound/cmd/api/src/config/TestSetValue","TestSetValue"
"Test cases for TestSavedQueries_IsSortable","0","TestSavedQueries_IsSortable","","Wed Apr 22 18:49:25 UTC 2026","passed","Wed Apr 22 18:49:25 UTC 2026","","Go Test","github.com/specterops/bloodhound/cmd/api/src/model/TestSavedQueries_IsSortable","TestSavedQueries_IsSortable"
"Test cases for TestIsDeadlockError","1","TestIsDeadlockError","","Wed Apr 22 18:49:24 UTC 2026","passed","Wed Apr 22 18:49:24 UTC 2026","","Go Test","github.com/specterops/bloodhound/cmd/api/src/daemons/changelog/TestIsDeadlockError","TestIsDeadlockError"
"Test cases for TestResources_UpdateSavedQuery_QueryBelongsToAnotherUser","0","TestResources_UpdateSavedQuery_QueryBelongsToAnotherUser","","Wed Apr 22 18:49:22 UTC 2026","passed","Wed Apr 22 18:49:22 UTC 2026","","Go Test","github.com/specterops/bloodhound/cmd/api/src/api/v2/TestResources_UpdateSavedQuery_QueryBelongsToAnotherUser","TestResources_UpdateSavedQuery_QueryBelongsToAnotherUser"
"Test cases for TestNodeNamePrefix_AppendSuffix","0","TestNodeNamePrefix_AppendSuffix","","Wed Apr 22 18:49:44 UTC 2026","passed","Wed Apr 22 18:49:44 UTC 2026","","Go Test","github.com/specterops/bloodhound/packages/go/analysis/ad/wellknown/TestNodeNamePrefix_AppendSuffix","TestNodeNamePrefix_AppendSuffix"
"Test cases for TestResources_ListADEntityPSRemoteRights","3","TestResources_ListADEntityPSRemoteRights","","Wed Apr 22 18:49:22 UTC 2026","passed","Wed Apr 22 18:49:22 UTC 2026","","Go Test","github.com/specterops/bloodhound/cmd/api/src/api/v2/TestResources_ListADEntityPSRemoteRights","TestResources_ListADEntityPSRemoteRights"
"Test cases for TestIsValidContentTypeForUpload","0","TestIsValidContentTypeForUpload","","Wed Apr 22 18:49:22 UTC 2026","passed","Wed Apr 22 18:49:22 UTC 2026","","Go Test","github.com/specterops/bloodhound/cmd/api/src/api/v2/TestIsValidContentTypeForUpload","TestIsValidContentTypeForUpload"
"Test cases for TestResources_DeleteSavedQuery_PublicQueryAndUserIsAdmin","0","TestResources_DeleteSavedQuery_PublicQueryAndUserIsAdmin","","Wed Apr 22 18:49:22 UTC 2026","passed","Wed Apr 22 18:49:22 UTC 2026","","Go Test","github.com/specterops/bloodhound/cmd/api/src/api/v2/TestResources_DeleteSavedQuery_PublicQueryAndUserIsAdmin","TestResources_DeleteSavedQuery_PublicQueryAndUserIsAdmin"
"Test cases for TestEncodingValues","0","TestEncodingValues","","Wed Apr 22 18:49:45 UTC 2026","passed","Wed Apr 22 18:49:45 UTC 2026","","Go Test","github.com/specterops/bloodhound/packages/go/bomenc/TestEncodingValues","TestEncodingValues"
"","11","dismisses a notification","AppNotifications","Wed Apr 22 18:54:01 UTC 2026","passed","Wed Apr 22 18:54:01 UTC 2026","","","",""
"","814","displays validation error messages when password does not match confirmation","PasswordDialog","Wed Apr 22 18:50:50 UTC 2026","passed","Wed Apr 22 18:50:51 UTC 2026","","","",""
"","70","disables the upload file button when the user does not have the opengraph write permission","SchemaUploadDialog","Wed Apr 22 18:51:32 UTC 2026","passed","Wed Apr 22 18:51:32 UTC 2026","","","",""
"","0","should exclude tags and operations that do not match the term","opsFilter","Wed Apr 22 18:54:19 UTC 2026","passed","Wed Apr 22 18:54:19 UTC 2026","","","",""
"","875","handles adding to tier zero asset group","AssetGroupMenuItem","Wed Apr 22 18:55:49 UTC 2026","passed","Wed Apr 22 18:55:50 UTC 2026","","adding to an asset group","",""
"","102","disables the JSON button if the JSON is empty","GraphControls","Wed Apr 22 18:51:31 UTC 2026","passed","Wed Apr 22 18:51:31 UTC 2026","","Exporting json","",""
"","359","should display correctly","DeleteConfirmationDialog","Wed Apr 22 18:54:49 UTC 2026","passed","Wed Apr 22 18:54:49 UTC 2026","","","",""
"Test cases for TestSavedQueries_GetValidFilterPredicatesAsStrings","0","TestSavedQueries_GetValidFilterPredicatesAsStrings","","Wed Apr 22 18:49:25 UTC 2026","passed","Wed Apr 22 18:49:25 UTC 2026","","Go Test","github.com/specterops/bloodhound/cmd/api/src/model/TestSavedQueries_GetValidFilterPredicatesAsStrings","TestSavedQueries_GetValidFilterPredicatesAsStrings"
"Test cases for TestResolver_StartDone","8","TestResolver_StartDone","","Wed Apr 22 18:49:28 UTC 2026","passed","Wed Apr 22 18:49:28 UTC 2026","","Go Test","github.com/specterops/bloodhound/cmd/api/src/services/graphify/endpoint/TestResolver_StartDone","TestResolver_StartDone"
"","1","runs a cypher search when the query param is set to ""cypher""","useExploreGraph","Wed Apr 22 18:51:20 UTC 2026","passed","Wed Apr 22 18:51:20 UTC 2026","","exploreGraphQueryFactory","",""
"Test cases for TestResources_DeleteAssetGroup","0","TestResources_DeleteAssetGroup","","Wed Apr 22 18:49:22 UTC 2026","passed","Wed Apr 22 18:49:22 UTC 2026","","Go Test","github.com/specterops/bloodhound/cmd/api/src/api/v2/TestResources_DeleteAssetGroup","TestResources_DeleteAssetGroup"
"","269","calls onResetColumnSize when ""Reset Size"" is clicked","ManageColumnsComboBox","Wed Apr 22 18:51:55 UTC 2026","passed","Wed Apr 22 18:51:55 UTC 2026","","","",""
"","3","returns all environments when no filters are active","filterAndSearchEnvironments","Wed Apr 22 18:50:30 UTC 2026","passed","Wed Apr 22 18:50:30 UTC 2026","","with no filters applied","",""
"Test cases for TestValidateRequestSignature","310","TestValidateRequestSignature","","Wed Apr 22 18:49:12 UTC 2026","passed","Wed Apr 22 18:49:13 UTC 2026","","Go Test","github.com/specterops/bloodhound/cmd/api/src/api/TestValidateRequestSignature","TestValidateRequestSignature"
"Test cases for TestPasswordValidator","0","TestPasswordValidator","","Wed Apr 22 18:49:44 UTC 2026","passed","Wed Apr 22 18:49:44 UTC 2026","","Go Test","github.com/specterops/bloodhound/cmd/api/src/utils/validation/TestPasswordValidator","TestPasswordValidator"
"","202","clears value if input is empty","ManagedDatePicker - input","Wed Apr 22 18:53:04 UTC 2026","passed","Wed Apr 22 18:53:04 UTC 2026","","","",""
"Test cases for TestBuildErrorResponseConflict","0","TestBuildErrorResponseConflict","","Wed Apr 22 18:49:13 UTC 2026","passed","Wed Apr 22 18:49:13 UTC 2026","","Go Test","github.com/specterops/bloodhound/cmd/api/src/api/TestBuildErrorResponseConflict","TestBuildErrorResponseConflict"
"","206","renders","EarlyAccessFeatureToggle","Wed Apr 22 18:56:24 UTC 2026","passed","Wed Apr 22 18:56:24 UTC 2026","","","",""
"","264","Hides selector information if additionalSections is false","EntityInfoDataTableList","Wed Apr 22 18:53:18 UTC 2026","passed","Wed Apr 22 18:53:19 UTC 2026","","","",""
"","7","removes the key when undefined is passed to the setter","useLocalStorage","Wed Apr 22 18:52:27 UTC 2026","passed","Wed Apr 22 18:52:27 UTC 2026","","setValue","",""
"Test cases for TestResources_ListAssetGroups","5","TestResources_ListAssetGroups","","Wed Apr 22 18:49:22 UTC 2026","passed","Wed Apr 22 18:49:22 UTC 2026","","Go Test","github.com/specterops/bloodhound/cmd/api/src/api/v2/TestResources_ListAssetGroups","TestResources_ListAssetGroups"
"","3","The data is loading","Getting the text for the disabled item display for a search when there are no results","Wed Apr 22 18:53:39 UTC 2026","passed","Wed Apr 22 18:53:39 UTC 2026","","Loading states","",""
"Test cases for TestResources_UpdateSavedQuery_ErrorFetchingPublicStatus","0","TestResources_UpdateSavedQuery_ErrorFetchingPublicStatus","","Wed Apr 22 18:49:22 UTC 2026","passed","Wed Apr 22 18:49:22 UTC 2026","","Go Test","github.com/specterops/bloodhound/cmd/api/src/api/v2/TestResources_UpdateSavedQuery_ErrorFetchingPublicStatus","TestResources_UpdateSavedQuery_ErrorFetchingPublicStatus"
"","465","renders correctly with requiresCurrentPassword false","PasswordDialog","Wed Apr 22 18:50:48 UTC 2026","passed","Wed Apr 22 18:50:48 UTC 2026","","","",""
"","5","should render when search string is not found in the text","HighlightedText","Wed Apr 22 18:54:36 UTC 2026","passed","Wed Apr 22 18:54:36 UTC 2026","","","",""
"","0","returns Cypher message when ruleType is SeedTypeCypher and seeds are required","getErrorMessage","Wed Apr 22 18:51:35 UTC 2026","passed","Wed Apr 22 18:51:35 UTC 2026","","","",""
"","0","fails for password without digits","testPassword","Wed Apr 22 18:55:21 UTC 2026","passed","Wed Apr 22 18:55:21 UTC 2026","","","",""
"","504","renders trigger button and dropdown items","TagToZoneLabel","Wed Apr 22 18:50:26 UTC 2026","passed","Wed Apr 22 18:50:27 UTC 2026","","","",""
"","500","filters by the selected date range","FileIngestFilterDialog","Wed Apr 22 18:51:42 UTC 2026","passed","Wed Apr 22 18:51:42 UTC 2026","","Date Range Inputs","",""
"","101","Disable Analyze Now and change to Analyzing if datapipe status is different from ""idle""","AnalyzeNowConfiguration","Wed Apr 22 18:52:26 UTC 2026","passed","Wed Apr 22 18:52:26 UTC 2026","","","",""
"","49","Gets focus on keyboard shortcut","SearchBar","Wed Apr 22 18:55:09 UTC 2026","passed","Wed Apr 22 18:55:09 UTC 2026","","","",""
"Test cases for TestBHCEStaticHandler","88","TestBHCEStaticHandler","","Wed Apr 22 18:49:16 UTC 2026","passed","Wed Apr 22 18:49:16 UTC 2026","","Go Test","github.com/specterops/bloodhound/cmd/api/src/api/static/TestBHCEStaticHandler","TestBHCEStaticHandler"
"","0","returns undefined if graphData is undefined or not a GraphResponse","getExploreTableData","Wed Apr 22 18:53:12 UTC 2026","passed","Wed Apr 22 18:53:12 UTC 2026","","","",""
"","62","should display a message","CypherSearchMessage","Wed Apr 22 18:55:29 UTC 2026","passed","Wed Apr 22 18:55:29 UTC 2026","","","",""
"","14","when there is no ID in the URL and no tags available, no ID is returned (it is undefined)","usePZQueryParams","Wed Apr 22 18:53:27 UTC 2026","passed","Wed Apr 22 18:53:27 UTC 2026","","","",""
"","254","clicking an enabled header toggles content (single mode)","<DetailsAccordion />","Wed Apr 22 18:51:54 UTC 2026","passed","Wed Apr 22 18:51:54 UTC 2026","","","",""
"Test cases for TestJSONFloat_MarshalJSON_NaN","0","TestJSONFloat_MarshalJSON_NaN","","Wed Apr 22 18:49:25 UTC 2026","passed","Wed Apr 22 18:49:25 UTC 2026","","Go Test","github.com/specterops/bloodhound/cmd/api/src/database/types/nan/TestJSONFloat_MarshalJSON_NaN","TestJSONFloat_MarshalJSON_NaN"
"","17","allows you to update the list of selected filters, only updating the url after calling the apply function","usePathfindingFilters","Wed Apr 22 18:54:45 UTC 2026","passed","Wed Apr 22 18:54:45 UTC 2026","","","",""
"","11","safely handles removing nonexistent key","useObjectState","Wed Apr 22 18:54:37 UTC 2026","passed","Wed Apr 22 18:54:37 UTC 2026","","","",""
"Test cases for TestNormalizeToUTF8_ReaderError","0","TestNormalizeToUTF8_ReaderError","","Wed Apr 22 18:49:45 UTC 2026","passed","Wed Apr 22 18:49:45 UTC 2026","","Go Test","github.com/specterops/bloodhound/packages/go/bomenc/TestNormalizeToUTF8_ReaderError","TestNormalizeToUTF8_ReaderError"
"Test cases for TestLoginSuccess","0","TestLoginSuccess","","Wed Apr 22 18:49:22 UTC 2026","passed","Wed Apr 22 18:49:22 UTC 2026","","Go Test","github.com/specterops/bloodhound/cmd/api/src/api/v2/auth/TestLoginSuccess","TestLoginSuccess"
"Test cases for TestGetVersion","0","TestGetVersion","","Wed Apr 22 18:49:22 UTC 2026","passed","Wed Apr 22 18:49:22 UTC 2026","","Go Test","github.com/specterops/bloodhound/cmd/api/src/api/v2/TestGetVersion","TestGetVersion"
"","73","indicates that filters are inactive","AssetGroupEdit","Wed Apr 22 18:52:07 UTC 2026","passed","Wed Apr 22 18:52:07 UTC 2026","","","",""
"","8","displays lastlogontimestamp cell as NEVER when the value is -1","ExploreTableDataCell","Wed Apr 22 18:54:39 UTC 2026","passed","Wed Apr 22 18:54:39 UTC 2026","","","",""
"","9","renders without label when label is empty string","StatusIndicator","Wed Apr 22 18:55:12 UTC 2026","passed","Wed Apr 22 18:55:12 UTC 2026","","","",""
"Test cases for TestSignRequestValuesUnsupportedHMACMethod","0","TestSignRequestValuesUnsupportedHMACMethod","","Wed Apr 22 18:49:12 UTC 2026","passed","Wed Apr 22 18:49:12 UTC 2026","","Go Test","github.com/specterops/bloodhound/cmd/api/src/api/TestSignRequestValuesUnsupportedHMACMethod","TestSignRequestValuesUnsupportedHMACMethod"
"","174","fires editQuery in context provider","ListItemActionMenu","Wed Apr 22 18:53:48 UTC 2026","passed","Wed Apr 22 18:53:48 UTC 2026","","","",""
"Test cases for TestRequestWaitDuration","0","TestRequestWaitDuration","","Wed Apr 22 18:49:15 UTC 2026","passed","Wed Apr 22 18:49:15 UTC 2026","","Go Test","github.com/specterops/bloodhound/cmd/api/src/api/middleware/TestRequestWaitDuration","TestRequestWaitDuration"
"Test cases for TestWriteResponseWrapperWithPagination","1","TestWriteResponseWrapperWithPagination","","Wed Apr 22 18:49:13 UTC 2026","passed","Wed Apr 22 18:49:13 UTC 2026","","Go Test","github.com/specterops/bloodhound/cmd/api/src/api/TestWriteResponseWrapperWithPagination","TestWriteResponseWrapperWithPagination"
"","331","renders the Object Tab content when Object tab is chosen","Selected Details Tab Content","Wed Apr 22 18:54:33 UTC 2026","passed","Wed Apr 22 18:54:33 UTC 2026","","","",""
"Test cases for Test_validateGraphExtension","3","Test_validateGraphExtension","","Wed Apr 22 18:49:29 UTC 2026","passed","Wed Apr 22 18:49:29 UTC 2026","","Go Test","github.com/specterops/bloodhound/cmd/api/src/services/opengraphschema/Test_validateGraphExtension","Test_validateGraphExtension"
"","157","renders the component with all info and switch off","CitrixRDPConfiguration","Wed Apr 22 18:52:13 UTC 2026","passed","Wed Apr 22 18:52:13 UTC 2026","","Initial render","",""
"Test cases for TestManagementResource_ListRoles_InvalidFilterPredicate","0","TestManagementResource_ListRoles_InvalidFilterPredicate","","Wed Apr 22 18:49:28 UTC 2026","passed","Wed Apr 22 18:49:28 UTC 2026","","Go Test","github.com/specterops/bloodhound/cmd/api/src/api/v2/auth/TestManagementResource_ListRoles_InvalidFilterPredicate","TestManagementResource_ListRoles_InvalidFilterPredicate"
