"DESCRIPTION","DURATION IN MS","NAME","PARENT SUITE","START TIME","STATUS","STOP TIME","SUB SUITE","SUITE","TEST CLASS","TEST METHOD"
"","0","isError returns as expected based on all queries combined","queriesAreLoadingOrErrored","Wed Apr 22 18:55:20 UTC 2026","passed","Wed Apr 22 18:55:20 UTC 2026","","","",""
"Test cases for TestResources_ListADGPOAffectedContainers","0","TestResources_ListADGPOAffectedContainers","","Wed Apr 22 18:49:22 UTC 2026","passed","Wed Apr 22 18:49:22 UTC 2026","","Go Test","github.com/specterops/bloodhound/cmd/api/src/api/v2/TestResources_ListADGPOAffectedContainers","TestResources_ListADGPOAffectedContainers"
"","16","renders note content when currentNote is present","HistoryNotes Component","Wed Apr 22 18:55:04 UTC 2026","passed","Wed Apr 22 18:55:04 UTC 2026","","","",""
"Test cases for TestIntFromPtr","0","TestIntFromPtr","","Wed Apr 22 18:49:25 UTC 2026","passed","Wed Apr 22 18:49:25 UTC 2026","","Go Test","github.com/specterops/bloodhound/cmd/api/src/database/types/null/TestIntFromPtr","TestIntFromPtr"
"","259","calls setExploreParams with searchType and relationshipQueryItemId when selecting a composition accordion","EdgeInfoContent","Wed Apr 22 18:50:37 UTC 2026","passed","Wed Apr 22 18:50:37 UTC 2026","","EdgeInfoContent support for Deep Linking","",""
"","1564","should render","EntityInfoHeader","Wed Apr 22 18:53:40 UTC 2026","passed","Wed Apr 22 18:53:42 UTC 2026","","","",""
"Test cases for TestResources_ImportSavedQuery","8","TestResources_ImportSavedQuery","","Wed Apr 22 18:49:22 UTC 2026","passed","Wed Apr 22 18:49:22 UTC 2026","","Go Test","github.com/specterops/bloodhound/cmd/api/src/api/v2/TestResources_ImportSavedQuery","TestResources_ImportSavedQuery"
"Test cases for Test_ParseSortParameters","0","Test_ParseSortParameters","","Wed Apr 22 18:49:13 UTC 2026","passed","Wed Apr 22 18:49:13 UTC 2026","","Go Test","github.com/specterops/bloodhound/cmd/api/src/api/Test_ParseSortParameters","Test_ParseSortParameters"
"Test cases for TestQueries_GetEntityResults","0","TestQueries_GetEntityResults","","Wed Apr 22 18:49:27 UTC 2026","passed","Wed Apr 22 18:49:27 UTC 2026","","Go Test","github.com/specterops/bloodhound/cmd/api/src/queries/TestQueries_GetEntityResults","TestQueries_GetEntityResults"
"Test cases for TestDomainSelectors_GetFilterCriteria_InvalidFilterPredicate","0","TestDomainSelectors_GetFilterCriteria_InvalidFilterPredicate","","Wed Apr 22 18:49:25 UTC 2026","passed","Wed Apr 22 18:49:25 UTC 2026","","Go Test","github.com/specterops/bloodhound/cmd/api/src/model/TestDomainSelectors_GetFilterCriteria_InvalidFilterPredicate","TestDomainSelectors_GetFilterCriteria_InvalidFilterPredicate"
"","20","selector members refetches on envrionment change","the useAssetGroupTags utilities","Wed Apr 22 18:51:51 UTC 2026","passed","Wed Apr 22 18:51:51 UTC 2026","","","",""
"","0","handles empty search string","filterAndSearchEnvironments","Wed Apr 22 18:50:30 UTC 2026","passed","Wed Apr 22 18:50:30 UTC 2026","","search filter","",""
"Test cases for TestBoolValueOrZero","0","TestBoolValueOrZero","","Wed Apr 22 18:49:25 UTC 2026","passed","Wed Apr 22 18:49:25 UTC 2026","","Go Test","github.com/specterops/bloodhound/cmd/api/src/database/types/null/TestBoolValueOrZero","TestBoolValueOrZero"
"Test cases for TestServeHTTP_Success","0","TestServeHTTP_Success","","Wed Apr 22 18:49:15 UTC 2026","passed","Wed Apr 22 18:49:15 UTC 2026","","Go Test","github.com/specterops/bloodhound/cmd/api/src/api/middleware/TestServeHTTP_Success","TestServeHTTP_Success"
"","1","calculates skip correctly for pageParam > 1","createHistoryParams","Wed Apr 22 18:54:28 UTC 2026","passed","Wed Apr 22 18:54:28 UTC 2026","","","",""
"Test cases for TestManagementResource_CreateOIDCProvider","1","TestManagementResource_CreateOIDCProvider","","Wed Apr 22 18:50:05 UTC 2026","passed","Wed Apr 22 18:50:05 UTC 2026","","Go Test","github.com/specterops/bloodhound/cmd/api/src/api/v2/auth/TestManagementResource_CreateOIDCProvider","TestManagementResource_CreateOIDCProvider"
"","207","displays expected results when searching by objectid","SearchCurrentNodes","Wed Apr 22 18:53:23 UTC 2026","passed","Wed Apr 22 18:53:23 UTC 2026","","","",""
"Test cases for TestResources_DeleteSavedQuery","0","TestResources_DeleteSavedQuery","","Wed Apr 22 18:49:22 UTC 2026","passed","Wed Apr 22 18:49:22 UTC 2026","","Go Test","github.com/specterops/bloodhound/cmd/api/src/api/v2/TestResources_DeleteSavedQuery","TestResources_DeleteSavedQuery"
"","75","takes the param appendQueryKey and will append that value to the existing queryKey","useAvailableEnvironments","Wed Apr 22 18:52:48 UTC 2026","passed","Wed Apr 22 18:52:48 UTC 2026","","useAvailableEnvironments","",""
"Test cases for TestResources_ListADCSEscalations","0","TestResources_ListADCSEscalations","","Wed Apr 22 18:49:22 UTC 2026","passed","Wed Apr 22 18:49:22 UTC 2026","","Go Test","github.com/specterops/bloodhound/cmd/api/src/api/v2/TestResources_ListADCSEscalations","TestResources_ListADCSEscalations"
"Test cases for TestResources_GetSavedQuery","22","TestResources_GetSavedQuery","","Wed Apr 22 18:49:22 UTC 2026","passed","Wed Apr 22 18:49:22 UTC 2026","","Go Test","github.com/specterops/bloodhound/cmd/api/src/api/v2/TestResources_GetSavedQuery","TestResources_GetSavedQuery"
"","2","EXTENDED ROUNDING when thresholds are set: abbreviates hundred-thousands, millions, billions, trillions as expected","numberFormatting","Wed Apr 22 18:53:09 UTC 2026","passed","Wed Apr 22 18:53:09 UTC 2026","","","",""
"","1","`undefined` input is provided","Parsing the debounced input for type and keyword values","Wed Apr 22 18:53:39 UTC 2026","passed","Wed Apr 22 18:53:39 UTC 2026","","","",""
"Test cases for Test_ConvertAzureRoleManagementPolicyAssignment","0","Test_ConvertAzureRoleManagementPolicyAssignment","","Wed Apr 22 18:49:45 UTC 2026","passed","Wed Apr 22 18:49:45 UTC 2026","","Go Test","github.com/specterops/bloodhound/packages/go/ein/Test_ConvertAzureRoleManagementPolicyAssignment","Test_ConvertAzureRoleManagementPolicyAssignment"
"","1200","a cypher search 404 does not render the GraphViewErrorAlert","GraphView","Wed Apr 22 18:56:07 UTC 2026","passed","Wed Apr 22 18:56:08 UTC 2026","","","",""
"","59","displays ! icon when one of the Affected Object calls fail","EntityInfoDataTableGraphed","Wed Apr 22 18:52:17 UTC 2026","passed","Wed Apr 22 18:52:17 UTC 2026","","Node count for nested table that counts all sections","",""
"","13","removes multiple keys from state","useObjectState","Wed Apr 22 18:54:37 UTC 2026","passed","Wed Apr 22 18:54:37 UTC 2026","","","",""
"","0","Input does not contain a type","Parsing the debounced input for type and keyword values","Wed Apr 22 18:53:39 UTC 2026","passed","Wed Apr 22 18:53:39 UTC 2026","","","",""
"","0","fails for empty password","testPassword","Wed Apr 22 18:55:21 UTC 2026","passed","Wed Apr 22 18:55:21 UTC 2026","","","",""
"Test cases for TestInt64IsZero","0","TestInt64IsZero","","Wed Apr 22 18:49:25 UTC 2026","passed","Wed Apr 22 18:49:25 UTC 2026","","Go Test","github.com/specterops/bloodhound/cmd/api/src/database/types/null/TestInt64IsZero","TestInt64IsZero"
"Test cases for TestNewAuditLog","0","TestNewAuditLog","","Wed Apr 22 18:49:24 UTC 2026","passed","Wed Apr 22 18:49:24 UTC 2026","","Go Test","github.com/specterops/bloodhound/cmd/api/src/database/TestNewAuditLog","TestNewAuditLog"
"Test cases for TestResources_ListAuditLogs_OnlyOffset","0","TestResources_ListAuditLogs_OnlyOffset","","Wed Apr 22 18:49:22 UTC 2026","passed","Wed Apr 22 18:49:22 UTC 2026","","Go Test","github.com/specterops/bloodhound/cmd/api/src/api/v2/TestResources_ListAuditLogs_OnlyOffset","TestResources_ListAuditLogs_OnlyOffset"
"","1760","should render search input","Pathfinding","Wed Apr 22 18:50:45 UTC 2026","passed","Wed Apr 22 18:50:47 UTC 2026","","","",""
"Test cases for Test_GetApplicationConfigurations","0","Test_GetApplicationConfigurations","","Wed Apr 22 18:49:22 UTC 2026","passed","Wed Apr 22 18:49:22 UTC 2026","","Go Test","github.com/specterops/bloodhound/cmd/api/src/api/v2/Test_GetApplicationConfigurations","Test_GetApplicationConfigurations"
"","406","renders an edit form for the selected asset group when a user has graph write permissions","GroupManagement","Wed Apr 22 18:56:13 UTC 2026","passed","Wed Apr 22 18:56:14 UTC 2026","","","",""
"","0","returns false if arrays have different length","areArraysSimilar","Wed Apr 22 18:54:59 UTC 2026","passed","Wed Apr 22 18:54:59 UTC 2026","","","",""
"","112","should redirect to nested /file-ingest route if user navigates to /","Administration","Wed Apr 22 18:56:29 UTC 2026","passed","Wed Apr 22 18:56:29 UTC 2026","","","",""
"","124","Searching for existing node type returns node properties","useFetchEntityInfo","Wed Apr 22 18:52:57 UTC 2026","passed","Wed Apr 22 18:52:57 UTC 2026","","","",""
"","6","dispatches a storage event when a value is set","useLocalStorage","Wed Apr 22 18:52:27 UTC 2026","passed","Wed Apr 22 18:52:27 UTC 2026","","storage event synchronisation","",""
"","2","returns undefined if graphData is undefined","normalizeGraphDataForSigma","Wed Apr 22 18:56:31 UTC 2026","passed","Wed Apr 22 18:56:31 UTC 2026","","","",""
"","276","should not call onSubmit when input is invalid and Submit button is clicked","UpsertSAMLProviderForm","Wed Apr 22 18:54:08 UTC 2026","passed","Wed Apr 22 18:54:09 UTC 2026","","","",""
"","0","should exclude operations within a tag when only the path matches but not all paths","opsFilter","Wed Apr 22 18:54:19 UTC 2026","passed","Wed Apr 22 18:54:19 UTC 2026","","","",""
"","304","toggles sort order when clicking sortable header","RulesAccordion","Wed Apr 22 18:53:17 UTC 2026","passed","Wed Apr 22 18:53:17 UTC 2026","","","",""
"Test cases for TestManagementResource_UpdateUser_DBError","1350","TestManagementResource_UpdateUser_DBError","","Wed Apr 22 18:49:42 UTC 2026","passed","Wed Apr 22 18:49:43 UTC 2026","","Go Test","github.com/specterops/bloodhound/cmd/api/src/api/v2/auth/TestManagementResource_UpdateUser_DBError","TestManagementResource_UpdateUser_DBError"
"","119","calls onClick when toggle button clicked","EarlyAccessFeatureToggle","Wed Apr 22 18:56:25 UTC 2026","passed","Wed Apr 22 18:56:25 UTC 2026","","","",""
"","0","passes ruleType through optionalParams with empty object","handleError","Wed Apr 22 18:51:35 UTC 2026","passed","Wed Apr 22 18:51:35 UTC 2026","","","",""
"","1188","should call onSubmit with password when reset password button clicked","PasswordResetForm","Wed Apr 22 18:52:52 UTC 2026","passed","Wed Apr 22 18:52:53 UTC 2026","","","",""
"Test cases for TestManagementResource_GetUser","21825","TestManagementResource_GetUser","","Wed Apr 22 18:49:43 UTC 2026","passed","Wed Apr 22 18:50:05 UTC 2026","","Go Test","github.com/specterops/bloodhound/cmd/api/src/api/v2/auth/TestManagementResource_GetUser","TestManagementResource_GetUser"
"","1938","search filters edges by name","Pathfinding","Wed Apr 22 18:51:20 UTC 2026","passed","Wed Apr 22 18:51:22 UTC 2026","","","",""
"","226","disables any available button toggles if the user lacks the permission","EarlyAccessFeatures","Wed Apr 22 18:56:15 UTC 2026","passed","Wed Apr 22 18:56:15 UTC 2026","","","",""
"","1","returns a comma separated number when provided with a number > 999","numberFormatting","Wed Apr 22 18:53:09 UTC 2026","passed","Wed Apr 22 18:53:09 UTC 2026","","","",""
"","3","writes initialValue to localStorage when the key is absent","useLocalStorage","Wed Apr 22 18:52:27 UTC 2026","passed","Wed Apr 22 18:52:27 UTC 2026","","initial value","",""
"","151","respects openIndex (default opened panel)","<DetailsAccordion />","Wed Apr 22 18:51:54 UTC 2026","passed","Wed Apr 22 18:51:54 UTC 2026","","","",""
"","726","should not call onSubmit when expired password matches current password when reset password button clicked","PasswordResetForm","Wed Apr 22 18:52:54 UTC 2026","passed","Wed Apr 22 18:52:55 UTC 2026","","","",""
"","68","returns false on 404","useGraphHasData","Wed Apr 22 18:54:47 UTC 2026","passed","Wed Apr 22 18:54:47 UTC 2026","","","",""
"","260","sets secondarySearch=id and searchType=node when primarySearch is falsey","ContextMenu","Wed Apr 22 18:51:47 UTC 2026","passed","Wed Apr 22 18:51:48 UTC 2026","","","",""
"","202","closes the dropdown when clicking outside","ManageColumnsComboBox","Wed Apr 22 18:51:56 UTC 2026","passed","Wed Apr 22 18:51:56 UTC 2026","","","",""
"Test cases for TestRequireAllEnvironmentAccessMiddleware","1","TestRequireAllEnvironmentAccessMiddleware","","Wed Apr 22 18:49:15 UTC 2026","passed","Wed Apr 22 18:49:15 UTC 2026","","Go Test","github.com/specterops/bloodhound/cmd/api/src/api/middleware/TestRequireAllEnvironmentAccessMiddleware","TestRequireAllEnvironmentAccessMiddleware"
"Test cases for TestModifyCookieAttribute","2","TestModifyCookieAttribute","","Wed Apr 22 18:49:44 UTC 2026","passed","Wed Apr 22 18:49:44 UTC 2026","","Go Test","github.com/specterops/bloodhound/cmd/api/src/utils/test/TestModifyCookieAttribute","TestModifyCookieAttribute"
"","532","clear validation error on input","ManagedDatePicker - date validation","Wed Apr 22 18:53:02 UTC 2026","passed","Wed Apr 22 18:53:03 UTC 2026","","","",""
"","480","calls setFilters when the Confirm button is clicked","Privilege Zones History Filter Dialog","Wed Apr 22 18:52:44 UTC 2026","passed","Wed Apr 22 18:52:45 UTC 2026","","","",""
"Test cases for TestManagementResource_DeleteUser_BadUserID","0","TestManagementResource_DeleteUser_BadUserID","","Wed Apr 22 18:49:43 UTC 2026","passed","Wed Apr 22 18:49:43 UTC 2026","","Go Test","github.com/specterops/bloodhound/cmd/api/src/api/v2/auth/TestManagementResource_DeleteUser_BadUserID","TestManagementResource_DeleteUser_BadUserID"
"Test cases for TestTimeIsZero","0","TestTimeIsZero","","Wed Apr 22 18:49:25 UTC 2026","passed","Wed Apr 22 18:49:25 UTC 2026","","Go Test","github.com/specterops/bloodhound/cmd/api/src/database/types/null/TestTimeIsZero","TestTimeIsZero"
"","6","should render when search string matches text entirely","HighlightedText","Wed Apr 22 18:54:36 UTC 2026","passed","Wed Apr 22 18:54:36 UTC 2026","","","",""
"Test cases for TestDeduplicateKinds","0","TestDeduplicateKinds","","Wed Apr 22 18:49:28 UTC 2026","passed","Wed Apr 22 18:49:28 UTC 2026","","Go Test","github.com/specterops/bloodhound/cmd/api/src/services/graphify/TestDeduplicateKinds","TestDeduplicateKinds"
"Test cases for TestResources_GetGroupEntityInfo","1","TestResources_GetGroupEntityInfo","","Wed Apr 22 18:49:22 UTC 2026","passed","Wed Apr 22 18:49:22 UTC 2026","","Go Test","github.com/specterops/bloodhound/cmd/api/src/api/v2/TestResources_GetGroupEntityInfo","TestResources_GetGroupEntityInfo"
"","3602","search forces sections to expand when there is a match","Pathfinding","Wed Apr 22 18:51:23 UTC 2026","passed","Wed Apr 22 18:51:27 UTC 2026","","","",""
"Test cases for TestResources_GetCollectorManifest","0","TestResources_GetCollectorManifest","","Wed Apr 22 18:49:22 UTC 2026","passed","Wed Apr 22 18:49:22 UTC 2026","","Go Test","github.com/specterops/bloodhound/cmd/api/src/api/v2/TestResources_GetCollectorManifest","TestResources_GetCollectorManifest"
"Test cases for TestResources_SearchAssetGroupTags","1","TestResources_SearchAssetGroupTags","","Wed Apr 22 18:49:22 UTC 2026","passed","Wed Apr 22 18:49:22 UTC 2026","","Go Test","github.com/specterops/bloodhound/cmd/api/src/api/v2/TestResources_SearchAssetGroupTags","TestResources_SearchAssetGroupTags"
"Test cases for TestResources_ListADComputerConstrainedDelegationUsers","4","TestResources_ListADComputerConstrainedDelegationUsers","","Wed Apr 22 18:49:22 UTC 2026","passed","Wed Apr 22 18:49:22 UTC 2026","","Go Test","github.com/specterops/bloodhound/cmd/api/src/api/v2/TestResources_ListADComputerConstrainedDelegationUsers","TestResources_ListADComputerConstrainedDelegationUsers"
"Test cases for TestCacheEntryDigester_DigestEndpoint_DefaultObjectID","0","TestCacheEntryDigester_DigestEndpoint_DefaultObjectID","","Wed Apr 22 18:49:28 UTC 2026","passed","Wed Apr 22 18:49:28 UTC 2026","","Go Test","github.com/specterops/bloodhound/cmd/api/src/services/graphify/endpoint/TestCacheEntryDigester_DigestEndpoint_DefaultObjectID","TestCacheEntryDigester_DigestEndpoint_DefaultObjectID"
"","334","should display a searchbox with a placeholder when rendered","AssetGroupEdit","Wed Apr 22 18:53:31 UTC 2026","passed","Wed Apr 22 18:53:31 UTC 2026","","","",""
"Test cases for TestWriteErrorResponse_InvalidFormat","0","TestWriteErrorResponse_InvalidFormat","","Wed Apr 22 18:49:13 UTC 2026","passed","Wed Apr 22 18:49:13 UTC 2026","","Go Test","github.com/specterops/bloodhound/cmd/api/src/api/TestWriteErrorResponse_InvalidFormat","TestWriteErrorResponse_InvalidFormat"
"","41","should display the checkbox group title","Checkbox group","Wed Apr 22 18:55:05 UTC 2026","passed","Wed Apr 22 18:55:05 UTC 2026","","","",""
"","129","disables the create user button and does not populate a table if the user lacks the permission","Users","Wed Apr 22 18:52:35 UTC 2026","passed","Wed Apr 22 18:52:35 UTC 2026","","","",""
"Test cases for TestReadRFC3339","0","TestReadRFC3339","","Wed Apr 22 18:49:44 UTC 2026","passed","Wed Apr 22 18:49:44 UTC 2026","","Go Test","github.com/specterops/bloodhound/cmd/api/src/utils/TestReadRFC3339","TestReadRFC3339"
"Test cases for TestTextUnmarshalBool","0","TestTextUnmarshalBool","","Wed Apr 22 18:49:25 UTC 2026","passed","Wed Apr 22 18:49:25 UTC 2026","","Go Test","github.com/specterops/bloodhound/cmd/api/src/database/types/null/TestTextUnmarshalBool","TestTextUnmarshalBool"
"Test cases for TestResources_GetAZEntityInformation","78","TestResources_GetAZEntityInformation","","Wed Apr 22 18:49:22 UTC 2026","passed","Wed Apr 22 18:49:22 UTC 2026","","Go Test","github.com/specterops/bloodhound/cmd/api/src/api/v2/TestResources_GetAZEntityInformation","TestResources_GetAZEntityInformation"
"Test cases for TestIsErrorResponse","0","TestIsErrorResponse","","Wed Apr 22 18:49:13 UTC 2026","passed","Wed Apr 22 18:49:13 UTC 2026","","Go Test","github.com/specterops/bloodhound/cmd/api/src/api/TestIsErrorResponse","TestIsErrorResponse"
"Test cases for TestContextMiddleware_InvalidWait","0","TestContextMiddleware_InvalidWait","","Wed Apr 22 18:49:15 UTC 2026","passed","Wed Apr 22 18:49:15 UTC 2026","","Go Test","github.com/specterops/bloodhound/cmd/api/src/api/middleware/TestContextMiddleware_InvalidWait","TestContextMiddleware_InvalidWait"
"Test cases for TestManagementResource_ListAuthTokens_DBError","0","TestManagementResource_ListAuthTokens_DBError","","Wed Apr 22 18:49:52 UTC 2026","passed","Wed Apr 22 18:49:52 UTC 2026","","Go Test","github.com/specterops/bloodhound/cmd/api/src/api/v2/auth/TestManagementResource_ListAuthTokens_DBError","TestManagementResource_ListAuthTokens_DBError"
"","59","passes data to testing component","SavedQueriesProvider","Wed Apr 22 18:55:01 UTC 2026","passed","Wed Apr 22 18:55:01 UTC 2026","","","",""
"Test cases for Test_parseAuthorizationHeader","0","Test_parseAuthorizationHeader","","Wed Apr 22 18:49:15 UTC 2026","passed","Wed Apr 22 18:49:15 UTC 2026","","Go Test","github.com/specterops/bloodhound/cmd/api/src/api/middleware/Test_parseAuthorizationHeader","Test_parseAuthorizationHeader"
"Test cases for TestAddWhereClauseToNeo4jQuery_WithWhereClause","0","TestAddWhereClauseToNeo4jQuery_WithWhereClause","","Wed Apr 22 18:49:22 UTC 2026","passed","Wed Apr 22 18:49:22 UTC 2026","","Go Test","github.com/specterops/bloodhound/cmd/api/src/api/v2/TestAddWhereClauseToNeo4jQuery_WithWhereClause","TestAddWhereClauseToNeo4jQuery_WithWhereClause"
"","0","returns paramValue as EnvironmentAggregation if paramValue is active-directory","useEnvironmentParams","Wed Apr 22 18:55:20 UTC 2026","passed","Wed Apr 22 18:55:20 UTC 2026","","parseEnvironmentAggregation","",""
"Test cases for TestContextMiddlewareBypassDisabled","0","TestContextMiddlewareBypassDisabled","","Wed Apr 22 18:49:15 UTC 2026","passed","Wed Apr 22 18:49:15 UTC 2026","","Go Test","github.com/specterops/bloodhound/cmd/api/src/api/middleware/TestContextMiddlewareBypassDisabled","TestContextMiddlewareBypassDisabled"
"","247","invalidates the extensions query after a successful upload","SchemaUploadDialog","Wed Apr 22 18:51:34 UTC 2026","passed","Wed Apr 22 18:51:34 UTC 2026","","","",""
"Test cases for TestVersion_GreaterThan","0","TestVersion_GreaterThan","","Wed Apr 22 18:49:44 UTC 2026","passed","Wed Apr 22 18:49:44 UTC 2026","","Go Test","github.com/specterops/bloodhound/cmd/api/src/version/TestVersion_GreaterThan","TestVersion_GreaterThan"
"Test cases for TestDisenrollMFA_Admin_FailureIncorrectPassword","2135","TestDisenrollMFA_Admin_FailureIncorrectPassword","","Wed Apr 22 18:50:01 UTC 2026","passed","Wed Apr 22 18:50:03 UTC 2026","","Go Test","github.com/specterops/bloodhound/cmd/api/src/api/v2/auth/TestDisenrollMFA_Admin_FailureIncorrectPassword","TestDisenrollMFA_Admin_FailureIncorrectPassword"
"Test cases for TestManagementResource_ListAuthTokens_Filtered","0","TestManagementResource_ListAuthTokens_Filtered","","Wed Apr 22 18:49:52 UTC 2026","passed","Wed Apr 22 18:49:52 UTC 2026","","Go Test","github.com/specterops/bloodhound/cmd/api/src/api/v2/auth/TestManagementResource_ListAuthTokens_Filtered","TestManagementResource_ListAuthTokens_Filtered"
"","7","does not render when selector is default","Delete Selector Button rendering","Wed Apr 22 18:55:01 UTC 2026","passed","Wed Apr 22 18:55:01 UTC 2026","","","",""
"","191","should disable the create provider button and not display providers if the user lacks permission","SSOConfiguration","Wed Apr 22 18:52:03 UTC 2026","passed","Wed Apr 22 18:52:03 UTC 2026","","","",""
"Test cases for TestTimeFrom","0","TestTimeFrom","","Wed Apr 22 18:49:25 UTC 2026","passed","Wed Apr 22 18:49:25 UTC 2026","","Go Test","github.com/specterops/bloodhound/cmd/api/src/database/types/null/TestTimeFrom","TestTimeFrom"
"Test cases for TestFoldl","3","TestFoldl","","Wed Apr 22 18:49:57 UTC 2026","passed","Wed Apr 22 18:49:57 UTC 2026","","Go Test","github.com/specterops/bloodhound/packages/go/slicesext/TestFoldl","TestFoldl"
"","0","returns false for arrays with different object references","areArraysSimilar","Wed Apr 22 18:54:59 UTC 2026","passed","Wed Apr 22 18:54:59 UTC 2026","","","",""
"","10","disables useAvailableEnvironment and does not attempt calling handleInitialEnvironment if queryOptions.enabled","useInitialEnvironment","Wed Apr 22 18:54:13 UTC 2026","passed","Wed Apr 22 18:54:13 UTC 2026","","","",""
"","20","whencreated","Handling value formatting for Active Directory entity properties lastlogon, lastlogontimestamp, whencreated, and pwdlastset","Wed Apr 22 18:52:02 UTC 2026","passed","Wed Apr 22 18:52:02 UTC 2026","","","",""
"","632","does not allow confirmation while dates are invalid","FileIngestFilterDialog","Wed Apr 22 18:51:42 UTC 2026","passed","Wed Apr 22 18:51:43 UTC 2026","","Date Range Inputs","",""
"","1","handles environment with impactValue at exact threshold boundaries","filterAndSearchEnvironments","Wed Apr 22 18:50:30 UTC 2026","passed","Wed Apr 22 18:50:30 UTC 2026","","edge cases","",""
"","1342","should render","EdgeInfoHeader","Wed Apr 22 18:53:56 UTC 2026","passed","Wed Apr 22 18:53:57 UTC 2026","","","",""
"Test cases for TestSetValuesFromEnv","0","TestSetValuesFromEnv","","Wed Apr 22 18:49:23 UTC 2026","passed","Wed Apr 22 18:49:23 UTC 2026","","Go Test","github.com/specterops/bloodhound/cmd/api/src/config/TestSetValuesFromEnv","TestSetValuesFromEnv"
"","441","toggles sort order when clicking sortable header","ObjectsAccordion","Wed Apr 22 18:54:23 UTC 2026","passed","Wed Apr 22 18:54:24 UTC 2026","","","",""
"","16","returns active-directory environmentInfo when environmentAggregation param is active-directory","useAvailableEnvironments","Wed Apr 22 18:52:48 UTC 2026","passed","Wed Apr 22 18:52:48 UTC 2026","","useSelectedEnvironment","",""
"Test cases for TestResources_ListADDomainContainedGroups","0","TestResources_ListADDomainContainedGroups","","Wed Apr 22 18:49:22 UTC 2026","passed","Wed Apr 22 18:49:22 UTC 2026","","Go Test","github.com/specterops/bloodhound/cmd/api/src/api/v2/TestResources_ListADDomainContainedGroups","TestResources_ListADDomainContainedGroups"
"","0","properly displays bitwise integers","Formatting number properties","Wed Apr 22 18:52:02 UTC 2026","passed","Wed Apr 22 18:52:02 UTC 2026","","","",""
"Test cases for TestManagementResource_SSOLoginHandler","5","TestManagementResource_SSOLoginHandler","","Wed Apr 22 18:50:05 UTC 2026","passed","Wed Apr 22 18:50:05 UTC 2026","","Go Test","github.com/specterops/bloodhound/cmd/api/src/api/v2/auth/TestManagementResource_SSOLoginHandler","TestManagementResource_SSOLoginHandler"
"Test cases for TestIntPointer","0","TestIntPointer","","Wed Apr 22 18:49:25 UTC 2026","passed","Wed Apr 22 18:49:25 UTC 2026","","Go Test","github.com/specterops/bloodhound/cmd/api/src/database/types/null/TestIntPointer","TestIntPointer"
"","180","renders the form for creating a new label","Tag Form","Wed Apr 22 18:50:16 UTC 2026","passed","Wed Apr 22 18:50:16 UTC 2026","","","",""
"","136","does not open the dialog when the user does not have the opengraph write permission","SchemaUploadDialog","Wed Apr 22 18:51:32 UTC 2026","passed","Wed Apr 22 18:51:32 UTC 2026","","","",""
"Test cases for TestUrlValidator","0","TestUrlValidator","","Wed Apr 22 18:49:44 UTC 2026","passed","Wed Apr 22 18:49:44 UTC 2026","","Go Test","github.com/specterops/bloodhound/cmd/api/src/utils/validation/TestUrlValidator","TestUrlValidator"
"Test cases for TestResources_ShareSavedQueriesPermissions_NonAdmin","4","TestResources_ShareSavedQueriesPermissions_NonAdmin","","Wed Apr 22 18:49:22 UTC 2026","passed","Wed Apr 22 18:49:22 UTC 2026","","Go Test","github.com/specterops/bloodhound/cmd/api/src/api/v2/TestResources_ShareSavedQueriesPermissions_NonAdmin","TestResources_ShareSavedQueriesPermissions_NonAdmin"
