"DESCRIPTION","DURATION IN MS","NAME","PARENT SUITE","START TIME","STATUS","STOP TIME","SUB SUITE","SUITE","TEST CLASS","TEST METHOD"
"Test cases for TestParseLimitQueryParameter_Invalid","0","TestParseLimitQueryParameter_Invalid","","Wed Apr 22 18:49:22 UTC 2026","passed","Wed Apr 22 18:49:22 UTC 2026","","Go Test","github.com/specterops/bloodhound/cmd/api/src/api/v2/TestParseLimitQueryParameter_Invalid","TestParseLimitQueryParameter_Invalid"
"","394","should render","OneTimePasscodeForm","Wed Apr 22 18:54:33 UTC 2026","passed","Wed Apr 22 18:54:33 UTC 2026","","","",""
"","471","should render list of available SSO providers","LoginViaSSOForm","Wed Apr 22 18:53:43 UTC 2026","passed","Wed Apr 22 18:53:43 UTC 2026","","","",""
"TestMigrator_GenerateManifest tests the full integrity of a Manifest generatedfrom 3 different Source's:1) Correct number of total migrations detected.2) Correct number of versions detected.3) The VersionTable has all versions, in order.4) All versions have the correct number of migrations.5) Schema files generate v0.0.0 migrations.6) Migrations are ordered within each version, in the order the Source was defined.","3","TestMigrator_GenerateManifest","","Wed Apr 22 18:49:25 UTC 2026","passed","Wed Apr 22 18:49:25 UTC 2026","","Go Test","github.com/specterops/bloodhound/cmd/api/src/database/migration/TestMigrator_GenerateManifest","TestMigrator_GenerateManifest"
"Test cases for TestManagementResource_OIDCLoginHandler","13","TestManagementResource_OIDCLoginHandler","","Wed Apr 22 18:50:05 UTC 2026","passed","Wed Apr 22 18:50:05 UTC 2026","","Go Test","github.com/specterops/bloodhound/cmd/api/src/api/v2/auth/TestManagementResource_OIDCLoginHandler","TestManagementResource_OIDCLoginHandler"
"","67","returns the full environment for the environmentid passed","useAvailableEnvironments","Wed Apr 22 18:52:48 UTC 2026","passed","Wed Apr 22 18:52:48 UTC 2026","","useSelectedEnvironment","",""
"Test cases for TestTrackerBuilder_Build_SortsKeysAndIDs","0","TestTrackerBuilder_Build_SortsKeysAndIDs","","Wed Apr 22 18:49:44 UTC 2026","passed","Wed Apr 22 18:49:44 UTC 2026","","Go Test","github.com/specterops/bloodhound/packages/go/analysis/post/TestTrackerBuilder_Build_SortsKeysAndIDs","TestTrackerBuilder_Build_SortsKeysAndIDs"
"Test cases for TestResources_PreviewSelectors","0","TestResources_PreviewSelectors","","Wed Apr 22 18:49:22 UTC 2026","passed","Wed Apr 22 18:49:22 UTC 2026","","Go Test","github.com/specterops/bloodhound/cmd/api/src/api/v2/TestResources_PreviewSelectors","TestResources_PreviewSelectors"
"","106","displays active styles for the selected layout when explore table is enabled","GraphControls","Wed Apr 22 18:51:31 UTC 2026","passed","Wed Apr 22 18:51:31 UTC 2026","","Selecting a layout","",""
"Test cases for TestNormalizeToUTF8","0","TestNormalizeToUTF8","","Wed Apr 22 18:49:45 UTC 2026","passed","Wed Apr 22 18:49:45 UTC 2026","","Go Test","github.com/specterops/bloodhound/packages/go/bomenc/TestNormalizeToUTF8","TestNormalizeToUTF8"
"","0","returns undefined if paramValue is not an expected value","useExploreParams","Wed Apr 22 18:55:26 UTC 2026","passed","Wed Apr 22 18:55:26 UTC 2026","","parseSearchType","",""
"","3308","subcategory with duplicate name does not show indeterminate when all its children are unchecked","Pathfinding","Wed Apr 22 18:51:34 UTC 2026","passed","Wed Apr 22 18:51:37 UTC 2026","","","",""
"","57","upon selecting just a destination node, updates the URL with a searchType of 'node' and secondarySearch of the node's objectid","usePathfindingSearch","Wed Apr 22 18:52:47 UTC 2026","passed","Wed Apr 22 18:52:47 UTC 2026","","","",""
"","389","renders","ObjectsAccordion","Wed Apr 22 18:53:19 UTC 2026","passed","Wed Apr 22 18:53:20 UTC 2026","","","",""
"","246","shows ""Clear All"" when all columns are selected","ManageColumnsComboBox","Wed Apr 22 18:51:54 UTC 2026","passed","Wed Apr 22 18:51:55 UTC 2026","","","",""
"","9","can composes search params from the search prop and use them in the redirect","AppNavigate","Wed Apr 22 18:54:05 UTC 2026","passed","Wed Apr 22 18:54:05 UTC 2026","","","",""
"Test cases for TestCreateUser_FailureDuplicateEmail","1272","TestCreateUser_FailureDuplicateEmail","","Wed Apr 22 18:49:28 UTC 2026","passed","Wed Apr 22 18:49:29 UTC 2026","","Go Test","github.com/specterops/bloodhound/cmd/api/src/api/v2/auth/TestCreateUser_FailureDuplicateEmail","TestCreateUser_FailureDuplicateEmail"
"Helper to verify that encodeAnyValue handles standard types correctly","0","TestEncodeAnyValue","","Wed Apr 22 18:49:28 UTC 2026","passed","Wed Apr 22 18:49:28 UTC 2026","","Go Test","github.com/specterops/bloodhound/cmd/api/src/services/graphify/endpoint/TestEncodeAnyValue","TestEncodeAnyValue"
"","78","should render a label and version number when expanded","MainNav","Wed Apr 22 18:52:25 UTC 2026","passed","Wed Apr 22 18:52:25 UTC 2026","","","",""
"Test cases for TestCreateUser_ETAC","3424","TestCreateUser_ETAC","","Wed Apr 22 18:49:30 UTC 2026","passed","Wed Apr 22 18:49:34 UTC 2026","","Go Test","github.com/specterops/bloodhound/cmd/api/src/api/v2/auth/TestCreateUser_ETAC","TestCreateUser_ETAC"
"Test cases for TestResources_ListADGroupMembership","0","TestResources_ListADGroupMembership","","Wed Apr 22 18:49:22 UTC 2026","passed","Wed Apr 22 18:49:22 UTC 2026","","Go Test","github.com/specterops/bloodhound/cmd/api/src/api/v2/TestResources_ListADGroupMembership","TestResources_ListADGroupMembership"
"Test cases for TestKeyEncoder_Key_VaryingInputs","0","TestKeyEncoder_Key_VaryingInputs","","Wed Apr 22 18:49:44 UTC 2026","passed","Wed Apr 22 18:49:44 UTC 2026","","Go Test","github.com/specterops/bloodhound/packages/go/analysis/post/TestKeyEncoder_Key_VaryingInputs","TestKeyEncoder_Key_VaryingInputs"
"","392","renders no asset group edit options without graph write permissions","ContextMenu","Wed Apr 22 18:56:04 UTC 2026","passed","Wed Apr 22 18:56:04 UTC 2026","","","",""
"Test cases for TestFloatValueOrZero","0","TestFloatValueOrZero","","Wed Apr 22 18:49:25 UTC 2026","passed","Wed Apr 22 18:49:25 UTC 2026","","Go Test","github.com/specterops/bloodhound/cmd/api/src/database/types/null/TestFloatValueOrZero","TestFloatValueOrZero"
"","147","invokes handleFilterChange with eq:true when clicked and custom_member filter is off","AssetGroupEdit","Wed Apr 22 18:52:09 UTC 2026","passed","Wed Apr 22 18:52:09 UTC 2026","","Custom Member checkbox filter","",""
"","1696","shows an error message when unable to delete a rule","Rule Form","Wed Apr 22 18:50:36 UTC 2026","passed","Wed Apr 22 18:50:37 UTC 2026","","","",""
"Test cases for TestValidateTOTPSecret","2","TestValidateTOTPSecret","","Wed Apr 22 18:49:23 UTC 2026","passed","Wed Apr 22 18:49:23 UTC 2026","","Go Test","github.com/specterops/bloodhound/cmd/api/src/auth/TestValidateTOTPSecret","TestValidateTOTPSecret"
"","8","does not return when label limit is not reached","useTagLimits","Wed Apr 22 18:50:47 UTC 2026","passed","Wed Apr 22 18:50:47 UTC 2026","","","",""
"","66","fails checks if the user does not have a matching permission","usePermissions","Wed Apr 22 18:52:13 UTC 2026","passed","Wed Apr 22 18:52:13 UTC 2026","","","",""
"","650","should fire Confirm once with true after typing challenge text","DeleteConfirmationDialog","Wed Apr 22 18:54:49 UTC 2026","passed","Wed Apr 22 18:54:50 UTC 2026","","","",""
"","64","returns a list of the users current permissions","usePermissions","Wed Apr 22 18:52:13 UTC 2026","passed","Wed Apr 22 18:52:13 UTC 2026","","","",""
"Test cases for TestMarshalFloat","0","TestMarshalFloat","","Wed Apr 22 18:49:25 UTC 2026","passed","Wed Apr 22 18:49:25 UTC 2026","","Go Test","github.com/specterops/bloodhound/cmd/api/src/database/types/null/TestMarshalFloat","TestMarshalFloat"
"Test cases for TestGetLatestQueryParameter","0","TestGetLatestQueryParameter","","Wed Apr 22 18:49:22 UTC 2026","passed","Wed Apr 22 18:49:22 UTC 2026","","Go Test","github.com/specterops/bloodhound/cmd/api/src/api/v2/TestGetLatestQueryParameter","TestGetLatestQueryParameter"
"","18","renders an error fallback when flag is not found","FeatureFlag","Wed Apr 22 18:54:13 UTC 2026","passed","Wed Apr 22 18:54:13 UTC 2026","","","",""
"Test cases for TestResources_CreateSavedQuery_EmptyBody","0","TestResources_CreateSavedQuery_EmptyBody","","Wed Apr 22 18:49:22 UTC 2026","passed","Wed Apr 22 18:49:22 UTC 2026","","Go Test","github.com/specterops/bloodhound/cmd/api/src/api/v2/TestResources_CreateSavedQuery_EmptyBody","TestResources_CreateSavedQuery_EmptyBody"
"","67","displays an error message while fetching fails","ActiveExtensionsCard","Wed Apr 22 18:50:36 UTC 2026","passed","Wed Apr 22 18:50:36 UTC 2026","","","",""
"","289","displays no search results message when search yields no matches","ActiveExtensionsCard","Wed Apr 22 18:50:36 UTC 2026","passed","Wed Apr 22 18:50:36 UTC 2026","","","",""
"","455","should display a ""Change Password"" modal","UserProfile","Wed Apr 22 18:52:20 UTC 2026","passed","Wed Apr 22 18:52:21 UTC 2026","","""Reset Password"" button is clicked","",""
"","2","should include all operations when the tag matches the term","opsFilter","Wed Apr 22 18:54:19 UTC 2026","passed","Wed Apr 22 18:54:19 UTC 2026","","","",""
"","209","renders the form for editing an existing label","Tag Form","Wed Apr 22 18:50:17 UTC 2026","passed","Wed Apr 22 18:50:17 UTC 2026","","","",""
"","877","displays validation error messages when password does not meet requirements","PasswordDialog","Wed Apr 22 18:50:49 UTC 2026","passed","Wed Apr 22 18:50:50 UTC 2026","","","",""
"","63","enables filtering out for tags that are treated as Labels (including Owned)","the useAssetGroupTags utilities","Wed Apr 22 18:51:51 UTC 2026","passed","Wed Apr 22 18:51:51 UTC 2026","","","",""
"","0","takes setSearchParams and availableParams returns a function","searchParams","Wed Apr 22 18:53:46 UTC 2026","passed","Wed Apr 22 18:53:46 UTC 2026","","setParamsFactory","",""
"","347","navigates to rule details when clicking a rule row","RulesAccordion","Wed Apr 22 18:53:17 UTC 2026","passed","Wed Apr 22 18:53:18 UTC 2026","","","",""
"","0","returns query config when searchType is composition and all required params are passed","useExploreGraph","Wed Apr 22 18:51:20 UTC 2026","passed","Wed Apr 22 18:51:20 UTC 2026","composition search queries","exploreGraphQueryFactory","",""
"Test cases for TestContextMiddleware_InvalidWaitLessThanZero","0","TestContextMiddleware_InvalidWaitLessThanZero","","Wed Apr 22 18:49:15 UTC 2026","passed","Wed Apr 22 18:49:15 UTC 2026","","Go Test","github.com/specterops/bloodhound/cmd/api/src/api/middleware/TestContextMiddleware_InvalidWaitLessThanZero","TestContextMiddleware_InvalidWaitLessThanZero"
"Test cases for TestStringScan","0","TestStringScan","","Wed Apr 22 18:49:25 UTC 2026","passed","Wed Apr 22 18:49:25 UTC 2026","","Go Test","github.com/specterops/bloodhound/cmd/api/src/database/types/null/TestStringScan","TestStringScan"
"Test cases for TestManagementResource_DeleteAuthToken","16","TestManagementResource_DeleteAuthToken","","Wed Apr 22 18:50:05 UTC 2026","passed","Wed Apr 22 18:50:05 UTC 2026","","Go Test","github.com/specterops/bloodhound/cmd/api/src/api/v2/auth/TestManagementResource_DeleteAuthToken","TestManagementResource_DeleteAuthToken"
"","414","Selecting an edge with a Computer target node that haslaps is enabled shows correct Windows Abuse text","EdgeInfoContent","Wed Apr 22 18:50:36 UTC 2026","passed","Wed Apr 22 18:50:36 UTC 2026","","","",""
"","1461","handles delete by nested graph data selection","DatabaseManagement","Wed Apr 22 18:55:58 UTC 2026","passed","Wed Apr 22 18:56:00 UTC 2026","","","",""
"","217","will request feature-flags when the user is fully authenticated","app","Wed Apr 22 18:56:21 UTC 2026","passed","Wed Apr 22 18:56:22 UTC 2026","","<Inner />","",""
"","28","renders GraphButton with correct text","GraphControls","Wed Apr 22 18:51:31 UTC 2026","passed","Wed Apr 22 18:51:31 UTC 2026","","Searching current results","",""
"Test cases for TestFloatFromPtr","0","TestFloatFromPtr","","Wed Apr 22 18:49:25 UTC 2026","passed","Wed Apr 22 18:49:25 UTC 2026","","Go Test","github.com/specterops/bloodhound/cmd/api/src/database/types/null/TestFloatFromPtr","TestFloatFromPtr"
"Test cases for TestFillAndPopulateDefaultAdminInfo","0","TestFillAndPopulateDefaultAdminInfo","","Wed Apr 22 18:49:23 UTC 2026","passed","Wed Apr 22 18:49:23 UTC 2026","","Go Test","github.com/specterops/bloodhound/cmd/api/src/bootstrap/TestFillAndPopulateDefaultAdminInfo","TestFillAndPopulateDefaultAdminInfo"
"","99","initializes the list with all filters checked by default","usePathfindingFilters","Wed Apr 22 18:54:45 UTC 2026","passed","Wed Apr 22 18:54:45 UTC 2026","","","",""
"Test cases for TestNewDefaultConfig","0","TestNewDefaultConfig","","Wed Apr 22 18:49:23 UTC 2026","passed","Wed Apr 22 18:49:23 UTC 2026","","Go Test","github.com/specterops/bloodhound/cmd/api/src/config/TestNewDefaultConfig","TestNewDefaultConfig"
"","1700","renders","Glyph Select Dialog","Wed Apr 22 18:54:54 UTC 2026","passed","Wed Apr 22 18:54:55 UTC 2026","","","",""
"","4","returns empty array when environments is empty","filterAndSearchEnvironments","Wed Apr 22 18:50:30 UTC 2026","passed","Wed Apr 22 18:50:30 UTC 2026","","with empty environments","",""
"","41","sets input text to value","ManagedDatePicker - value","Wed Apr 22 18:53:03 UTC 2026","passed","Wed Apr 22 18:53:03 UTC 2026","","","",""
"","423","sets a primarySearch=id and searchType=pathfinding when secondarySearch is truethy","ContextMenu","Wed Apr 22 18:51:47 UTC 2026","passed","Wed Apr 22 18:51:47 UTC 2026","","","",""
"Test cases for TestResources_ListADDomainInboundTrusts","0","TestResources_ListADDomainInboundTrusts","","Wed Apr 22 18:49:22 UTC 2026","passed","Wed Apr 22 18:49:22 UTC 2026","","Go Test","github.com/specterops/bloodhound/cmd/api/src/api/v2/TestResources_ListADDomainInboundTrusts","TestResources_ListADDomainInboundTrusts"
"","224","shows an error state","AssetGroupMenuItem","Wed Apr 22 18:52:02 UTC 2026","passed","Wed Apr 22 18:52:02 UTC 2026","","","",""
"","139","should should reflect the checked state for public query","SavedQueryPermissions","Wed Apr 22 18:53:41 UTC 2026","passed","Wed Apr 22 18:53:41 UTC 2026","","","",""
"Test cases for TestTimeSetValid","0","TestTimeSetValid","","Wed Apr 22 18:49:25 UTC 2026","passed","Wed Apr 22 18:49:25 UTC 2026","","Go Test","github.com/specterops/bloodhound/cmd/api/src/database/types/null/TestTimeSetValid","TestTimeSetValid"
"Test cases for TestTagScanner_NextTopLevelTag","1","TestTagScanner_NextTopLevelTag","","Wed Apr 22 18:49:30 UTC 2026","passed","Wed Apr 22 18:49:30 UTC 2026","","Go Test","github.com/specterops/bloodhound/cmd/api/src/services/upload/TestTagScanner_NextTopLevelTag","TestTagScanner_NextTopLevelTag"
"Test cases for TestResources_ListAcceptedFileUploadTypes","1","TestResources_ListAcceptedFileUploadTypes","","Wed Apr 22 18:49:22 UTC 2026","passed","Wed Apr 22 18:49:22 UTC 2026","","Go Test","github.com/specterops/bloodhound/cmd/api/src/api/v2/TestResources_ListAcceptedFileUploadTypes","TestResources_ListAcceptedFileUploadTypes"
"","6","returns true when WebGL is available in the current browser context","WebGL compatibility check","Wed Apr 22 18:55:28 UTC 2026","passed","Wed Apr 22 18:55:28 UTC 2026","","","",""
"Test cases for TestRateLimitMiddleware","2","TestRateLimitMiddleware","","Wed Apr 22 18:49:15 UTC 2026","passed","Wed Apr 22 18:49:15 UTC 2026","","Go Test","github.com/specterops/bloodhound/cmd/api/src/api/middleware/TestRateLimitMiddleware","TestRateLimitMiddleware"
"","2495","should close the edge filtering dialog when user clicks cancel button","EdgeFilter","Wed Apr 22 18:52:55 UTC 2026","passed","Wed Apr 22 18:52:58 UTC 2026","","","",""
"","353","should render a TagToZoneLabelDialog component","TagToZoneLabelDialog","Wed Apr 22 18:53:14 UTC 2026","passed","Wed Apr 22 18:53:14 UTC 2026","","","",""
"","1","EXTENDED ROUNDING when thresholds are set: does not abbreviate numbers < 10000","numberFormatting","Wed Apr 22 18:53:09 UTC 2026","passed","Wed Apr 22 18:53:09 UTC 2026","","","",""
"","4","shows the collection methods for the given job","toCollected","Wed Apr 22 18:54:55 UTC 2026","passed","Wed Apr 22 18:54:55 UTC 2026","","","",""
"","277","calls the onReset prop when the crop button is clicked","GraphControls","Wed Apr 22 18:51:29 UTC 2026","passed","Wed Apr 22 18:51:29 UTC 2026","","Resetting graph","",""
"","769","calls onSave when valid form inputs are provided","PasswordDialog","Wed Apr 22 18:50:53 UTC 2026","passed","Wed Apr 22 18:50:53 UTC 2026","","","",""
"Test cases for TestQueries_BuildEntityQueryParams_InvalidSkip","0","TestQueries_BuildEntityQueryParams_InvalidSkip","","Wed Apr 22 18:49:27 UTC 2026","passed","Wed Apr 22 18:49:27 UTC 2026","","Go Test","github.com/specterops/bloodhound/cmd/api/src/queries/TestQueries_BuildEntityQueryParams_InvalidSkip","TestQueries_BuildEntityQueryParams_InvalidSkip"
"","64","sets autoDisplayTable to true if query returns nodes only, searchType = cypher, and and enabled is true","useExploreTableAutoDisplay","Wed Apr 22 18:54:17 UTC 2026","passed","Wed Apr 22 18:54:17 UTC 2026","","","",""
"","0","returns true if arrays have same content in different order","areArraysSimilar","Wed Apr 22 18:54:59 UTC 2026","passed","Wed Apr 22 18:54:59 UTC 2026","","","",""
"","0","fails for password shorter than 12 characters","testPassword","Wed Apr 22 18:55:21 UTC 2026","passed","Wed Apr 22 18:55:21 UTC 2026","","","",""
"Test cases for TestGetAzureDataQualityStats_Success","3","TestGetAzureDataQualityStats_Success","","Wed Apr 22 18:49:22 UTC 2026","passed","Wed Apr 22 18:49:22 UTC 2026","","Go Test","github.com/specterops/bloodhound/cmd/api/src/api/v2/TestGetAzureDataQualityStats_Success","TestGetAzureDataQualityStats_Success"
"Test cases for TestNewSIDSuffix","0","TestNewSIDSuffix","","Wed Apr 22 18:49:44 UTC 2026","passed","Wed Apr 22 18:49:44 UTC 2026","","Go Test","github.com/specterops/bloodhound/packages/go/analysis/ad/wellknown/TestNewSIDSuffix","TestNewSIDSuffix"
"Test cases for TestExpireUserAuthSecret_Failure","0","TestExpireUserAuthSecret_Failure","","Wed Apr 22 18:49:28 UTC 2026","passed","Wed Apr 22 18:49:28 UTC 2026","","Go Test","github.com/specterops/bloodhound/cmd/api/src/api/v2/auth/TestExpireUserAuthSecret_Failure","TestExpireUserAuthSecret_Failure"
"Test cases for TestManagementResource_ListAuthTokens_UserIDFilter","0","TestManagementResource_ListAuthTokens_UserIDFilter","","Wed Apr 22 18:49:52 UTC 2026","passed","Wed Apr 22 18:49:52 UTC 2026","","Go Test","github.com/specterops/bloodhound/cmd/api/src/api/v2/auth/TestManagementResource_ListAuthTokens_UserIDFilter","TestManagementResource_ListAuthTokens_UserIDFilter"
"","238","eventually displays a list of early access features when warning dialog is accepted","EarlyAccessFeatures","Wed Apr 22 18:56:14 UTC 2026","passed","Wed Apr 22 18:56:14 UTC 2026","","","",""
"","0","should return an empty map when no tags or paths match","opsFilter","Wed Apr 22 18:54:19 UTC 2026","passed","Wed Apr 22 18:54:19 UTC 2026","","","",""
"Test cases for TestResources_GetAssetGroupMemberCount_IDMalformed","0","TestResources_GetAssetGroupMemberCount_IDMalformed","","Wed Apr 22 18:49:22 UTC 2026","passed","Wed Apr 22 18:49:22 UTC 2026","","Go Test","github.com/specterops/bloodhound/cmd/api/src/api/v2/TestResources_GetAssetGroupMemberCount_IDMalformed","TestResources_GetAssetGroupMemberCount_IDMalformed"
"","1655","renders correct search elements after keypresses","GraphView","Wed Apr 22 18:56:10 UTC 2026","passed","Wed Apr 22 18:56:12 UTC 2026","","","",""
"Test cases for TestResources_ListADEntityConstrainedDelegationRights","0","TestResources_ListADEntityConstrainedDelegationRights","","Wed Apr 22 18:49:22 UTC 2026","passed","Wed Apr 22 18:49:22 UTC 2026","","Go Test","github.com/specterops/bloodhound/cmd/api/src/api/v2/TestResources_ListADEntityConstrainedDelegationRights","TestResources_ListADEntityConstrainedDelegationRights"
"Test cases for TestStringSetValid","0","TestStringSetValid","","Wed Apr 22 18:49:25 UTC 2026","passed","Wed Apr 22 18:49:25 UTC 2026","","Go Test","github.com/specterops/bloodhound/cmd/api/src/database/types/null/TestStringSetValid","TestStringSetValid"
"","83","renders a ListItemActionMenu component","ListItemActionMenu","Wed Apr 22 18:53:47 UTC 2026","passed","Wed Apr 22 18:53:47 UTC 2026","","","",""
"Test cases for TestResources_DeleteSavedQuery_RecordNotFound","0","TestResources_DeleteSavedQuery_RecordNotFound","","Wed Apr 22 18:49:22 UTC 2026","passed","Wed Apr 22 18:49:22 UTC 2026","","Go Test","github.com/specterops/bloodhound/cmd/api/src/api/v2/TestResources_DeleteSavedQuery_RecordNotFound","TestResources_DeleteSavedQuery_RecordNotFound"
"","140","calls handleInitialEnvironment with the highest impactValue as the initial environment","useInitialEnvironment","Wed Apr 22 18:54:13 UTC 2026","passed","Wed Apr 22 18:54:13 UTC 2026","","","",""
"","0","should handle an entity that has no name property","Evaluating the entity display name from a given entity","Wed Apr 22 18:52:02 UTC 2026","passed","Wed Apr 22 18:52:02 UTC 2026","","","",""
"Test cases for TestGenerateRandomBase64String","0","TestGenerateRandomBase64String","","Wed Apr 22 18:49:23 UTC 2026","passed","Wed Apr 22 18:49:23 UTC 2026","","Go Test","github.com/specterops/bloodhound/cmd/api/src/config/TestGenerateRandomBase64String","TestGenerateRandomBase64String"
"Test cases for Test_GetAssetGroupMembersBySelector","7","Test_GetAssetGroupMembersBySelector","","Wed Apr 22 18:49:22 UTC 2026","passed","Wed Apr 22 18:49:22 UTC 2026","","Go Test","github.com/specterops/bloodhound/cmd/api/src/api/v2/Test_GetAssetGroupMembersBySelector","Test_GetAssetGroupMembersBySelector"
"","147","renders count for a selected zone if prop is set","DynamicDetails","Wed Apr 22 18:52:25 UTC 2026","passed","Wed Apr 22 18:52:25 UTC 2026","","","",""
"Test cases for TestStringPointer","0","TestStringPointer","","Wed Apr 22 18:49:25 UTC 2026","passed","Wed Apr 22 18:49:25 UTC 2026","","Go Test","github.com/specterops/bloodhound/cmd/api/src/database/types/null/TestStringPointer","TestStringPointer"
"Test cases for Test_GetAssetGroupMembersByTag","5","Test_GetAssetGroupMembersByTag","","Wed Apr 22 18:49:22 UTC 2026","passed","Wed Apr 22 18:49:22 UTC 2026","","Go Test","github.com/specterops/bloodhound/cmd/api/src/api/v2/Test_GetAssetGroupMembersByTag","Test_GetAssetGroupMembersByTag"
"Test cases for TestGormLogAdapter_Info","0","TestGormLogAdapter_Info","","Wed Apr 22 18:49:24 UTC 2026","passed","Wed Apr 22 18:49:24 UTC 2026","","Go Test","github.com/specterops/bloodhound/cmd/api/src/database/TestGormLogAdapter_Info","TestGormLogAdapter_Info"
"Test cases for TestManagementResource_UpdateUser_ETAC","3241","TestManagementResource_UpdateUser_ETAC","","Wed Apr 22 18:49:49 UTC 2026","passed","Wed Apr 22 18:49:52 UTC 2026","","Go Test","github.com/specterops/bloodhound/cmd/api/src/api/v2/auth/TestManagementResource_UpdateUser_ETAC","TestManagementResource_UpdateUser_ETAC"
"","7","updates key in state","useObjectState","Wed Apr 22 18:54:37 UTC 2026","passed","Wed Apr 22 18:54:37 UTC 2026","","","",""
"Test cases for TestArgon2Digest_String","1","TestArgon2Digest_String","","Wed Apr 22 18:49:45 UTC 2026","passed","Wed Apr 22 18:49:45 UTC 2026","","Go Test","github.com/specterops/bloodhound/packages/go/crypto/TestArgon2Digest_String","TestArgon2Digest_String"
"","69","has a button with text Clear Filters","AssetGroupEdit","Wed Apr 22 18:52:09 UTC 2026","passed","Wed Apr 22 18:52:09 UTC 2026","","Clear Filters button","",""
"","124","initializes search tab to the exploreSearchTab on initial render","ExploreSearch sets searchType on tab changing","Wed Apr 22 18:55:53 UTC 2026","passed","Wed Apr 22 18:55:53 UTC 2026","","","",""
"","363","should call onSubmit with one time passcode when check code button clicked","OneTimePasscodeForm","Wed Apr 22 18:54:33 UTC 2026","passed","Wed Apr 22 18:54:33 UTC 2026","","","",""
"","0","The node radius is adjusted to take into account the current camera zoom ratio","getNodeRadius","Wed Apr 22 18:56:23 UTC 2026","passed","Wed Apr 22 18:56:23 UTC 2026","","","",""
"","2","does not add optional filters if not present","createHistoryParams","Wed Apr 22 18:54:28 UTC 2026","passed","Wed Apr 22 18:54:28 UTC 2026","","","",""
"","87","should display locally formatted numbers if they are larger than 999","LoadContainer","Wed Apr 22 18:55:29 UTC 2026","passed","Wed Apr 22 18:55:29 UTC 2026","","","",""
"Test cases for TestDatabase_NullUUID","0","TestDatabase_NullUUID","","Wed Apr 22 18:49:24 UTC 2026","passed","Wed Apr 22 18:49:24 UTC 2026","","Go Test","github.com/specterops/bloodhound/cmd/api/src/database/TestDatabase_NullUUID","TestDatabase_NullUUID"
"","29","renders a list of pre-built searches and displays categories and subcategories one time","PrebuiltSearchList","Wed Apr 22 18:53:12 UTC 2026","passed","Wed Apr 22 18:53:12 UTC 2026","","","",""
"","1","floors DateTime objects to the nearest minute","floorToNearestMinute","Wed Apr 22 18:54:37 UTC 2026","passed","Wed Apr 22 18:54:37 UTC 2026","","","",""
"","17","upon performing a search, updates the url params with the base64-encoded current query and sets searchType to 'cypher'","useCypherSearch","Wed Apr 22 18:54:53 UTC 2026","passed","Wed Apr 22 18:54:53 UTC 2026","","","",""
"","1","will return a list of values","Formatting list properties","Wed Apr 22 18:52:02 UTC 2026","passed","Wed Apr 22 18:52:02 UTC 2026","","","",""
"","164","a name value is required to submit the form","Tag Form","Wed Apr 22 18:50:17 UTC 2026","passed","Wed Apr 22 18:50:17 UTC 2026","","","",""
"","433","handles a selection as expected","DropdownSelector","Wed Apr 22 18:54:03 UTC 2026","passed","Wed Apr 22 18:54:03 UTC 2026","","","",""
