"DESCRIPTION","DURATION IN MS","NAME","PARENT SUITE","START TIME","STATUS","STOP TIME","SUB SUITE","SUITE","TEST CLASS","TEST METHOD"
"Test cases for TestResources_ListADUserSessions","0","TestResources_ListADUserSessions","","Wed Apr 22 18:49:22 UTC 2026","passed","Wed Apr 22 18:49:22 UTC 2026","","Go Test","github.com/specterops/bloodhound/cmd/api/src/api/v2/TestResources_ListADUserSessions","TestResources_ListADUserSessions"
"Test cases for TestResources_EndIngestJob","57","TestResources_EndIngestJob","","Wed Apr 22 18:49:22 UTC 2026","passed","Wed Apr 22 18:49:22 UTC 2026","","Go Test","github.com/specterops/bloodhound/cmd/api/src/api/v2/TestResources_EndIngestJob","TestResources_EndIngestJob"
"","278","shows all extensions when search is cleared","ActiveExtensionsCard","Wed Apr 22 18:50:36 UTC 2026","passed","Wed Apr 22 18:50:37 UTC 2026","","","",""
"","354","renders the Rule Tab content when Rule tab is chosen","Selected Details Tab Content","Wed Apr 22 18:54:32 UTC 2026","passed","Wed Apr 22 18:54:32 UTC 2026","","","",""
"","609","when an `inputValue` is provided it eventually displays a list of search results","ExploreSearchCombobox","Wed Apr 22 18:52:08 UTC 2026","passed","Wed Apr 22 18:52:08 UTC 2026","","","",""
"","1793","renders","DatabaseManagement","Wed Apr 22 18:55:49 UTC 2026","passed","Wed Apr 22 18:55:51 UTC 2026","","","",""
"","227","passes item props to Header and Content","<DetailsAccordion />","Wed Apr 22 18:51:53 UTC 2026","passed","Wed Apr 22 18:51:53 UTC 2026","","","",""
"","69","includes all traversable OpenGraph edges in their own category when they are available via the API","useEdgeCategories","Wed Apr 22 18:52:13 UTC 2026","passed","Wed Apr 22 18:52:13 UTC 2026","","","",""
"Test cases for Test_ParseGraphSortParameters_Success","0","Test_ParseGraphSortParameters_Success","","Wed Apr 22 18:49:13 UTC 2026","passed","Wed Apr 22 18:49:13 UTC 2026","","Go Test","github.com/specterops/bloodhound/cmd/api/src/api/Test_ParseGraphSortParameters_Success","Test_ParseGraphSortParameters_Success"
"Test cases for FuzzFoldr","0","FuzzFoldr","","Wed Apr 22 18:49:57 UTC 2026","passed","Wed Apr 22 18:49:57 UTC 2026","","Go Test","github.com/specterops/bloodhound/packages/go/slicesext/FuzzFoldr","FuzzFoldr"
"","501","clears the applied filter","FileIngestFilterDialog","Wed Apr 22 18:51:41 UTC 2026","passed","Wed Apr 22 18:51:42 UTC 2026","","Status Select","",""
"","72","renders the title","ProcessingIndicator","Wed Apr 22 18:55:23 UTC 2026","passed","Wed Apr 22 18:55:23 UTC 2026","","","",""
"","220","validates that the name input is under the max length","Tag Form","Wed Apr 22 18:50:17 UTC 2026","passed","Wed Apr 22 18:50:18 UTC 2026","","","",""
"","14","returns the OpenGraph environmentInfo when environmentAggregation param is not a known type","useAvailableEnvironments","Wed Apr 22 18:52:48 UTC 2026","passed","Wed Apr 22 18:52:48 UTC 2026","","useSelectedEnvironment","",""
"","408","should call onClose when cancel button is clicked","SaveQueryDialog","Wed Apr 22 18:50:18 UTC 2026","passed","Wed Apr 22 18:50:18 UTC 2026","","","",""
"Test cases for Test_FixtureSetup","0","Test_FixtureSetup","","Wed Apr 22 18:49:45 UTC 2026","passed","Wed Apr 22 18:49:45 UTC 2026","","Go Test","github.com/specterops/bloodhound/packages/go/lab/Test_FixtureSetup","Test_FixtureSetup"
"","233","should handle close event","TagToZoneLabelDialog","Wed Apr 22 18:53:14 UTC 2026","passed","Wed Apr 22 18:53:15 UTC 2026","","","",""
"","2","treats a missing key as null when computing the next value","useLocalStorage","Wed Apr 22 18:52:27 UTC 2026","passed","Wed Apr 22 18:52:27 UTC 2026","","functional updater","",""
"Test cases for TestResources_ListAuditLogs","0","TestResources_ListAuditLogs","","Wed Apr 22 18:49:22 UTC 2026","passed","Wed Apr 22 18:49:22 UTC 2026","","Go Test","github.com/specterops/bloodhound/cmd/api/src/api/v2/TestResources_ListAuditLogs","TestResources_ListAuditLogs"
"","58","Error handling for fetching edge information","EdgeObjectInformation","Wed Apr 22 18:53:25 UTC 2026","passed","Wed Apr 22 18:53:25 UTC 2026","","","",""
"","174","should display a toggle switch to enable multi-factor authentication","UserProfile","Wed Apr 22 18:52:21 UTC 2026","passed","Wed Apr 22 18:52:21 UTC 2026","","","",""
"Test cases for TestResources_ListCAPKIHierarchy","1","TestResources_ListCAPKIHierarchy","","Wed Apr 22 18:49:22 UTC 2026","passed","Wed Apr 22 18:49:22 UTC 2026","","Go Test","github.com/specterops/bloodhound/cmd/api/src/api/v2/TestResources_ListCAPKIHierarchy","TestResources_ListCAPKIHierarchy"
"","234","The API key management option should appear in profile page if the user is configured for SAML login","UserProfile with SSO User","Wed Apr 22 18:52:19 UTC 2026","passed","Wed Apr 22 18:52:19 UTC 2026","","","",""
"","21","renders details for a selected rule and is of type ""Object""","DynamicDetails","Wed Apr 22 18:52:25 UTC 2026","passed","Wed Apr 22 18:52:25 UTC 2026","","","",""
"Test cases for TestUnmarshalTimeJSON","0","TestUnmarshalTimeJSON","","Wed Apr 22 18:49:25 UTC 2026","passed","Wed Apr 22 18:49:25 UTC 2026","","Go Test","github.com/specterops/bloodhound/cmd/api/src/database/types/null/TestUnmarshalTimeJSON","TestUnmarshalTimeJSON"
"","816","dark mode should persist between logging in and out","redux store","Wed Apr 22 18:56:25 UTC 2026","passed","Wed Apr 22 18:56:26 UTC 2026","","","",""
"","454","toggles a source kind off from all selected nested graph data options","GraphDataCheckboxes","Wed Apr 22 18:51:16 UTC 2026","passed","Wed Apr 22 18:51:16 UTC 2026","","","",""
"","10","should render a Field when the provided value is -0","Field","Wed Apr 22 18:54:48 UTC 2026","passed","Wed Apr 22 18:54:48 UTC 2026","","","",""
"","18","shows hint by default","ManagedDatePicker - placeholders","Wed Apr 22 18:53:03 UTC 2026","passed","Wed Apr 22 18:53:03 UTC 2026","","","",""
"","134","buttons are disabled while loading","PasswordResetForm","Wed Apr 22 18:52:55 UTC 2026","passed","Wed Apr 22 18:52:55 UTC 2026","","","",""
"","227","on clicking switch shows modal and when clicking confirm closes it and switch changes to disabled","CitrixRDPConfiguration","Wed Apr 22 18:52:14 UTC 2026","passed","Wed Apr 22 18:52:14 UTC 2026","","Click on switch to disable","",""
"","0","fails for password without lowercase letters","testPassword","Wed Apr 22 18:55:21 UTC 2026","passed","Wed Apr 22 18:55:21 UTC 2026","","","",""
"","333","adds a ""Close"" button that closes the dialog after a failed upload","SchemaUploadDialog","Wed Apr 22 18:51:34 UTC 2026","passed","Wed Apr 22 18:51:34 UTC 2026","","","",""
"","3127","categories default to expanded","Pathfinding","Wed Apr 22 18:50:49 UTC 2026","passed","Wed Apr 22 18:50:53 UTC 2026","","","",""
"","158","should fire Cancel once with false","DeleteConfirmationDialog","Wed Apr 22 18:54:49 UTC 2026","passed","Wed Apr 22 18:54:49 UTC 2026","","","",""
"","62","correctly handles the hygiene ID with value 0 by not omitting it in the params value even though 0 is falsey","usePZQueryParams","Wed Apr 22 18:53:27 UTC 2026","passed","Wed Apr 22 18:53:27 UTC 2026","","","",""
"","1","filters by critical risk level","filterAndSearchEnvironments","Wed Apr 22 18:50:30 UTC 2026","passed","Wed Apr 22 18:50:30 UTC 2026","","risk filters","",""
"Test cases for TestTimePointer","0","TestTimePointer","","Wed Apr 22 18:49:25 UTC 2026","passed","Wed Apr 22 18:49:25 UTC 2026","","Go Test","github.com/specterops/bloodhound/cmd/api/src/database/types/null/TestTimePointer","TestTimePointer"
"Test cases for TestResources_ListAvailableEnvironments","26","TestResources_ListAvailableEnvironments","","Wed Apr 22 18:49:22 UTC 2026","passed","Wed Apr 22 18:49:22 UTC 2026","","Go Test","github.com/specterops/bloodhound/cmd/api/src/api/v2/TestResources_ListAvailableEnvironments","TestResources_ListAvailableEnvironments"
"Test cases for TestConvertAzureRoleEligibilityScheduleInstanceToRel","0","TestConvertAzureRoleEligibilityScheduleInstanceToRel","","Wed Apr 22 18:49:45 UTC 2026","passed","Wed Apr 22 18:49:45 UTC 2026","","Go Test","github.com/specterops/bloodhound/packages/go/ein/TestConvertAzureRoleEligibilityScheduleInstanceToRel","TestConvertAzureRoleEligibilityScheduleInstanceToRel"
"Test cases for TestResources_ExportSavedQueries","4","TestResources_ExportSavedQueries","","Wed Apr 22 18:49:22 UTC 2026","passed","Wed Apr 22 18:49:22 UTC 2026","","Go Test","github.com/specterops/bloodhound/cmd/api/src/api/v2/TestResources_ExportSavedQueries","TestResources_ExportSavedQueries"
"","15","Calls the cypher search endpoint for a node that is hidden from user with not all environments access","EntityObjectInformation","Wed Apr 22 18:53:02 UTC 2026","passed","Wed Apr 22 18:53:02 UTC 2026","","","",""
"Test cases for TestUnmarshalString","0","TestUnmarshalString","","Wed Apr 22 18:49:25 UTC 2026","passed","Wed Apr 22 18:49:25 UTC 2026","","Go Test","github.com/specterops/bloodhound/cmd/api/src/database/types/null/TestUnmarshalString","TestUnmarshalString"
"","202","should display error message when error prop is provided","UpdateUserDialog","Wed Apr 22 18:51:07 UTC 2026","passed","Wed Apr 22 18:51:07 UTC 2026","","","",""
"Test cases for TestResources_ListADDomainForeignGPOControllers","0","TestResources_ListADDomainForeignGPOControllers","","Wed Apr 22 18:49:22 UTC 2026","passed","Wed Apr 22 18:49:22 UTC 2026","","Go Test","github.com/specterops/bloodhound/cmd/api/src/api/v2/TestResources_ListADDomainForeignGPOControllers","TestResources_ListADDomainForeignGPOControllers"
"","49","calls openSAMLProviderDialog when create provider button is clicked","CreateMenu","Wed Apr 22 18:52:08 UTC 2026","passed","Wed Apr 22 18:52:08 UTC 2026","","oidc_support feature flag disabled","",""
"Test cases for TestManagementResource_DeleteUser_UserCannotSelfDelete","1387","TestManagementResource_DeleteUser_UserCannotSelfDelete","","Wed Apr 22 18:49:43 UTC 2026","passed","Wed Apr 22 18:49:44 UTC 2026","","Go Test","github.com/specterops/bloodhound/cmd/api/src/api/v2/auth/TestManagementResource_DeleteUser_UserCannotSelfDelete","TestManagementResource_DeleteUser_UserCannotSelfDelete"
"Test cases for TestSortJSONArrays","3","TestSortJSONArrays","","Wed Apr 22 18:49:44 UTC 2026","passed","Wed Apr 22 18:49:44 UTC 2026","","Go Test","github.com/specterops/bloodhound/cmd/api/src/utils/test/TestSortJSONArrays","TestSortJSONArrays"
"Test cases for TestResources_GetRootCAEntityInfo","141","TestResources_GetRootCAEntityInfo","","Wed Apr 22 18:49:22 UTC 2026","passed","Wed Apr 22 18:49:22 UTC 2026","","Go Test","github.com/specterops/bloodhound/cmd/api/src/api/v2/TestResources_GetRootCAEntityInfo","TestResources_GetRootCAEntityInfo"
"","244","dispatches an action to the delete the associated node","Rule Object Select","Wed Apr 22 18:53:53 UTC 2026","passed","Wed Apr 22 18:53:54 UTC 2026","","","",""
"","764","shows indeterminate states when some graph data is selected","GraphDataCheckboxes","Wed Apr 22 18:51:14 UTC 2026","passed","Wed Apr 22 18:51:14 UTC 2026","","","",""
"Test cases for TestHasValidRolesForETAC","0","TestHasValidRolesForETAC","","Wed Apr 22 18:49:22 UTC 2026","passed","Wed Apr 22 18:49:22 UTC 2026","","Go Test","github.com/specterops/bloodhound/cmd/api/src/api/v2/auth/TestHasValidRolesForETAC","TestHasValidRolesForETAC"
"Test cases for TestBuildErrorResponseDefault","0","TestBuildErrorResponseDefault","","Wed Apr 22 18:49:13 UTC 2026","passed","Wed Apr 22 18:49:13 UTC 2026","","Go Test","github.com/specterops/bloodhound/cmd/api/src/api/TestBuildErrorResponseDefault","TestBuildErrorResponseDefault"
"Test cases for TestResources_CancelAnalysisRequest","113","TestResources_CancelAnalysisRequest","","Wed Apr 22 18:49:22 UTC 2026","passed","Wed Apr 22 18:49:22 UTC 2026","","Go Test","github.com/specterops/bloodhound/cmd/api/src/api/v2/TestResources_CancelAnalysisRequest","TestResources_CancelAnalysisRequest"
"","16","sets autoDisplayTable to false if query type is relationship","useExploreTableAutoDisplay","Wed Apr 22 18:54:17 UTC 2026","passed","Wed Apr 22 18:54:17 UTC 2026","","","",""
"Test cases for TestResources_ListPublishedToCAs","0","TestResources_ListPublishedToCAs","","Wed Apr 22 18:49:22 UTC 2026","passed","Wed Apr 22 18:49:22 UTC 2026","","Go Test","github.com/specterops/bloodhound/cmd/api/src/api/v2/TestResources_ListPublishedToCAs","TestResources_ListPublishedToCAs"
"","125","requests finished jobs","useFinishedJobs","Wed Apr 22 18:52:42 UTC 2026","passed","Wed Apr 22 18:52:42 UTC 2026","","","",""
"Test cases for TestConvertDomainToNode_DomainInvalidProperties","0","TestConvertDomainToNode_DomainInvalidProperties","","Wed Apr 22 18:49:45 UTC 2026","passed","Wed Apr 22 18:49:45 UTC 2026","","Go Test","github.com/specterops/bloodhound/packages/go/ein/TestConvertDomainToNode_DomainInvalidProperties","TestConvertDomainToNode_DomainInvalidProperties"
"","1079","shows a table with partially completed jobs","FileIngestTable","Wed Apr 22 18:52:52 UTC 2026","passed","Wed Apr 22 18:52:53 UTC 2026","","","",""
"Test cases for TestResources_ListADDomainForeignAdmins","0","TestResources_ListADDomainForeignAdmins","","Wed Apr 22 18:49:22 UTC 2026","passed","Wed Apr 22 18:49:22 UTC 2026","","Go Test","github.com/specterops/bloodhound/cmd/api/src/api/v2/TestResources_ListADDomainForeignAdmins","TestResources_ListADDomainForeignAdmins"
"","2082","should clear out the SSO Provider id from submission data when the authentication method is changed","CreateUserDialog","Wed Apr 22 18:50:56 UTC 2026","passed","Wed Apr 22 18:50:58 UTC 2026","","","",""
"Test cases for TestGetADDataQualityStats_Failure","0","TestGetADDataQualityStats_Failure","","Wed Apr 22 18:49:22 UTC 2026","passed","Wed Apr 22 18:49:22 UTC 2026","","Go Test","github.com/specterops/bloodhound/cmd/api/src/api/v2/TestGetADDataQualityStats_Failure","TestGetADDataQualityStats_Failure"
"Test cases for TestRandomDurationBetween","15","TestRandomDurationBetween","","Wed Apr 22 18:49:23 UTC 2026","passed","Wed Apr 22 18:49:23 UTC 2026","","Go Test","github.com/specterops/bloodhound/cmd/api/src/daemons/datapipe/TestRandomDurationBetween","TestRandomDurationBetween"
"","0","should compute the length of a line segment","bezier","Wed Apr 22 18:56:14 UTC 2026","passed","Wed Apr 22 18:56:14 UTC 2026","","","",""
"","183","calls clickHandler when a line item is clicked","PrebuiltSearchList","Wed Apr 22 18:53:11 UTC 2026","passed","Wed Apr 22 18:53:11 UTC 2026","","","",""
"","14","should be aligned to right of screen","GenericErrorBoundaryFallback","Wed Apr 22 18:55:26 UTC 2026","passed","Wed Apr 22 18:55:26 UTC 2026","","","",""
"Test cases for TestInvalidValueError","0","TestInvalidValueError","","Wed Apr 22 18:49:45 UTC 2026","passed","Wed Apr 22 18:49:45 UTC 2026","","Go Test","github.com/specterops/bloodhound/packages/go/cache/TestInvalidValueError","TestInvalidValueError"
"Test cases for TestFormatDatabaseErrorNotFound","0","TestFormatDatabaseErrorNotFound","","Wed Apr 22 18:49:13 UTC 2026","passed","Wed Apr 22 18:49:13 UTC 2026","","Go Test","github.com/specterops/bloodhound/cmd/api/src/api/TestFormatDatabaseErrorNotFound","TestFormatDatabaseErrorNotFound"
"","11","constructs correct URLSearchParams with all filters","createHistoryParams","Wed Apr 22 18:54:28 UTC 2026","passed","Wed Apr 22 18:54:28 UTC 2026","","","",""
"","879","should render many sections with many navigation items","SubNav","Wed Apr 22 18:54:09 UTC 2026","passed","Wed Apr 22 18:54:10 UTC 2026","","","",""
"Test cases for TestFloatEqual","0","TestFloatEqual","","Wed Apr 22 18:49:25 UTC 2026","passed","Wed Apr 22 18:49:25 UTC 2026","","Go Test","github.com/specterops/bloodhound/cmd/api/src/database/types/null/TestFloatEqual","TestFloatEqual"
"Test cases for TestManagementResource_ListUsers_DBError","0","TestManagementResource_ListUsers_DBError","","Wed Apr 22 18:49:28 UTC 2026","passed","Wed Apr 22 18:49:28 UTC 2026","","Go Test","github.com/specterops/bloodhound/cmd/api/src/api/v2/auth/TestManagementResource_ListUsers_DBError","TestManagementResource_ListUsers_DBError"
"","120","passes check if the user has a required permission","usePermissions","Wed Apr 22 18:52:13 UTC 2026","passed","Wed Apr 22 18:52:13 UTC 2026","","","",""
"","2","rounds down fractional minutes/days","getSimpleDuration","Wed Apr 22 18:54:37 UTC 2026","passed","Wed Apr 22 18:54:37 UTC 2026","","","",""
"","67","should navigate to the correct page on alt + digit keydown","Keyboard shortcuts","Wed Apr 22 18:52:26 UTC 2026","passed","Wed Apr 22 18:52:26 UTC 2026","","","",""
"","107","displays the value thats passed via children","CodeController","Wed Apr 22 18:55:05 UTC 2026","passed","Wed Apr 22 18:55:05 UTC 2026","","","",""
"","818","should call onSave when Save button is clicked and form input is valid","UpdateUserDialog","Wed Apr 22 18:51:04 UTC 2026","passed","Wed Apr 22 18:51:04 UTC 2026","","","",""
"","184","shows ""Select All"" when not all columns are selected","ManageColumnsComboBox","Wed Apr 22 18:51:54 UTC 2026","passed","Wed Apr 22 18:51:54 UTC 2026","","","",""
"Test cases for TestUnmarshalFloat","0","TestUnmarshalFloat","","Wed Apr 22 18:49:25 UTC 2026","passed","Wed Apr 22 18:49:25 UTC 2026","","Go Test","github.com/specterops/bloodhound/cmd/api/src/database/types/null/TestUnmarshalFloat","TestUnmarshalFloat"
"","142","renders a button for opening the dialog","SchemaUploadDialog","Wed Apr 22 18:51:32 UTC 2026","passed","Wed Apr 22 18:51:32 UTC 2026","","","",""
"Test cases for TestResources_GetAnalysisRequest","0","TestResources_GetAnalysisRequest","","Wed Apr 22 18:49:22 UTC 2026","passed","Wed Apr 22 18:49:22 UTC 2026","","Go Test","github.com/specterops/bloodhound/cmd/api/src/api/v2/TestResources_GetAnalysisRequest","TestResources_GetAnalysisRequest"
"Test cases for TestManagementResource_ListUsers_InvalidFilterPredicate","0","TestManagementResource_ListUsers_InvalidFilterPredicate","","Wed Apr 22 18:49:28 UTC 2026","passed","Wed Apr 22 18:49:28 UTC 2026","","Go Test","github.com/specterops/bloodhound/cmd/api/src/api/v2/auth/TestManagementResource_ListUsers_InvalidFilterPredicate","TestManagementResource_ListUsers_InvalidFilterPredicate"
"","0","returns fallback Cypher message when ruleType is undefined and seeds are required","getErrorMessage","Wed Apr 22 18:51:35 UTC 2026","passed","Wed Apr 22 18:51:35 UTC 2026","","","",""
"","1","returns graphData as is if it doesnt match the GraphResponse interface","normalizeGraphDataForSigma","Wed Apr 22 18:56:31 UTC 2026","passed","Wed Apr 22 18:56:31 UTC 2026","","","",""
"Test cases for TestGC_Name","0","TestGC_Name","","Wed Apr 22 18:49:23 UTC 2026","passed","Wed Apr 22 18:49:23 UTC 2026","","Go Test","github.com/specterops/bloodhound/cmd/api/src/daemons/gc/TestGC_Name","TestGC_Name"
"","161","displays Force Password Reset checkbox when showNeedsPasswordReset is true","PasswordDialog","Wed Apr 22 18:50:48 UTC 2026","passed","Wed Apr 22 18:50:49 UTC 2026","","","",""
"","75","clicking cancel on the form takes the user back to the page the user was on previously","Tag Form","Wed Apr 22 18:50:17 UTC 2026","passed","Wed Apr 22 18:50:17 UTC 2026","","","",""
"","7","handles ISO 8601 formatted date strings and converts it into our standard date display format","Formatting string properties","Wed Apr 22 18:52:02 UTC 2026","passed","Wed Apr 22 18:52:02 UTC 2026","","","",""
"","1","should return the edge parts from the key","getEdgeDataFromKey","Wed Apr 22 18:56:31 UTC 2026","passed","Wed Apr 22 18:56:31 UTC 2026","","","",""
"Test cases for TestEncodingInterface","0","TestEncodingInterface","","Wed Apr 22 18:49:45 UTC 2026","passed","Wed Apr 22 18:49:45 UTC 2026","","Go Test","github.com/specterops/bloodhound/packages/go/bomenc/TestEncodingInterface","TestEncodingInterface"
"","107","renders a list of pre-built searches","PrebuiltSearchList","Wed Apr 22 18:53:11 UTC 2026","passed","Wed Apr 22 18:53:11 UTC 2026","","","",""
"Test cases for TestCreateAssetGroupRequest_AuditData","0","TestCreateAssetGroupRequest_AuditData","","Wed Apr 22 18:49:22 UTC 2026","passed","Wed Apr 22 18:49:22 UTC 2026","","Go Test","github.com/specterops/bloodhound/cmd/api/src/api/v2/TestCreateAssetGroupRequest_AuditData","TestCreateAssetGroupRequest_AuditData"
"","746","renders the Platforms dropdown and handles click event","QuerySearchFilter","Wed Apr 22 18:53:25 UTC 2026","passed","Wed Apr 22 18:53:26 UTC 2026","","","",""
"","78","if a hint is given, it show date placeholder on focus, restores hint on blur","ManagedDatePicker - placeholders","Wed Apr 22 18:53:03 UTC 2026","passed","Wed Apr 22 18:53:03 UTC 2026","","","",""
"","0","The node radius is adjusted for nodes that have their ""highlighted"" property set to true since the highlight adds some padding","getNodeRadius","Wed Apr 22 18:56:23 UTC 2026","passed","Wed Apr 22 18:56:23 UTC 2026","","","",""
"","740","app does not crash if ""token"" cookie exists and ""persistedState"" localstorage key does not exist","redux store","Wed Apr 22 18:56:26 UTC 2026","passed","Wed Apr 22 18:56:27 UTC 2026","","","",""
"","120","should render all of the options as checkboxes","Checkbox group","Wed Apr 22 18:55:04 UTC 2026","passed","Wed Apr 22 18:55:04 UTC 2026","","","",""
"","17","should filter properties that we do not want to display in the entity panel","ObjectInfoFields","Wed Apr 22 18:54:48 UTC 2026","passed","Wed Apr 22 18:54:48 UTC 2026","","","",""
"Test cases for TestDomainSelectors_GetFilterCriteria_Domain","0","TestDomainSelectors_GetFilterCriteria_Domain","","Wed Apr 22 18:49:25 UTC 2026","passed","Wed Apr 22 18:49:25 UTC 2026","","Go Test","github.com/specterops/bloodhound/cmd/api/src/model/TestDomainSelectors_GetFilterCriteria_Domain","TestDomainSelectors_GetFilterCriteria_Domain"
"","21","removes key from state","useObjectState","Wed Apr 22 18:54:37 UTC 2026","passed","Wed Apr 22 18:54:37 UTC 2026","","","",""
"","273","renders the QuerySearchFilter component","QuerySearchFilter","Wed Apr 22 18:53:25 UTC 2026","passed","Wed Apr 22 18:53:25 UTC 2026","","","",""
"","821","renders a filter search and platform dropdown menu","CommonSearches","Wed Apr 22 18:51:58 UTC 2026","passed","Wed Apr 22 18:51:58 UTC 2026","","","",""
"","24","the queries in the list only include nodes and edges that are defined in our schema","common search list","Wed Apr 22 18:54:57 UTC 2026","passed","Wed Apr 22 18:54:57 UTC 2026","","","",""
"","333","clears the applied filter","FileIngestFilterDialog","Wed Apr 22 18:51:44 UTC 2026","passed","Wed Apr 22 18:51:44 UTC 2026","","User Select","",""
"","70","calls onSort when clicked with a tooltip","ColumnHeaders","Wed Apr 22 18:53:08 UTC 2026","passed","Wed Apr 22 18:53:08 UTC 2026","","SortableHeader with Tooltip","",""
"","8","should not render a Field when the provided value is []","Field","Wed Apr 22 18:54:48 UTC 2026","passed","Wed Apr 22 18:54:48 UTC 2026","","","",""
"","210","handles close event","ImportQueryDialog","Wed Apr 22 18:55:14 UTC 2026","passed","Wed Apr 22 18:55:14 UTC 2026","","","",""
"","4","returns true if arrays are referentially equal","areArraysSimilar","Wed Apr 22 18:54:59 UTC 2026","passed","Wed Apr 22 18:54:59 UTC 2026","","","",""
"Test cases for TestNodeNamePrefix_String","0","TestNodeNamePrefix_String","","Wed Apr 22 18:49:44 UTC 2026","passed","Wed Apr 22 18:49:44 UTC 2026","","Go Test","github.com/specterops/bloodhound/packages/go/analysis/ad/wellknown/TestNodeNamePrefix_String","TestNodeNamePrefix_String"
"Test cases for TestResources_GetEdgeRelayTargets","60","TestResources_GetEdgeRelayTargets","","Wed Apr 22 18:49:22 UTC 2026","passed","Wed Apr 22 18:49:22 UTC 2026","","Go Test","github.com/specterops/bloodhound/cmd/api/src/api/v2/TestResources_GetEdgeRelayTargets","TestResources_GetEdgeRelayTargets"
"","0","returns null if paramValue is undefined","useEnvironmentParams","Wed Apr 22 18:55:20 UTC 2026","passed","Wed Apr 22 18:55:20 UTC 2026","","parseEnvironmentAggregation","",""
"","82","displays a warning when there is a problem fetching the list of collectors","DownloadCollectors","Wed Apr 22 18:55:59 UTC 2026","passed","Wed Apr 22 18:55:59 UTC 2026","","","",""
"Test cases for TestCreateUser_Failure","0","TestCreateUser_Failure","","Wed Apr 22 18:49:28 UTC 2026","passed","Wed Apr 22 18:49:28 UTC 2026","","Go Test","github.com/specterops/bloodhound/cmd/api/src/api/v2/auth/TestCreateUser_Failure","TestCreateUser_Failure"
"Test cases for TestResources_PatchDomain","0","TestResources_PatchDomain","","Wed Apr 22 18:49:22 UTC 2026","passed","Wed Apr 22 18:49:22 UTC 2026","","Go Test","github.com/specterops/bloodhound/cmd/api/src/api/v2/TestResources_PatchDomain","TestResources_PatchDomain"
"","170","shows all checked boxes","GraphDataCheckboxes","Wed Apr 22 18:51:14 UTC 2026","passed","Wed Apr 22 18:51:14 UTC 2026","","","",""
"Test cases for TestResources_ExportSavedQuery","8","TestResources_ExportSavedQuery","","Wed Apr 22 18:49:22 UTC 2026","passed","Wed Apr 22 18:49:22 UTC 2026","","Go Test","github.com/specterops/bloodhound/cmd/api/src/api/v2/TestResources_ExportSavedQuery","TestResources_ExportSavedQuery"
"","0","returns false if value is +0","searchParams","Wed Apr 22 18:53:46 UTC 2026","passed","Wed Apr 22 18:53:46 UTC 2026","","isEmptyParam","",""
"","1641","does not show the ""Disable MFA"" context menu option for users without MFA enabled","Users","Wed Apr 22 18:52:35 UTC 2026","passed","Wed Apr 22 18:52:37 UTC 2026","","","",""
"Test cases for TestResources_ListADComputerAdmins","0","TestResources_ListADComputerAdmins","","Wed Apr 22 18:49:22 UTC 2026","passed","Wed Apr 22 18:49:22 UTC 2026","","Go Test","github.com/specterops/bloodhound/cmd/api/src/api/v2/TestResources_ListADComputerAdmins","TestResources_ListADComputerAdmins"
