"DESCRIPTION","DURATION IN MS","NAME","PARENT SUITE","START TIME","STATUS","STOP TIME","SUB SUITE","SUITE","TEST CLASS","TEST METHOD"
"Test cases for TestRewriter_Enter_UpdatingClauseSetsHasMutation","0","TestRewriter_Enter_UpdatingClauseSetsHasMutation","","Fri May 22 18:54:25 UTC 2026","passed","Fri May 22 18:54:25 UTC 2026","","Go Test","github.com/specterops/bloodhound/cmd/api/src/queries/TestRewriter_Enter_UpdatingClauseSetsHasMutation","TestRewriter_Enter_UpdatingClauseSetsHasMutation"
"","1187","a cypher search 404 does not render the GraphViewErrorAlert","GraphView","Fri May 22 19:00:56 UTC 2026","passed","Fri May 22 19:00:57 UTC 2026","","","",""
"","106","renders the analysis toggle when multi tier analysis enabled is true and when editing an existing zone","Tag Form","Fri May 22 18:55:08 UTC 2026","passed","Fri May 22 18:55:08 UTC 2026","","","",""
"Test cases for Test_ConvertAzureRoleManagementPolicyAssignment","0","Test_ConvertAzureRoleManagementPolicyAssignment","","Fri May 22 18:54:36 UTC 2026","passed","Fri May 22 18:54:36 UTC 2026","","Go Test","github.com/specterops/bloodhound/packages/go/ein/Test_ConvertAzureRoleManagementPolicyAssignment","Test_ConvertAzureRoleManagementPolicyAssignment"
"","720","open and closes dialog with confirm button after user inputs required text","Tag Form","Fri May 22 18:55:11 UTC 2026","passed","Fri May 22 18:55:12 UTC 2026","","","",""
"","10","when password is expired and on password reset page, no redirect occurs","AuthenticatedRoute","Fri May 22 19:01:25 UTC 2026","passed","Fri May 22 19:01:25 UTC 2026","","","",""
"","0","returns false if arrays have different elements","areArraysSimilar","Fri May 22 19:00:06 UTC 2026","passed","Fri May 22 19:00:06 UTC 2026","","","",""
"","7088","expand all button expands all sections after collapsing","Pathfinding","Fri May 22 18:56:23 UTC 2026","passed","Fri May 22 18:56:30 UTC 2026","","","",""
"Test cases for TestIntPointer","0","TestIntPointer","","Fri May 22 18:54:23 UTC 2026","passed","Fri May 22 18:54:23 UTC 2026","","Go Test","github.com/specterops/bloodhound/cmd/api/src/database/types/null/TestIntPointer","TestIntPointer"
"Test cases for TestSignRequestValuesUnsupportedHMACMethod","0","TestSignRequestValuesUnsupportedHMACMethod","","Fri May 22 18:54:09 UTC 2026","passed","Fri May 22 18:54:09 UTC 2026","","Go Test","github.com/specterops/bloodhound/cmd/api/src/api/TestSignRequestValuesUnsupportedHMACMethod","TestSignRequestValuesUnsupportedHMACMethod"
"Test cases for TestResources_ListAssetGroupMembersCount","2","TestResources_ListAssetGroupMembersCount","","Fri May 22 18:54:20 UTC 2026","passed","Fri May 22 18:54:20 UTC 2026","","Go Test","github.com/specterops/bloodhound/cmd/api/src/api/v2/TestResources_ListAssetGroupMembersCount","TestResources_ListAssetGroupMembersCount"
"Test cases for TestBoolScan","0","TestBoolScan","","Fri May 22 18:54:23 UTC 2026","passed","Fri May 22 18:54:23 UTC 2026","","Go Test","github.com/specterops/bloodhound/cmd/api/src/database/types/null/TestBoolScan","TestBoolScan"
"Test cases for TestNewNodeNamePrefix","0","TestNewNodeNamePrefix","","Fri May 22 18:54:35 UTC 2026","passed","Fri May 22 18:54:35 UTC 2026","","Go Test","github.com/specterops/bloodhound/packages/go/analysis/ad/wellknown/TestNewNodeNamePrefix","TestNewNodeNamePrefix"
"","137","should call onLoginViaSAML when login via sso button clicked","LoginForm","Fri May 22 18:59:48 UTC 2026","passed","Fri May 22 18:59:48 UTC 2026","","","",""
"Test cases for TestResources_DeleteAssetGroup","0","TestResources_DeleteAssetGroup","","Fri May 22 18:54:20 UTC 2026","passed","Fri May 22 18:54:20 UTC 2026","","Go Test","github.com/specterops/bloodhound/cmd/api/src/api/v2/TestResources_DeleteAssetGroup","TestResources_DeleteAssetGroup"
"","585","displays a warning dialog when mounted","EarlyAccessFeatures","Fri May 22 19:01:22 UTC 2026","passed","Fri May 22 19:01:23 UTC 2026","","","",""
"","570","when an `inputValue` is provided it eventually displays a list of search results","ExploreSearchCombobox","Fri May 22 18:57:17 UTC 2026","passed","Fri May 22 18:57:18 UTC 2026","","","",""
"","241","fires runQuery in context provider","ListItemActionMenu","Fri May 22 18:58:55 UTC 2026","passed","Fri May 22 18:58:55 UTC 2026","","","",""
"","57","Gets focus on keyboard shortcut","SearchBar","Fri May 22 19:00:16 UTC 2026","passed","Fri May 22 19:00:17 UTC 2026","","","",""
"","103","renders an input box","SearchBar","Fri May 22 19:00:16 UTC 2026","passed","Fri May 22 19:00:16 UTC 2026","","","",""
"","1","combines platform and collected filters","filterAndSearchEnvironments","Fri May 22 18:55:30 UTC 2026","passed","Fri May 22 18:55:30 UTC 2026","","combined filters","",""
"Test cases for TestResources_GetAZRelatedEntities","112","TestResources_GetAZRelatedEntities","","Fri May 22 18:54:20 UTC 2026","passed","Fri May 22 18:54:20 UTC 2026","","Go Test","github.com/specterops/bloodhound/cmd/api/src/api/v2/TestResources_GetAZRelatedEntities","TestResources_GetAZRelatedEntities"
"Test cases for TestConvertOUToNode_InheritanceHashes","0","TestConvertOUToNode_InheritanceHashes","","Fri May 22 18:54:36 UTC 2026","passed","Fri May 22 18:54:36 UTC 2026","","Go Test","github.com/specterops/bloodhound/packages/go/ein/TestConvertOUToNode_InheritanceHashes","TestConvertOUToNode_InheritanceHashes"
"","178","renders enabled Label, Rule and Object tabs","Selected Details Tabs","Fri May 22 18:57:42 UTC 2026","passed","Fri May 22 18:57:43 UTC 2026","","Selected Details Tabs - Params present","",""
"Test cases for TestResources_GetDomainEntityInfo","0","TestResources_GetDomainEntityInfo","","Fri May 22 18:54:20 UTC 2026","passed","Fri May 22 18:54:20 UTC 2026","","Go Test","github.com/specterops/bloodhound/cmd/api/src/api/v2/TestResources_GetDomainEntityInfo","TestResources_GetDomainEntityInfo"
"Test cases for TestManagementResource_UpdateUser_ETAC","1687","TestManagementResource_UpdateUser_ETAC","","Fri May 22 18:54:44 UTC 2026","passed","Fri May 22 18:54:46 UTC 2026","","Go Test","github.com/specterops/bloodhound/cmd/api/src/api/v2/auth/TestManagementResource_UpdateUser_ETAC","TestManagementResource_UpdateUser_ETAC"
"","122","Calls the `Base` endpoint for a LocalGroup type node","EntityObjectInformation","Fri May 22 18:58:10 UTC 2026","passed","Fri May 22 18:58:10 UTC 2026","","","",""
"","2","rounds down fractional minutes/days","getSimpleDuration","Fri May 22 18:59:44 UTC 2026","passed","Fri May 22 18:59:44 UTC 2026","","","",""
"","0","should be case-insensitive when matching by path","opsFilter","Fri May 22 18:59:27 UTC 2026","passed","Fri May 22 18:59:27 UTC 2026","","","",""
"Test cases for TestResources_UpdateSavedQuery_InvalidBody","0","TestResources_UpdateSavedQuery_InvalidBody","","Fri May 22 18:54:20 UTC 2026","passed","Fri May 22 18:54:20 UTC 2026","","Go Test","github.com/specterops/bloodhound/cmd/api/src/api/v2/TestResources_UpdateSavedQuery_InvalidBody","TestResources_UpdateSavedQuery_InvalidBody"
"TestCacheEntryDigester_DigestEndpoint_MatchByProperty tests the sorting and hashinglogic when MatchBy is set to MatchByProperty.","0","TestCacheEntryDigester_DigestEndpoint_MatchByProperty","","Fri May 22 18:54:28 UTC 2026","passed","Fri May 22 18:54:28 UTC 2026","","Go Test","github.com/specterops/bloodhound/cmd/api/src/services/graphify/endpoint/TestCacheEntryDigester_DigestEndpoint_MatchByProperty","TestCacheEntryDigester_DigestEndpoint_MatchByProperty"
"","16","should filter properties that we do not want to display in the entity panel","ObjectInfoFields","Fri May 22 18:59:56 UTC 2026","passed","Fri May 22 18:59:56 UTC 2026","","","",""
"Test cases for TestDetectBOMEncoding","1","TestDetectBOMEncoding","","Fri May 22 18:54:36 UTC 2026","passed","Fri May 22 18:54:36 UTC 2026","","Go Test","github.com/specterops/bloodhound/packages/go/bomenc/TestDetectBOMEncoding","TestDetectBOMEncoding"
"","526","calls handleFilterChange when a node type is selected","AssetGroupEdit","Fri May 22 18:57:17 UTC 2026","passed","Fri May 22 18:57:18 UTC 2026","","Node Type dropdown filter","",""
"","461","On unsuccessful upload, notifies with an error and displays a retry button","SchemaUploadDialog","Fri May 22 18:56:40 UTC 2026","passed","Fri May 22 18:56:41 UTC 2026","","","",""
"Test cases for TestDefineNodeName","1","TestDefineNodeName","","Fri May 22 18:54:35 UTC 2026","passed","Fri May 22 18:54:35 UTC 2026","","Go Test","github.com/specterops/bloodhound/packages/go/analysis/ad/wellknown/TestDefineNodeName","TestDefineNodeName"
"Test cases for TestIntIsZero","0","TestIntIsZero","","Fri May 22 18:54:23 UTC 2026","passed","Fri May 22 18:54:23 UTC 2026","","Go Test","github.com/specterops/bloodhound/cmd/api/src/database/types/null/TestIntIsZero","TestIntIsZero"
"Test cases for TestCacheEntryDigester_PoolStateReuse","0","TestCacheEntryDigester_PoolStateReuse","","Fri May 22 18:54:28 UTC 2026","passed","Fri May 22 18:54:28 UTC 2026","","Go Test","github.com/specterops/bloodhound/cmd/api/src/services/graphify/endpoint/TestCacheEntryDigester_PoolStateReuse","TestCacheEntryDigester_PoolStateReuse"
"","150","invokes handleFilterChange with eq:true when clicked and custom_member filter is off","AssetGroupEdit","Fri May 22 18:57:18 UTC 2026","passed","Fri May 22 18:57:18 UTC 2026","","Custom Member checkbox filter","",""
"","2","returns undefined for headers when db config timeout limit setting is enabled and state of is disable query limit is true","useExploreGraph","Fri May 22 18:56:33 UTC 2026","passed","Fri May 22 18:56:33 UTC 2026","userSettings","exploreGraphQueryFactory","",""
"Test cases for TestManagementResource_SSOLoginHandler","11","TestManagementResource_SSOLoginHandler","","Fri May 22 18:54:54 UTC 2026","passed","Fri May 22 18:54:54 UTC 2026","","Go Test","github.com/specterops/bloodhound/cmd/api/src/api/v2/auth/TestManagementResource_SSOLoginHandler","TestManagementResource_SSOLoginHandler"
"","0","returns paramValue as EnvironmentAggregation if paramValue is active-directory","useEnvironmentParams","Fri May 22 19:00:27 UTC 2026","passed","Fri May 22 19:00:27 UTC 2026","","parseEnvironmentAggregation","",""
"","67","should render oidc info provider","SSOProviderTable","Fri May 22 18:58:55 UTC 2026","passed","Fri May 22 18:58:55 UTC 2026","","","",""
"","224","fires editQuery in context provider","ListItemActionMenu","Fri May 22 18:58:55 UTC 2026","passed","Fri May 22 18:58:55 UTC 2026","","","",""
"Test cases for TestConvertAzureSubscriptionContributorToRels","0","TestConvertAzureSubscriptionContributorToRels","","Fri May 22 18:54:36 UTC 2026","passed","Fri May 22 18:54:36 UTC 2026","","Go Test","github.com/specterops/bloodhound/packages/go/ein/TestConvertAzureSubscriptionContributorToRels","TestConvertAzureSubscriptionContributorToRels"
"Test cases for TestTimeIsZero","0","TestTimeIsZero","","Fri May 22 18:54:23 UTC 2026","passed","Fri May 22 18:54:23 UTC 2026","","Go Test","github.com/specterops/bloodhound/cmd/api/src/database/types/null/TestTimeIsZero","TestTimeIsZero"
"","187","displays a table of completed ingest logs","FileIngest","Fri May 22 18:59:37 UTC 2026","passed","Fri May 22 18:59:38 UTC 2026","","","",""
"Test cases for TestNewSIDSuffix","0","TestNewSIDSuffix","","Fri May 22 18:54:35 UTC 2026","passed","Fri May 22 18:54:35 UTC 2026","","Go Test","github.com/specterops/bloodhound/packages/go/analysis/ad/wellknown/TestNewSIDSuffix","TestNewSIDSuffix"
"Test cases for TestMatches_FailureAction","0","TestMatches_FailureAction","","Fri May 22 18:54:24 UTC 2026","passed","Fri May 22 18:54:24 UTC 2026","","Go Test","github.com/specterops/bloodhound/cmd/api/src/model/TestMatches_FailureAction","TestMatches_FailureAction"
"","0","handles only escapable characters","escapeCypherString","Fri May 22 19:00:21 UTC 2026","passed","Fri May 22 19:00:21 UTC 2026","","","",""
"","59","displays security warning","Enable2FADialog","Fri May 22 18:59:04 UTC 2026","passed","Fri May 22 18:59:04 UTC 2026","","","",""
"","314","renders","ObjectsAccordion","Fri May 22 18:58:28 UTC 2026","passed","Fri May 22 18:58:28 UTC 2026","","","",""
"Test cases for TestEncodingInterface","0","TestEncodingInterface","","Fri May 22 18:54:36 UTC 2026","passed","Fri May 22 18:54:36 UTC 2026","","Go Test","github.com/specterops/bloodhound/packages/go/bomenc/TestEncodingInterface","TestEncodingInterface"
"Test cases for TestBoolSetValid","0","TestBoolSetValid","","Fri May 22 18:54:23 UTC 2026","passed","Fri May 22 18:54:23 UTC 2026","","Go Test","github.com/specterops/bloodhound/cmd/api/src/database/types/null/TestBoolSetValid","TestBoolSetValid"
"","6078","closes explore search tab menu and clears selected item when a cypher query returns multiple nodes","CypherSearch","Fri May 22 18:56:03 UTC 2026","passed","Fri May 22 18:56:09 UTC 2026","","Minimize explorer page elements when multiple nodes are returned","",""
"Test cases for TestSignRequestValuesSuccess","0","TestSignRequestValuesSuccess","","Fri May 22 18:54:09 UTC 2026","passed","Fri May 22 18:54:09 UTC 2026","","Go Test","github.com/specterops/bloodhound/cmd/api/src/api/TestSignRequestValuesSuccess","TestSignRequestValuesSuccess"
"","1","filters by active-directory platform","filterAndSearchEnvironments","Fri May 22 18:55:30 UTC 2026","passed","Fri May 22 18:55:30 UTC 2026","","platform filters","",""
"","65","includes all traversable OpenGraph edges in their own category when they are available via the API","useEdgeCategories","Fri May 22 18:57:22 UTC 2026","passed","Fri May 22 18:57:22 UTC 2026","","","",""
"Test cases for TestResolver_StartDone","0","TestResolver_StartDone","","Fri May 22 18:54:28 UTC 2026","passed","Fri May 22 18:54:28 UTC 2026","","Go Test","github.com/specterops/bloodhound/cmd/api/src/services/graphify/endpoint/TestResolver_StartDone","TestResolver_StartDone"
"","967","shows a table with partially completed jobs","FileIngestTable","Fri May 22 18:56:12 UTC 2026","passed","Fri May 22 18:56:13 UTC 2026","","","",""
"","85","initializes the list with all filters checked by default","usePathfindingFilters","Fri May 22 18:59:52 UTC 2026","passed","Fri May 22 18:59:52 UTC 2026","","","",""
"","8","returns all collected environment ids associated to a given aggregation","getEnvironmentAggregationIds","Fri May 22 18:55:30 UTC 2026","passed","Fri May 22 18:55:30 UTC 2026","","","",""
"","175","invokes handleFilterChange with eq:false when clicked and custom_member filter is on","AssetGroupEdit","Fri May 22 18:57:18 UTC 2026","passed","Fri May 22 18:57:18 UTC 2026","","Custom Member checkbox filter","",""
"","15","allows you to cancel filter updates before applying them to the url and reset to the default filter state","usePathfindingFilters","Fri May 22 18:59:52 UTC 2026","passed","Fri May 22 18:59:52 UTC 2026","","","",""
"","5470","calls onExploreMenuCollapse again when user reopens widget and runs another multi-node query","CypherSearch","Fri May 22 18:56:25 UTC 2026","passed","Fri May 22 18:56:30 UTC 2026","","Minimize explorer page elements when multiple nodes are returned","",""
"","3","uses sequentialLayout by default","Explore utils","Fri May 22 19:01:17 UTC 2026","passed","Fri May 22 19:01:17 UTC 2026","","initGraph","",""
"","0","falls back to the default Cypher message when ruleType is undefined and seeds are required","handleError","Fri May 22 18:56:40 UTC 2026","passed","Fri May 22 18:56:40 UTC 2026","","","",""
"Test cases for TestIsDeadlockError","0","TestIsDeadlockError","","Fri May 22 18:54:21 UTC 2026","passed","Fri May 22 18:54:21 UTC 2026","","Go Test","github.com/specterops/bloodhound/cmd/api/src/daemons/changelog/TestIsDeadlockError","TestIsDeadlockError"
"Test cases for TestError","0","TestError","","Fri May 22 18:54:10 UTC 2026","passed","Fri May 22 18:54:10 UTC 2026","","Go Test","github.com/specterops/bloodhound/cmd/api/src/api/TestError","TestError"
"Test cases for TestParseOptionalBool","0","TestParseOptionalBool","","Fri May 22 18:54:09 UTC 2026","passed","Fri May 22 18:54:09 UTC 2026","","Go Test","github.com/specterops/bloodhound/cmd/api/src/api/TestParseOptionalBool","TestParseOptionalBool"
"","63","enables correctly returning the tag associated with Tier Zero (position value of 1) from the list of tags","the useAssetGroupTags utilities","Fri May 22 18:57:01 UTC 2026","passed","Fri May 22 18:57:01 UTC 2026","","","",""
"Test cases for TestResources_ListADEntityAdminRights","0","TestResources_ListADEntityAdminRights","","Fri May 22 18:54:20 UTC 2026","passed","Fri May 22 18:54:20 UTC 2026","","Go Test","github.com/specterops/bloodhound/cmd/api/src/api/v2/TestResources_ListADEntityAdminRights","TestResources_ListADEntityAdminRights"
"","0","returns disabled config when any required param is falsey","useExploreGraph","Fri May 22 18:56:33 UTC 2026","passed","Fri May 22 18:56:33 UTC 2026","relationship search queries","exploreGraphQueryFactory","",""
"","255","renders the Cypher Rules Panel when clicking the Rule Tab","Selected Details Tab Content","Fri May 22 18:59:38 UTC 2026","passed","Fri May 22 18:59:39 UTC 2026","","","",""
"Test cases for TestManagementResource_UpdateUser_UserSelfModify","1281","TestManagementResource_UpdateUser_UserSelfModify","","Fri May 22 18:54:39 UTC 2026","passed","Fri May 22 18:54:40 UTC 2026","","Go Test","github.com/specterops/bloodhound/cmd/api/src/api/v2/auth/TestManagementResource_UpdateUser_UserSelfModify","TestManagementResource_UpdateUser_UserSelfModify"
"","160","shows ""API Expiration Date"" column header when expiration is enabled","UserTokenManagementDialog - API Expiration Date column","Fri May 22 18:56:56 UTC 2026","passed","Fri May 22 18:56:57 UTC 2026","","","",""
"Test cases for TestValidateRequestSignature","285","TestValidateRequestSignature","","Fri May 22 18:54:09 UTC 2026","passed","Fri May 22 18:54:10 UTC 2026","","Go Test","github.com/specterops/bloodhound/cmd/api/src/api/TestValidateRequestSignature","TestValidateRequestSignature"
"","180","displays an error message","GraphView","Fri May 22 19:00:56 UTC 2026","passed","Fri May 22 19:00:56 UTC 2026","","","",""
"","657","should call onSubmit with initiation_url of selected SSO provider","LoginViaSSOForm","Fri May 22 18:58:53 UTC 2026","passed","Fri May 22 18:58:53 UTC 2026","","","",""
"","397","should render saml info provider","SSOProviderTable","Fri May 22 18:58:54 UTC 2026","passed","Fri May 22 18:58:55 UTC 2026","","","",""
"Test cases for TestManagementResource_CreateAuthToken","8368","TestManagementResource_CreateAuthToken","","Fri May 22 18:54:46 UTC 2026","passed","Fri May 22 18:54:54 UTC 2026","","Go Test","github.com/specterops/bloodhound/cmd/api/src/api/v2/auth/TestManagementResource_CreateAuthToken","TestManagementResource_CreateAuthToken"
"","0","returns false if value is 'array'","searchParams","Fri May 22 18:58:55 UTC 2026","passed","Fri May 22 18:58:55 UTC 2026","","isEmptyParam","",""
"","3","returns empty array when environments is empty","filterAndSearchEnvironments","Fri May 22 18:55:30 UTC 2026","passed","Fri May 22 18:55:30 UTC 2026","","with empty environments","",""
"","0","returns undefined if graphData is null or not a GraphResponse","getExploreTableData","Fri May 22 18:58:23 UTC 2026","passed","Fri May 22 18:58:23 UTC 2026","","","",""
"","0","should appropriately handle edges that contain underscores","getEdgeDataFromKey","Fri May 22 19:01:39 UTC 2026","passed","Fri May 22 19:01:39 UTC 2026","","","",""
"Test cases for TestIntSetValid","0","TestIntSetValid","","Fri May 22 18:54:23 UTC 2026","passed","Fri May 22 18:54:23 UTC 2026","","Go Test","github.com/specterops/bloodhound/cmd/api/src/database/types/null/TestIntSetValid","TestIntSetValid"
"Test cases for TestResources_DeleteSavedQuery_RecordNotFound","0","TestResources_DeleteSavedQuery_RecordNotFound","","Fri May 22 18:54:20 UTC 2026","passed","Fri May 22 18:54:20 UTC 2026","","Go Test","github.com/specterops/bloodhound/cmd/api/src/api/v2/TestResources_DeleteSavedQuery_RecordNotFound","TestResources_DeleteSavedQuery_RecordNotFound"
"Test cases for Test_FixtureTeardown","0","Test_FixtureTeardown","","Fri May 22 18:54:37 UTC 2026","passed","Fri May 22 18:54:37 UTC 2026","","Go Test","github.com/specterops/bloodhound/packages/go/lab/Test_FixtureTeardown","Test_FixtureTeardown"
"","2684","search filters edges by name","Pathfinding","Fri May 22 18:56:30 UTC 2026","passed","Fri May 22 18:56:33 UTC 2026","","","",""
"","0","returns undefined if graphData is %s or not a GraphResponse","getExploreTableData","Fri May 22 18:58:23 UTC 2026","passed","Fri May 22 18:58:23 UTC 2026","","","",""
"Test cases for TestHandleDatabaseError","0","TestHandleDatabaseError","","Fri May 22 18:54:10 UTC 2026","passed","Fri May 22 18:54:10 UTC 2026","","Go Test","github.com/specterops/bloodhound/cmd/api/src/api/TestHandleDatabaseError","TestHandleDatabaseError"
"","78","hides loading state when data is available","GraphDataCheckboxes","Fri May 22 18:56:33 UTC 2026","passed","Fri May 22 18:56:33 UTC 2026","","","",""
"Test cases for TestResources_DeleteSavedQueryPermissions","1","TestResources_DeleteSavedQueryPermissions","","Fri May 22 18:54:20 UTC 2026","passed","Fri May 22 18:54:20 UTC 2026","","Go Test","github.com/specterops/bloodhound/cmd/api/src/api/v2/TestResources_DeleteSavedQueryPermissions","TestResources_DeleteSavedQueryPermissions"
"","71","has a button with text Clear Filters","AssetGroupEdit","Fri May 22 18:57:18 UTC 2026","passed","Fri May 22 18:57:18 UTC 2026","","Clear Filters button","",""
"Test cases for Test_getSearchableNodeKinds","0","Test_getSearchableNodeKinds","","Fri May 22 18:54:20 UTC 2026","passed","Fri May 22 18:54:20 UTC 2026","","Go Test","github.com/specterops/bloodhound/cmd/api/src/api/v2/Test_getSearchableNodeKinds","Test_getSearchableNodeKinds"
"","7","adds expected text alignment class depending on the textAlign prop","ColumnHeaders","Fri May 22 18:58:14 UTC 2026","passed","Fri May 22 18:58:14 UTC 2026","","BaseColumnHeader","",""
"","985","opens the entity information panel for the auto-selected node","GraphView","Fri May 22 19:01:00 UTC 2026","passed","Fri May 22 19:01:01 UTC 2026","","","",""
"","129","reverts all menu options to an unselected state when isExploreLayoutSelected becomes false","GraphControls","Fri May 22 18:55:28 UTC 2026","passed","Fri May 22 18:55:28 UTC 2026","","Selecting a layout","",""
"","111","highlights selectedLayout rather than the table option when searchType is not cypher","GraphControls","Fri May 22 18:55:28 UTC 2026","passed","Fri May 22 18:55:28 UTC 2026","","Table view selection state","",""
"","446","adds a ""Close"" button that closes the dialog after a failed upload","SchemaUploadDialog","Fri May 22 18:56:39 UTC 2026","passed","Fri May 22 18:56:40 UTC 2026","","","",""
"","502","disables a nested graph data option while its source kind is selected","GraphDataCheckboxes","Fri May 22 18:56:38 UTC 2026","passed","Fri May 22 18:56:38 UTC 2026","","","",""
"","3","should return null if the edge key does not have enough information","getEdgeDataFromKey","Fri May 22 19:01:39 UTC 2026","passed","Fri May 22 19:01:39 UTC 2026","","","",""
"","841","should call onSubmit with email address and password when login button clicked","LoginForm","Fri May 22 18:59:47 UTC 2026","passed","Fri May 22 18:59:48 UTC 2026","","","",""
"Test cases for TestManagementResource_EnrollMFA","1842","TestManagementResource_EnrollMFA","","Fri May 22 18:54:46 UTC 2026","passed","Fri May 22 18:54:48 UTC 2026","","Go Test","github.com/specterops/bloodhound/cmd/api/src/api/v2/auth/TestManagementResource_EnrollMFA","TestManagementResource_EnrollMFA"
"","77","should not display api key management button","Api Keys","Fri May 22 18:57:30 UTC 2026","passed","Fri May 22 18:57:30 UTC 2026","","","",""
"Test cases for TestAssetGroupMembers_Filter_NotEquals","0","TestAssetGroupMembers_Filter_NotEquals","","Fri May 22 18:54:09 UTC 2026","passed","Fri May 22 18:54:09 UTC 2026","","Go Test","github.com/specterops/bloodhound/cmd/api/src/api/TestAssetGroupMembers_Filter_NotEquals","TestAssetGroupMembers_Filter_NotEquals"
"","1","floors DateTime objects to the nearest minute","floorToNearestMinute","Fri May 22 18:59:44 UTC 2026","passed","Fri May 22 18:59:44 UTC 2026","","","",""
"","0","returns Cypher message when ruleType is SeedTypeCypher and seeds are required","getErrorMessage","Fri May 22 18:56:40 UTC 2026","passed","Fri May 22 18:56:40 UTC 2026","","","",""
"","3","Default label and sizing are used when graph of origin does not specify","copySigmaNodesToGraphlibGraph","Fri May 22 19:01:26 UTC 2026","passed","Fri May 22 19:01:26 UTC 2026","","","",""
"Test cases for TestResources_GetComputerEntityInfo","4","TestResources_GetComputerEntityInfo","","Fri May 22 18:54:20 UTC 2026","passed","Fri May 22 18:54:20 UTC 2026","","Go Test","github.com/specterops/bloodhound/cmd/api/src/api/v2/TestResources_GetComputerEntityInfo","TestResources_GetComputerEntityInfo"
"Test cases for TestQueries_BuildEntityQueryParams_InvalidSkip","2","TestQueries_BuildEntityQueryParams_InvalidSkip","","Fri May 22 18:54:25 UTC 2026","passed","Fri May 22 18:54:25 UTC 2026","","Go Test","github.com/specterops/bloodhound/cmd/api/src/queries/TestQueries_BuildEntityQueryParams_InvalidSkip","TestQueries_BuildEntityQueryParams_InvalidSkip"
"","54","shows the empty form message when Cypher Rule Form is empty","Seed Selection Results","Fri May 22 18:56:58 UTC 2026","passed","Fri May 22 18:56:58 UTC 2026","","","",""
"","5","calls the provided notification method","handleError","Fri May 22 18:56:40 UTC 2026","passed","Fri May 22 18:56:40 UTC 2026","","","",""
"","6","removes key from state","useObjectState","Fri May 22 18:59:42 UTC 2026","passed","Fri May 22 18:59:42 UTC 2026","","","",""
"","1376","when user performs a single node search, the selected node carries over to the `start node` input field on the pathfinding tab","ExploreSearch interaction","Fri May 22 19:01:07 UTC 2026","passed","Fri May 22 19:01:08 UTC 2026","","","",""
