"DESCRIPTION","DURATION IN MS","NAME","PARENT SUITE","START TIME","STATUS","STOP TIME","SUB SUITE","SUITE","TEST CLASS","TEST METHOD"
"","244","shows ""Select All"" when not all columns are selected","ManageColumnsComboBox","Fri May 22 18:57:03 UTC 2026","passed","Fri May 22 18:57:04 UTC 2026","","","",""
"Test cases for TestSavedQueries_GetValidFilterPredicatesAsStrings","0","TestSavedQueries_GetValidFilterPredicatesAsStrings","","Fri May 22 18:54:24 UTC 2026","passed","Fri May 22 18:54:24 UTC 2026","","Go Test","github.com/specterops/bloodhound/cmd/api/src/model/TestSavedQueries_GetValidFilterPredicatesAsStrings","TestSavedQueries_GetValidFilterPredicatesAsStrings"
"Test cases for TestManagementResource_ListSAMLProviders","7","TestManagementResource_ListSAMLProviders","","Fri May 22 18:54:54 UTC 2026","passed","Fri May 22 18:54:54 UTC 2026","","Go Test","github.com/specterops/bloodhound/cmd/api/src/api/v2/auth/TestManagementResource_ListSAMLProviders","TestManagementResource_ListSAMLProviders"
"Test cases for TestBoolPointer","0","TestBoolPointer","","Fri May 22 18:54:23 UTC 2026","passed","Fri May 22 18:54:23 UTC 2026","","Go Test","github.com/specterops/bloodhound/cmd/api/src/database/types/null/TestBoolPointer","TestBoolPointer"
"","1","reads and parses an existing value from localStorage","useLocalStorage","Fri May 22 18:57:35 UTC 2026","passed","Fri May 22 18:57:35 UTC 2026","","initial value","",""
"Test cases for TestFloatIsZero","0","TestFloatIsZero","","Fri May 22 18:54:23 UTC 2026","passed","Fri May 22 18:54:23 UTC 2026","","Go Test","github.com/specterops/bloodhound/cmd/api/src/database/types/null/TestFloatIsZero","TestFloatIsZero"
"Test cases for TestManagementResource_ListUsers_PredicateMismatchWithColumn","0","TestManagementResource_ListUsers_PredicateMismatchWithColumn","","Fri May 22 18:54:26 UTC 2026","passed","Fri May 22 18:54:26 UTC 2026","","Go Test","github.com/specterops/bloodhound/cmd/api/src/api/v2/auth/TestManagementResource_ListUsers_PredicateMismatchWithColumn","TestManagementResource_ListUsers_PredicateMismatchWithColumn"
"Test cases for TestResources_GetShortestPath","6","TestResources_GetShortestPath","","Fri May 22 18:54:20 UTC 2026","passed","Fri May 22 18:54:20 UTC 2026","","Go Test","github.com/specterops/bloodhound/cmd/api/src/api/v2/TestResources_GetShortestPath","TestResources_GetShortestPath"
"Test cases for TestErrorReadDomainSIDandNameAsString","0","TestErrorReadDomainSIDandNameAsString","","Fri May 22 18:54:35 UTC 2026","passed","Fri May 22 18:54:35 UTC 2026","","Go Test","github.com/specterops/bloodhound/packages/go/analysis/ad/internal/nodeprops/TestErrorReadDomainSIDandNameAsString","TestErrorReadDomainSIDandNameAsString"
"Test cases for TestWriteBasicResponse","0","TestWriteBasicResponse","","Fri May 22 18:54:10 UTC 2026","passed","Fri May 22 18:54:10 UTC 2026","","Go Test","github.com/specterops/bloodhound/cmd/api/src/api/TestWriteBasicResponse","TestWriteBasicResponse"
"","69","should have a .z-nav class","MainNav","Fri May 22 18:57:34 UTC 2026","passed","Fri May 22 18:57:35 UTC 2026","","","",""
"","61","Validate Displays all the Roles","useListDisplayRoles","Fri May 22 18:56:50 UTC 2026","passed","Fri May 22 18:56:50 UTC 2026","","","",""
"Test cases for TestResources_ListADGPOAffectedTierZero","0","TestResources_ListADGPOAffectedTierZero","","Fri May 22 18:54:20 UTC 2026","passed","Fri May 22 18:54:20 UTC 2026","","Go Test","github.com/specterops/bloodhound/cmd/api/src/api/v2/TestResources_ListADGPOAffectedTierZero","TestResources_ListADGPOAffectedTierZero"
"","372","should eventually display list of tokens","UserTokenManagementDialog","Fri May 22 18:56:55 UTC 2026","passed","Fri May 22 18:56:55 UTC 2026","","","",""
"Test cases for TestOpenGraphSchemaService_ListExtensions","1","TestOpenGraphSchemaService_ListExtensions","","Fri May 22 18:54:28 UTC 2026","passed","Fri May 22 18:54:28 UTC 2026","","Go Test","github.com/specterops/bloodhound/cmd/api/src/services/opengraphschema/TestOpenGraphSchemaService_ListExtensions","TestOpenGraphSchemaService_ListExtensions"
"Test cases for TestTextUnmarshalInt64","0","TestTextUnmarshalInt64","","Fri May 22 18:54:23 UTC 2026","passed","Fri May 22 18:54:23 UTC 2026","","Go Test","github.com/specterops/bloodhound/cmd/api/src/database/types/null/TestTextUnmarshalInt64","TestTextUnmarshalInt64"
"","1","returns false when WebGL is not available in the current browser context","WebGL compatibility check","Fri May 22 19:00:36 UTC 2026","passed","Fri May 22 19:00:36 UTC 2026","","","",""
"Test cases for TestManagementResource_ListPermissions_SortingError","0","TestManagementResource_ListPermissions_SortingError","","Fri May 22 18:54:26 UTC 2026","passed","Fri May 22 18:54:26 UTC 2026","","Go Test","github.com/specterops/bloodhound/cmd/api/src/api/v2/auth/TestManagementResource_ListPermissions_SortingError","TestManagementResource_ListPermissions_SortingError"
"Test cases for TestNormalizeToUTF8","0","TestNormalizeToUTF8","","Fri May 22 18:54:36 UTC 2026","passed","Fri May 22 18:54:36 UTC 2026","","Go Test","github.com/specterops/bloodhound/packages/go/bomenc/TestNormalizeToUTF8","TestNormalizeToUTF8"
"Test cases for TestResources_UpdateSavedQuery_AdminPublicQuery_Success","0","TestResources_UpdateSavedQuery_AdminPublicQuery_Success","","Fri May 22 18:54:20 UTC 2026","passed","Fri May 22 18:54:20 UTC 2026","","Go Test","github.com/specterops/bloodhound/cmd/api/src/api/v2/TestResources_UpdateSavedQuery_AdminPublicQuery_Success","TestResources_UpdateSavedQuery_AdminPublicQuery_Success"
"","548","changes the text from ""Disabled"" to ""Enabled"" when the Rule Status switch is toggled","Rule Form","Fri May 22 18:55:26 UTC 2026","passed","Fri May 22 18:55:27 UTC 2026","","","",""
"","97","initializes search tab to node search if the exploreSearchTab is not a supported tab name on first render","ExploreSearch sets searchType on tab changing","Fri May 22 19:01:07 UTC 2026","passed","Fri May 22 19:01:07 UTC 2026","","","",""
"","1820","should remove the option from the changelog when the corresponding button is clicked","AssetGroupEdit","Fri May 22 18:58:48 UTC 2026","passed","Fri May 22 18:58:50 UTC 2026","","","",""
"","697","does not allow confirmation while dates are invalid","FileIngestFilterDialog","Fri May 22 18:56:48 UTC 2026","passed","Fri May 22 18:56:49 UTC 2026","","Date Range Inputs","",""
"Test cases for TestUrlValidator","1","TestUrlValidator","","Fri May 22 18:54:34 UTC 2026","passed","Fri May 22 18:54:34 UTC 2026","","Go Test","github.com/specterops/bloodhound/cmd/api/src/utils/validation/TestUrlValidator","TestUrlValidator"
"","4359","Sort arrow is visible and direction is correct","ExploreTable","Fri May 22 18:55:24 UTC 2026","passed","Fri May 22 18:55:28 UTC 2026","","","",""
"Test cases for TestActivateMFA_Failure","646","TestActivateMFA_Failure","","Fri May 22 18:54:53 UTC 2026","passed","Fri May 22 18:54:53 UTC 2026","","Go Test","github.com/specterops/bloodhound/cmd/api/src/api/v2/auth/TestActivateMFA_Failure","TestActivateMFA_Failure"
"","106","renders the total count and object counts on success","ObjectCountPanel","Fri May 22 18:59:51 UTC 2026","passed","Fri May 22 18:59:51 UTC 2026","","","",""
"Test cases for TestWriteResponseWrapperWithTimeWindowAndPagination","0","TestWriteResponseWrapperWithTimeWindowAndPagination","","Fri May 22 18:54:10 UTC 2026","passed","Fri May 22 18:54:10 UTC 2026","","Go Test","github.com/specterops/bloodhound/cmd/api/src/api/TestWriteResponseWrapperWithTimeWindowAndPagination","TestWriteResponseWrapperWithTimeWindowAndPagination"
"Test cases for TestManagementResource_ListAuthTokens_NonAdmin","0","TestManagementResource_ListAuthTokens_NonAdmin","","Fri May 22 18:54:46 UTC 2026","passed","Fri May 22 18:54:46 UTC 2026","","Go Test","github.com/specterops/bloodhound/cmd/api/src/api/v2/auth/TestManagementResource_ListAuthTokens_NonAdmin","TestManagementResource_ListAuthTokens_NonAdmin"
"","504","On successful upload, displays a completion of 100% and adds a ""Complete"" button that closes the dialog","SchemaUploadDialog","Fri May 22 18:56:39 UTC 2026","passed","Fri May 22 18:56:39 UTC 2026","","","",""
"TestMigrator_GenerateManifestAfterVersion builds upon the GenerateManifest testby starting from different version points and spot checking migration counts.","0","TestMigrator_GenerateManifestAfterVersion","","Fri May 22 18:54:23 UTC 2026","passed","Fri May 22 18:54:23 UTC 2026","","Go Test","github.com/specterops/bloodhound/cmd/api/src/database/migration/TestMigrator_GenerateManifestAfterVersion","TestMigrator_GenerateManifestAfterVersion"
"","3","succeeds for valid password","testPassword","Fri May 22 19:00:27 UTC 2026","passed","Fri May 22 19:00:27 UTC 2026","","","",""
"","4101","should clear state when logout action is dispatched","redux store","Fri May 22 19:01:28 UTC 2026","passed","Fri May 22 19:01:32 UTC 2026","","","",""
"","608","should display Environmental Targeted Access Control panel when showEnvironmentAccessControls prop is true and read-only role is selected","CreateUserForm","Fri May 22 18:55:43 UTC 2026","passed","Fri May 22 18:55:44 UTC 2026","","","",""
"Test cases for TestUnmarshalNonIntegerNumberToInt64","0","TestUnmarshalNonIntegerNumberToInt64","","Fri May 22 18:54:23 UTC 2026","passed","Fri May 22 18:54:23 UTC 2026","","Go Test","github.com/specterops/bloodhound/cmd/api/src/database/types/null/TestUnmarshalNonIntegerNumberToInt64","TestUnmarshalNonIntegerNumberToInt64"
"","325","filters unselected columns when typing in the filter input","ManageColumnsComboBox","Fri May 22 18:57:05 UTC 2026","passed","Fri May 22 18:57:06 UTC 2026","","","",""
"","104","should hide Environmental Targeted Access Control panel when showEnvironmentAccessControls prop is false","CreateUserForm","Fri May 22 18:55:45 UTC 2026","passed","Fri May 22 18:55:45 UTC 2026","","","",""
"","20","renders note content when currentNote is present","HistoryNotes Component","Fri May 22 19:00:11 UTC 2026","passed","Fri May 22 19:00:11 UTC 2026","","","",""
"Test cases for TestTagScanner_NextTopLevelTag","0","TestTagScanner_NextTopLevelTag","","Fri May 22 18:54:29 UTC 2026","passed","Fri May 22 18:54:29 UTC 2026","","Go Test","github.com/specterops/bloodhound/cmd/api/src/services/upload/TestTagScanner_NextTopLevelTag","TestTagScanner_NextTopLevelTag"
"Test cases for TestGetLimitParamForGraphQuery","1","TestGetLimitParamForGraphQuery","","Fri May 22 18:54:32 UTC 2026","passed","Fri May 22 18:54:32 UTC 2026","","Go Test","github.com/specterops/bloodhound/cmd/api/src/utils/TestGetLimitParamForGraphQuery","TestGetLimitParamForGraphQuery"
"Test cases for TestResources_ListUsersMinimal","6","TestResources_ListUsersMinimal","","Fri May 22 18:54:54 UTC 2026","passed","Fri May 22 18:54:54 UTC 2026","","Go Test","github.com/specterops/bloodhound/cmd/api/src/api/v2/auth/TestResources_ListUsersMinimal","TestResources_ListUsersMinimal"
"","334","should fire ""onClose"" once","UserTokenManagementDialog","Fri May 22 18:56:55 UTC 2026","passed","Fri May 22 18:56:56 UTC 2026","","when user clicks ""Close"" button","",""
"","265","Hides selector information if additionalSections is false","EntityInfoDataTableList","Fri May 22 18:58:27 UTC 2026","passed","Fri May 22 18:58:27 UTC 2026","","","",""
"","4","should recognize active directory properties","validating a node property against the shared generated schema","Fri May 22 18:57:12 UTC 2026","passed","Fri May 22 18:57:12 UTC 2026","","","",""
"","159","upon selecting a source node, updates the URL with a searchType of 'node' and primarySearch of the node's objectid","useNodeSearch","Fri May 22 18:59:32 UTC 2026","passed","Fri May 22 18:59:32 UTC 2026","","","",""
"","761","should call onSave when Save button is clicked and form input is valid","UpdateUserDialog","Fri May 22 18:56:23 UTC 2026","passed","Fri May 22 18:56:24 UTC 2026","","","",""
"","1","should recognize a common properties","validating a node property against the shared generated schema","Fri May 22 18:57:12 UTC 2026","passed","Fri May 22 18:57:12 UTC 2026","","","",""
"","662","renders a primary button as expected","DropdownSelector","Fri May 22 18:59:09 UTC 2026","passed","Fri May 22 18:59:10 UTC 2026","","","",""
"Test cases for Test_sortAndSliceResults_sorting","0","Test_sortAndSliceResults_sorting","","Fri May 22 18:54:25 UTC 2026","passed","Fri May 22 18:54:25 UTC 2026","","Go Test","github.com/specterops/bloodhound/cmd/api/src/queries/Test_sortAndSliceResults_sorting","Test_sortAndSliceResults_sorting"
"Test cases for TestRoleAssignments_NodesWithRolesExclusive","0","TestRoleAssignments_NodesWithRolesExclusive","","Fri May 22 18:54:35 UTC 2026","passed","Fri May 22 18:54:35 UTC 2026","","Go Test","github.com/specterops/bloodhound/packages/go/analysis/azure/TestRoleAssignments_NodesWithRolesExclusive","TestRoleAssignments_NodesWithRolesExclusive"
"Test that the digester handles empty property lists gracefully","0","TestCacheEntryDigester_EmptyMatchers","","Fri May 22 18:54:28 UTC 2026","passed","Fri May 22 18:54:28 UTC 2026","","Go Test","github.com/specterops/bloodhound/cmd/api/src/services/graphify/endpoint/TestCacheEntryDigester_EmptyMatchers","TestCacheEntryDigester_EmptyMatchers"
"","3","returns default empty labels and relationshipTypes when called with no arguments","graphSchema","Fri May 22 18:59:58 UTC 2026","passed","Fri May 22 18:59:58 UTC 2026","","","",""
"","1076","displays validation error messages when password does not meet requirements","PasswordDialog","Fri May 22 18:55:49 UTC 2026","passed","Fri May 22 18:55:50 UTC 2026","","","",""
"","19","renders the tooltip icon when tooltipText prop is passed","ColumnHeaders","Fri May 22 18:58:15 UTC 2026","passed","Fri May 22 18:58:15 UTC 2026","","SortableHeader with Tooltip","",""
"Test cases for TestResources_GetAIACAEntityInfo","217","TestResources_GetAIACAEntityInfo","","Fri May 22 18:54:20 UTC 2026","passed","Fri May 22 18:54:20 UTC 2026","","Go Test","github.com/specterops/bloodhound/cmd/api/src/api/v2/TestResources_GetAIACAEntityInfo","TestResources_GetAIACAEntityInfo"
"Test cases for TestPermissionsCheckAll","0","TestPermissionsCheckAll","","Fri May 22 18:54:14 UTC 2026","passed","Fri May 22 18:54:14 UTC 2026","","Go Test","github.com/specterops/bloodhound/cmd/api/src/api/middleware/TestPermissionsCheckAll","TestPermissionsCheckAll"
"Test cases for TestBuildErrorResponseInternalServerError","0","TestBuildErrorResponseInternalServerError","","Fri May 22 18:54:10 UTC 2026","passed","Fri May 22 18:54:10 UTC 2026","","Go Test","github.com/specterops/bloodhound/cmd/api/src/api/TestBuildErrorResponseInternalServerError","TestBuildErrorResponseInternalServerError"
"","7","fully replaces state","useObjectState","Fri May 22 18:59:42 UTC 2026","passed","Fri May 22 18:59:42 UTC 2026","","","",""
"Test cases for TestMaybeSubmitNodeUpdate","0","TestMaybeSubmitNodeUpdate","","Fri May 22 18:54:28 UTC 2026","passed","Fri May 22 18:54:28 UTC 2026","","Go Test","github.com/specterops/bloodhound/cmd/api/src/services/graphify/TestMaybeSubmitNodeUpdate","TestMaybeSubmitNodeUpdate"
"","453","has date range input filters","FileIngestFilterDialog","Fri May 22 18:56:47 UTC 2026","passed","Fri May 22 18:56:47 UTC 2026","","Date Range Inputs","",""
"","135","buttons are disabled while loading","PasswordResetForm","Fri May 22 18:58:05 UTC 2026","passed","Fri May 22 18:58:05 UTC 2026","","","",""
"","18","displays CaretDownOutline icon when the sortOrder is undefined","ColumnHeaders","Fri May 22 18:58:15 UTC 2026","passed","Fri May 22 18:58:15 UTC 2026","","SortableHeader","",""
"Test cases for TestTracker_HasEdge_NilVsEmptyProperties","0","TestTracker_HasEdge_NilVsEmptyProperties","","Fri May 22 18:54:36 UTC 2026","passed","Fri May 22 18:54:36 UTC 2026","","Go Test","github.com/specterops/bloodhound/packages/go/analysis/post/TestTracker_HasEdge_NilVsEmptyProperties","TestTracker_HasEdge_NilVsEmptyProperties"
"Test cases for Test_UseHooks","0","Test_UseHooks","","Fri May 22 18:54:37 UTC 2026","passed","Fri May 22 18:54:37 UTC 2026","","Go Test","github.com/specterops/bloodhound/packages/go/lab/Test_UseHooks","Test_UseHooks"
"","184","renders an interactive version when preview is set to false","PrivilegeZonesCypherEditor Search component for Zone Management","Fri May 22 18:59:22 UTC 2026","passed","Fri May 22 18:59:22 UTC 2026","","","",""
"Test cases for TestManagementResource_ListUsers_InvalidFilterPredicate","0","TestManagementResource_ListUsers_InvalidFilterPredicate","","Fri May 22 18:54:26 UTC 2026","passed","Fri May 22 18:54:26 UTC 2026","","Go Test","github.com/specterops/bloodhound/cmd/api/src/api/v2/auth/TestManagementResource_ListUsers_InvalidFilterPredicate","TestManagementResource_ListUsers_InvalidFilterPredicate"
"Test cases for TestResources_ListADDomainContainedGroups","0","TestResources_ListADDomainContainedGroups","","Fri May 22 18:54:20 UTC 2026","passed","Fri May 22 18:54:20 UTC 2026","","Go Test","github.com/specterops/bloodhound/cmd/api/src/api/v2/TestResources_ListADDomainContainedGroups","TestResources_ListADDomainContainedGroups"
"","61","button is disabled when note is falsy","NoteCell component","Fri May 22 18:59:05 UTC 2026","passed","Fri May 22 18:59:05 UTC 2026","","","",""
"Test cases for Test_SetDependency","0","Test_SetDependency","","Fri May 22 18:54:37 UTC 2026","passed","Fri May 22 18:54:37 UTC 2026","","Go Test","github.com/specterops/bloodhound/packages/go/lab/Test_SetDependency","Test_SetDependency"
"","176","does not show ""API Expiration Date"" column header when expiration is disabled","UserTokenManagementDialog - API Expiration Date column","Fri May 22 18:56:56 UTC 2026","passed","Fri May 22 18:56:56 UTC 2026","","","",""
"","2","should recognize azure properties","validating a node property against the shared generated schema","Fri May 22 18:57:12 UTC 2026","passed","Fri May 22 18:57:12 UTC 2026","","","",""
"Test cases for Test_ParseGraphSortParameters_InvalidSortColumn","0","Test_ParseGraphSortParameters_InvalidSortColumn","","Fri May 22 18:54:10 UTC 2026","passed","Fri May 22 18:54:10 UTC 2026","","Go Test","github.com/specterops/bloodhound/cmd/api/src/api/Test_ParseGraphSortParameters_InvalidSortColumn","Test_ParseGraphSortParameters_InvalidSortColumn"
"Test cases for TestOpenGraphSchemaService_DeleteExtension","1","TestOpenGraphSchemaService_DeleteExtension","","Fri May 22 18:54:28 UTC 2026","passed","Fri May 22 18:54:28 UTC 2026","","Go Test","github.com/specterops/bloodhound/cmd/api/src/services/opengraphschema/TestOpenGraphSchemaService_DeleteExtension","TestOpenGraphSchemaService_DeleteExtension"
"Test cases for TestGetADDataQualityStats_Failure","0","TestGetADDataQualityStats_Failure","","Fri May 22 18:54:20 UTC 2026","passed","Fri May 22 18:54:20 UTC 2026","","Go Test","github.com/specterops/bloodhound/cmd/api/src/api/v2/TestGetADDataQualityStats_Failure","TestGetADDataQualityStats_Failure"
"","13","does not render note content when selected is null","HistoryNotes Component","Fri May 22 19:00:11 UTC 2026","passed","Fri May 22 19:00:11 UTC 2026","","","",""
"Test cases for TestArgon2_Digest","0","TestArgon2_Digest","","Fri May 22 18:54:36 UTC 2026","passed","Fri May 22 18:54:36 UTC 2026","","Go Test","github.com/specterops/bloodhound/packages/go/crypto/TestArgon2_Digest","TestArgon2_Digest"
"","608","renders the form for creating a new rule","Rule Form","Fri May 22 18:55:25 UTC 2026","passed","Fri May 22 18:55:25 UTC 2026","","","",""
"Test cases for TestJSONFloat_MarshalJSON_NaN","0","TestJSONFloat_MarshalJSON_NaN","","Fri May 22 18:54:23 UTC 2026","passed","Fri May 22 18:54:23 UTC 2026","","Go Test","github.com/specterops/bloodhound/cmd/api/src/database/types/nan/TestJSONFloat_MarshalJSON_NaN","TestJSONFloat_MarshalJSON_NaN"
"Test cases for TestGetAzureDataQualityStats_Success","0","TestGetAzureDataQualityStats_Success","","Fri May 22 18:54:20 UTC 2026","passed","Fri May 22 18:54:20 UTC 2026","","Go Test","github.com/specterops/bloodhound/cmd/api/src/api/v2/TestGetAzureDataQualityStats_Success","TestGetAzureDataQualityStats_Success"
"Test cases for TestParseOptionalLimitQueryParameter","82","TestParseOptionalLimitQueryParameter","","Fri May 22 18:54:20 UTC 2026","passed","Fri May 22 18:54:20 UTC 2026","","Go Test","github.com/specterops/bloodhound/cmd/api/src/api/v2/TestParseOptionalLimitQueryParameter","TestParseOptionalLimitQueryParameter"
"","76","is disabled if no filters are active","AssetGroupEdit","Fri May 22 18:57:18 UTC 2026","passed","Fri May 22 18:57:18 UTC 2026","","Clear Filters button","",""
"Test cases for TestMinMaxValidator","0","TestMinMaxValidator","","Fri May 22 18:54:34 UTC 2026","passed","Fri May 22 18:54:34 UTC 2026","","Go Test","github.com/specterops/bloodhound/cmd/api/src/utils/validation/TestMinMaxValidator","TestMinMaxValidator"
"","255","filters extensions based on search input","ActiveExtensionsCard","Fri May 22 18:55:36 UTC 2026","passed","Fri May 22 18:55:36 UTC 2026","","","",""
"","428","should display ""Generate/Revoke API Tokens"" title","UserTokenManagementDialog","Fri May 22 18:56:54 UTC 2026","passed","Fri May 22 18:56:55 UTC 2026","","","",""
"Test cases for TestSignRequestAtInternalError","0","TestSignRequestAtInternalError","","Fri May 22 18:54:10 UTC 2026","passed","Fri May 22 18:54:10 UTC 2026","","Go Test","github.com/specterops/bloodhound/cmd/api/src/api/TestSignRequestAtInternalError","TestSignRequestAtInternalError"
"","160","Verify Vault Reader count is the count returned by All Readers","EntityInfoDataTable","Fri May 22 18:56:46 UTC 2026","passed","Fri May 22 18:56:47 UTC 2026","","Node count for Vault Readers nested table","",""
"","369","renders with applied filters","Privilege Zones History Filter Dialog","Fri May 22 18:57:50 UTC 2026","passed","Fri May 22 18:57:50 UTC 2026","","","",""
"Test cases for TestResources_ListADComputerSQLAdmins","3","TestResources_ListADComputerSQLAdmins","","Fri May 22 18:54:20 UTC 2026","passed","Fri May 22 18:54:20 UTC 2026","","Go Test","github.com/specterops/bloodhound/cmd/api/src/api/v2/TestResources_ListADComputerSQLAdmins","TestResources_ListADComputerSQLAdmins"
"","440","renders correctly with requiresCurrentPassword false","PasswordDialog","Fri May 22 18:55:48 UTC 2026","passed","Fri May 22 18:55:48 UTC 2026","","","",""
"","202","renders with the Export and Delete buttons disabled","QuerySearchFilter","Fri May 22 18:58:34 UTC 2026","passed","Fri May 22 18:58:34 UTC 2026","","","",""
"","309","clicking a delete button calls deleteHandler","PrebuiltSearchList","Fri May 22 18:58:20 UTC 2026","passed","Fri May 22 18:58:20 UTC 2026","","","",""
"Test cases for TestResources_ListADEntityControllables","2","TestResources_ListADEntityControllables","","Fri May 22 18:54:20 UTC 2026","passed","Fri May 22 18:54:20 UTC 2026","","Go Test","github.com/specterops/bloodhound/cmd/api/src/api/v2/TestResources_ListADEntityControllables","TestResources_ListADEntityControllables"
"Test cases for TestGenerateTOTPSecret","0","TestGenerateTOTPSecret","","Fri May 22 18:54:20 UTC 2026","passed","Fri May 22 18:54:20 UTC 2026","","Go Test","github.com/specterops/bloodhound/cmd/api/src/auth/TestGenerateTOTPSecret","TestGenerateTOTPSecret"
"Test cases for TestResources_CreateSavedQuery_DuplicateName","0","TestResources_CreateSavedQuery_DuplicateName","","Fri May 22 18:54:20 UTC 2026","passed","Fri May 22 18:54:20 UTC 2026","","Go Test","github.com/specterops/bloodhound/cmd/api/src/api/v2/TestResources_CreateSavedQuery_DuplicateName","TestResources_CreateSavedQuery_DuplicateName"
"Test cases for TestQueries_BuildEntityQueryParams","0","TestQueries_BuildEntityQueryParams","","Fri May 22 18:54:25 UTC 2026","passed","Fri May 22 18:54:25 UTC 2026","","Go Test","github.com/specterops/bloodhound/cmd/api/src/queries/TestQueries_BuildEntityQueryParams","TestQueries_BuildEntityQueryParams"
"","163","renders Label as first tab and is also the initially selected on first render in Labels View/Tab","Selected Details Tabs","Fri May 22 18:57:42 UTC 2026","passed","Fri May 22 18:57:42 UTC 2026","","Selected Details Tabs - Params present","",""
"","34","renders the title passed via title prop","ColumnHeaders","Fri May 22 18:58:14 UTC 2026","passed","Fri May 22 18:58:14 UTC 2026","","SortableHeader","",""
"","0","The user has yet to type into the search (for OU and Domain searches that have hard coded types)","Getting the text for the disabled item display for a search when there are no results","Fri May 22 18:58:49 UTC 2026","passed","Fri May 22 18:58:49 UTC 2026","","Empty data states","",""
"Test cases for TestResources_ListAuditLogs_SkipAndOffset","0","TestResources_ListAuditLogs_SkipAndOffset","","Fri May 22 18:54:20 UTC 2026","passed","Fri May 22 18:54:20 UTC 2026","","Go Test","github.com/specterops/bloodhound/cmd/api/src/api/v2/TestResources_ListAuditLogs_SkipAndOffset","TestResources_ListAuditLogs_SkipAndOffset"
"","0","prefixes each node_kind with a colon for labels","graphSchema","Fri May 22 18:59:58 UTC 2026","passed","Fri May 22 18:59:58 UTC 2026","","","",""
"","2","should compute normal vectors for line segments","bezier","Fri May 22 19:01:19 UTC 2026","passed","Fri May 22 19:01:19 UTC 2026","","","",""
"","582","displays current password error messages when current password is empty","PasswordDialog","Fri May 22 18:55:51 UTC 2026","passed","Fri May 22 18:55:52 UTC 2026","","","",""
"","750","should display generate/revoke api tokens button","Api Keys","Fri May 22 18:58:58 UTC 2026","passed","Fri May 22 18:58:59 UTC 2026","","","",""
"Test cases for TestWriteAndValidateJSON_NormalizationError","3","TestWriteAndValidateJSON_NormalizationError","","Fri May 22 18:54:29 UTC 2026","passed","Fri May 22 18:54:29 UTC 2026","","Go Test","github.com/specterops/bloodhound/cmd/api/src/services/upload/TestWriteAndValidateJSON_NormalizationError","TestWriteAndValidateJSON_NormalizationError"
