"DESCRIPTION","DURATION IN MS","NAME","PARENT SUITE","START TIME","STATUS","STOP TIME","SUB SUITE","SUITE","TEST CLASS","TEST METHOD"
"","3","prevents Sigma defaults events","preventAllDefaults","Fri May 22 19:01:42 UTC 2026","passed","Fri May 22 19:01:42 UTC 2026","","","",""
"","305","Toggles node and edge labels on/off depending on their existing state","GraphControls","Fri May 22 18:55:27 UTC 2026","passed","Fri May 22 18:55:27 UTC 2026","","Toggling labels","",""
"","1","fails for password without lowercase letters","testPassword","Fri May 22 19:00:27 UTC 2026","passed","Fri May 22 19:00:27 UTC 2026","","","",""
"Test cases for TestManagementResource_ListRoles_InvalidFilterPredicate","0","TestManagementResource_ListRoles_InvalidFilterPredicate","","Fri May 22 18:54:26 UTC 2026","passed","Fri May 22 18:54:26 UTC 2026","","Go Test","github.com/specterops/bloodhound/cmd/api/src/api/v2/auth/TestManagementResource_ListRoles_InvalidFilterPredicate","TestManagementResource_ListRoles_InvalidFilterPredicate"
"","52","does not render count for a selected zone if prop is not set","DynamicDetails","Fri May 22 18:57:33 UTC 2026","passed","Fri May 22 18:57:33 UTC 2026","","","",""
"Test cases for TestWriteErrorResponse_V2","0","TestWriteErrorResponse_V2","","Fri May 22 18:54:10 UTC 2026","passed","Fri May 22 18:54:10 UTC 2026","","Go Test","github.com/specterops/bloodhound/cmd/api/src/api/TestWriteErrorResponse_V2","TestWriteErrorResponse_V2"
"Test cases for TestGetPlatformAggregateStats_Success","0","TestGetPlatformAggregateStats_Success","","Fri May 22 18:54:20 UTC 2026","passed","Fri May 22 18:54:20 UTC 2026","","Go Test","github.com/specterops/bloodhound/cmd/api/src/api/v2/TestGetPlatformAggregateStats_Success","TestGetPlatformAggregateStats_Success"
"","383","should disable Cancel and Save buttons while isLoading is true","UpdateUserDialog","Fri May 22 18:56:26 UTC 2026","passed","Fri May 22 18:56:27 UTC 2026","","","",""
"","1","returns propertyKeys from all three kind property enums","graphSchema","Fri May 22 18:59:58 UTC 2026","passed","Fri May 22 18:59:58 UTC 2026","","","",""
"","216","renders the QuerySearchFilter component","QuerySearchFilter","Fri May 22 18:58:33 UTC 2026","passed","Fri May 22 18:58:34 UTC 2026","","","",""
"","0","fails for empty password","testPassword","Fri May 22 19:00:27 UTC 2026","passed","Fri May 22 19:00:27 UTC 2026","","","",""
"","257","Trying to view the edge info does not crash the app when selecting an unrecognized edge","EdgeInfoContent","Fri May 22 18:55:35 UTC 2026","passed","Fri May 22 18:55:36 UTC 2026","","","",""
"Test cases for TestResources_DownloadCollectorChecksumByVersion","0","TestResources_DownloadCollectorChecksumByVersion","","Fri May 22 18:54:20 UTC 2026","passed","Fri May 22 18:54:20 UTC 2026","","Go Test","github.com/specterops/bloodhound/cmd/api/src/api/v2/TestResources_DownloadCollectorChecksumByVersion","TestResources_DownloadCollectorChecksumByVersion"
"Test cases for TestResources_GetGroupEntityInfo","3","TestResources_GetGroupEntityInfo","","Fri May 22 18:54:20 UTC 2026","passed","Fri May 22 18:54:20 UTC 2026","","Go Test","github.com/specterops/bloodhound/cmd/api/src/api/v2/TestResources_GetGroupEntityInfo","TestResources_GetGroupEntityInfo"
"Test cases for TestInt64From","0","TestInt64From","","Fri May 22 18:54:23 UTC 2026","passed","Fri May 22 18:54:23 UTC 2026","","Go Test","github.com/specterops/bloodhound/cmd/api/src/database/types/null/TestInt64From","TestInt64From"
"","0","filters by low risk level","filterAndSearchEnvironments","Fri May 22 18:55:30 UTC 2026","passed","Fri May 22 18:55:30 UTC 2026","","risk filters","",""
"","178","calls clickHandler when a line item is clicked","PrebuiltSearchList","Fri May 22 18:58:20 UTC 2026","passed","Fri May 22 18:58:20 UTC 2026","","","",""
"","1","should return an empty map when no tags or paths match","opsFilter","Fri May 22 18:59:27 UTC 2026","passed","Fri May 22 18:59:27 UTC 2026","","","",""
"","7","does not request finished jobs if lacking permission","useFinishedJobs","Fri May 22 18:57:53 UTC 2026","passed","Fri May 22 18:57:53 UTC 2026","","","",""
"Test cases for TestPredefinedNodeNamePrefixes","0","TestPredefinedNodeNamePrefixes","","Fri May 22 18:54:35 UTC 2026","passed","Fri May 22 18:54:35 UTC 2026","","Go Test","github.com/specterops/bloodhound/packages/go/analysis/ad/wellknown/TestPredefinedNodeNamePrefixes","TestPredefinedNodeNamePrefixes"
"","1251","shows a warning for using labels associated with tags in zone forms","Rule Form","Fri May 22 18:55:31 UTC 2026","passed","Fri May 22 18:55:32 UTC 2026","","","",""
"","754","should display all available roles","UpdateUserDialog","Fri May 22 18:56:24 UTC 2026","passed","Fri May 22 18:56:25 UTC 2026","","","",""
"Test cases for TestResources_ListADDomainContainedComputers","0","TestResources_ListADDomainContainedComputers","","Fri May 22 18:54:20 UTC 2026","passed","Fri May 22 18:54:20 UTC 2026","","Go Test","github.com/specterops/bloodhound/cmd/api/src/api/v2/TestResources_ListADDomainContainedComputers","TestResources_ListADDomainContainedComputers"
"Test cases for TestResources_ListADComputerRDPUsers","1","TestResources_ListADComputerRDPUsers","","Fri May 22 18:54:20 UTC 2026","passed","Fri May 22 18:54:20 UTC 2026","","Go Test","github.com/specterops/bloodhound/cmd/api/src/api/v2/TestResources_ListADComputerRDPUsers","TestResources_ListADComputerRDPUsers"
"","33","should display the checkbox group title","Checkbox group","Fri May 22 19:00:13 UTC 2026","passed","Fri May 22 19:00:13 UTC 2026","","","",""
"","0","The node radius is adjusted to take into account the current camera zoom ratio","getNodeRadius","Fri May 22 19:01:32 UTC 2026","passed","Fri May 22 19:01:32 UTC 2026","","","",""
"","345","renders the popup content with run, edit/share, and delete when the menu trigger","ListItemActionMenu","Fri May 22 18:58:54 UTC 2026","passed","Fri May 22 18:58:55 UTC 2026","","","",""
"Test cases for TestSet","0","TestSet","","Fri May 22 18:54:37 UTC 2026","passed","Fri May 22 18:54:37 UTC 2026","","Go Test","github.com/specterops/bloodhound/packages/go/lab/internal/TestSet","TestSet"
"","0","escapes a backslash","escapeCypherString","Fri May 22 19:00:21 UTC 2026","passed","Fri May 22 19:00:21 UTC 2026","","","",""
"Test cases for TestManagementResource_ListUsers_InvalidColumn","0","TestManagementResource_ListUsers_InvalidColumn","","Fri May 22 18:54:26 UTC 2026","passed","Fri May 22 18:54:26 UTC 2026","","Go Test","github.com/specterops/bloodhound/cmd/api/src/api/v2/auth/TestManagementResource_ListUsers_InvalidColumn","TestManagementResource_ListUsers_InvalidColumn"
"","350","invalidates the extensions query after a successful upload","SchemaUploadDialog","Fri May 22 18:56:40 UTC 2026","passed","Fri May 22 18:56:40 UTC 2026","","","",""
"","23","renders custom icon correctly","NodeIcon","Fri May 22 18:59:48 UTC 2026","passed","Fri May 22 18:59:48 UTC 2026","","","",""
"","1","should return the edge parts from the key","getEdgeDataFromKey","Fri May 22 19:01:39 UTC 2026","passed","Fri May 22 19:01:39 UTC 2026","","","",""
"","31","returns undefined if environmentId searched for is not found","useAvailableEnvironments","Fri May 22 18:57:56 UTC 2026","passed","Fri May 22 18:57:56 UTC 2026","","useSelectedEnvironment","",""
"Test cases for TestResources_UpdateSavedQuery_NotAUserAuth","0","TestResources_UpdateSavedQuery_NotAUserAuth","","Fri May 22 18:54:20 UTC 2026","passed","Fri May 22 18:54:20 UTC 2026","","Go Test","github.com/specterops/bloodhound/cmd/api/src/api/v2/TestResources_UpdateSavedQuery_NotAUserAuth","TestResources_UpdateSavedQuery_NotAUserAuth"
"Test cases for TestResources_CreateSavedQuery","0","TestResources_CreateSavedQuery","","Fri May 22 18:54:20 UTC 2026","passed","Fri May 22 18:54:20 UTC 2026","","Go Test","github.com/specterops/bloodhound/cmd/api/src/api/v2/TestResources_CreateSavedQuery","TestResources_CreateSavedQuery"
"","0","EXTENDED ROUNDING when thresholds are set: does not abbreviate numbers < 10000","numberFormatting","Fri May 22 18:58:18 UTC 2026","passed","Fri May 22 18:58:18 UTC 2026","","","",""
"TestMigrator_GenerateManifest tests the full integrity of a Manifest generatedfrom 3 different Source's:1) Correct number of total migrations detected.2) Correct number of versions detected.3) The VersionTable has all versions, in order.4) All versions have the correct number of migrations.5) Schema files generate v0.0.0 migrations.6) Migrations are ordered within each version, in the order the Source was defined.","0","TestMigrator_GenerateManifest","","Fri May 22 18:54:23 UTC 2026","passed","Fri May 22 18:54:23 UTC 2026","","Go Test","github.com/specterops/bloodhound/cmd/api/src/database/migration/TestMigrator_GenerateManifest","TestMigrator_GenerateManifest"
"","653","shows success notification after successful deletion","ActiveExtensionsCard","Fri May 22 18:55:40 UTC 2026","passed","Fri May 22 18:55:41 UTC 2026","","","",""
"Test cases for TestMergedFS_ReadDir","0","TestMergedFS_ReadDir","","Fri May 22 18:54:23 UTC 2026","passed","Fri May 22 18:54:23 UTC 2026","","Go Test","github.com/specterops/bloodhound/cmd/api/src/database/migration/TestMergedFS_ReadDir","TestMergedFS_ReadDir"
"","8","dismisses a notification","AppNotifications","Fri May 22 18:59:10 UTC 2026","passed","Fri May 22 18:59:10 UTC 2026","","","",""
"","1003","should hide Environmental Targeted Access Control panel when showEnvironmentAccessControls prop is true and power user role is selected","CreateUserForm","Fri May 22 18:55:44 UTC 2026","passed","Fri May 22 18:55:45 UTC 2026","","","",""
"Test cases for TestLoginExpiry","0","TestLoginExpiry","","Fri May 22 18:54:54 UTC 2026","passed","Fri May 22 18:54:54 UTC 2026","","Go Test","github.com/specterops/bloodhound/cmd/api/src/api/v2/auth/TestLoginExpiry","TestLoginExpiry"
"","65","passes checks if the user has multiple required permissions","usePermissions","Fri May 22 18:57:22 UTC 2026","passed","Fri May 22 18:57:22 UTC 2026","","","",""
"","241","renders enabled Zone and Object tabs and disabled Rule tab","Selected Details Tabs","Fri May 22 18:57:42 UTC 2026","passed","Fri May 22 18:57:42 UTC 2026","","Selected Details Tabs - Params present","",""
"Test cases for TestTextUnmarshalString","0","TestTextUnmarshalString","","Fri May 22 18:54:23 UTC 2026","passed","Fri May 22 18:54:23 UTC 2026","","Go Test","github.com/specterops/bloodhound/cmd/api/src/database/types/null/TestTextUnmarshalString","TestTextUnmarshalString"
"Test cases for TestTracker_HasEdge_PropertyChangeDetectedAsDeletion","0","TestTracker_HasEdge_PropertyChangeDetectedAsDeletion","","Fri May 22 18:54:36 UTC 2026","passed","Fri May 22 18:54:36 UTC 2026","","Go Test","github.com/specterops/bloodhound/packages/go/analysis/post/TestTracker_HasEdge_PropertyChangeDetectedAsDeletion","TestTracker_HasEdge_PropertyChangeDetectedAsDeletion"
"Test cases for TestResources_ListADCSEscalations","0","TestResources_ListADCSEscalations","","Fri May 22 18:54:20 UTC 2026","passed","Fri May 22 18:54:20 UTC 2026","","Go Test","github.com/specterops/bloodhound/cmd/api/src/api/v2/TestResources_ListADCSEscalations","TestResources_ListADCSEscalations"
"","99","when `selectedItem` is provided, the combobox displays the icon","icon rendering","Fri May 22 18:57:18 UTC 2026","passed","Fri May 22 18:57:18 UTC 2026","","","",""
"","6","displays lastlogontimestamp cell as NEVER when the value is -1","ExploreTableDataCell","Fri May 22 18:59:46 UTC 2026","passed","Fri May 22 18:59:46 UTC 2026","","","",""
"","70","should hide Environmental Targeted Access Control panel when showEnvironmentAccessControls prop is false","UpdateUserForm","Fri May 22 18:55:20 UTC 2026","passed","Fri May 22 18:55:20 UTC 2026","","","",""
"Test cases for Test_filterAndFormatSearchResults_filterEnvironments_tenantIDFail","0","Test_filterAndFormatSearchResults_filterEnvironments_tenantIDFail","","Fri May 22 18:54:20 UTC 2026","passed","Fri May 22 18:54:20 UTC 2026","","Go Test","github.com/specterops/bloodhound/cmd/api/src/api/v2/Test_filterAndFormatSearchResults_filterEnvironments_tenantIDFail","Test_filterAndFormatSearchResults_filterEnvironments_tenantIDFail"
"Test cases for TestSIDSuffix_String","0","TestSIDSuffix_String","","Fri May 22 18:54:35 UTC 2026","passed","Fri May 22 18:54:35 UTC 2026","","Go Test","github.com/specterops/bloodhound/packages/go/analysis/ad/wellknown/TestSIDSuffix_String","TestSIDSuffix_String"
"","246","renders correctly with requiresCurrentPassword true","PasswordDialog","Fri May 22 18:55:48 UTC 2026","passed","Fri May 22 18:55:49 UTC 2026","","","",""
"","404","renders a non-primary button as expected","DropdownSelector","Fri May 22 18:59:10 UTC 2026","passed","Fri May 22 18:59:10 UTC 2026","","","",""
"","5","adds new key to state","useObjectState","Fri May 22 18:59:42 UTC 2026","passed","Fri May 22 18:59:42 UTC 2026","","","",""
"Test cases for TestRRuleValidator","0","TestRRuleValidator","","Fri May 22 18:54:34 UTC 2026","passed","Fri May 22 18:54:34 UTC 2026","","Go Test","github.com/specterops/bloodhound/cmd/api/src/utils/validation/TestRRuleValidator","TestRRuleValidator"
"","16","does not render the tooltip icon when tooltipText prop is not passed","ColumnHeaders","Fri May 22 18:58:15 UTC 2026","passed","Fri May 22 18:58:15 UTC 2026","","SortableHeader with Tooltip","",""
"","0","leaves double quotes untouched","escapeCypherString","Fri May 22 19:00:21 UTC 2026","passed","Fri May 22 19:00:21 UTC 2026","","","",""
"Test cases for TestBHCEStaticHandler","0","TestBHCEStaticHandler","","Fri May 22 18:54:14 UTC 2026","passed","Fri May 22 18:54:14 UTC 2026","","Go Test","github.com/specterops/bloodhound/cmd/api/src/api/static/TestBHCEStaticHandler","TestBHCEStaticHandler"
"Test cases for TestAddWhereClauseToNeo4jQuery_NoWhereClause","0","TestAddWhereClauseToNeo4jQuery_NoWhereClause","","Fri May 22 18:54:20 UTC 2026","passed","Fri May 22 18:54:20 UTC 2026","","Go Test","github.com/specterops/bloodhound/cmd/api/src/api/v2/TestAddWhereClauseToNeo4jQuery_NoWhereClause","TestAddWhereClauseToNeo4jQuery_NoWhereClause"
"","551","displays a Upload Files button","FileIngest","Fri May 22 18:59:36 UTC 2026","passed","Fri May 22 18:59:37 UTC 2026","","","",""
"","610","should accept passwords with unicode punctuation characters","CreateUserForm","Fri May 22 18:55:46 UTC 2026","passed","Fri May 22 18:55:47 UTC 2026","","","",""
"Test cases for Test_filterAndFormatSearchResults_filterEnvironments","0","Test_filterAndFormatSearchResults_filterEnvironments","","Fri May 22 18:54:20 UTC 2026","passed","Fri May 22 18:54:20 UTC 2026","","Go Test","github.com/specterops/bloodhound/cmd/api/src/api/v2/Test_filterAndFormatSearchResults_filterEnvironments","Test_filterAndFormatSearchResults_filterEnvironments"
"Test cases for TestStringSetValid","3","TestStringSetValid","","Fri May 22 18:54:23 UTC 2026","passed","Fri May 22 18:54:23 UTC 2026","","Go Test","github.com/specterops/bloodhound/cmd/api/src/database/types/null/TestStringSetValid","TestStringSetValid"
"","296","should render","Rule Object Select","Fri May 22 18:59:06 UTC 2026","passed","Fri May 22 18:59:06 UTC 2026","","","",""
"","23","should display a none selected header and a message to select an object","EntityInfoPanel","Fri May 22 18:59:28 UTC 2026","passed","Fri May 22 18:59:28 UTC 2026","","","",""
"","93","renders delete buttons for each extension","ActiveExtensionsCard","Fri May 22 18:55:36 UTC 2026","passed","Fri May 22 18:55:36 UTC 2026","","","",""
"Test cases for TestManagementResource_DeleteUser_DeleteUserError","639","TestManagementResource_DeleteUser_DeleteUserError","","Fri May 22 18:54:42 UTC 2026","passed","Fri May 22 18:54:43 UTC 2026","","Go Test","github.com/specterops/bloodhound/cmd/api/src/api/v2/auth/TestManagementResource_DeleteUser_DeleteUserError","TestManagementResource_DeleteUser_DeleteUserError"
"Test cases for TestIntScan","0","TestIntScan","","Fri May 22 18:54:23 UTC 2026","passed","Fri May 22 18:54:23 UTC 2026","","Go Test","github.com/specterops/bloodhound/cmd/api/src/database/types/null/TestIntScan","TestIntScan"
"","0","returns undefined if graphData is {} or not a GraphResponse","getExploreTableData","Fri May 22 18:58:23 UTC 2026","passed","Fri May 22 18:58:23 UTC 2026","","","",""
"","831","clears input when dialog is closed and reopened","ActiveExtensionsCard","Fri May 22 18:55:39 UTC 2026","passed","Fri May 22 18:55:39 UTC 2026","","","",""
"","52","composes search params from the search prop and use them in the link","AppLink","Fri May 22 18:58:41 UTC 2026","passed","Fri May 22 18:58:41 UTC 2026","","","",""
"","728","calls delete mutation when confirm button is clicked with correct input","ActiveExtensionsCard","Fri May 22 18:55:39 UTC 2026","passed","Fri May 22 18:55:40 UTC 2026","","","",""
"Test cases for TestGraphQuery_PrepareCypherQuery","44","TestGraphQuery_PrepareCypherQuery","","Fri May 22 18:54:25 UTC 2026","passed","Fri May 22 18:54:25 UTC 2026","","Go Test","github.com/specterops/bloodhound/cmd/api/src/queries/TestGraphQuery_PrepareCypherQuery","TestGraphQuery_PrepareCypherQuery"
"Test cases for TestResources_GetIssuancePolicyEntityInfo","217","TestResources_GetIssuancePolicyEntityInfo","","Fri May 22 18:54:20 UTC 2026","passed","Fri May 22 18:54:20 UTC 2026","","Go Test","github.com/specterops/bloodhound/cmd/api/src/api/v2/TestResources_GetIssuancePolicyEntityInfo","TestResources_GetIssuancePolicyEntityInfo"
"","0","returns empty array when combined filters match nothing","filterAndSearchEnvironments","Fri May 22 18:55:30 UTC 2026","passed","Fri May 22 18:55:30 UTC 2026","","combined filters","",""
"Test cases for TestStringPointer","0","TestStringPointer","","Fri May 22 18:54:23 UTC 2026","passed","Fri May 22 18:54:23 UTC 2026","","Go Test","github.com/specterops/bloodhound/cmd/api/src/database/types/null/TestStringPointer","TestStringPointer"
"","327","renders the Import Query Dialog","ImportQueryDialog","Fri May 22 19:00:20 UTC 2026","passed","Fri May 22 19:00:20 UTC 2026","","","",""
"Test cases for TestGetScheme","0","TestGetScheme","","Fri May 22 18:54:14 UTC 2026","passed","Fri May 22 18:54:14 UTC 2026","","Go Test","github.com/specterops/bloodhound/cmd/api/src/api/middleware/TestGetScheme","TestGetScheme"
"Test cases for TestGenerateQRCodeBase64","0","TestGenerateQRCodeBase64","","Fri May 22 18:54:20 UTC 2026","passed","Fri May 22 18:54:20 UTC 2026","","Go Test","github.com/specterops/bloodhound/cmd/api/src/auth/TestGenerateQRCodeBase64","TestGenerateQRCodeBase64"
"","23","should display hidden label for hidden edge","EdgeInfoHeader","Fri May 22 18:59:01 UTC 2026","passed","Fri May 22 18:59:01 UTC 2026","","","",""
"","0","should handle the well formed entities","Evaluating the entity display name from a given entity","Fri May 22 18:57:12 UTC 2026","passed","Fri May 22 18:57:12 UTC 2026","","","",""
"","250","fires click handlers","ConfirmDeleteQueryDialog","Fri May 22 19:00:21 UTC 2026","passed","Fri May 22 19:00:21 UTC 2026","","","",""
"Test cases for TestParseLimitQueryParameter_Invalid","0","TestParseLimitQueryParameter_Invalid","","Fri May 22 18:54:20 UTC 2026","passed","Fri May 22 18:54:20 UTC 2026","","Go Test","github.com/specterops/bloodhound/cmd/api/src/api/v2/TestParseLimitQueryParameter_Invalid","TestParseLimitQueryParameter_Invalid"
"","707","should render","ExploreTable","Fri May 22 18:55:02 UTC 2026","passed","Fri May 22 18:55:03 UTC 2026","","","",""
"","75","clicking cancel on the form takes the user back to the page the user was on previously","Tag Form","Fri May 22 18:55:08 UTC 2026","passed","Fri May 22 18:55:08 UTC 2026","","","",""
"Test cases for TestManagementResource_UpdateSAMLProviderRequest","14","TestManagementResource_UpdateSAMLProviderRequest","","Fri May 22 18:54:54 UTC 2026","passed","Fri May 22 18:54:54 UTC 2026","","Go Test","github.com/specterops/bloodhound/cmd/api/src/api/v2/auth/TestManagementResource_UpdateSAMLProviderRequest","TestManagementResource_UpdateSAMLProviderRequest"
"Test cases for Test_HarnessSetup","0","Test_HarnessSetup","","Fri May 22 18:54:37 UTC 2026","passed","Fri May 22 18:54:37 UTC 2026","","Go Test","github.com/specterops/bloodhound/packages/go/lab/Test_HarnessSetup","Test_HarnessSetup"
"","381","renders headers","CommonSearches","Fri May 22 18:57:07 UTC 2026","passed","Fri May 22 18:57:07 UTC 2026","","","",""
"","30","selector members refetches on sort change","the useAssetGroupTags utilities","Fri May 22 18:57:01 UTC 2026","passed","Fri May 22 18:57:01 UTC 2026","","","",""
"","2","stores a string value in localStorage","useLocalStorage","Fri May 22 18:57:35 UTC 2026","passed","Fri May 22 18:57:35 UTC 2026","","setValue","",""
"Test cases for TestRewriter_Enter_AllAttackPathsShortcut_TakesPrecedenceOverOtherShortcuts","0","TestRewriter_Enter_AllAttackPathsShortcut_TakesPrecedenceOverOtherShortcuts","","Fri May 22 18:54:25 UTC 2026","passed","Fri May 22 18:54:25 UTC 2026","","Go Test","github.com/specterops/bloodhound/cmd/api/src/queries/TestRewriter_Enter_AllAttackPathsShortcut_TakesPrecedenceOverOtherShortcuts","TestRewriter_Enter_AllAttackPathsShortcut_TakesPrecedenceOverOtherShortcuts"
"","7","should not render a Field when the provided value is []","Field","Fri May 22 18:59:56 UTC 2026","passed","Fri May 22 18:59:56 UTC 2026","","","",""
"Test cases for TestManagementResource_ListAuthTokens_PredicateMismatchWithColumn","0","TestManagementResource_ListAuthTokens_PredicateMismatchWithColumn","","Fri May 22 18:54:46 UTC 2026","passed","Fri May 22 18:54:46 UTC 2026","","Go Test","github.com/specterops/bloodhound/cmd/api/src/api/v2/auth/TestManagementResource_ListAuthTokens_PredicateMismatchWithColumn","TestManagementResource_ListAuthTokens_PredicateMismatchWithColumn"
"","811","should open save dialog on keyboard press alt+S","CypherSearch","Fri May 22 18:56:02 UTC 2026","passed","Fri May 22 18:56:03 UTC 2026","","","",""
"","43","applies empty state height when no results","ActiveExtensionsCard","Fri May 22 18:55:37 UTC 2026","passed","Fri May 22 18:55:37 UTC 2026","","","",""
"","528","clear validation error on input","ManagedDatePicker - date validation","Fri May 22 18:58:10 UTC 2026","passed","Fri May 22 18:58:11 UTC 2026","","","",""
"","2523","should clear out the SSO Provider id from submission data when the authentication method is changed","CreateUserDialog","Fri May 22 18:56:04 UTC 2026","passed","Fri May 22 18:56:07 UTC 2026","","","",""
"Test cases for Test_filterAndFormatSearchResults_default","0","Test_filterAndFormatSearchResults_default","","Fri May 22 18:54:20 UTC 2026","passed","Fri May 22 18:54:20 UTC 2026","","Go Test","github.com/specterops/bloodhound/cmd/api/src/api/v2/Test_filterAndFormatSearchResults_default","Test_filterAndFormatSearchResults_default"
"Test cases for TestSelfDestructingTempFile","0","TestSelfDestructingTempFile","","Fri May 22 18:54:10 UTC 2026","passed","Fri May 22 18:54:10 UTC 2026","","Go Test","github.com/specterops/bloodhound/cmd/api/src/api/TestSelfDestructingTempFile","TestSelfDestructingTempFile"
"","0","shows some collection methods for the given job","toCollected","Fri May 22 19:00:02 UTC 2026","passed","Fri May 22 19:00:02 UTC 2026","","","",""
"","167","renders enabled Zone and Rule tabs and disabled Object tab","Selected Details Tabs","Fri May 22 18:57:42 UTC 2026","passed","Fri May 22 18:57:42 UTC 2026","","Selected Details Tabs - Params present","",""
"","138","collapses an open item when its header is clicked again","<DetailsAccordion />","Fri May 22 18:57:03 UTC 2026","passed","Fri May 22 18:57:03 UTC 2026","","","",""
"","19","does not include OpenGraph edges when the associated feature flag is disabled","useEdgeCategories","Fri May 22 18:57:22 UTC 2026","passed","Fri May 22 18:57:22 UTC 2026","","","",""
"","753","should initiate data loading when an item is selected","Simple Environment Selector","Fri May 22 18:57:29 UTC 2026","passed","Fri May 22 18:57:29 UTC 2026","","","",""
"Test cases for TestFoldl","0","TestFoldl","","Fri May 22 18:54:38 UTC 2026","passed","Fri May 22 18:54:38 UTC 2026","","Go Test","github.com/specterops/bloodhound/packages/go/slicesext/TestFoldl","TestFoldl"
"Test cases for TestCache_Set","0","TestCache_Set","","Fri May 22 18:54:36 UTC 2026","passed","Fri May 22 18:54:36 UTC 2026","","Go Test","github.com/specterops/bloodhound/packages/go/cache/TestCache_Set","TestCache_Set"
"","133","renders correctly","NodeIcon","Fri May 22 18:59:48 UTC 2026","passed","Fri May 22 18:59:48 UTC 2026","","","",""
"","359","should display correctly","DeleteConfirmationDialog","Fri May 22 18:59:55 UTC 2026","passed","Fri May 22 18:59:56 UTC 2026","","","",""
"Test cases for TestFormatDatabaseErrorNotFound","0","TestFormatDatabaseErrorNotFound","","Fri May 22 18:54:10 UTC 2026","passed","Fri May 22 18:54:10 UTC 2026","","Go Test","github.com/specterops/bloodhound/cmd/api/src/api/TestFormatDatabaseErrorNotFound","TestFormatDatabaseErrorNotFound"
"","0","takes setSearchParams and availableParams returns a function","searchParams","Fri May 22 18:58:55 UTC 2026","passed","Fri May 22 18:58:55 UTC 2026","","setParamsFactory","",""
"","60","shows an error notification if there is an error fetching","useFinishedJobs","Fri May 22 18:57:53 UTC 2026","passed","Fri May 22 18:57:53 UTC 2026","","","",""
"","35","renders correctly when an unexpected nodeType is passed","NodeIcon","Fri May 22 18:59:48 UTC 2026","passed","Fri May 22 18:59:48 UTC 2026","","","",""
"Test cases for TestDefaultRateLimitMiddleware","1","TestDefaultRateLimitMiddleware","","Fri May 22 18:54:14 UTC 2026","passed","Fri May 22 18:54:14 UTC 2026","","Go Test","github.com/specterops/bloodhound/cmd/api/src/api/middleware/TestDefaultRateLimitMiddleware","TestDefaultRateLimitMiddleware"
"","1","`undefined` input is provided","Parsing the debounced input for type and keyword values","Fri May 22 18:58:49 UTC 2026","passed","Fri May 22 18:58:49 UTC 2026","","","",""
