"DESCRIPTION","DURATION IN MS","NAME","PARENT SUITE","START TIME","STATUS","STOP TIME","SUB SUITE","SUITE","TEST CLASS","TEST METHOD"
"","10","does not set the document title when no title prop is provided","PageWithTitle","Tue Jul 07 00:06:41 UTC 2026","passed","Tue Jul 07 00:06:41 UTC 2026","","","",""
"Test cases for Test_UseFixture","0","Test_UseFixture","","Tue Jul 07 00:01:09 UTC 2026","passed","Tue Jul 07 00:01:09 UTC 2026","","Go Test","github.com/specterops/bloodhound/packages/go/lab/Test_UseFixture","Test_UseFixture"
"","295","displays expected results when searching by objectid","SearchCurrentNodes","Tue Jul 07 00:04:48 UTC 2026","passed","Tue Jul 07 00:04:48 UTC 2026","","","",""
"Test cases for TestManagementResource_ListUsers_InvalidFilterPredicate","0","TestManagementResource_ListUsers_InvalidFilterPredicate","","Tue Jul 07 00:00:42 UTC 2026","passed","Tue Jul 07 00:00:42 UTC 2026","","Go Test","github.com/specterops/bloodhound/cmd/api/src/api/v2/auth/TestManagementResource_ListUsers_InvalidFilterPredicate","TestManagementResource_ListUsers_InvalidFilterPredicate"
"","0","matches all AZ edges","Make sure pathfinding filterable edges match schemagen","Tue Jul 07 00:06:44 UTC 2026","passed","Tue Jul 07 00:06:44 UTC 2026","","","",""
"Test cases for TestIntValueOrZero","0","TestIntValueOrZero","","Tue Jul 07 00:00:43 UTC 2026","passed","Tue Jul 07 00:00:43 UTC 2026","","Go Test","github.com/specterops/bloodhound/cmd/api/src/database/types/null/TestIntValueOrZero","TestIntValueOrZero"
"","291","clicking a delete button calls deleteHandler","PrebuiltSearchList","Tue Jul 07 00:04:36 UTC 2026","passed","Tue Jul 07 00:04:36 UTC 2026","","","",""
"","19","does not render the tooltip icon when tooltipText prop is not passed","ColumnHeaders","Tue Jul 07 00:04:31 UTC 2026","passed","Tue Jul 07 00:04:31 UTC 2026","","SortableHeader with Tooltip","",""
"Test cases for TestQueries_GetEntityResults","0","TestQueries_GetEntityResults","","Tue Jul 07 00:00:45 UTC 2026","passed","Tue Jul 07 00:00:45 UTC 2026","","Go Test","github.com/specterops/bloodhound/cmd/api/src/queries/TestQueries_GetEntityResults","TestQueries_GetEntityResults"
"","104","clicking cancel on the form takes the user back to the page the user was on previously","Tag Form","Tue Jul 07 00:01:25 UTC 2026","passed","Tue Jul 07 00:01:25 UTC 2026","","","",""
"Test cases for Test_SetApplicationConfiguration","1","Test_SetApplicationConfiguration","","Tue Jul 07 00:00:36 UTC 2026","passed","Tue Jul 07 00:00:36 UTC 2026","","Go Test","github.com/specterops/bloodhound/cmd/api/src/api/v2/Test_SetApplicationConfiguration","Test_SetApplicationConfiguration"
"Test cases for TestContextMiddleware_InvalidWaitLessThanZero","0","TestContextMiddleware_InvalidWaitLessThanZero","","Tue Jul 07 00:00:27 UTC 2026","passed","Tue Jul 07 00:00:27 UTC 2026","","Go Test","github.com/specterops/bloodhound/cmd/api/src/api/middleware/TestContextMiddleware_InvalidWaitLessThanZero","TestContextMiddleware_InvalidWaitLessThanZero"
"","165","navigates to previous history entry when warning dialog is cancelled","EarlyAccessFeatures","Tue Jul 07 00:07:36 UTC 2026","passed","Tue Jul 07 00:07:36 UTC 2026","","","",""
"Test cases for Test_filterAndFormatSearchResults_filterEnvironmentsOG","0","Test_filterAndFormatSearchResults_filterEnvironmentsOG","","Tue Jul 07 00:00:36 UTC 2026","passed","Tue Jul 07 00:00:36 UTC 2026","","Go Test","github.com/specterops/bloodhound/cmd/api/src/api/v2/Test_filterAndFormatSearchResults_filterEnvironmentsOG","Test_filterAndFormatSearchResults_filterEnvironmentsOG"
"","1","returns false when WebGL is not available in the current browser context","WebGL compatibility check","Tue Jul 07 00:06:52 UTC 2026","passed","Tue Jul 07 00:06:52 UTC 2026","","","",""
"","78","shows the Automatic Certification label and the zone-level disabled message","BasicInfo","Tue Jul 07 00:04:12 UTC 2026","passed","Tue Jul 07 00:04:12 UTC 2026","","when isCertificationDisabledOnZoneLevel is false","",""
"","30","should display the checkbox group title","Checkbox group","Tue Jul 07 00:06:28 UTC 2026","passed","Tue Jul 07 00:06:28 UTC 2026","","","",""
"Test cases for TestInt64IsZero","0","TestInt64IsZero","","Tue Jul 07 00:00:43 UTC 2026","passed","Tue Jul 07 00:00:43 UTC 2026","","Go Test","github.com/specterops/bloodhound/cmd/api/src/database/types/null/TestInt64IsZero","TestInt64IsZero"
"","156","renders a button for opening the dialog","SchemaUploadDialog","Tue Jul 07 00:02:45 UTC 2026","passed","Tue Jul 07 00:02:45 UTC 2026","","","",""
"","277","Displays a notification when an error happened when requesting analysis","AnalyzeNowConfiguration","Tue Jul 07 00:03:56 UTC 2026","passed","Tue Jul 07 00:03:56 UTC 2026","","","",""
"","2","should recognize azure properties","validating a node property against the shared generated schema","Tue Jul 07 00:03:30 UTC 2026","passed","Tue Jul 07 00:03:30 UTC 2026","","","",""
"","170","should display","GenericErrorBoundaryFallback","Tue Jul 07 00:06:50 UTC 2026","passed","Tue Jul 07 00:06:50 UTC 2026","","","",""
"","5408","Typing in the search bar filters the results","ExploreTable","Tue Jul 07 00:01:27 UTC 2026","passed","Tue Jul 07 00:01:32 UTC 2026","","","",""
"Test cases for TestNormalizeEinNodeProperties","0","TestNormalizeEinNodeProperties","","Tue Jul 07 00:00:49 UTC 2026","passed","Tue Jul 07 00:00:49 UTC 2026","","Go Test","github.com/specterops/bloodhound/cmd/api/src/services/graphify/TestNormalizeEinNodeProperties","TestNormalizeEinNodeProperties"
"","414","reflects the persisted selected layout in the controls menu","GraphView","Tue Jul 07 00:07:16 UTC 2026","passed","Tue Jul 07 00:07:17 UTC 2026","","Layout selection and de-selection","",""
"","4073","closes explore search tab menu and clears selected item when a cypher query returns multiple nodes","CypherSearch","Tue Jul 07 00:02:20 UTC 2026","passed","Tue Jul 07 00:02:24 UTC 2026","","Minimize explorer page elements when multiple nodes are returned","",""
"","630","handles creating a new rule","Rule Form","Tue Jul 07 00:01:40 UTC 2026","passed","Tue Jul 07 00:01:40 UTC 2026","","","",""
"Test cases for Test_ApplyTimeoutReduction","3","Test_ApplyTimeoutReduction","","Tue Jul 07 00:00:45 UTC 2026","passed","Tue Jul 07 00:00:45 UTC 2026","","Go Test","github.com/specterops/bloodhound/cmd/api/src/queries/Test_ApplyTimeoutReduction","Test_ApplyTimeoutReduction"
"","545","renders the form for creating a new rule","Rule Form","Tue Jul 07 00:01:34 UTC 2026","passed","Tue Jul 07 00:01:34 UTC 2026","","","",""
"","71","indicates the code container is scrollable when the code is unwrapped","CodeController","Tue Jul 07 00:06:27 UTC 2026","passed","Tue Jul 07 00:06:27 UTC 2026","","","",""
"Test cases for TestManagementResource_UpdateUser_IDMalformed","1196","TestManagementResource_UpdateUser_IDMalformed","","Tue Jul 07 00:00:49 UTC 2026","passed","Tue Jul 07 00:00:51 UTC 2026","","Go Test","github.com/specterops/bloodhound/cmd/api/src/api/v2/auth/TestManagementResource_UpdateUser_IDMalformed","TestManagementResource_UpdateUser_IDMalformed"
"","256","should handle click events on apply and cancel","ConfirmUpdateQueryDialog","Tue Jul 07 00:06:20 UTC 2026","passed","Tue Jul 07 00:06:20 UTC 2026","","","",""
"","306","should handle close event","TagToZoneLabelDialog","Tue Jul 07 00:04:38 UTC 2026","passed","Tue Jul 07 00:04:38 UTC 2026","","","",""
"Test cases for TestAssetGroupSelectorSpec_Validate","6","TestAssetGroupSelectorSpec_Validate","","Tue Jul 07 00:00:44 UTC 2026","passed","Tue Jul 07 00:00:44 UTC 2026","","Go Test","github.com/specterops/bloodhound/cmd/api/src/model/TestAssetGroupSelectorSpec_Validate","TestAssetGroupSelectorSpec_Validate"
"","61","displays a status indicator","StatusIndicator","Tue Jul 07 00:06:35 UTC 2026","passed","Tue Jul 07 00:06:36 UTC 2026","","","",""
"Test cases for TestFloatFrom","0","TestFloatFrom","","Tue Jul 07 00:00:43 UTC 2026","passed","Tue Jul 07 00:00:43 UTC 2026","","Go Test","github.com/specterops/bloodhound/cmd/api/src/database/types/null/TestFloatFrom","TestFloatFrom"
"Test cases for TestAddOrderByToNeo4jQuery_WithOrderByClause","0","TestAddOrderByToNeo4jQuery_WithOrderByClause","","Tue Jul 07 00:00:36 UTC 2026","passed","Tue Jul 07 00:00:36 UTC 2026","","Go Test","github.com/specterops/bloodhound/cmd/api/src/api/v2/TestAddOrderByToNeo4jQuery_WithOrderByClause","TestAddOrderByToNeo4jQuery_WithOrderByClause"
"","13","when password is expired and on password reset page, no redirect occurs","AuthenticatedRoute","Tue Jul 07 00:07:35 UTC 2026","passed","Tue Jul 07 00:07:35 UTC 2026","","","",""
"","25","should display hidden node label for hidden node","EntityInfoHeader","Tue Jul 07 00:05:07 UTC 2026","passed","Tue Jul 07 00:05:07 UTC 2026","","","",""
"","209","allows a user to upload a single file and displays its name in the dialog","SchemaUploadDialog","Tue Jul 07 00:02:46 UTC 2026","passed","Tue Jul 07 00:02:46 UTC 2026","","","",""
"Test cases for TestResources_GetPermissionsForSavedQuery","50","TestResources_GetPermissionsForSavedQuery","","Tue Jul 07 00:00:36 UTC 2026","passed","Tue Jul 07 00:00:36 UTC 2026","","Go Test","github.com/specterops/bloodhound/cmd/api/src/api/v2/TestResources_GetPermissionsForSavedQuery","TestResources_GetPermissionsForSavedQuery"
"","184","renders with the Export and Delete buttons disabled","QuerySearchFilter","Tue Jul 07 00:04:50 UTC 2026","passed","Tue Jul 07 00:04:50 UTC 2026","","","",""
"","0","isError returns as expected based on all queries combined","queriesAreLoadingOrErrored","Tue Jul 07 00:06:44 UTC 2026","passed","Tue Jul 07 00:06:44 UTC 2026","","","",""
"Test cases for TestParseSkipQueryParameter_Invalid","0","TestParseSkipQueryParameter_Invalid","","Tue Jul 07 00:00:36 UTC 2026","passed","Tue Jul 07 00:00:36 UTC 2026","","Go Test","github.com/specterops/bloodhound/cmd/api/src/api/v2/TestParseSkipQueryParameter_Invalid","TestParseSkipQueryParameter_Invalid"
"","432","renders no asset group edit options without graph write permissions","ContextMenu","Tue Jul 07 00:03:17 UTC 2026","passed","Tue Jul 07 00:03:17 UTC 2026","","","",""
"Test cases for TestHandlers_IsEnabled","0","TestHandlers_IsEnabled","","Tue Jul 07 00:01:32 UTC 2026","passed","Tue Jul 07 00:01:32 UTC 2026","","Go Test","github.com/specterops/bloodhound/server/featureflags/internal/handlers/TestHandlers_IsEnabled","TestHandlers_IsEnabled"
"","109","renders Empty when items is undefined and Empty is provided","<DetailsAccordion />","Tue Jul 07 00:03:20 UTC 2026","passed","Tue Jul 07 00:03:20 UTC 2026","","","",""
"Test cases for TestResources_ListADDomainForeignGroups","4","TestResources_ListADDomainForeignGroups","","Tue Jul 07 00:00:36 UTC 2026","passed","Tue Jul 07 00:00:36 UTC 2026","","Go Test","github.com/specterops/bloodhound/cmd/api/src/api/v2/TestResources_ListADDomainForeignGroups","TestResources_ListADDomainForeignGroups"
"Test cases for TestManagementResource_ListRoles_DBError","0","TestManagementResource_ListRoles_DBError","","Tue Jul 07 00:00:42 UTC 2026","passed","Tue Jul 07 00:00:42 UTC 2026","","Go Test","github.com/specterops/bloodhound/cmd/api/src/api/v2/auth/TestManagementResource_ListRoles_DBError","TestManagementResource_ListRoles_DBError"
"Test cases for TestQueries_GetRequestedType","0","TestQueries_GetRequestedType","","Tue Jul 07 00:00:45 UTC 2026","passed","Tue Jul 07 00:00:45 UTC 2026","","Go Test","github.com/specterops/bloodhound/cmd/api/src/queries/TestQueries_GetRequestedType","TestQueries_GetRequestedType"
"","0","returns paramValue as EnvironmentAggregation if paramValue is azure","useEnvironmentParams","Tue Jul 07 00:06:43 UTC 2026","passed","Tue Jul 07 00:06:43 UTC 2026","","parseEnvironmentAggregation","",""
"","127","buttons are disabled while loading","OneTimePasscodeForm","Tue Jul 07 00:05:55 UTC 2026","passed","Tue Jul 07 00:05:55 UTC 2026","","","",""
"","195","should display ""Create Token"" button","UserTokenManagementDialog","Tue Jul 07 00:03:14 UTC 2026","passed","Tue Jul 07 00:03:14 UTC 2026","","","",""
"Test cases for TestPermissionsCheckAll","0","TestPermissionsCheckAll","","Tue Jul 07 00:00:27 UTC 2026","passed","Tue Jul 07 00:00:27 UTC 2026","","Go Test","github.com/specterops/bloodhound/cmd/api/src/api/middleware/TestPermissionsCheckAll","TestPermissionsCheckAll"
"","97","initializes the list with all filters checked by default","usePathfindingFilters","Tue Jul 07 00:06:07 UTC 2026","passed","Tue Jul 07 00:06:07 UTC 2026","","","",""
"","326","shows all extensions when search is cleared","ActiveExtensionsCard","Tue Jul 07 00:01:51 UTC 2026","passed","Tue Jul 07 00:01:51 UTC 2026","","","",""
"","173","opens when keyboard shortcut is pressed","GraphControls","Tue Jul 07 00:01:54 UTC 2026","passed","Tue Jul 07 00:01:54 UTC 2026","","Searching current results","",""
"Test cases for TestManagementResource_ServeMetadata","23","TestManagementResource_ServeMetadata","","Tue Jul 07 00:01:22 UTC 2026","passed","Tue Jul 07 00:01:22 UTC 2026","","Go Test","github.com/specterops/bloodhound/cmd/api/src/api/v2/auth/TestManagementResource_ServeMetadata","TestManagementResource_ServeMetadata"
"","55","initializes with the given state","useObjectState","Tue Jul 07 00:05:58 UTC 2026","passed","Tue Jul 07 00:05:58 UTC 2026","","","",""
"","13","makes no count request when neither a Tag or Rule is selected (tagId and ruleId are undefined from path params","useObjectCounts","Tue Jul 07 00:06:16 UTC 2026","passed","Tue Jul 07 00:06:16 UTC 2026","","","",""
"","45","applies accent styling to headers when accent is true","<DetailsAccordion />","Tue Jul 07 00:03:20 UTC 2026","passed","Tue Jul 07 00:03:21 UTC 2026","","","",""
"","0","abbreviates thousands, millions, billions, trillions as expected","numberFormatting","Tue Jul 07 00:04:33 UTC 2026","passed","Tue Jul 07 00:04:33 UTC 2026","","","",""
"Test cases for TestIsDeadlockError","1","TestIsDeadlockError","","Tue Jul 07 00:00:38 UTC 2026","passed","Tue Jul 07 00:00:38 UTC 2026","","Go Test","github.com/specterops/bloodhound/cmd/api/src/daemons/changelog/TestIsDeadlockError","TestIsDeadlockError"
"","796","disables the confirm button until user types required text","Tag Form","Tue Jul 07 00:01:27 UTC 2026","passed","Tue Jul 07 00:01:28 UTC 2026","","","",""
"","226","The API key management option should appear in profile page if the user is configured for SAML login","UserProfile with SSO User","Tue Jul 07 00:03:49 UTC 2026","passed","Tue Jul 07 00:03:49 UTC 2026","","","",""
"","369","should display CreateUserTokenDialog","UserTokenManagementDialog","Tue Jul 07 00:03:14 UTC 2026","passed","Tue Jul 07 00:03:15 UTC 2026","","when user clicks ""Create Token"" button","",""
"","773","opens the entity information panel for the auto-selected node","GraphView","Tue Jul 07 00:07:13 UTC 2026","passed","Tue Jul 07 00:07:14 UTC 2026","","","",""
"Test cases for TestDisenrollMFA_Admin_Success","4243","TestDisenrollMFA_Admin_Success","","Tue Jul 07 00:01:10 UTC 2026","passed","Tue Jul 07 00:01:15 UTC 2026","","Go Test","github.com/specterops/bloodhound/cmd/api/src/api/v2/auth/TestDisenrollMFA_Admin_Success","TestDisenrollMFA_Admin_Success"
"","133","buttons are disabled while loading","LoginForm","Tue Jul 07 00:06:04 UTC 2026","passed","Tue Jul 07 00:06:04 UTC 2026","","","",""
"Test cases for TestAnalysisPipelineResultErrors","0","TestAnalysisPipelineResultErrors","","Tue Jul 07 00:01:07 UTC 2026","passed","Tue Jul 07 00:01:07 UTC 2026","","Go Test","github.com/specterops/bloodhound/packages/go/analysis/TestAnalysisPipelineResultErrors","TestAnalysisPipelineResultErrors"
"","1144","when user performs a single node search, the selected node carries over to the `start node` input field on the pathfinding tab","ExploreSearch interaction","Tue Jul 07 00:07:20 UTC 2026","passed","Tue Jul 07 00:07:22 UTC 2026","","","",""
"","992","opens a submenu when user hovers over `Copy`","ContextMenu","Tue Jul 07 00:07:29 UTC 2026","passed","Tue Jul 07 00:07:30 UTC 2026","","","",""
"Test cases for TestAddWhereClauseToNeo4jQuery_WithWhereClause","0","TestAddWhereClauseToNeo4jQuery_WithWhereClause","","Tue Jul 07 00:00:36 UTC 2026","passed","Tue Jul 07 00:00:36 UTC 2026","","Go Test","github.com/specterops/bloodhound/cmd/api/src/api/v2/TestAddWhereClauseToNeo4jQuery_WithWhereClause","TestAddWhereClauseToNeo4jQuery_WithWhereClause"
"Test cases for TestHandlers_CancelAnalysisRequest","0","TestHandlers_CancelAnalysisRequest","","Tue Jul 07 00:01:29 UTC 2026","passed","Tue Jul 07 00:01:29 UTC 2026","","Go Test","github.com/specterops/bloodhound/server/analysis/internal/handlers/TestHandlers_CancelAnalysisRequest","TestHandlers_CancelAnalysisRequest"
"","1519","should clear out the sso provider id from submission data when the authentication method is changed","UpdateUserDialog","Tue Jul 07 00:02:39 UTC 2026","passed","Tue Jul 07 00:02:41 UTC 2026","","","",""
"","57","stores the state of a search term without modifying the query params","useCypherSearch","Tue Jul 07 00:06:16 UTC 2026","passed","Tue Jul 07 00:06:16 UTC 2026","","","",""
"","75","should display an error when error prop is truthy","SaveQueryDialog","Tue Jul 07 00:01:27 UTC 2026","passed","Tue Jul 07 00:01:27 UTC 2026","","","",""
"","9","updates key in state","useObjectState","Tue Jul 07 00:05:58 UTC 2026","passed","Tue Jul 07 00:05:58 UTC 2026","","","",""
"","22","renders correctly when an unexpected nodeType is passed","NodeIcon","Tue Jul 07 00:06:03 UTC 2026","passed","Tue Jul 07 00:06:04 UTC 2026","","","",""
"Test cases for TestService_ToggleFlag","0","TestService_ToggleFlag","","Tue Jul 07 00:01:32 UTC 2026","passed","Tue Jul 07 00:01:32 UTC 2026","","Go Test","github.com/specterops/bloodhound/server/featureflags/internal/services/TestService_ToggleFlag","TestService_ToggleFlag"
"","42","displays security warning","Enable2FADialog","Tue Jul 07 00:05:26 UTC 2026","passed","Tue Jul 07 00:05:26 UTC 2026","","","",""
"","34","mounts a polite aria-live region","AnnouncementProvider","Tue Jul 07 00:04:36 UTC 2026","passed","Tue Jul 07 00:04:36 UTC 2026","","","",""
"","33","the queries in the list only include nodes and edges that are defined in our schema","common search list","Tue Jul 07 00:06:19 UTC 2026","passed","Tue Jul 07 00:06:19 UTC 2026","","","",""
"Test cases for TestMarshalFloat","0","TestMarshalFloat","","Tue Jul 07 00:00:43 UTC 2026","passed","Tue Jul 07 00:00:43 UTC 2026","","Go Test","github.com/specterops/bloodhound/cmd/api/src/database/types/null/TestMarshalFloat","TestMarshalFloat"
"","3010","should open edge filtering dialog","EdgeFilter","Tue Jul 07 00:04:16 UTC 2026","passed","Tue Jul 07 00:04:19 UTC 2026","","","",""
"","88","displays the value from filterParams.node_type","AssetGroupEdit","Tue Jul 07 00:03:35 UTC 2026","passed","Tue Jul 07 00:03:36 UTC 2026","","Node Type dropdown filter","",""
"","2276","search filters edges by name","Pathfinding","Tue Jul 07 00:02:47 UTC 2026","passed","Tue Jul 07 00:02:49 UTC 2026","","","",""
"Test cases for TestParseGPOData","6","TestParseGPOData","","Tue Jul 07 00:01:08 UTC 2026","passed","Tue Jul 07 00:01:08 UTC 2026","","Go Test","github.com/specterops/bloodhound/packages/go/ein/TestParseGPOData","TestParseGPOData"
"Test cases for TestResources_DeleteSavedQuery_PublicQueryAndUserIsAdmin","0","TestResources_DeleteSavedQuery_PublicQueryAndUserIsAdmin","","Tue Jul 07 00:00:36 UTC 2026","passed","Tue Jul 07 00:00:36 UTC 2026","","Go Test","github.com/specterops/bloodhound/cmd/api/src/api/v2/TestResources_DeleteSavedQuery_PublicQueryAndUserIsAdmin","TestResources_DeleteSavedQuery_PublicQueryAndUserIsAdmin"
"Test cases for TestResources_UpdateSavedQuery_AdminPrivateQuery_Success","0","TestResources_UpdateSavedQuery_AdminPrivateQuery_Success","","Tue Jul 07 00:00:36 UTC 2026","passed","Tue Jul 07 00:00:36 UTC 2026","","Go Test","github.com/specterops/bloodhound/cmd/api/src/api/v2/TestResources_UpdateSavedQuery_AdminPrivateQuery_Success","TestResources_UpdateSavedQuery_AdminPrivateQuery_Success"
"","135","does not highlight the table option when isExploreTableSelected is true but isExploreLayoutSelected is false","GraphControls","Tue Jul 07 00:01:52 UTC 2026","passed","Tue Jul 07 00:01:53 UTC 2026","","Table view selection state","",""
"Test cases for TestExtractIngestFiles","13","TestExtractIngestFiles","","Tue Jul 07 00:00:49 UTC 2026","passed","Tue Jul 07 00:00:49 UTC 2026","","Go Test","github.com/specterops/bloodhound/cmd/api/src/services/graphify/TestExtractIngestFiles","TestExtractIngestFiles"
"Test cases for TestResources_ListADEntityControllers","1","TestResources_ListADEntityControllers","","Tue Jul 07 00:00:36 UTC 2026","passed","Tue Jul 07 00:00:36 UTC 2026","","Go Test","github.com/specterops/bloodhound/cmd/api/src/api/v2/TestResources_ListADEntityControllers","TestResources_ListADEntityControllers"
"Test cases for TestIsValidContentTypeForUpload","0","TestIsValidContentTypeForUpload","","Tue Jul 07 00:00:36 UTC 2026","passed","Tue Jul 07 00:00:36 UTC 2026","","Go Test","github.com/specterops/bloodhound/cmd/api/src/api/v2/TestIsValidContentTypeForUpload","TestIsValidContentTypeForUpload"
"","179","a name value is required to submit the form","Rule Form","Tue Jul 07 00:01:38 UTC 2026","passed","Tue Jul 07 00:01:38 UTC 2026","","","",""
"","81","skips undefined items gracefully","<DetailsAccordion />","Tue Jul 07 00:03:20 UTC 2026","passed","Tue Jul 07 00:03:20 UTC 2026","","","",""
"Test cases for TestCreateAssetGroupRequest_AuditData","0","TestCreateAssetGroupRequest_AuditData","","Tue Jul 07 00:00:36 UTC 2026","passed","Tue Jul 07 00:00:36 UTC 2026","","Go Test","github.com/specterops/bloodhound/cmd/api/src/api/v2/TestCreateAssetGroupRequest_AuditData","TestCreateAssetGroupRequest_AuditData"
"","67","takes the param appendQueryKey and will append that value to the existing queryKey","useAvailableEnvironments","Tue Jul 07 00:04:14 UTC 2026","passed","Tue Jul 07 00:04:14 UTC 2026","","useAvailableEnvironments","",""
"Test cases for TestCache_FillFifo","0","TestCache_FillFifo","","Tue Jul 07 00:01:08 UTC 2026","passed","Tue Jul 07 00:01:08 UTC 2026","","Go Test","github.com/specterops/bloodhound/packages/go/cache/TestCache_FillFifo","TestCache_FillFifo"
"Test cases for TestParseDomainTrusts_TrustAttributes","0","TestParseDomainTrusts_TrustAttributes","","Tue Jul 07 00:01:08 UTC 2026","passed","Tue Jul 07 00:01:08 UTC 2026","","Go Test","github.com/specterops/bloodhound/packages/go/ein/TestParseDomainTrusts_TrustAttributes","TestParseDomainTrusts_TrustAttributes"
"Test cases for TestNormalizePath","8","TestNormalizePath","","Tue Jul 07 00:01:27 UTC 2026","passed","Tue Jul 07 00:01:27 UTC 2026","","Go Test","github.com/specterops/bloodhound/packages/go/storage/TestNormalizePath","TestNormalizePath"
"","654","app does not crash if ""token"" cookie exists and ""persistedState"" localstorage key does not exist","redux store","Tue Jul 07 00:07:47 UTC 2026","passed","Tue Jul 07 00:07:47 UTC 2026","","","",""
"Test cases for TestMarshalInt64Text","0","TestMarshalInt64Text","","Tue Jul 07 00:00:43 UTC 2026","passed","Tue Jul 07 00:00:43 UTC 2026","","Go Test","github.com/specterops/bloodhound/cmd/api/src/database/types/null/TestMarshalInt64Text","TestMarshalInt64Text"
"","263","dispatches an action to the delete the associated node","Rule Object Select","Tue Jul 07 00:05:20 UTC 2026","passed","Tue Jul 07 00:05:20 UTC 2026","","","",""
"","462","should not have less characters than the minimum requirement","UpdateUserForm","Tue Jul 07 00:01:34 UTC 2026","passed","Tue Jul 07 00:01:35 UTC 2026","","","",""
"","318","displays 0 when a given sections returns empty, and sums the rest of the sections correctly","EntityInfoDataTable","Tue Jul 07 00:03:08 UTC 2026","passed","Tue Jul 07 00:03:09 UTC 2026","","Node count for nested table that counts all sections","",""
"","118","Searching for existing node type returns node properties","useFetchEntityInfo","Tue Jul 07 00:04:22 UTC 2026","passed","Tue Jul 07 00:04:22 UTC 2026","","","",""
"Test cases for TestWriteResponseWrapperWithPagination","0","TestWriteResponseWrapperWithPagination","","Tue Jul 07 00:00:24 UTC 2026","passed","Tue Jul 07 00:00:24 UTC 2026","","Go Test","github.com/specterops/bloodhound/cmd/api/src/api/TestWriteResponseWrapperWithPagination","TestWriteResponseWrapperWithPagination"
"","7","hides the item when only the feature flag passes","useSubNavRoutes","Tue Jul 07 00:04:12 UTC 2026","passed","Tue Jul 07 00:04:12 UTC 2026","","combined gates","",""
"Test cases for TestResources_GetAZEntityInformation","82","TestResources_GetAZEntityInformation","","Tue Jul 07 00:00:36 UTC 2026","passed","Tue Jul 07 00:00:36 UTC 2026","","Go Test","github.com/specterops/bloodhound/cmd/api/src/api/v2/TestResources_GetAZEntityInformation","TestResources_GetAZEntityInformation"
"","72","sets primarySearch, searchType, exploreSearchTab in URL params when the click handler is executed","useEdgeInfoItems","Tue Jul 07 00:05:00 UTC 2026","passed","Tue Jul 07 00:05:00 UTC 2026","","","",""
"","571","calls onSave without current password when requireCurrentPassword is false","PasswordDialog","Tue Jul 07 00:02:08 UTC 2026","passed","Tue Jul 07 00:02:09 UTC 2026","","","",""
"Test cases for TestConvertContainerToNode_InheritanceHashes","0","TestConvertContainerToNode_InheritanceHashes","","Tue Jul 07 00:01:08 UTC 2026","passed","Tue Jul 07 00:01:08 UTC 2026","","Go Test","github.com/specterops/bloodhound/packages/go/ein/TestConvertContainerToNode_InheritanceHashes","TestConvertContainerToNode_InheritanceHashes"
"","224","should render a nav element with logo, two lists, a version number and a powered by","MainNav","Tue Jul 07 00:03:55 UTC 2026","passed","Tue Jul 07 00:03:56 UTC 2026","","","",""
