"DESCRIPTION","DURATION IN MS","NAME","PARENT SUITE","START TIME","STATUS","STOP TIME","SUB SUITE","SUITE","TEST CLASS","TEST METHOD"
"","276","The edge properties are fetched through a cypher search which includes lastseen","EdgeObjectInformation","Mon Apr 20 17:06:34 UTC 2026","passed","Mon Apr 20 17:06:34 UTC 2026","","","",""
"","37","renders the title passed via title prop","ColumnHeaders","Mon Apr 20 17:06:19 UTC 2026","passed","Mon Apr 20 17:06:19 UTC 2026","","SortableHeader","",""
"","61","passes checks if the user has multiple required permissions","usePermissions","Mon Apr 20 17:05:16 UTC 2026","passed","Mon Apr 20 17:05:16 UTC 2026","","","",""
"","57","returns when zone limit is reached","useTagLimits","Mon Apr 20 17:04:14 UTC 2026","passed","Mon Apr 20 17:04:14 UTC 2026","","","",""
"","383","should call ""onSave"" one time","Enable2FADialog","Mon Apr 20 17:07:06 UTC 2026","passed","Mon Apr 20 17:07:07 UTC 2026","user clicks ""Disable Multi-Factor Authentication"" button","user enters valid password","",""
"","404","should call onClose when cancel button is clicked","SaveQueryDialog","Mon Apr 20 17:03:50 UTC 2026","passed","Mon Apr 20 17:03:51 UTC 2026","","","",""
"","145","renders the Zone/Labels Tab content when first tab is chosen","Selected Details Tab Content","Mon Apr 20 17:07:37 UTC 2026","passed","Mon Apr 20 17:07:38 UTC 2026","","","",""
"","17","will update the selected filters based on the values stored in query params when the initialize function is called","usePathfindingFilters","Mon Apr 20 17:07:50 UTC 2026","passed","Mon Apr 20 17:07:50 UTC 2026","","","",""
"Test cases for TestMarshalString","0","TestMarshalString","","Mon Apr 20 17:02:53 UTC 2026","passed","Mon Apr 20 17:02:53 UTC 2026","","Go Test","github.com/specterops/bloodhound/cmd/api/src/database/types/null/TestMarshalString","TestMarshalString"
"Test cases for TestResources_ListAssetGroupMembersCount","4","TestResources_ListAssetGroupMembersCount","","Mon Apr 20 17:02:51 UTC 2026","passed","Mon Apr 20 17:02:51 UTC 2026","","Go Test","github.com/specterops/bloodhound/cmd/api/src/api/v2/TestResources_ListAssetGroupMembersCount","TestResources_ListAssetGroupMembersCount"
"Test cases for TestEncodingInterface","0","TestEncodingInterface","","Mon Apr 20 17:03:12 UTC 2026","passed","Mon Apr 20 17:03:12 UTC 2026","","Go Test","github.com/specterops/bloodhound/packages/go/bomenc/TestEncodingInterface","TestEncodingInterface"
"Test cases for Test_cacheQueryResult","0","Test_cacheQueryResult","","Mon Apr 20 17:02:56 UTC 2026","passed","Mon Apr 20 17:02:56 UTC 2026","","Go Test","github.com/specterops/bloodhound/cmd/api/src/queries/Test_cacheQueryResult","Test_cacheQueryResult"
"Test cases for TestCache_GuardedSet","0","TestCache_GuardedSet","","Mon Apr 20 17:03:12 UTC 2026","passed","Mon Apr 20 17:03:12 UTC 2026","","Go Test","github.com/specterops/bloodhound/packages/go/cache/TestCache_GuardedSet","TestCache_GuardedSet"
"","194","should disable the create provider button and not display providers if the user lacks permission","SSOConfiguration","Mon Apr 20 17:05:07 UTC 2026","passed","Mon Apr 20 17:05:07 UTC 2026","","","",""
"","793","renders a filter search and platform dropdown menu","CommonSearches","Mon Apr 20 17:05:02 UTC 2026","passed","Mon Apr 20 17:05:02 UTC 2026","","","",""
"Test cases for TestManagementResource_CreateAuthToken","9953","TestManagementResource_CreateAuthToken","","Mon Apr 20 17:03:19 UTC 2026","passed","Mon Apr 20 17:03:29 UTC 2026","","Go Test","github.com/specterops/bloodhound/cmd/api/src/api/v2/auth/TestManagementResource_CreateAuthToken","TestManagementResource_CreateAuthToken"
"","142","initializes search tab to the exploreSearchTab on initial render","ExploreSearch sets searchType on tab changing","Mon Apr 20 17:08:53 UTC 2026","passed","Mon Apr 20 17:08:53 UTC 2026","","","",""
"","105","renders the analysis toggle when multi tier analysis enabled is true and when editing an existing zone","Tag Form","Mon Apr 20 17:03:50 UTC 2026","passed","Mon Apr 20 17:03:50 UTC 2026","","","",""
"","0","succeeds for valid password with unicode characters","testPassword","Mon Apr 20 17:08:23 UTC 2026","passed","Mon Apr 20 17:08:23 UTC 2026","","","",""
"","50","links to the specified route with global params intact when triggered by a splat route","AppLink","Mon Apr 20 17:06:43 UTC 2026","passed","Mon Apr 20 17:06:43 UTC 2026","","","",""
"","61","should on clicking remove call clearSelectedItem","EdgeInfoHeader","Mon Apr 20 17:07:05 UTC 2026","passed","Mon Apr 20 17:07:05 UTC 2026","","","",""
"Test cases for TestResources_GetUserEntityInfo","4","TestResources_GetUserEntityInfo","","Mon Apr 20 17:02:51 UTC 2026","passed","Mon Apr 20 17:02:51 UTC 2026","","Go Test","github.com/specterops/bloodhound/cmd/api/src/api/v2/TestResources_GetUserEntityInfo","TestResources_GetUserEntityInfo"
"","463","displays correct content based on platform filter AD","CommonSearches","Mon Apr 20 17:05:03 UTC 2026","passed","Mon Apr 20 17:05:03 UTC 2026","","","",""
"Test cases for TestResources_UpdateCustomNodeKindsTest","110","TestResources_UpdateCustomNodeKindsTest","","Mon Apr 20 17:02:51 UTC 2026","passed","Mon Apr 20 17:02:51 UTC 2026","","Go Test","github.com/specterops/bloodhound/cmd/api/src/api/v2/TestResources_UpdateCustomNodeKindsTest","TestResources_UpdateCustomNodeKindsTest"
"","254","displays 0 when a given sections returns empty, and sums the rest of the sections correctly","EntityInfoDataTable","Mon Apr 20 17:04:46 UTC 2026","passed","Mon Apr 20 17:04:47 UTC 2026","","Node count for nested table that counts all sections","",""
"Test cases for TestResources_SearchHandler","4","TestResources_SearchHandler","","Mon Apr 20 17:02:51 UTC 2026","passed","Mon Apr 20 17:02:51 UTC 2026","","Go Test","github.com/specterops/bloodhound/cmd/api/src/api/v2/TestResources_SearchHandler","TestResources_SearchHandler"
"Test cases for Test_ValidateGraph","9","Test_ValidateGraph","","Mon Apr 20 17:02:58 UTC 2026","passed","Mon Apr 20 17:02:58 UTC 2026","","Go Test","github.com/specterops/bloodhound/cmd/api/src/services/upload/Test_ValidateGraph","Test_ValidateGraph"
"","259","displays no search results message when search yields no matches","ActiveExtensionsCard","Mon Apr 20 17:04:07 UTC 2026","passed","Mon Apr 20 17:04:07 UTC 2026","","","",""
"Test cases for TestFeatureFlag_HA","301","TestFeatureFlag_HA","","Mon Apr 20 17:02:52 UTC 2026","passed","Mon Apr 20 17:02:52 UTC 2026","","Go Test","github.com/specterops/bloodhound/cmd/api/src/daemons/changelog/TestFeatureFlag_HA","TestFeatureFlag_HA"
"","964","should render with a full list of multiple tenants and domains","Simple Environment Selector","Mon Apr 20 17:05:25 UTC 2026","passed","Mon Apr 20 17:05:26 UTC 2026","","","",""
"Test cases for TestNormalizeToUTF8","0","TestNormalizeToUTF8","","Mon Apr 20 17:03:12 UTC 2026","passed","Mon Apr 20 17:03:12 UTC 2026","","Go Test","github.com/specterops/bloodhound/packages/go/bomenc/TestNormalizeToUTF8","TestNormalizeToUTF8"
"","155","renders the form for creating a new label","Tag Form","Mon Apr 20 17:03:49 UTC 2026","passed","Mon Apr 20 17:03:49 UTC 2026","","","",""
"","0","abbreviates thousands, millions, billions, trillions as expected","numberFormatting","Mon Apr 20 17:06:21 UTC 2026","passed","Mon Apr 20 17:06:21 UTC 2026","","","",""
"Test cases for TestAddWhereClauseToNeo4jQuery_WithWhereClause","0","TestAddWhereClauseToNeo4jQuery_WithWhereClause","","Mon Apr 20 17:02:51 UTC 2026","passed","Mon Apr 20 17:02:51 UTC 2026","","Go Test","github.com/specterops/bloodhound/cmd/api/src/api/v2/TestAddWhereClauseToNeo4jQuery_WithWhereClause","TestAddWhereClauseToNeo4jQuery_WithWhereClause"
"Test cases for TestResources_ListEdgeTypes","79","TestResources_ListEdgeTypes","","Mon Apr 20 17:02:51 UTC 2026","passed","Mon Apr 20 17:02:51 UTC 2026","","Go Test","github.com/specterops/bloodhound/cmd/api/src/api/v2/TestResources_ListEdgeTypes","TestResources_ListEdgeTypes"
"","350","renders total rules and accordion sections","RulesAccordion","Mon Apr 20 17:06:27 UTC 2026","passed","Mon Apr 20 17:06:28 UTC 2026","","","",""
"Test cases for Test_ParseAndValidatePayload","5","Test_ParseAndValidatePayload","","Mon Apr 20 17:02:58 UTC 2026","passed","Mon Apr 20 17:02:58 UTC 2026","","Go Test","github.com/specterops/bloodhound/cmd/api/src/services/upload/Test_ParseAndValidatePayload","Test_ParseAndValidatePayload"
"","11","can composes search params from the search prop and use them in the redirect","AppNavigate","Mon Apr 20 17:07:12 UTC 2026","passed","Mon Apr 20 17:07:12 UTC 2026","","","",""
"","229","calls setExploreParams with searchType and relationshipQueryItemId when selecting a composition accordion","EdgeInfoContent","Mon Apr 20 17:04:08 UTC 2026","passed","Mon Apr 20 17:04:08 UTC 2026","","EdgeInfoContent support for Deep Linking","",""
"","253","handles creating a new zone","Tag Form","Mon Apr 20 17:03:51 UTC 2026","passed","Mon Apr 20 17:03:51 UTC 2026","","","",""
"","175","opens and closes the dialog with the cancel button","Tag Form","Mon Apr 20 17:03:52 UTC 2026","passed","Mon Apr 20 17:03:53 UTC 2026","","","",""
"","54","Should display a list of the asset group members","AssetGroupMemberList","Mon Apr 20 17:07:39 UTC 2026","passed","Mon Apr 20 17:07:39 UTC 2026","","","",""
"Test cases for TestWriteResultRawJson","0","TestWriteResultRawJson","","Mon Apr 20 17:03:11 UTC 2026","passed","Mon Apr 20 17:03:11 UTC 2026","","Go Test","github.com/specterops/bloodhound/cmd/api/src/utils/TestWriteResultRawJson","TestWriteResultRawJson"
"","61","shows an error notification if there is an error fetching","useFinishedJobs","Mon Apr 20 17:05:57 UTC 2026","passed","Mon Apr 20 17:05:57 UTC 2026","","","",""
"","88","should render when search string is at the beginning of the text","HighlightedText","Mon Apr 20 17:07:41 UTC 2026","passed","Mon Apr 20 17:07:41 UTC 2026","","","",""
"Test cases for TestManagementResource_GetPermission","31314","TestManagementResource_GetPermission","","Mon Apr 20 17:02:57 UTC 2026","passed","Mon Apr 20 17:03:29 UTC 2026","","Go Test","github.com/specterops/bloodhound/cmd/api/src/api/v2/auth/TestManagementResource_GetPermission","TestManagementResource_GetPermission"
"Test cases for TestManagementResource_ListAuthTokens_PredicateMismatchWithColumn","0","TestManagementResource_ListAuthTokens_PredicateMismatchWithColumn","","Mon Apr 20 17:03:19 UTC 2026","passed","Mon Apr 20 17:03:19 UTC 2026","","Go Test","github.com/specterops/bloodhound/cmd/api/src/api/v2/auth/TestManagementResource_ListAuthTokens_PredicateMismatchWithColumn","TestManagementResource_ListAuthTokens_PredicateMismatchWithColumn"
"Test cases for TestResources_UpdateSavedQuery_UpdateFailed","0","TestResources_UpdateSavedQuery_UpdateFailed","","Mon Apr 20 17:02:51 UTC 2026","passed","Mon Apr 20 17:02:51 UTC 2026","","Go Test","github.com/specterops/bloodhound/cmd/api/src/api/v2/TestResources_UpdateSavedQuery_UpdateFailed","TestResources_UpdateSavedQuery_UpdateFailed"
"Test cases for TestResources_GetCollectorManifest","0","TestResources_GetCollectorManifest","","Mon Apr 20 17:02:51 UTC 2026","passed","Mon Apr 20 17:02:51 UTC 2026","","Go Test","github.com/specterops/bloodhound/cmd/api/src/api/v2/TestResources_GetCollectorManifest","TestResources_GetCollectorManifest"
"","84","displays the value thats passed via children","CodeController","Mon Apr 20 17:08:07 UTC 2026","passed","Mon Apr 20 17:08:07 UTC 2026","","","",""
"Test cases for TestGetMFAActivationStatus_Success","0","TestGetMFAActivationStatus_Success","","Mon Apr 20 17:03:27 UTC 2026","passed","Mon Apr 20 17:03:27 UTC 2026","","Go Test","github.com/specterops/bloodhound/cmd/api/src/api/v2/auth/TestGetMFAActivationStatus_Success","TestGetMFAActivationStatus_Success"
"Test cases for TestUpdateAssetGroupRequest_AuditData","0","TestUpdateAssetGroupRequest_AuditData","","Mon Apr 20 17:02:51 UTC 2026","passed","Mon Apr 20 17:02:51 UTC 2026","","Go Test","github.com/specterops/bloodhound/cmd/api/src/api/v2/TestUpdateAssetGroupRequest_AuditData","TestUpdateAssetGroupRequest_AuditData"
"","329","on clicking switch shows modal and when clicking cancel closes it and switch stays disabled","CitrixRDPConfiguration","Mon Apr 20 17:05:16 UTC 2026","passed","Mon Apr 20 17:05:17 UTC 2026","","Click on switch to enable","",""
"Test cases for TestSignRequestValuesSuccess","0","TestSignRequestValuesSuccess","","Mon Apr 20 17:02:41 UTC 2026","passed","Mon Apr 20 17:02:41 UTC 2026","","Go Test","github.com/specterops/bloodhound/cmd/api/src/api/TestSignRequestValuesSuccess","TestSignRequestValuesSuccess"
"Test cases for Test_NewSpecWithHooks","0","Test_NewSpecWithHooks","","Mon Apr 20 17:03:12 UTC 2026","passed","Mon Apr 20 17:03:12 UTC 2026","","Go Test","github.com/specterops/bloodhound/packages/go/lab/Test_NewSpecWithHooks","Test_NewSpecWithHooks"
"","361","filters by the selected user","FileIngestFilterDialog","Mon Apr 20 17:04:48 UTC 2026","passed","Mon Apr 20 17:04:48 UTC 2026","","User Select","",""
"","82","should not display the ETAC role-based filtering badge when filtering is disabled","Zone Management","Mon Apr 20 17:07:17 UTC 2026","passed","Mon Apr 20 17:07:17 UTC 2026","","","",""
"","55","should render a navigation list item","MainNav","Mon Apr 20 17:05:31 UTC 2026","passed","Mon Apr 20 17:05:31 UTC 2026","","","",""
"Test cases for TestDisenrollMFA_Failure","0","TestDisenrollMFA_Failure","","Mon Apr 20 17:03:21 UTC 2026","passed","Mon Apr 20 17:03:21 UTC 2026","","Go Test","github.com/specterops/bloodhound/cmd/api/src/api/v2/auth/TestDisenrollMFA_Failure","TestDisenrollMFA_Failure"
"Test cases for TestUnmarshalBool","0","TestUnmarshalBool","","Mon Apr 20 17:02:53 UTC 2026","passed","Mon Apr 20 17:02:53 UTC 2026","","Go Test","github.com/specterops/bloodhound/cmd/api/src/database/types/null/TestUnmarshalBool","TestUnmarshalBool"
"","1366","executes a pathfinding search when both a source and destination node are provided","Pathfinding: interaction","Mon Apr 20 17:05:44 UTC 2026","passed","Mon Apr 20 17:05:46 UTC 2026","","","",""
"Test cases for TestResources_CreateAssetGroupTagSelector","3","TestResources_CreateAssetGroupTagSelector","","Mon Apr 20 17:02:51 UTC 2026","passed","Mon Apr 20 17:02:51 UTC 2026","","Go Test","github.com/specterops/bloodhound/cmd/api/src/api/v2/TestResources_CreateAssetGroupTagSelector","TestResources_CreateAssetGroupTagSelector"
"","414","should call onSubmit with one time passcode when check code button clicked","OneTimePasscodeForm","Mon Apr 20 17:07:38 UTC 2026","passed","Mon Apr 20 17:07:38 UTC 2026","","","",""
"Test cases for TestManagementResource_ListPermissions_SortingError","0","TestManagementResource_ListPermissions_SortingError","","Mon Apr 20 17:02:57 UTC 2026","passed","Mon Apr 20 17:02:57 UTC 2026","","Go Test","github.com/specterops/bloodhound/cmd/api/src/api/v2/auth/TestManagementResource_ListPermissions_SortingError","TestManagementResource_ListPermissions_SortingError"
"","12","does not include OpenGraph edges when the associated feature flag is disabled","useEdgeCategories","Mon Apr 20 17:05:16 UTC 2026","passed","Mon Apr 20 17:05:16 UTC 2026","","","",""
"Test cases for TestResources_UpdateSavedQuery_ErrorFetchingPublicStatus","0","TestResources_UpdateSavedQuery_ErrorFetchingPublicStatus","","Mon Apr 20 17:02:51 UTC 2026","passed","Mon Apr 20 17:02:51 UTC 2026","","Go Test","github.com/specterops/bloodhound/cmd/api/src/api/v2/TestResources_UpdateSavedQuery_ErrorFetchingPublicStatus","TestResources_UpdateSavedQuery_ErrorFetchingPublicStatus"
"","0","Will ignore colons after the first and use them as part of the keyword search","Parsing the debounced input for type and keyword values","Mon Apr 20 17:06:51 UTC 2026","passed","Mon Apr 20 17:06:51 UTC 2026","","","",""
"","195","handles creating a new label","Tag Form","Mon Apr 20 17:03:51 UTC 2026","passed","Mon Apr 20 17:03:51 UTC 2026","","","",""
"Test cases for TestTimeValueOrZero","0","TestTimeValueOrZero","","Mon Apr 20 17:02:53 UTC 2026","passed","Mon Apr 20 17:02:53 UTC 2026","","Go Test","github.com/specterops/bloodhound/cmd/api/src/database/types/null/TestTimeValueOrZero","TestTimeValueOrZero"
"","0","returns the distance between two coordinates","getDistanceBetween","Mon Apr 20 17:09:27 UTC 2026","passed","Mon Apr 20 17:09:27 UTC 2026","","","",""
"","108","renders count for a selected zone if prop is set","DynamicDetails","Mon Apr 20 17:05:30 UTC 2026","passed","Mon Apr 20 17:05:30 UTC 2026","","","",""
"Test cases for TestEncodingValues","1","TestEncodingValues","","Mon Apr 20 17:03:12 UTC 2026","passed","Mon Apr 20 17:03:12 UTC 2026","","Go Test","github.com/specterops/bloodhound/packages/go/bomenc/TestEncodingValues","TestEncodingValues"
"Test cases for TestJSONFloat_UnmarshalJSON","0","TestJSONFloat_UnmarshalJSON","","Mon Apr 20 17:02:53 UTC 2026","passed","Mon Apr 20 17:02:53 UTC 2026","","Go Test","github.com/specterops/bloodhound/cmd/api/src/database/types/nan/TestJSONFloat_UnmarshalJSON","TestJSONFloat_UnmarshalJSON"
"Test cases for TestManagementResource_UpdateUser_SelfDisable","861","TestManagementResource_UpdateUser_SelfDisable","","Mon Apr 20 17:03:08 UTC 2026","passed","Mon Apr 20 17:03:09 UTC 2026","","Go Test","github.com/specterops/bloodhound/cmd/api/src/api/v2/auth/TestManagementResource_UpdateUser_SelfDisable","TestManagementResource_UpdateUser_SelfDisable"
"","426","should display Environmental Targeted Access Control panel when showEnvironmentAccessControls prop is true and user role is selected","UpdateUserForm","Mon Apr 20 17:03:58 UTC 2026","passed","Mon Apr 20 17:03:59 UTC 2026","","","",""
"","4","returns a function that takes a key found in updatedParams and updates the searchParams with that matching value from updatedParams","searchParams","Mon Apr 20 17:06:55 UTC 2026","passed","Mon Apr 20 17:06:55 UTC 2026","","setSingleParamFactory","",""
"Test cases for FuzzFoldl","0","FuzzFoldl","","Mon Apr 20 17:03:13 UTC 2026","passed","Mon Apr 20 17:03:13 UTC 2026","","Go Test","github.com/specterops/bloodhound/packages/go/slicesext/FuzzFoldl","FuzzFoldl"
"","2","stores an array value in localStorage","useLocalStorage","Mon Apr 20 17:05:33 UTC 2026","passed","Mon Apr 20 17:05:33 UTC 2026","","setValue","",""
"","9","should render a Field when the provided value is -0","Field","Mon Apr 20 17:07:53 UTC 2026","passed","Mon Apr 20 17:07:53 UTC 2026","","","",""
"","186","a null response from the server is handled","ExploreSearchCombobox with null response","Mon Apr 20 17:05:12 UTC 2026","passed","Mon Apr 20 17:05:12 UTC 2026","","","",""
"","103","should display the logged in user's full name","UserProfile","Mon Apr 20 17:05:22 UTC 2026","passed","Mon Apr 20 17:05:22 UTC 2026","","","",""
"Test cases for TestManagementResource_UpdateUser_IDMalformed","1135","TestManagementResource_UpdateUser_IDMalformed","","Mon Apr 20 17:03:05 UTC 2026","passed","Mon Apr 20 17:03:07 UTC 2026","","Go Test","github.com/specterops/bloodhound/cmd/api/src/api/v2/auth/TestManagementResource_UpdateUser_IDMalformed","TestManagementResource_UpdateUser_IDMalformed"
"","9","should handle special characters","HighlightedText","Mon Apr 20 17:07:41 UTC 2026","passed","Mon Apr 20 17:07:41 UTC 2026","","","",""
"","207","only sends dirty fields in the request when updating","Tag Form","Mon Apr 20 17:03:51 UTC 2026","passed","Mon Apr 20 17:03:52 UTC 2026","","","",""
"Test cases for TestResources_GetNTAuthStoreEntityInfo","212","TestResources_GetNTAuthStoreEntityInfo","","Mon Apr 20 17:02:51 UTC 2026","passed","Mon Apr 20 17:02:51 UTC 2026","","Go Test","github.com/specterops/bloodhound/cmd/api/src/api/v2/TestResources_GetNTAuthStoreEntityInfo","TestResources_GetNTAuthStoreEntityInfo"
"","1","should return the edge parts from the key","getEdgeDataFromKey","Mon Apr 20 17:09:27 UTC 2026","passed","Mon Apr 20 17:09:27 UTC 2026","","","",""
"","276","renders analyze now section","AnalyzeNowConfiguration","Mon Apr 20 17:05:34 UTC 2026","passed","Mon Apr 20 17:05:34 UTC 2026","","","",""
"Test cases for TestArgon2Digest_String","0","TestArgon2Digest_String","","Mon Apr 20 17:03:12 UTC 2026","passed","Mon Apr 20 17:03:12 UTC 2026","","Go Test","github.com/specterops/bloodhound/packages/go/crypto/TestArgon2Digest_String","TestArgon2Digest_String"
"","0","A type was provided but no keyword follows the typed filter","Getting the text for the disabled item display for a search when there are no results","Mon Apr 20 17:06:51 UTC 2026","passed","Mon Apr 20 17:06:51 UTC 2026","","Empty data states","",""
"Test cases for TestResources_ListADEntityPSRemoteRights","1","TestResources_ListADEntityPSRemoteRights","","Mon Apr 20 17:02:51 UTC 2026","passed","Mon Apr 20 17:02:51 UTC 2026","","Go Test","github.com/specterops/bloodhound/cmd/api/src/api/v2/TestResources_ListADEntityPSRemoteRights","TestResources_ListADEntityPSRemoteRights"
"Test cases for TestCORSMiddleware","0","TestCORSMiddleware","","Mon Apr 20 17:02:44 UTC 2026","passed","Mon Apr 20 17:02:44 UTC 2026","","Go Test","github.com/specterops/bloodhound/cmd/api/src/api/middleware/TestCORSMiddleware","TestCORSMiddleware"
"Test cases for TestManagementResource_ListRoles_SortingError","0","TestManagementResource_ListRoles_SortingError","","Mon Apr 20 17:02:57 UTC 2026","passed","Mon Apr 20 17:02:57 UTC 2026","","Go Test","github.com/specterops/bloodhound/cmd/api/src/api/v2/auth/TestManagementResource_ListRoles_SortingError","TestManagementResource_ListRoles_SortingError"
"","1","filters by high risk level","filterAndSearchEnvironments","Mon Apr 20 17:04:02 UTC 2026","passed","Mon Apr 20 17:04:02 UTC 2026","","risk filters","",""
"Test cases for TestMarshalFloat","0","TestMarshalFloat","","Mon Apr 20 17:02:53 UTC 2026","passed","Mon Apr 20 17:02:53 UTC 2026","","Go Test","github.com/specterops/bloodhound/cmd/api/src/database/types/null/TestMarshalFloat","TestMarshalFloat"
"","585","should render a SaveQueryDialog","SaveQueryDialog","Mon Apr 20 17:03:48 UTC 2026","passed","Mon Apr 20 17:03:49 UTC 2026","","","",""
"","212","should fire ""onClose"" once","UserTokenManagementDialog","Mon Apr 20 17:04:50 UTC 2026","passed","Mon Apr 20 17:04:51 UTC 2026","","when user clicks ""Close"" button","",""
"Test cases for TestCreateUser_ETAC","4395","TestCreateUser_ETAC","","Mon Apr 20 17:03:00 UTC 2026","passed","Mon Apr 20 17:03:04 UTC 2026","","Go Test","github.com/specterops/bloodhound/cmd/api/src/api/v2/auth/TestCreateUser_ETAC","TestCreateUser_ETAC"
"Test cases for TestResources_ExportSavedQueries","25","TestResources_ExportSavedQueries","","Mon Apr 20 17:02:51 UTC 2026","passed","Mon Apr 20 17:02:51 UTC 2026","","Go Test","github.com/specterops/bloodhound/cmd/api/src/api/v2/TestResources_ExportSavedQueries","TestResources_ExportSavedQueries"
"Test cases for TestResources_DeleteExtension","75","TestResources_DeleteExtension","","Mon Apr 20 17:02:51 UTC 2026","passed","Mon Apr 20 17:02:51 UTC 2026","","Go Test","github.com/specterops/bloodhound/cmd/api/src/api/v2/TestResources_DeleteExtension","TestResources_DeleteExtension"
"","169","navigates to previous history entry when warning dialog is cancelled","EarlyAccessFeatures","Mon Apr 20 17:09:10 UTC 2026","passed","Mon Apr 20 17:09:11 UTC 2026","","","",""
"","159","should call ""onCancel one time""","Enable2FADialog","Mon Apr 20 17:07:06 UTC 2026","passed","Mon Apr 20 17:07:06 UTC 2026","","user clicks ""Cancel"" button","",""
"","237","toggles sort order when clicking sortable header","ObjectsAccordion","Mon Apr 20 17:06:30 UTC 2026","passed","Mon Apr 20 17:06:30 UTC 2026","","","",""
"","538","should sort by type","SSOProviderTable","Mon Apr 20 17:07:01 UTC 2026","passed","Mon Apr 20 17:07:02 UTC 2026","","","",""
"Test cases for TestManagementResource_GetSelf","0","TestManagementResource_GetSelf","","Mon Apr 20 17:03:13 UTC 2026","passed","Mon Apr 20 17:03:13 UTC 2026","","Go Test","github.com/specterops/bloodhound/cmd/api/src/api/v2/auth/TestManagementResource_GetSelf","TestManagementResource_GetSelf"
"","213","displays validation error messages when Save button is clicked and no form input is provided","PasswordDialog","Mon Apr 20 17:04:16 UTC 2026","passed","Mon Apr 20 17:04:16 UTC 2026","","","",""
"Test cases for TestQueries_BuildEntityQueryParams_DataTypeCount","0","TestQueries_BuildEntityQueryParams_DataTypeCount","","Mon Apr 20 17:02:56 UTC 2026","passed","Mon Apr 20 17:02:56 UTC 2026","","Go Test","github.com/specterops/bloodhound/cmd/api/src/queries/TestQueries_BuildEntityQueryParams_DataTypeCount","TestQueries_BuildEntityQueryParams_DataTypeCount"
"","199","sums nested section node counts","EntityInfoDataTableGraphed","Mon Apr 20 17:05:20 UTC 2026","passed","Mon Apr 20 17:05:20 UTC 2026","","Node count for nested table that counts all sections","",""
"","4","returns all environments when no filters are active","filterAndSearchEnvironments","Mon Apr 20 17:04:02 UTC 2026","passed","Mon Apr 20 17:04:02 UTC 2026","","with no filters applied","",""
"","186","calls onLayoutChange with the selected layout","GraphControls","Mon Apr 20 17:04:37 UTC 2026","passed","Mon Apr 20 17:04:37 UTC 2026","","Selecting a layout","",""
"","1","calculates skip correctly for pageParam > 1","createHistoryParams","Mon Apr 20 17:07:33 UTC 2026","passed","Mon Apr 20 17:07:33 UTC 2026","","","",""
"","177","should display a toggle switch to enable multi-factor authentication","UserProfile","Mon Apr 20 17:05:23 UTC 2026","passed","Mon Apr 20 17:05:23 UTC 2026","","","",""
"Test cases for TestManagementResource_EnableUserSAML","1","TestManagementResource_EnableUserSAML","","Mon Apr 20 17:02:57 UTC 2026","passed","Mon Apr 20 17:02:57 UTC 2026","","Go Test","github.com/specterops/bloodhound/cmd/api/src/api/v2/auth/TestManagementResource_EnableUserSAML","TestManagementResource_EnableUserSAML"
