"DESCRIPTION","DURATION IN MS","NAME","PARENT SUITE","START TIME","STATUS","STOP TIME","SUB SUITE","SUITE","TEST CLASS","TEST METHOD"
"","932","should render","CypherSearch","Mon Apr 20 17:04:20 UTC 2026","passed","Mon Apr 20 17:04:21 UTC 2026","","","",""
"","1","adds email filter if madeBy contains ""@""","createHistoryParams","Mon Apr 20 17:07:33 UTC 2026","passed","Mon Apr 20 17:07:33 UTC 2026","","","",""
"","149","calls onClick when toggle button clicked","EarlyAccessFeatureToggle","Mon Apr 20 17:09:20 UTC 2026","passed","Mon Apr 20 17:09:20 UTC 2026","","","",""
"","0","returns fallback Cypher message when ruleType is undefined and seeds are required","getErrorMessage","Mon Apr 20 17:04:40 UTC 2026","passed","Mon Apr 20 17:04:40 UTC 2026","","","",""
"","115","calls handleFilterChange with all filter types and empty strings when clicked while filters are active","AssetGroupEdit","Mon Apr 20 17:05:12 UTC 2026","passed","Mon Apr 20 17:05:12 UTC 2026","","Clear Filters button","",""
"","201","Displays a notification when analysis has been requested successfully","AnalyzeNowConfiguration","Mon Apr 20 17:05:35 UTC 2026","passed","Mon Apr 20 17:05:35 UTC 2026","","","",""
"","126","continue button is disabled when no SSO provider has been selected","LoginViaSSOForm","Mon Apr 20 17:06:53 UTC 2026","passed","Mon Apr 20 17:06:53 UTC 2026","","","",""
"Test cases for TestFormatDatabaseErrorNotFound","0","TestFormatDatabaseErrorNotFound","","Mon Apr 20 17:02:41 UTC 2026","passed","Mon Apr 20 17:02:41 UTC 2026","","Go Test","github.com/specterops/bloodhound/cmd/api/src/api/TestFormatDatabaseErrorNotFound","TestFormatDatabaseErrorNotFound"
"","8","renders highlight only for active selector when ruleId is present","SelectedHighlight","Mon Apr 20 17:07:32 UTC 2026","passed","Mon Apr 20 17:07:32 UTC 2026","","","",""
"","78","List Display Roles Hook is Loading","useListDisplayRoles","Mon Apr 20 17:04:45 UTC 2026","passed","Mon Apr 20 17:04:45 UTC 2026","","","",""
"","6","should not render a Field when the provided value is []","Field","Mon Apr 20 17:07:53 UTC 2026","passed","Mon Apr 20 17:07:53 UTC 2026","","","",""
"Test cases for TestResources_UpdateSavedQuery_QueryBelongsToAnotherUser","4","TestResources_UpdateSavedQuery_QueryBelongsToAnotherUser","","Mon Apr 20 17:02:51 UTC 2026","passed","Mon Apr 20 17:02:51 UTC 2026","","Go Test","github.com/specterops/bloodhound/cmd/api/src/api/v2/TestResources_UpdateSavedQuery_QueryBelongsToAnotherUser","TestResources_UpdateSavedQuery_QueryBelongsToAnotherUser"
"","37","tag members refetches on sort change","the useAssetGroupTags utilities","Mon Apr 20 17:04:56 UTC 2026","passed","Mon Apr 20 17:04:56 UTC 2026","","","",""
"Test cases for TestSet","0","TestSet","","Mon Apr 20 17:03:13 UTC 2026","passed","Mon Apr 20 17:03:13 UTC 2026","","Go Test","github.com/specterops/bloodhound/packages/go/lab/internal/TestSet","TestSet"
"","93","renders enabled prop when flag is enabled","FeatureFlag","Mon Apr 20 17:07:20 UTC 2026","passed","Mon Apr 20 17:07:20 UTC 2026","","","",""
"Test cases for TestManagementResource_UpdateUser_DBError","1455","TestManagementResource_UpdateUser_DBError","","Mon Apr 20 17:03:11 UTC 2026","passed","Mon Apr 20 17:03:13 UTC 2026","","Go Test","github.com/specterops/bloodhound/cmd/api/src/api/v2/auth/TestManagementResource_UpdateUser_DBError","TestManagementResource_UpdateUser_DBError"
"Test cases for TestResources_ListADComputerSQLAdmins","0","TestResources_ListADComputerSQLAdmins","","Mon Apr 20 17:02:51 UTC 2026","passed","Mon Apr 20 17:02:51 UTC 2026","","Go Test","github.com/specterops/bloodhound/cmd/api/src/api/v2/TestResources_ListADComputerSQLAdmins","TestResources_ListADComputerSQLAdmins"
"","57","disables the upload file button when the user does not have the opengraph write permission","SchemaUploadDialog","Mon Apr 20 17:04:39 UTC 2026","passed","Mon Apr 20 17:04:39 UTC 2026","","","",""
"","198","Verify Vault Reader count is the count returned by All Readers","EntityInfoDataTableGraphed","Mon Apr 20 17:05:20 UTC 2026","passed","Mon Apr 20 17:05:20 UTC 2026","","Node count for Vault Readers nested table","",""
"","16","sets autoDisplayTable to false if query type is pathfinding","useExploreTableAutoDisplay","Mon Apr 20 17:07:24 UTC 2026","passed","Mon Apr 20 17:07:24 UTC 2026","","","",""
"Test cases for TestResources_ShareSavedQueriesPermissions_SavingPermissionsErrors","0","TestResources_ShareSavedQueriesPermissions_SavingPermissionsErrors","","Mon Apr 20 17:02:51 UTC 2026","passed","Mon Apr 20 17:02:51 UTC 2026","","Go Test","github.com/specterops/bloodhound/cmd/api/src/api/v2/TestResources_ShareSavedQueriesPermissions_SavingPermissionsErrors","TestResources_ShareSavedQueriesPermissions_SavingPermissionsErrors"
"","147","should call onCancel when return to login button clicked","OneTimePasscodeForm","Mon Apr 20 17:07:38 UTC 2026","passed","Mon Apr 20 17:07:38 UTC 2026","","","",""
"Test cases for TestResources_UpdateSavedQuery_GetSavedQueryError","3","TestResources_UpdateSavedQuery_GetSavedQueryError","","Mon Apr 20 17:02:51 UTC 2026","passed","Mon Apr 20 17:02:51 UTC 2026","","Go Test","github.com/specterops/bloodhound/cmd/api/src/api/v2/TestResources_UpdateSavedQuery_GetSavedQueryError","TestResources_UpdateSavedQuery_GetSavedQueryError"
"","0","returns undefined if graphData is {} or not a GraphResponse","getExploreTableData","Mon Apr 20 17:06:23 UTC 2026","passed","Mon Apr 20 17:06:23 UTC 2026","","","",""
"Test cases for TestResources_ListADComputerRDPUsers","1","TestResources_ListADComputerRDPUsers","","Mon Apr 20 17:02:51 UTC 2026","passed","Mon Apr 20 17:02:51 UTC 2026","","Go Test","github.com/specterops/bloodhound/cmd/api/src/api/v2/TestResources_ListADComputerRDPUsers","TestResources_ListADComputerRDPUsers"
"","207","shows ""Select All"" when not all columns are selected","ManageColumnsComboBox","Mon Apr 20 17:04:59 UTC 2026","passed","Mon Apr 20 17:04:59 UTC 2026","","","",""
"","51","upon selecting just a destination node, updates the URL with a searchType of 'node' and secondarySearch of the node's objectid","usePathfindingSearch","Mon Apr 20 17:06:00 UTC 2026","passed","Mon Apr 20 17:06:00 UTC 2026","","","",""
"Test cases for TestResources_UpdateSavedQuery_AdminPublicQuery_Success","0","TestResources_UpdateSavedQuery_AdminPublicQuery_Success","","Mon Apr 20 17:02:51 UTC 2026","passed","Mon Apr 20 17:02:51 UTC 2026","","Go Test","github.com/specterops/bloodhound/cmd/api/src/api/v2/TestResources_UpdateSavedQuery_AdminPublicQuery_Success","TestResources_UpdateSavedQuery_AdminPublicQuery_Success"
"","321","On unsuccessful upload, notifies with an error and displays a retry button","SchemaUploadDialog","Mon Apr 20 17:04:41 UTC 2026","passed","Mon Apr 20 17:04:41 UTC 2026","","","",""
"Test cases for TestResources_BuildDeleteRequest","1","TestResources_BuildDeleteRequest","","Mon Apr 20 17:02:51 UTC 2026","passed","Mon Apr 20 17:02:51 UTC 2026","","Go Test","github.com/specterops/bloodhound/cmd/api/src/api/v2/TestResources_BuildDeleteRequest","TestResources_BuildDeleteRequest"
"Test cases for TestGenerateRandomBase64String","0","TestGenerateRandomBase64String","","Mon Apr 20 17:02:51 UTC 2026","passed","Mon Apr 20 17:02:51 UTC 2026","","Go Test","github.com/specterops/bloodhound/cmd/api/src/config/TestGenerateRandomBase64String","TestGenerateRandomBase64String"
"","1","filters by critical risk level","filterAndSearchEnvironments","Mon Apr 20 17:04:02 UTC 2026","passed","Mon Apr 20 17:04:02 UTC 2026","","risk filters","",""
"","420","calls setFilters when the Confirm button is clicked","Privilege Zones History Filter Dialog","Mon Apr 20 17:06:01 UTC 2026","passed","Mon Apr 20 17:06:01 UTC 2026","","","",""
"","1659","does not show the ""Disable MFA"" context menu option for users without MFA enabled","Users","Mon Apr 20 17:05:41 UTC 2026","passed","Mon Apr 20 17:05:43 UTC 2026","","","",""
"","1","filters by collected=false when ""no"" filter is active","filterAndSearchEnvironments","Mon Apr 20 17:04:02 UTC 2026","passed","Mon Apr 20 17:04:02 UTC 2026","","collected filters","",""
"","346","displays 0 when a given sections returns empty, and sums the rest of the sections correctly","EntityInfoDataTableGraphed","Mon Apr 20 17:05:20 UTC 2026","passed","Mon Apr 20 17:05:20 UTC 2026","","Node count for nested table that counts all sections","",""
"Test cases for TestManagementResource_ListRoles_PredicateMismatchWithColumn","1","TestManagementResource_ListRoles_PredicateMismatchWithColumn","","Mon Apr 20 17:02:57 UTC 2026","passed","Mon Apr 20 17:02:57 UTC 2026","","Go Test","github.com/specterops/bloodhound/cmd/api/src/api/v2/auth/TestManagementResource_ListRoles_PredicateMismatchWithColumn","TestManagementResource_ListRoles_PredicateMismatchWithColumn"
"Test cases for Test_GetAssetGroupMembersByTag","4","Test_GetAssetGroupMembersByTag","","Mon Apr 20 17:02:51 UTC 2026","passed","Mon Apr 20 17:02:51 UTC 2026","","Go Test","github.com/specterops/bloodhound/cmd/api/src/api/v2/Test_GetAssetGroupMembersByTag","Test_GetAssetGroupMembersByTag"
"","515","has status filters","FileIngestFilterDialog","Mon Apr 20 17:04:45 UTC 2026","passed","Mon Apr 20 17:04:45 UTC 2026","","Status Select","",""
"Test cases for TestResources_GetAssetGroupTagMemberInfo","2","TestResources_GetAssetGroupTagMemberInfo","","Mon Apr 20 17:02:51 UTC 2026","passed","Mon Apr 20 17:02:51 UTC 2026","","Go Test","github.com/specterops/bloodhound/cmd/api/src/api/v2/TestResources_GetAssetGroupTagMemberInfo","TestResources_GetAssetGroupTagMemberInfo"
"Test cases for TestStringPointer","0","TestStringPointer","","Mon Apr 20 17:02:53 UTC 2026","passed","Mon Apr 20 17:02:53 UTC 2026","","Go Test","github.com/specterops/bloodhound/cmd/api/src/database/types/null/TestStringPointer","TestStringPointer"
"","173","renders the Cypher Rules Panel when clicking the Rule Tab","Selected Details Tab Content","Mon Apr 20 17:07:38 UTC 2026","passed","Mon Apr 20 17:07:38 UTC 2026","","","",""
"Test cases for TestParseUserIP_XForwardedFor_RemoteAddr","0","TestParseUserIP_XForwardedFor_RemoteAddr","","Mon Apr 20 17:02:44 UTC 2026","passed","Mon Apr 20 17:02:44 UTC 2026","","Go Test","github.com/specterops/bloodhound/cmd/api/src/api/middleware/TestParseUserIP_XForwardedFor_RemoteAddr","TestParseUserIP_XForwardedFor_RemoteAddr"
"Test cases for TestEndNodes","1","TestEndNodes","","Mon Apr 20 17:03:11 UTC 2026","passed","Mon Apr 20 17:03:11 UTC 2026","","Go Test","github.com/specterops/bloodhound/packages/go/analysis/azure/TestEndNodes","TestEndNodes"
"Test cases for TestResources_ProcessIngestTask","6","TestResources_ProcessIngestTask","","Mon Apr 20 17:02:51 UTC 2026","passed","Mon Apr 20 17:02:51 UTC 2026","","Go Test","github.com/specterops/bloodhound/cmd/api/src/api/v2/TestResources_ProcessIngestTask","TestResources_ProcessIngestTask"
"Test cases for TestParseSkipQueryParameter_BadFormat","0","TestParseSkipQueryParameter_BadFormat","","Mon Apr 20 17:02:51 UTC 2026","passed","Mon Apr 20 17:02:51 UTC 2026","","Go Test","github.com/specterops/bloodhound/cmd/api/src/api/v2/TestParseSkipQueryParameter_BadFormat","TestParseSkipQueryParameter_BadFormat"
"Test cases for TestManagementResource_SAMLLoginRedirect","7","TestManagementResource_SAMLLoginRedirect","","Mon Apr 20 17:03:29 UTC 2026","passed","Mon Apr 20 17:03:29 UTC 2026","","Go Test","github.com/specterops/bloodhound/cmd/api/src/api/v2/auth/TestManagementResource_SAMLLoginRedirect","TestManagementResource_SAMLLoginRedirect"
"Test cases for TestRRuleValidator","0","TestRRuleValidator","","Mon Apr 20 17:03:11 UTC 2026","passed","Mon Apr 20 17:03:11 UTC 2026","","Go Test","github.com/specterops/bloodhound/cmd/api/src/utils/validation/TestRRuleValidator","TestRRuleValidator"
"Test cases for TestOpenGraphSchemaService_ListExtensions","0","TestOpenGraphSchemaService_ListExtensions","","Mon Apr 20 17:02:58 UTC 2026","passed","Mon Apr 20 17:02:58 UTC 2026","","Go Test","github.com/specterops/bloodhound/cmd/api/src/services/opengraphschema/TestOpenGraphSchemaService_ListExtensions","TestOpenGraphSchemaService_ListExtensions"
"Test cases for TestWriteResponseWrapperWithTimeWindowAndPagination","0","TestWriteResponseWrapperWithTimeWindowAndPagination","","Mon Apr 20 17:02:41 UTC 2026","passed","Mon Apr 20 17:02:41 UTC 2026","","Go Test","github.com/specterops/bloodhound/cmd/api/src/api/TestWriteResponseWrapperWithTimeWindowAndPagination","TestWriteResponseWrapperWithTimeWindowAndPagination"
"","255","Selecting an edge that meets ACL inheritance criteria shows the ""ACE Inherited From"" dropdown","EdgeInfoContent","Mon Apr 20 17:04:08 UTC 2026","passed","Mon Apr 20 17:04:08 UTC 2026","","","",""
"","0","returns paramValue as EnvironmentAggregation for unknown values (custom types)","useEnvironmentParams","Mon Apr 20 17:08:21 UTC 2026","passed","Mon Apr 20 17:08:21 UTC 2026","","parseEnvironmentAggregation","",""
"","415","accepts a valid file and allows the user to continue through the upload process","File Upload","Mon Apr 20 17:05:58 UTC 2026","passed","Mon Apr 20 17:05:58 UTC 2026","","","",""
"","84","returns an object with values for assetGroupTagId, params, and setPZQueryParams","usePZQueryParams","Mon Apr 20 17:06:37 UTC 2026","passed","Mon Apr 20 17:06:37 UTC 2026","","","",""
"","10","disables the upload button and does not populate a table if the user lacks the permission","File Upload","Mon Apr 20 17:05:58 UTC 2026","passed","Mon Apr 20 17:05:58 UTC 2026","","","",""
"","140","shows the empty form message when Object Rule Form is empty","Seed Selection Results","Mon Apr 20 17:04:53 UTC 2026","passed","Mon Apr 20 17:04:53 UTC 2026","","","",""
"","25","tag members refetches on environment change","the useAssetGroupTags utilities","Mon Apr 20 17:04:56 UTC 2026","passed","Mon Apr 20 17:04:56 UTC 2026","","","",""
"Test cases for TestManagementResource_DeleteUser_UserBhCtxNotFound","0","TestManagementResource_DeleteUser_UserBhCtxNotFound","","Mon Apr 20 17:03:13 UTC 2026","passed","Mon Apr 20 17:03:13 UTC 2026","","Go Test","github.com/specterops/bloodhound/cmd/api/src/api/v2/auth/TestManagementResource_DeleteUser_UserBhCtxNotFound","TestManagementResource_DeleteUser_UserBhCtxNotFound"
"","9","returns azure environmentInfo when environmentAggregation param is azure","useAvailableEnvironments","Mon Apr 20 17:06:02 UTC 2026","passed","Mon Apr 20 17:06:02 UTC 2026","","useSelectedEnvironment","",""
"Test cases for TestUnmarshalTimeJSON","0","TestUnmarshalTimeJSON","","Mon Apr 20 17:02:53 UTC 2026","passed","Mon Apr 20 17:02:53 UTC 2026","","Go Test","github.com/specterops/bloodhound/cmd/api/src/database/types/null/TestUnmarshalTimeJSON","TestUnmarshalTimeJSON"
"","3","succeeds for valid password","testPassword","Mon Apr 20 17:08:23 UTC 2026","passed","Mon Apr 20 17:08:23 UTC 2026","","","",""
"Test cases for TestOpenGraphSchemaService_GetSchemaFindings","0","TestOpenGraphSchemaService_GetSchemaFindings","","Mon Apr 20 17:02:58 UTC 2026","passed","Mon Apr 20 17:02:58 UTC 2026","","Go Test","github.com/specterops/bloodhound/cmd/api/src/services/opengraphschema/TestOpenGraphSchemaService_GetSchemaFindings","TestOpenGraphSchemaService_GetSchemaFindings"
"Test cases for TestKeyEncoder_Key_Deterministic","0","TestKeyEncoder_Key_Deterministic","","Mon Apr 20 17:03:11 UTC 2026","passed","Mon Apr 20 17:03:11 UTC 2026","","Go Test","github.com/specterops/bloodhound/packages/go/analysis/post/TestKeyEncoder_Key_Deterministic","TestKeyEncoder_Key_Deterministic"
"","80","clicking a disabled header does not toggle content","<DetailsAccordion />","Mon Apr 20 17:04:58 UTC 2026","passed","Mon Apr 20 17:04:58 UTC 2026","","","",""
"","244","disables GraphButton when isCurrentSearchOpen is true","GraphControls","Mon Apr 20 17:04:37 UTC 2026","passed","Mon Apr 20 17:04:38 UTC 2026","","Searching current results","",""
"Test cases for TestResources_ListADComputerPSRemoteUsers","0","TestResources_ListADComputerPSRemoteUsers","","Mon Apr 20 17:02:51 UTC 2026","passed","Mon Apr 20 17:02:51 UTC 2026","","Go Test","github.com/specterops/bloodhound/cmd/api/src/api/v2/TestResources_ListADComputerPSRemoteUsers","TestResources_ListADComputerPSRemoteUsers"
"","137","Disable Analyze Now and change to Analyzing if datapipe status is different from ""idle""","AnalyzeNowConfiguration","Mon Apr 20 17:05:34 UTC 2026","passed","Mon Apr 20 17:05:34 UTC 2026","","","",""
"","74","renders a dash when actor is BloodHoundString","NoteCell component","Mon Apr 20 17:07:06 UTC 2026","passed","Mon Apr 20 17:07:06 UTC 2026","","","",""
"","398","sets exploreSearchTab param to pathfinding when the user clicks the `pathfinding` tab","ExploreSearch sets searchType on tab changing","Mon Apr 20 17:08:52 UTC 2026","passed","Mon Apr 20 17:08:52 UTC 2026","","","",""
"Test cases for TestManagementResource_ListUsers_InvalidColumn","0","TestManagementResource_ListUsers_InvalidColumn","","Mon Apr 20 17:02:57 UTC 2026","passed","Mon Apr 20 17:02:57 UTC 2026","","Go Test","github.com/specterops/bloodhound/cmd/api/src/api/v2/auth/TestManagementResource_ListUsers_InvalidColumn","TestManagementResource_ListUsers_InvalidColumn"
"Test cases for TestResources_CreateSavedQuery_EmptyBody","0","TestResources_CreateSavedQuery_EmptyBody","","Mon Apr 20 17:02:51 UTC 2026","passed","Mon Apr 20 17:02:51 UTC 2026","","Go Test","github.com/specterops/bloodhound/cmd/api/src/api/v2/TestResources_CreateSavedQuery_EmptyBody","TestResources_CreateSavedQuery_EmptyBody"
"","47","navigates to the specified route with global params intact","AppNavigate","Mon Apr 20 17:07:12 UTC 2026","passed","Mon Apr 20 17:07:12 UTC 2026","","","",""
"","0","reports an Object ID-specific error when editing a rule and ruleType is SeedTypeObjectId and seeds are required","handleError","Mon Apr 20 17:04:40 UTC 2026","passed","Mon Apr 20 17:04:40 UTC 2026","","","",""
"","107","shows formatted expiration date (yyyy-MM-dd) when expires_at is set","UserTokenManagementDialog - API Expiration Date column","Mon Apr 20 17:04:52 UTC 2026","passed","Mon Apr 20 17:04:52 UTC 2026","","","",""
"","45","does not render the analysis toggle when multi tier analysis enabled is false","Tag Form","Mon Apr 20 17:03:50 UTC 2026","passed","Mon Apr 20 17:03:50 UTC 2026","","","",""
"","400","should render list of available SSO providers","LoginViaSSOForm","Mon Apr 20 17:06:53 UTC 2026","passed","Mon Apr 20 17:06:53 UTC 2026","","","",""
"","1","handles null or empty madeBy","createHistoryParams","Mon Apr 20 17:07:33 UTC 2026","passed","Mon Apr 20 17:07:33 UTC 2026","","","",""
"","5","calls the provided notification method","handleError","Mon Apr 20 17:04:40 UTC 2026","passed","Mon Apr 20 17:04:40 UTC 2026","","","",""
"","165","renders an interactive version when preview is set to false","PrivilegeZonesCypherEditor Search component for Zone Management","Mon Apr 20 17:07:24 UTC 2026","passed","Mon Apr 20 17:07:24 UTC 2026","","","",""
"Test cases for TestManagementResource_GetAZEntity","114","TestManagementResource_GetAZEntity","","Mon Apr 20 17:02:51 UTC 2026","passed","Mon Apr 20 17:02:51 UTC 2026","","Go Test","github.com/specterops/bloodhound/cmd/api/src/api/v2/TestManagementResource_GetAZEntity","TestManagementResource_GetAZEntity"
"","113","should display the logged in user's email address","UserProfile","Mon Apr 20 17:05:22 UTC 2026","passed","Mon Apr 20 17:05:22 UTC 2026","","","",""
"","0","returns disabled if relationshipQueryItemId does not have a matching sourceId, edgeType, targetId","useExploreGraph","Mon Apr 20 17:04:27 UTC 2026","passed","Mon Apr 20 17:04:27 UTC 2026","composition search queries","exploreGraphQueryFactory","",""
"","61","enables filtering out for tags that are treated as Labels (including Owned)","the useAssetGroupTags utilities","Mon Apr 20 17:04:56 UTC 2026","passed","Mon Apr 20 17:04:56 UTC 2026","","","",""
"Test cases for TestResources_ShareSavedQueriesPermissions_Admin","0","TestResources_ShareSavedQueriesPermissions_Admin","","Mon Apr 20 17:02:51 UTC 2026","passed","Mon Apr 20 17:02:51 UTC 2026","","Go Test","github.com/specterops/bloodhound/cmd/api/src/api/v2/TestResources_ShareSavedQueriesPermissions_Admin","TestResources_ShareSavedQueriesPermissions_Admin"
"Test cases for TestJSONFloat_MarshalJSON_NaN","0","TestJSONFloat_MarshalJSON_NaN","","Mon Apr 20 17:02:53 UTC 2026","passed","Mon Apr 20 17:02:53 UTC 2026","","Go Test","github.com/specterops/bloodhound/cmd/api/src/database/types/nan/TestJSONFloat_MarshalJSON_NaN","TestJSONFloat_MarshalJSON_NaN"
"","589","clears the applied filter","FileIngestFilterDialog","Mon Apr 20 17:04:46 UTC 2026","passed","Mon Apr 20 17:04:46 UTC 2026","","Status Select","",""
"Test cases for TestSavedQueries_IsString","0","TestSavedQueries_IsString","","Mon Apr 20 17:02:54 UTC 2026","passed","Mon Apr 20 17:02:54 UTC 2026","","Go Test","github.com/specterops/bloodhound/cmd/api/src/model/TestSavedQueries_IsString","TestSavedQueries_IsString"
"","385","displays a completion of 100% and adds a ""Close"" button that closes the dialog after a successful upload","SchemaUploadDialog","Mon Apr 20 17:04:40 UTC 2026","passed","Mon Apr 20 17:04:40 UTC 2026","","","",""
"Test cases for Test_UseFixture","0","Test_UseFixture","","Mon Apr 20 17:03:12 UTC 2026","passed","Mon Apr 20 17:03:12 UTC 2026","","Go Test","github.com/specterops/bloodhound/packages/go/lab/Test_UseFixture","Test_UseFixture"
"","9806","checking a subcategory updates all children (edge types) in its group","Pathfinding","Mon Apr 20 17:05:38 UTC 2026","passed","Mon Apr 20 17:05:48 UTC 2026","","","",""
"","218","shows Popper when isCurrentSearchOpen is true","GraphControls","Mon Apr 20 17:04:38 UTC 2026","passed","Mon Apr 20 17:04:38 UTC 2026","","Searching current results","",""
"","239","passes item props to Header and Content","<DetailsAccordion />","Mon Apr 20 17:04:57 UTC 2026","passed","Mon Apr 20 17:04:58 UTC 2026","","","",""
"Test cases for TestWriteTimeWindowedResponse","0","TestWriteTimeWindowedResponse","","Mon Apr 20 17:02:41 UTC 2026","passed","Mon Apr 20 17:02:41 UTC 2026","","Go Test","github.com/specterops/bloodhound/cmd/api/src/api/TestWriteTimeWindowedResponse","TestWriteTimeWindowedResponse"
"Test cases for TestGetLatestQueryParameter","0","TestGetLatestQueryParameter","","Mon Apr 20 17:02:51 UTC 2026","passed","Mon Apr 20 17:02:51 UTC 2026","","Go Test","github.com/specterops/bloodhound/cmd/api/src/api/v2/TestGetLatestQueryParameter","TestGetLatestQueryParameter"
"","131","renders enabled Zone tab and disabled Rule and Object tabs","Selected Details Tabs","Mon Apr 20 17:05:52 UTC 2026","passed","Mon Apr 20 17:05:52 UTC 2026","","Selected Details Tabs - Params present","",""
"Test cases for TestIntFrom","0","TestIntFrom","","Mon Apr 20 17:02:53 UTC 2026","passed","Mon Apr 20 17:02:53 UTC 2026","","Go Test","github.com/specterops/bloodhound/cmd/api/src/database/types/null/TestIntFrom","TestIntFrom"
"Test cases for TestIntScan","0","TestIntScan","","Mon Apr 20 17:02:53 UTC 2026","passed","Mon Apr 20 17:02:53 UTC 2026","","Go Test","github.com/specterops/bloodhound/cmd/api/src/database/types/null/TestIntScan","TestIntScan"
"Test cases for TestArgon2_ParseDigest","0","TestArgon2_ParseDigest","","Mon Apr 20 17:03:12 UTC 2026","passed","Mon Apr 20 17:03:12 UTC 2026","","Go Test","github.com/specterops/bloodhound/packages/go/crypto/TestArgon2_ParseDigest","TestArgon2_ParseDigest"
"","700","should render a create user form","CreateUserDialog","Mon Apr 20 17:04:18 UTC 2026","passed","Mon Apr 20 17:04:19 UTC 2026","","","",""
"Test cases for TestResources_GetAZEntityInformation","118","TestResources_GetAZEntityInformation","","Mon Apr 20 17:02:51 UTC 2026","passed","Mon Apr 20 17:02:51 UTC 2026","","Go Test","github.com/specterops/bloodhound/cmd/api/src/api/v2/TestResources_GetAZEntityInformation","TestResources_GetAZEntityInformation"
"Test cases for TestFloatFrom","0","TestFloatFrom","","Mon Apr 20 17:02:53 UTC 2026","passed","Mon Apr 20 17:02:53 UTC 2026","","Go Test","github.com/specterops/bloodhound/cmd/api/src/database/types/null/TestFloatFrom","TestFloatFrom"
"Test cases for TestConvertOUToNode_InheritanceHashes","1","TestConvertOUToNode_InheritanceHashes","","Mon Apr 20 17:03:12 UTC 2026","passed","Mon Apr 20 17:03:12 UTC 2026","","Go Test","github.com/specterops/bloodhound/packages/go/ein/TestConvertOUToNode_InheritanceHashes","TestConvertOUToNode_InheritanceHashes"
"","66","returns the full environment for the environmentid passed","useAvailableEnvironments","Mon Apr 20 17:06:01 UTC 2026","passed","Mon Apr 20 17:06:02 UTC 2026","","useSelectedEnvironment","",""
"","0","properly displays bitwise integers","Formatting number properties","Mon Apr 20 17:05:06 UTC 2026","passed","Mon Apr 20 17:05:06 UTC 2026","","","",""
"","4","isLoading returns as expected based on all queries combined","queriesAreLoadingOrErrored","Mon Apr 20 17:08:22 UTC 2026","passed","Mon Apr 20 17:08:22 UTC 2026","","","",""
"","0","runs a pathfinding search when the query param is set to ""pathfinding""","useExploreGraph","Mon Apr 20 17:04:27 UTC 2026","passed","Mon Apr 20 17:04:27 UTC 2026","","exploreGraphQueryFactory","",""
"","421","displays a validation error","ManagedDatePicker - date validation","Mon Apr 20 17:06:15 UTC 2026","passed","Mon Apr 20 17:06:15 UTC 2026","","","",""
"","10","removes a notification","AppNotifications","Mon Apr 20 17:07:10 UTC 2026","passed","Mon Apr 20 17:07:10 UTC 2026","","","",""
"","0","The data is fetching","Getting the text for the disabled item display for a search when there are no results","Mon Apr 20 17:06:51 UTC 2026","passed","Mon Apr 20 17:06:51 UTC 2026","","Loading states","",""
"Test cases for TestFormatDatabaseError","0","TestFormatDatabaseError","","Mon Apr 20 17:02:41 UTC 2026","passed","Mon Apr 20 17:02:41 UTC 2026","","Go Test","github.com/specterops/bloodhound/cmd/api/src/api/TestFormatDatabaseError","TestFormatDatabaseError"
