"DESCRIPTION","DURATION IN MS","NAME","PARENT SUITE","START TIME","STATUS","STOP TIME","SUB SUITE","SUITE","TEST CLASS","TEST METHOD"
"","55","shows the direct object list and expanded object list empty, when only direct objects in results","Seed Selection Results","Wed Jul 08 14:31:55 UTC 2026","passed","Wed Jul 08 14:31:55 UTC 2026","","","",""
"Test cases for TestStore_GetNode","3","TestStore_GetNode","","Wed Jul 08 14:30:35 UTC 2026","passed","Wed Jul 08 14:30:35 UTC 2026","","Go Test","github.com/specterops/bloodhound/server/graphdb/internal/appdb/TestStore_GetNode","TestStore_GetNode"
"Test cases for TestHandlers_GetNodeByID","3","TestHandlers_GetNodeByID","","Wed Jul 08 14:30:35 UTC 2026","passed","Wed Jul 08 14:30:35 UTC 2026","","Go Test","github.com/specterops/bloodhound/server/graphdb/internal/handlers/TestHandlers_GetNodeByID","TestHandlers_GetNodeByID"
"Test cases for Test_FixtureTeardown","0","Test_FixtureTeardown","","Wed Jul 08 14:30:10 UTC 2026","passed","Wed Jul 08 14:30:10 UTC 2026","","Go Test","github.com/specterops/bloodhound/packages/go/lab/Test_FixtureTeardown","Test_FixtureTeardown"
"","104","should call onCancel when return to login button clicked","PasswordResetForm","Wed Jul 08 14:32:44 UTC 2026","passed","Wed Jul 08 14:32:44 UTC 2026","","","",""
"Test cases for Test_AuthMiddleware","4","Test_AuthMiddleware","","Wed Jul 08 14:29:32 UTC 2026","passed","Wed Jul 08 14:29:32 UTC 2026","","Go Test","github.com/specterops/bloodhound/cmd/api/src/api/middleware/Test_AuthMiddleware","Test_AuthMiddleware"
"Test cases for TestResources_GetContainerEntityInfo","165","TestResources_GetContainerEntityInfo","","Wed Jul 08 14:29:40 UTC 2026","passed","Wed Jul 08 14:29:40 UTC 2026","","Go Test","github.com/specterops/bloodhound/cmd/api/src/api/v2/TestResources_GetContainerEntityInfo","TestResources_GetContainerEntityInfo"
"Test cases for TestResources_DeleteSavedQuery_UserNotAdmin","0","TestResources_DeleteSavedQuery_UserNotAdmin","","Wed Jul 08 14:29:40 UTC 2026","passed","Wed Jul 08 14:29:40 UTC 2026","","Go Test","github.com/specterops/bloodhound/cmd/api/src/api/v2/TestResources_DeleteSavedQuery_UserNotAdmin","TestResources_DeleteSavedQuery_UserNotAdmin"
"","255","sets a secondary=id and searchType=pathfinding when primary is truethy","ContextMenu","Wed Jul 08 14:31:54 UTC 2026","passed","Wed Jul 08 14:31:54 UTC 2026","","","",""
"Test cases for TestResources_ListADOUContainedGroups","0","TestResources_ListADOUContainedGroups","","Wed Jul 08 14:29:40 UTC 2026","passed","Wed Jul 08 14:29:40 UTC 2026","","Go Test","github.com/specterops/bloodhound/cmd/api/src/api/v2/TestResources_ListADOUContainedGroups","TestResources_ListADOUContainedGroups"
"Test cases for TestMarshalInt64","0","TestMarshalInt64","","Wed Jul 08 14:29:46 UTC 2026","passed","Wed Jul 08 14:29:46 UTC 2026","","Go Test","github.com/specterops/bloodhound/cmd/api/src/database/types/null/TestMarshalInt64","TestMarshalInt64"
"","14","should be aligned to right of screen","GenericErrorBoundaryFallback","Wed Jul 08 14:34:49 UTC 2026","passed","Wed Jul 08 14:34:49 UTC 2026","","","",""
"","4","uppercases boolean values","Formatting boolean properties","Wed Jul 08 14:32:04 UTC 2026","passed","Wed Jul 08 14:32:04 UTC 2026","","","",""
"","161","a timeout response from the server is handled","ExploreSearchCombobox with search timeout","Wed Jul 08 14:32:10 UTC 2026","passed","Wed Jul 08 14:32:11 UTC 2026","","","",""
"","2","dispatches a storage event when a value is set","useLocalStorage","Wed Jul 08 14:32:26 UTC 2026","passed","Wed Jul 08 14:32:26 UTC 2026","","storage event synchronisation","",""
"","682","displays must be new password error messages when current password is the same as new password","PasswordDialog","Wed Jul 08 14:30:57 UTC 2026","passed","Wed Jul 08 14:30:57 UTC 2026","","","",""
"Test cases for TestResources_ListADDomainForeignGPOControllers","4","TestResources_ListADDomainForeignGPOControllers","","Wed Jul 08 14:29:40 UTC 2026","passed","Wed Jul 08 14:29:40 UTC 2026","","Go Test","github.com/specterops/bloodhound/cmd/api/src/api/v2/TestResources_ListADDomainForeignGPOControllers","TestResources_ListADDomainForeignGPOControllers"
"","352","displays default text for domain selector when globalDomain is null","GroupManagement","Wed Jul 08 14:35:29 UTC 2026","passed","Wed Jul 08 14:35:29 UTC 2026","","","",""
"","378","clears the applied filter","FileIngestFilterDialog","Wed Jul 08 14:31:42 UTC 2026","passed","Wed Jul 08 14:31:42 UTC 2026","","User Select","",""
"","10","should render when search string at the end of the text","HighlightedText","Wed Jul 08 14:34:06 UTC 2026","passed","Wed Jul 08 14:34:06 UTC 2026","","","",""
"Test cases for TestNodeNamePrefix_String","1","TestNodeNamePrefix_String","","Wed Jul 08 14:30:08 UTC 2026","passed","Wed Jul 08 14:30:08 UTC 2026","","Go Test","github.com/specterops/bloodhound/packages/go/analysis/ad/wellknown/TestNodeNamePrefix_String","TestNodeNamePrefix_String"
"","0","returns false if arrays have different elements","areArraysSimilar","Wed Jul 08 14:34:23 UTC 2026","passed","Wed Jul 08 14:34:23 UTC 2026","","","",""
"Test cases for TestResources_EndIngestJob","77","TestResources_EndIngestJob","","Wed Jul 08 14:29:40 UTC 2026","passed","Wed Jul 08 14:29:40 UTC 2026","","Go Test","github.com/specterops/bloodhound/cmd/api/src/api/v2/TestResources_EndIngestJob","TestResources_EndIngestJob"
"","1","reports an API error when there is only statusText","handleError","Wed Jul 08 14:31:34 UTC 2026","passed","Wed Jul 08 14:31:34 UTC 2026","","","",""
"","1057","does not show a warning for using labels associated with tags in label forms (also shows correct View in Explore link)","Rule Form","Wed Jul 08 14:30:35 UTC 2026","passed","Wed Jul 08 14:30:36 UTC 2026","","","",""
"","242","Toggles node and edge labels on/off depending on their existing state","GraphControls","Wed Jul 08 14:30:44 UTC 2026","passed","Wed Jul 08 14:30:44 UTC 2026","","Toggling labels","",""
"","0","The node radius is adjusted for nodes that have their ""highlighted"" property set to true since the highlight adds some padding","getNodeRadius","Wed Jul 08 14:35:36 UTC 2026","passed","Wed Jul 08 14:35:36 UTC 2026","","","",""
"Test cases for TestDomainSelectors_GetValidFilterPredicatesAsStrings","0","TestDomainSelectors_GetValidFilterPredicatesAsStrings","","Wed Jul 08 14:29:47 UTC 2026","passed","Wed Jul 08 14:29:47 UTC 2026","","Go Test","github.com/specterops/bloodhound/cmd/api/src/model/TestDomainSelectors_GetValidFilterPredicatesAsStrings","TestDomainSelectors_GetValidFilterPredicatesAsStrings"
"","4","checks whether more data is needed when loadedCount changes","useInfiniteScroll","Wed Jul 08 14:33:28 UTC 2026","passed","Wed Jul 08 14:33:28 UTC 2026","","","",""
"","651","should render an update user form","UpdateUserDialog","Wed Jul 08 14:31:21 UTC 2026","passed","Wed Jul 08 14:31:22 UTC 2026","","","",""
"Test cases for Test_TopLevel","1","Test_TopLevel","","Wed Jul 08 14:30:26 UTC 2026","passed","Wed Jul 08 14:30:26 UTC 2026","","Go Test","github.com/specterops/bloodhound/packages/go/schemagen/csgen/Test_TopLevel","Test_TopLevel"
"","55","passes data to testing component","SavedQueriesProvider","Wed Jul 08 14:34:26 UTC 2026","passed","Wed Jul 08 14:34:26 UTC 2026","","","",""
"Test cases for TestManagementResource_ListUsers_InvalidFilterPredicate","0","TestManagementResource_ListUsers_InvalidFilterPredicate","","Wed Jul 08 14:29:47 UTC 2026","passed","Wed Jul 08 14:29:47 UTC 2026","","Go Test","github.com/specterops/bloodhound/cmd/api/src/api/v2/auth/TestManagementResource_ListUsers_InvalidFilterPredicate","TestManagementResource_ListUsers_InvalidFilterPredicate"
"","169","should render","SSOProviderTable","Wed Jul 08 14:33:34 UTC 2026","passed","Wed Jul 08 14:33:35 UTC 2026","","","",""
"","11","when password is expired and not on password reset page, redirects to password reset page","AuthenticatedRoute","Wed Jul 08 14:35:27 UTC 2026","passed","Wed Jul 08 14:35:27 UTC 2026","","","",""
"","365","calls handleFilterChange when a node type is selected","AssetGroupEdit","Wed Jul 08 14:32:09 UTC 2026","passed","Wed Jul 08 14:32:09 UTC 2026","","Node Type dropdown filter","",""
"Test cases for TestFloatPointer","0","TestFloatPointer","","Wed Jul 08 14:29:46 UTC 2026","passed","Wed Jul 08 14:29:46 UTC 2026","","Go Test","github.com/specterops/bloodhound/cmd/api/src/database/types/null/TestFloatPointer","TestFloatPointer"
"Test cases for TestMarshalTime","0","TestMarshalTime","","Wed Jul 08 14:29:46 UTC 2026","passed","Wed Jul 08 14:29:46 UTC 2026","","Go Test","github.com/specterops/bloodhound/cmd/api/src/database/types/null/TestMarshalTime","TestMarshalTime"
"","19","will update the selected filters based on the values stored in query params when the initialize function is called","usePathfindingFilters","Wed Jul 08 14:34:13 UTC 2026","passed","Wed Jul 08 14:34:13 UTC 2026","","","",""
"","87","should hide Environmental Targeted Access Control panel when showEnvironmentAccessControls prop is false","CreateUserForm","Wed Jul 08 14:30:54 UTC 2026","passed","Wed Jul 08 14:30:54 UTC 2026","","","",""
"","11","when user does not have a disallowed role for a route with disallowed roles, they see the normal page","AuthenticatedRoute","Wed Jul 08 14:35:27 UTC 2026","passed","Wed Jul 08 14:35:27 UTC 2026","","","",""
"Test cases for TestUrlValidator","0","TestUrlValidator","","Wed Jul 08 14:30:08 UTC 2026","passed","Wed Jul 08 14:30:08 UTC 2026","","Go Test","github.com/specterops/bloodhound/cmd/api/src/utils/validation/TestUrlValidator","TestUrlValidator"
"","263","should not render list items for domains that are not collected","Context Selector","Wed Jul 08 14:32:19 UTC 2026","passed","Wed Jul 08 14:32:19 UTC 2026","","","",""
"Copyright 2021 The Go Authors. All rights reserved.TestConcat was ripped from go1.22 source and should be replaced with the stdlib implementation when we move to 1.22Original source: https:","2","TestConcat","","Wed Jul 08 14:30:26 UTC 2026","passed","Wed Jul 08 14:30:26 UTC 2026","","Go Test","github.com/specterops/bloodhound/packages/go/slicesext/TestConcat","TestConcat"
"Test cases for TestResources_GetPathfindingResult","0","TestResources_GetPathfindingResult","","Wed Jul 08 14:29:40 UTC 2026","passed","Wed Jul 08 14:29:40 UTC 2026","","Go Test","github.com/specterops/bloodhound/cmd/api/src/api/v2/TestResources_GetPathfindingResult","TestResources_GetPathfindingResult"
"","2","stores a boolean value in localStorage","useLocalStorage","Wed Jul 08 14:32:26 UTC 2026","passed","Wed Jul 08 14:32:26 UTC 2026","","setValue","",""
"","136","enables the create user button when the user is admin role","Users","Wed Jul 08 14:31:40 UTC 2026","passed","Wed Jul 08 14:31:40 UTC 2026","","","",""
"","2","dispatches a storage event with null newValue when the key is removed","useLocalStorage","Wed Jul 08 14:32:26 UTC 2026","passed","Wed Jul 08 14:32:26 UTC 2026","","storage event synchronisation","",""
"Test cases for TestParseSkipQueryParameter","0","TestParseSkipQueryParameter","","Wed Jul 08 14:29:40 UTC 2026","passed","Wed Jul 08 14:29:40 UTC 2026","","Go Test","github.com/specterops/bloodhound/cmd/api/src/api/v2/TestParseSkipQueryParameter","TestParseSkipQueryParameter"
"","1552","executes a pathfinding search when both a source and destination node are provided","Pathfinding: interaction","Wed Jul 08 14:32:34 UTC 2026","passed","Wed Jul 08 14:32:35 UTC 2026","","","",""
"Test cases for TestOpenGraphSchemaService_GetEnvironmentKindsAndSchemaEnvironmentData","2","TestOpenGraphSchemaService_GetEnvironmentKindsAndSchemaEnvironmentData","","Wed Jul 08 14:29:53 UTC 2026","passed","Wed Jul 08 14:29:53 UTC 2026","","Go Test","github.com/specterops/bloodhound/cmd/api/src/services/opengraphschema/TestOpenGraphSchemaService_GetEnvironmentKindsAndSchemaEnvironmentData","TestOpenGraphSchemaService_GetEnvironmentKindsAndSchemaEnvironmentData"
"","810","should hide Environmental Targeted Access Control panel when showEnvironmentAccessControls prop is true and power user role is selected","CreateUserForm","Wed Jul 08 14:30:53 UTC 2026","passed","Wed Jul 08 14:30:54 UTC 2026","","","",""
"Test cases for TestResources_ListKinds","70","TestResources_ListKinds","","Wed Jul 08 14:29:40 UTC 2026","passed","Wed Jul 08 14:29:40 UTC 2026","","Go Test","github.com/specterops/bloodhound/cmd/api/src/api/v2/TestResources_ListKinds","TestResources_ListKinds"
"Test cases for TestResources_ListADDomainContainedGPOs","0","TestResources_ListADDomainContainedGPOs","","Wed Jul 08 14:29:40 UTC 2026","passed","Wed Jul 08 14:29:40 UTC 2026","","Go Test","github.com/specterops/bloodhound/cmd/api/src/api/v2/TestResources_ListADDomainContainedGPOs","TestResources_ListADDomainContainedGPOs"
"","40","displays a status indicator","StatusIndicator","Wed Jul 08 14:34:36 UTC 2026","passed","Wed Jul 08 14:34:36 UTC 2026","","","",""
"Test cases for TestManagementResource_ListSAMLSignOnEndpoints","14","TestManagementResource_ListSAMLSignOnEndpoints","","Wed Jul 08 14:30:29 UTC 2026","passed","Wed Jul 08 14:30:29 UTC 2026","","Go Test","github.com/specterops/bloodhound/cmd/api/src/api/v2/auth/TestManagementResource_ListSAMLSignOnEndpoints","TestManagementResource_ListSAMLSignOnEndpoints"
"","3268","The password reset dialog is opened when switching a user from SAML based authentication to username/password based authentication","Users","Wed Jul 08 14:31:37 UTC 2026","passed","Wed Jul 08 14:31:40 UTC 2026","","","",""
"","121","renders with a selected icon","Glyph Select Dialog","Wed Jul 08 14:34:23 UTC 2026","passed","Wed Jul 08 14:34:23 UTC 2026","","","",""
"Test cases for TestStore_GetNodeKindsByNames","3","TestStore_GetNodeKindsByNames","","Wed Jul 08 14:30:35 UTC 2026","passed","Wed Jul 08 14:30:35 UTC 2026","","Go Test","github.com/specterops/bloodhound/server/graphdb/internal/appdb/TestStore_GetNodeKindsByNames","TestStore_GetNodeKindsByNames"
"","11","navigates to the specified route with global params intact when triggered by a splat route","AppNavigate","Wed Jul 08 14:33:44 UTC 2026","passed","Wed Jul 08 14:33:44 UTC 2026","","","",""
"Test cases for TestResources_UpdateAssetGroupTag","3","TestResources_UpdateAssetGroupTag","","Wed Jul 08 14:29:40 UTC 2026","passed","Wed Jul 08 14:29:40 UTC 2026","","Go Test","github.com/specterops/bloodhound/cmd/api/src/api/v2/TestResources_UpdateAssetGroupTag","TestResources_UpdateAssetGroupTag"
"Test cases for TestUnmarshalNonIntegerNumberToInt64","0","TestUnmarshalNonIntegerNumberToInt64","","Wed Jul 08 14:29:46 UTC 2026","passed","Wed Jul 08 14:29:46 UTC 2026","","Go Test","github.com/specterops/bloodhound/cmd/api/src/database/types/null/TestUnmarshalNonIntegerNumberToInt64","TestUnmarshalNonIntegerNumberToInt64"
"","15","sets autoDisplayTable to false if query returns nodes only but the enabled prop is false","useExploreTableAutoDisplay","Wed Jul 08 14:33:45 UTC 2026","passed","Wed Jul 08 14:33:45 UTC 2026","","","",""
"Test cases for TestResources_ListADOUContainedUsers","0","TestResources_ListADOUContainedUsers","","Wed Jul 08 14:29:40 UTC 2026","passed","Wed Jul 08 14:29:40 UTC 2026","","Go Test","github.com/specterops/bloodhound/cmd/api/src/api/v2/TestResources_ListADOUContainedUsers","TestResources_ListADOUContainedUsers"
"Test cases for TestResources_ListADEntityPSRemoteRights","0","TestResources_ListADEntityPSRemoteRights","","Wed Jul 08 14:29:40 UTC 2026","passed","Wed Jul 08 14:29:40 UTC 2026","","Go Test","github.com/specterops/bloodhound/cmd/api/src/api/v2/TestResources_ListADEntityPSRemoteRights","TestResources_ListADEntityPSRemoteRights"
"","0","leaves double quotes untouched","escapeCypherString","Wed Jul 08 14:34:37 UTC 2026","passed","Wed Jul 08 14:34:37 UTC 2026","","","",""
"","261","should display correctly","ConfirmationDialog","Wed Jul 08 14:34:32 UTC 2026","passed","Wed Jul 08 14:34:32 UTC 2026","","","",""
"Test cases for TestResources_DownloadCollectorByVersion","2","TestResources_DownloadCollectorByVersion","","Wed Jul 08 14:29:40 UTC 2026","passed","Wed Jul 08 14:29:40 UTC 2026","","Go Test","github.com/specterops/bloodhound/cmd/api/src/api/v2/TestResources_DownloadCollectorByVersion","TestResources_DownloadCollectorByVersion"
"Test cases for TestResources_GetIssuancePolicyEntityInfo","146","TestResources_GetIssuancePolicyEntityInfo","","Wed Jul 08 14:29:40 UTC 2026","passed","Wed Jul 08 14:29:40 UTC 2026","","Go Test","github.com/specterops/bloodhound/cmd/api/src/api/v2/TestResources_GetIssuancePolicyEntityInfo","TestResources_GetIssuancePolicyEntityInfo"
"","45","when `selectedItem` is null, the combobox does not display an icon","icon rendering","Wed Jul 08 14:32:10 UTC 2026","passed","Wed Jul 08 14:32:10 UTC 2026","","","",""
"","2","returns undefined if graphData is undefined","normalizeGraphDataForSigma","Wed Jul 08 14:35:41 UTC 2026","passed","Wed Jul 08 14:35:41 UTC 2026","","","",""
"","89","displays pinned columns and unselected columns in the dropdown","ManageColumnsComboBox","Wed Jul 08 14:32:00 UTC 2026","passed","Wed Jul 08 14:32:00 UTC 2026","","","",""
"Test cases for TestMarshalInt","0","TestMarshalInt","","Wed Jul 08 14:29:46 UTC 2026","passed","Wed Jul 08 14:29:46 UTC 2026","","Go Test","github.com/specterops/bloodhound/cmd/api/src/database/types/null/TestMarshalInt","TestMarshalInt"
"","17","returns the OpenGraph environmentInfo when environmentAggregation param is not a known type","useAvailableEnvironments","Wed Jul 08 14:32:39 UTC 2026","passed","Wed Jul 08 14:32:39 UTC 2026","","useSelectedEnvironment","",""
"","23","selector members refetches on envrionment change","the useAssetGroupTags utilities","Wed Jul 08 14:31:55 UTC 2026","passed","Wed Jul 08 14:31:55 UTC 2026","","","",""
"","23","whencreated","Handling value formatting for Active Directory entity properties lastlogon, lastlogontimestamp, whencreated, and pwdlastset","Wed Jul 08 14:32:04 UTC 2026","passed","Wed Jul 08 14:32:04 UTC 2026","","","",""
"","3","returns the full inbound and outbound path when selecting a middle node","SigmaChart Utils","Wed Jul 08 14:35:29 UTC 2026","passed","Wed Jul 08 14:35:29 UTC 2026","when a node is selected","getFullPathHighlightedEntities","",""
"","15","selector members refetches on sort change","the useAssetGroupTags utilities","Wed Jul 08 14:31:55 UTC 2026","passed","Wed Jul 08 14:31:55 UTC 2026","","","",""
"","0","A type and keyword were provided but there were no results available","Getting the text for the disabled item display for a search when there are no results","Wed Jul 08 14:33:54 UTC 2026","passed","Wed Jul 08 14:33:54 UTC 2026","","Empty data states","",""
"","241","adds a ""Close"" button that closes the dialog after a failed upload","SchemaUploadDialog","Wed Jul 08 14:31:32 UTC 2026","passed","Wed Jul 08 14:31:32 UTC 2026","","","",""
"","22","does not return when zone limit is not reached","useTagLimits","Wed Jul 08 14:30:59 UTC 2026","passed","Wed Jul 08 14:30:59 UTC 2026","","","",""
"Test cases for TestQueries_BuildEntityQueryParams_DataTypeCount","0","TestQueries_BuildEntityQueryParams_DataTypeCount","","Wed Jul 08 14:29:48 UTC 2026","passed","Wed Jul 08 14:29:48 UTC 2026","","Go Test","github.com/specterops/bloodhound/cmd/api/src/queries/TestQueries_BuildEntityQueryParams_DataTypeCount","TestQueries_BuildEntityQueryParams_DataTypeCount"
"Test cases for TestTypes_Value","0","TestTypes_Value","","Wed Jul 08 14:29:45 UTC 2026","passed","Wed Jul 08 14:29:45 UTC 2026","","Go Test","github.com/specterops/bloodhound/cmd/api/src/database/types/TestTypes_Value","TestTypes_Value"
"","1","filters by name search (case insensitive)","filterAndSearchEnvironments","Wed Jul 08 14:30:41 UTC 2026","passed","Wed Jul 08 14:30:41 UTC 2026","","search filter","",""
"","330","filters extensions based on search input","ActiveExtensionsCard","Wed Jul 08 14:30:43 UTC 2026","passed","Wed Jul 08 14:30:43 UTC 2026","","","",""
"","1","returns true when the highlighted item is an edge in the graph","SigmaChart Utils","Wed Jul 08 14:35:29 UTC 2026","passed","Wed Jul 08 14:35:29 UTC 2026","","getIsHighlightedItemInGraph","",""
"Test cases for TestManagementResource_ListRoles_InvalidColumn","0","TestManagementResource_ListRoles_InvalidColumn","","Wed Jul 08 14:29:47 UTC 2026","passed","Wed Jul 08 14:29:47 UTC 2026","","Go Test","github.com/specterops/bloodhound/cmd/api/src/api/v2/auth/TestManagementResource_ListRoles_InvalidColumn","TestManagementResource_ListRoles_InvalidColumn"
"","3713","collapse all button collapses all sections","Pathfinding","Wed Jul 08 14:31:20 UTC 2026","passed","Wed Jul 08 14:31:24 UTC 2026","","","",""
"Test cases for TestOrphanFileSweeper_Clear","0","TestOrphanFileSweeper_Clear","","Wed Jul 08 14:29:43 UTC 2026","passed","Wed Jul 08 14:29:43 UTC 2026","","Go Test","github.com/specterops/bloodhound/cmd/api/src/daemons/datapipe/TestOrphanFileSweeper_Clear","TestOrphanFileSweeper_Clear"
"Test cases for TestAssetGroupMembers_Filter_Equals","0","TestAssetGroupMembers_Filter_Equals","","Wed Jul 08 14:29:29 UTC 2026","passed","Wed Jul 08 14:29:29 UTC 2026","","Go Test","github.com/specterops/bloodhound/cmd/api/src/api/TestAssetGroupMembers_Filter_Equals","TestAssetGroupMembers_Filter_Equals"
"Test cases for TestAddOrderByToNeo4jQuery_NoOrderByClause","0","TestAddOrderByToNeo4jQuery_NoOrderByClause","","Wed Jul 08 14:29:40 UTC 2026","passed","Wed Jul 08 14:29:40 UTC 2026","","Go Test","github.com/specterops/bloodhound/cmd/api/src/api/v2/TestAddOrderByToNeo4jQuery_NoOrderByClause","TestAddOrderByToNeo4jQuery_NoOrderByClause"
"","53","hides loading state when data is available","GraphDataCheckboxes","Wed Jul 08 14:31:27 UTC 2026","passed","Wed Jul 08 14:31:27 UTC 2026","","","",""
"Test cases for TestLocalStore_List","21","TestLocalStore_List","","Wed Jul 08 14:30:29 UTC 2026","passed","Wed Jul 08 14:30:30 UTC 2026","","Go Test","github.com/specterops/bloodhound/packages/go/storage/TestLocalStore_List","TestLocalStore_List"
"","106","renders details for a selected rule and is of type ""Cypher""","DynamicDetails","Wed Jul 08 14:32:25 UTC 2026","passed","Wed Jul 08 14:32:25 UTC 2026","","","",""
"","63","should render oidc info provider","SSOProviderTable","Wed Jul 08 14:33:30 UTC 2026","passed","Wed Jul 08 14:33:30 UTC 2026","","","",""
"Test cases for TestParseVersion","0","TestParseVersion","","Wed Jul 08 14:30:08 UTC 2026","passed","Wed Jul 08 14:30:08 UTC 2026","","Go Test","github.com/specterops/bloodhound/cmd/api/src/version/TestParseVersion","TestParseVersion"
"","2517","resets skip to 0 when filters change so rows are visible on the new result set","FileIngestTable","Wed Jul 08 14:31:13 UTC 2026","passed","Wed Jul 08 14:31:16 UTC 2026","","pagination reset","",""
"","187","Hides selector information if additionalSections is false","EntityInfoDataTableList","Wed Jul 08 14:33:03 UTC 2026","passed","Wed Jul 08 14:33:03 UTC 2026","","","",""
"Test cases for TestResources_ListADUserSessions","0","TestResources_ListADUserSessions","","Wed Jul 08 14:29:40 UTC 2026","passed","Wed Jul 08 14:29:40 UTC 2026","","Go Test","github.com/specterops/bloodhound/cmd/api/src/api/v2/TestResources_ListADUserSessions","TestResources_ListADUserSessions"
"","124","does not show ""<10 Days to Expire"" warning when token expires in more than 10 days","UserTokenManagementDialog - API Expiration Date column","Wed Jul 08 14:31:52 UTC 2026","passed","Wed Jul 08 14:31:52 UTC 2026","","","",""
"","414","clicking cancel on the form takes the user back to the details page the user was on previously","Rule Form","Wed Jul 08 14:30:32 UTC 2026","passed","Wed Jul 08 14:30:32 UTC 2026","","","",""
"Test cases for TestWritePaginated","0","TestWritePaginated","","Wed Jul 08 14:30:13 UTC 2026","passed","Wed Jul 08 14:30:13 UTC 2026","","Go Test","github.com/specterops/bloodhound/packages/go/responses/TestWritePaginated","TestWritePaginated"
"Test cases for TestParseUUID","1","TestParseUUID","","Wed Jul 08 14:30:08 UTC 2026","passed","Wed Jul 08 14:30:08 UTC 2026","","Go Test","github.com/specterops/bloodhound/cmd/api/src/utils/TestParseUUID","TestParseUUID"
"Test cases for TestTracker_HasEdge_DuplicateCalls","0","TestTracker_HasEdge_DuplicateCalls","","Wed Jul 08 14:30:08 UTC 2026","passed","Wed Jul 08 14:30:08 UTC 2026","","Go Test","github.com/specterops/bloodhound/packages/go/analysis/post/TestTracker_HasEdge_DuplicateCalls","TestTracker_HasEdge_DuplicateCalls"
"","246","does not display a “Disable query timeout” checkbox when timeout limit param config is enabled true","ExploreSearch interaction","Wed Jul 08 14:35:17 UTC 2026","passed","Wed Jul 08 14:35:17 UTC 2026","","","",""
"","0","The user has yet to type into the search (for OU and Domain searches that have hard coded types)","Getting the text for the disabled item display for a search when there are no results","Wed Jul 08 14:33:54 UTC 2026","passed","Wed Jul 08 14:33:54 UTC 2026","","Empty data states","",""
"Test cases for TestResources_ListAuditLogs_Filtered","0","TestResources_ListAuditLogs_Filtered","","Wed Jul 08 14:29:40 UTC 2026","passed","Wed Jul 08 14:29:40 UTC 2026","","Go Test","github.com/specterops/bloodhound/cmd/api/src/api/v2/TestResources_ListAuditLogs_Filtered","TestResources_ListAuditLogs_Filtered"
"Test cases for TestResources_DeleteSavedQuery_RecordNotFound_EdgeCase","0","TestResources_DeleteSavedQuery_RecordNotFound_EdgeCase","","Wed Jul 08 14:29:40 UTC 2026","passed","Wed Jul 08 14:29:40 UTC 2026","","Go Test","github.com/specterops/bloodhound/cmd/api/src/api/v2/TestResources_DeleteSavedQuery_RecordNotFound_EdgeCase","TestResources_DeleteSavedQuery_RecordNotFound_EdgeCase"
"","6","does not render when selector is default","Delete Selector Button rendering","Wed Jul 08 14:34:25 UTC 2026","passed","Wed Jul 08 14:34:25 UTC 2026","","","",""
