"DESCRIPTION","DURATION IN MS","NAME","PARENT SUITE","START TIME","STATUS","STOP TIME","SUB SUITE","SUITE","TEST CLASS","TEST METHOD"
"","537","triggers a file download when a download button is clicked","DownloadCollectors","Wed Jul 08 14:35:21 UTC 2026","passed","Wed Jul 08 14:35:22 UTC 2026","","","",""
"","0","takes setSearchParams and availableParams returns a function","searchParams","Wed Jul 08 14:33:29 UTC 2026","passed","Wed Jul 08 14:33:29 UTC 2026","","setParamsFactory","",""
"","100","invokes handleFilterChange with eq:true when clicked and custom_member filter is off","AssetGroupEdit","Wed Jul 08 14:32:09 UTC 2026","passed","Wed Jul 08 14:32:09 UTC 2026","","Custom Member checkbox filter","",""
"Test cases for TestManagementResource_DeleteUser_UserBhCtxNotFound","0","TestManagementResource_DeleteUser_UserBhCtxNotFound","","Wed Jul 08 14:30:03 UTC 2026","passed","Wed Jul 08 14:30:03 UTC 2026","","Go Test","github.com/specterops/bloodhound/cmd/api/src/api/v2/auth/TestManagementResource_DeleteUser_UserBhCtxNotFound","TestManagementResource_DeleteUser_UserBhCtxNotFound"
"Test cases for TestResources_ListUsersMinimal","17","TestResources_ListUsersMinimal","","Wed Jul 08 14:30:29 UTC 2026","passed","Wed Jul 08 14:30:29 UTC 2026","","Go Test","github.com/specterops/bloodhound/cmd/api/src/api/v2/auth/TestResources_ListUsersMinimal","TestResources_ListUsersMinimal"
"","217","sets a secondary=id and searchType=pathfinding when primary is truthy","ContextMenu","Wed Jul 08 14:35:22 UTC 2026","passed","Wed Jul 08 14:35:22 UTC 2026","","","",""
"","220","should display ""Disable Multi-Factor Authentication?"" title","Enable2FADialog","Wed Jul 08 14:33:38 UTC 2026","passed","Wed Jul 08 14:33:38 UTC 2026","","","",""
"Test cases for TestTimeEqual","0","TestTimeEqual","","Wed Jul 08 14:29:46 UTC 2026","passed","Wed Jul 08 14:29:46 UTC 2026","","Go Test","github.com/specterops/bloodhound/cmd/api/src/database/types/null/TestTimeEqual","TestTimeEqual"
"","643","Download button opens a menu and selecting ""Selected Columns"" calls json2csv with selected columns only","ExploreTable","Wed Jul 08 14:30:22 UTC 2026","passed","Wed Jul 08 14:30:22 UTC 2026","","","",""
"","846","renders the form for editing an existing rule","Rule Form","Wed Jul 08 14:30:30 UTC 2026","passed","Wed Jul 08 14:30:30 UTC 2026","","","",""
"Test cases for TestResources_UpdateSavedQuery_Admin_NonPublicQuery","0","TestResources_UpdateSavedQuery_Admin_NonPublicQuery","","Wed Jul 08 14:29:40 UTC 2026","passed","Wed Jul 08 14:29:40 UTC 2026","","Go Test","github.com/specterops/bloodhound/cmd/api/src/api/v2/TestResources_UpdateSavedQuery_Admin_NonPublicQuery","TestResources_UpdateSavedQuery_Admin_NonPublicQuery"
"Test cases for TestManagementResource_SAMLLoginRedirect","14","TestManagementResource_SAMLLoginRedirect","","Wed Jul 08 14:30:29 UTC 2026","passed","Wed Jul 08 14:30:29 UTC 2026","","Go Test","github.com/specterops/bloodhound/cmd/api/src/api/v2/auth/TestManagementResource_SAMLLoginRedirect","TestManagementResource_SAMLLoginRedirect"
"Test cases for TestActivateMFA_Success","1288","TestActivateMFA_Success","","Wed Jul 08 14:30:28 UTC 2026","passed","Wed Jul 08 14:30:29 UTC 2026","","Go Test","github.com/specterops/bloodhound/cmd/api/src/api/v2/auth/TestActivateMFA_Success","TestActivateMFA_Success"
"","1166","should display all available SSO providers","CreateUserDialog","Wed Jul 08 14:31:05 UTC 2026","passed","Wed Jul 08 14:31:06 UTC 2026","","","",""
"Test cases for TestResources_GetPermissionsForSavedQuery","38","TestResources_GetPermissionsForSavedQuery","","Wed Jul 08 14:29:40 UTC 2026","passed","Wed Jul 08 14:29:40 UTC 2026","","Go Test","github.com/specterops/bloodhound/cmd/api/src/api/v2/TestResources_GetPermissionsForSavedQuery","TestResources_GetPermissionsForSavedQuery"
"Test cases for TestService_IsEnabled","0","TestService_IsEnabled","","Wed Jul 08 14:30:35 UTC 2026","passed","Wed Jul 08 14:30:35 UTC 2026","","Go Test","github.com/specterops/bloodhound/server/featureflags/internal/services/TestService_IsEnabled","TestService_IsEnabled"
"","32","should highlight selected route","Main Nav Route Highlighting","Wed Jul 08 14:32:24 UTC 2026","passed","Wed Jul 08 14:32:25 UTC 2026","","","",""
"","0","returns false if value is 'array'","searchParams","Wed Jul 08 14:33:29 UTC 2026","passed","Wed Jul 08 14:33:29 UTC 2026","","isEmptyParam","",""
"","2","returns true if value is undefined","searchParams","Wed Jul 08 14:33:29 UTC 2026","passed","Wed Jul 08 14:33:29 UTC 2026","","isEmptyParam","",""
"","0","should return an object denoting that the property is not in the schema when it is unrecognized","validating a node property against the shared generated schema","Wed Jul 08 14:32:04 UTC 2026","passed","Wed Jul 08 14:32:04 UTC 2026","","","",""
"Test cases for TestTenantRoles","0","TestTenantRoles","","Wed Jul 08 14:30:08 UTC 2026","passed","Wed Jul 08 14:30:08 UTC 2026","","Go Test","github.com/specterops/bloodhound/packages/go/analysis/azure/TestTenantRoles","TestTenantRoles"
"Test cases for TestManagementResource_SSOCallbackHandler","17","TestManagementResource_SSOCallbackHandler","","Wed Jul 08 14:30:29 UTC 2026","passed","Wed Jul 08 14:30:29 UTC 2026","","Go Test","github.com/specterops/bloodhound/cmd/api/src/api/v2/auth/TestManagementResource_SSOCallbackHandler","TestManagementResource_SSOCallbackHandler"
"","103","requests finished jobs","useFinishedJobs","Wed Jul 08 14:32:34 UTC 2026","passed","Wed Jul 08 14:32:34 UTC 2026","","","",""
"","685","should call onSubmit with email address and password when login button clicked","LoginForm","Wed Jul 08 14:34:09 UTC 2026","passed","Wed Jul 08 14:34:10 UTC 2026","","","",""
"Test cases for TestDefaultRateLimitMiddleware","6","TestDefaultRateLimitMiddleware","","Wed Jul 08 14:29:32 UTC 2026","passed","Wed Jul 08 14:29:32 UTC 2026","","Go Test","github.com/specterops/bloodhound/cmd/api/src/api/middleware/TestDefaultRateLimitMiddleware","TestDefaultRateLimitMiddleware"
"Test cases for TestGC_NewDataPruningDaemon","0","TestGC_NewDataPruningDaemon","","Wed Jul 08 14:29:43 UTC 2026","passed","Wed Jul 08 14:29:43 UTC 2026","","Go Test","github.com/specterops/bloodhound/cmd/api/src/daemons/gc/TestGC_NewDataPruningDaemon","TestGC_NewDataPruningDaemon"
"","2","should include all operations when the tag matches the term","opsFilter","Wed Jul 08 14:33:55 UTC 2026","passed","Wed Jul 08 14:33:55 UTC 2026","","","",""
"Test cases for TestBoolIsZero","0","TestBoolIsZero","","Wed Jul 08 14:29:46 UTC 2026","passed","Wed Jul 08 14:29:46 UTC 2026","","Go Test","github.com/specterops/bloodhound/cmd/api/src/database/types/null/TestBoolIsZero","TestBoolIsZero"
"Test cases for Test_NewSpec","0","Test_NewSpec","","Wed Jul 08 14:30:10 UTC 2026","passed","Wed Jul 08 14:30:10 UTC 2026","","Go Test","github.com/specterops/bloodhound/packages/go/lab/Test_NewSpec","Test_NewSpec"
"","0","returns paramValue as EnvironmentAggregation if paramValue is all","useEnvironmentParams","Wed Jul 08 14:34:43 UTC 2026","passed","Wed Jul 08 14:34:43 UTC 2026","","parseEnvironmentAggregation","",""
"Test cases for TestResolver_StartDone","13","TestResolver_StartDone","","Wed Jul 08 14:29:53 UTC 2026","passed","Wed Jul 08 14:29:53 UTC 2026","","Go Test","github.com/specterops/bloodhound/cmd/api/src/services/graphify/endpoint/TestResolver_StartDone","TestResolver_StartDone"
"","10","toggles a descending sort to ascending when sorting the same column","useSortParams","Wed Jul 08 14:33:25 UTC 2026","passed","Wed Jul 08 14:33:25 UTC 2026","","","",""
"Test cases for TestStringIsZero","0","TestStringIsZero","","Wed Jul 08 14:29:46 UTC 2026","passed","Wed Jul 08 14:29:46 UTC 2026","","Go Test","github.com/specterops/bloodhound/cmd/api/src/database/types/null/TestStringIsZero","TestStringIsZero"
"Test cases for TestAnalysisErrorsEvaluateErrors","1","TestAnalysisErrorsEvaluateErrors","","Wed Jul 08 14:30:08 UTC 2026","passed","Wed Jul 08 14:30:08 UTC 2026","","Go Test","github.com/specterops/bloodhound/packages/go/analysis/TestAnalysisErrorsEvaluateErrors","TestAnalysisErrorsEvaluateErrors"
"","8","hides items while permissions are loading","useSubNavRoutes","Wed Jul 08 14:32:38 UTC 2026","passed","Wed Jul 08 14:32:38 UTC 2026","","adminOnly gate","",""
"Test cases for Test_SetApplicationConfiguration","0","Test_SetApplicationConfiguration","","Wed Jul 08 14:29:40 UTC 2026","passed","Wed Jul 08 14:29:40 UTC 2026","","Go Test","github.com/specterops/bloodhound/cmd/api/src/api/v2/Test_SetApplicationConfiguration","Test_SetApplicationConfiguration"
"","232","fires delete when edit is clicked","ListItemActionMenu","Wed Jul 08 14:33:30 UTC 2026","passed","Wed Jul 08 14:33:31 UTC 2026","","","",""
"","29","displays lastlogon cell as UNKNOWN when the value is 0","ExploreTableDataCell","Wed Jul 08 14:34:08 UTC 2026","passed","Wed Jul 08 14:34:08 UTC 2026","","","",""
"Test cases for TestResources_DeleteSavedQuery_NotPublicQueryAndUserIsAdmin","0","TestResources_DeleteSavedQuery_NotPublicQueryAndUserIsAdmin","","Wed Jul 08 14:29:40 UTC 2026","passed","Wed Jul 08 14:29:40 UTC 2026","","Go Test","github.com/specterops/bloodhound/cmd/api/src/api/v2/TestResources_DeleteSavedQuery_NotPublicQueryAndUserIsAdmin","TestResources_DeleteSavedQuery_NotPublicQueryAndUserIsAdmin"
"","70","shows View in Explore if exploreUrl is supplied","Seed Selection Results","Wed Jul 08 14:31:54 UTC 2026","passed","Wed Jul 08 14:31:54 UTC 2026","","","",""
"Test cases for TestService_CreateRequest","1","TestService_CreateRequest","","Wed Jul 08 14:30:32 UTC 2026","passed","Wed Jul 08 14:30:32 UTC 2026","","Go Test","github.com/specterops/bloodhound/server/analysis/internal/services/TestService_CreateRequest","TestService_CreateRequest"
"","0","A type was provided but no keyword follows the typed filter","Getting the text for the disabled item display for a search when there are no results","Wed Jul 08 14:33:54 UTC 2026","passed","Wed Jul 08 14:33:54 UTC 2026","","Empty data states","",""
"","125","a null response from the server is handled","ExploreSearchCombobox with null response","Wed Jul 08 14:32:10 UTC 2026","passed","Wed Jul 08 14:32:10 UTC 2026","","","",""
"Test cases for TestWriteResponseWrapperWithTimeWindowAndPagination","0","TestWriteResponseWrapperWithTimeWindowAndPagination","","Wed Jul 08 14:29:29 UTC 2026","passed","Wed Jul 08 14:29:29 UTC 2026","","Go Test","github.com/specterops/bloodhound/cmd/api/src/api/TestWriteResponseWrapperWithTimeWindowAndPagination","TestWriteResponseWrapperWithTimeWindowAndPagination"
"Test cases for TestStorageFileService_WriteFile","21","TestStorageFileService_WriteFile","","Wed Jul 08 14:30:29 UTC 2026","passed","Wed Jul 08 14:30:30 UTC 2026","","Go Test","github.com/specterops/bloodhound/packages/go/storage/TestStorageFileService_WriteFile","TestStorageFileService_WriteFile"
"","11","sets autoDisplayTable to false if query type is composition","useExploreTableAutoDisplay","Wed Jul 08 14:33:45 UTC 2026","passed","Wed Jul 08 14:33:45 UTC 2026","","","",""
"","679","executes a primary search when only a source node is provided","Pathfinding: interaction","Wed Jul 08 14:32:33 UTC 2026","passed","Wed Jul 08 14:32:34 UTC 2026","","","",""
"","86","renders count for a selected zone if prop is set","DynamicDetails","Wed Jul 08 14:32:24 UTC 2026","passed","Wed Jul 08 14:32:25 UTC 2026","","","",""
"Test cases for TestManagementResource_ListAuthTokens_InvalidColumn","0","TestManagementResource_ListAuthTokens_InvalidColumn","","Wed Jul 08 14:30:11 UTC 2026","passed","Wed Jul 08 14:30:11 UTC 2026","","Go Test","github.com/specterops/bloodhound/cmd/api/src/api/v2/auth/TestManagementResource_ListAuthTokens_InvalidColumn","TestManagementResource_ListAuthTokens_InvalidColumn"
"Test cases for TestManagementResource_ListAuthProviders","0","TestManagementResource_ListAuthProviders","","Wed Jul 08 14:30:29 UTC 2026","passed","Wed Jul 08 14:30:29 UTC 2026","","Go Test","github.com/specterops/bloodhound/cmd/api/src/api/v2/auth/TestManagementResource_ListAuthProviders","TestManagementResource_ListAuthProviders"
"Test cases for TestResources_UpdateSavedQuery_AdminPrivateQuery_Success","1","TestResources_UpdateSavedQuery_AdminPrivateQuery_Success","","Wed Jul 08 14:29:40 UTC 2026","passed","Wed Jul 08 14:29:40 UTC 2026","","Go Test","github.com/specterops/bloodhound/cmd/api/src/api/v2/TestResources_UpdateSavedQuery_AdminPrivateQuery_Success","TestResources_UpdateSavedQuery_AdminPrivateQuery_Success"
"Test cases for TestSIDSuffix_PrependPrefix","0","TestSIDSuffix_PrependPrefix","","Wed Jul 08 14:30:08 UTC 2026","passed","Wed Jul 08 14:30:08 UTC 2026","","Go Test","github.com/specterops/bloodhound/packages/go/analysis/ad/wellknown/TestSIDSuffix_PrependPrefix","TestSIDSuffix_PrependPrefix"
"Test cases for TestManagementResource_SSOLoginHandler","17","TestManagementResource_SSOLoginHandler","","Wed Jul 08 14:30:29 UTC 2026","passed","Wed Jul 08 14:30:29 UTC 2026","","Go Test","github.com/specterops/bloodhound/cmd/api/src/api/v2/auth/TestManagementResource_SSOLoginHandler","TestManagementResource_SSOLoginHandler"
"","11","should not render if open === false","ConfirmUpdateQueryDialog","Wed Jul 08 14:34:22 UTC 2026","passed","Wed Jul 08 14:34:22 UTC 2026","","","",""
"","49","displays ! icon when one of the Affected Object calls fail","EntityInfoDataTable","Wed Jul 08 14:31:46 UTC 2026","passed","Wed Jul 08 14:31:46 UTC 2026","","Node count for nested table that counts all sections","",""
"Test cases for TestFloatScan","0","TestFloatScan","","Wed Jul 08 14:29:46 UTC 2026","passed","Wed Jul 08 14:29:46 UTC 2026","","Go Test","github.com/specterops/bloodhound/cmd/api/src/database/types/null/TestFloatScan","TestFloatScan"
"","90","button displays ""Enabled"" when flag is enabled","EarlyAccessFeatureToggle","Wed Jul 08 14:35:36 UTC 2026","passed","Wed Jul 08 14:35:36 UTC 2026","","","",""
"Test cases for FuzzFoldlLazy","1","FuzzFoldlLazy","","Wed Jul 08 14:30:26 UTC 2026","passed","Wed Jul 08 14:30:26 UTC 2026","","Go Test","github.com/specterops/bloodhound/packages/go/slicesext/FuzzFoldlLazy","FuzzFoldlLazy"
"Test cases for TestGetAzureDataQualityStats_Success","1","TestGetAzureDataQualityStats_Success","","Wed Jul 08 14:29:40 UTC 2026","passed","Wed Jul 08 14:29:40 UTC 2026","","Go Test","github.com/specterops/bloodhound/cmd/api/src/api/v2/TestGetAzureDataQualityStats_Success","TestGetAzureDataQualityStats_Success"
"","539","should display Environmental Targeted Access Control panel when showEnvironmentAccessControls prop is true and read-only role is selected","UpdateUserForm","Wed Jul 08 14:30:30 UTC 2026","passed","Wed Jul 08 14:30:31 UTC 2026","","","",""
"","0","abbreviates numbers larger than 1000 and should not round the tenth place digit","numberFormatting","Wed Jul 08 14:32:55 UTC 2026","passed","Wed Jul 08 14:32:55 UTC 2026","","","",""
"","179","shows a table with finished jobs","FileIngestTable","Wed Jul 08 14:31:12 UTC 2026","passed","Wed Jul 08 14:31:13 UTC 2026","","","",""
"","5","returns null if paramValue is +0","useEnvironmentParams","Wed Jul 08 14:34:43 UTC 2026","passed","Wed Jul 08 14:34:43 UTC 2026","","parseEnvironmentAggregation","",""
"","112","renders a filter button","FileIngestFilterDialog","Wed Jul 08 14:31:37 UTC 2026","passed","Wed Jul 08 14:31:38 UTC 2026","","","",""
"Test cases for TestParseAndValidate_Parsing","0","TestParseAndValidate_Parsing","","Wed Jul 08 14:30:09 UTC 2026","passed","Wed Jul 08 14:30:09 UTC 2026","","Go Test","github.com/specterops/bloodhound/packages/go/filters/TestParseAndValidate_Parsing","TestParseAndValidate_Parsing"
"","0","returns disabled config when any required param is falsey","useExploreGraph","Wed Jul 08 14:31:33 UTC 2026","passed","Wed Jul 08 14:31:33 UTC 2026","composition search queries","exploreGraphQueryFactory","",""
"","2251","resets skip to 0 when rows per page changes so rows are visible on the new page size","FileIngestTable","Wed Jul 08 14:31:16 UTC 2026","passed","Wed Jul 08 14:31:18 UTC 2026","","pagination reset","",""
"","54","Should display a list of the asset group members","AssetGroupMemberList","Wed Jul 08 14:34:04 UTC 2026","passed","Wed Jul 08 14:34:04 UTC 2026","","","",""
"","63","fails checks if the user does not have a matching permission","usePermissions","Wed Jul 08 14:32:13 UTC 2026","passed","Wed Jul 08 14:32:14 UTC 2026","","","",""
"Test cases for Test_sortAndSliceResults_sorting","0","Test_sortAndSliceResults_sorting","","Wed Jul 08 14:29:48 UTC 2026","passed","Wed Jul 08 14:29:48 UTC 2026","","Go Test","github.com/specterops/bloodhound/cmd/api/src/queries/Test_sortAndSliceResults_sorting","Test_sortAndSliceResults_sorting"
"","7","hides the item when only the feature flag passes","useSubNavRoutes","Wed Jul 08 14:32:38 UTC 2026","passed","Wed Jul 08 14:32:38 UTC 2026","","combined gates","",""
"","1","should recognize a common properties","validating a node property against the shared generated schema","Wed Jul 08 14:32:04 UTC 2026","passed","Wed Jul 08 14:32:04 UTC 2026","","","",""
"","179","renders correctly with requiresCurrentPassword true","PasswordDialog","Wed Jul 08 14:30:54 UTC 2026","passed","Wed Jul 08 14:30:54 UTC 2026","","","",""
"","58","will request feature-flags when the user is fully authenticated","app","Wed Jul 08 14:35:34 UTC 2026","passed","Wed Jul 08 14:35:35 UTC 2026","","<Inner />","",""
"","4","returns bounds for text rendered to canvas","getLabelBoundsFromContext","Wed Jul 08 14:35:36 UTC 2026","passed","Wed Jul 08 14:35:36 UTC 2026","","","",""
"","531","sets exploreSearchTab param to cypher when the user clicks the `cypher` tab","ExploreSearch sets searchType on tab changing","Wed Jul 08 14:35:14 UTC 2026","passed","Wed Jul 08 14:35:14 UTC 2026","","","",""
"Test cases for TestDefineSID","3","TestDefineSID","","Wed Jul 08 14:30:08 UTC 2026","passed","Wed Jul 08 14:30:08 UTC 2026","","Go Test","github.com/specterops/bloodhound/packages/go/analysis/ad/wellknown/TestDefineSID","TestDefineSID"
"","1","If for some reason the node size is not defined return 1 as a default","getNodeRadius","Wed Jul 08 14:35:36 UTC 2026","passed","Wed Jul 08 14:35:36 UTC 2026","","","",""
"Test cases for TestLocalStore_PathSafety","35","TestLocalStore_PathSafety","","Wed Jul 08 14:30:29 UTC 2026","passed","Wed Jul 08 14:30:30 UTC 2026","","Go Test","github.com/specterops/bloodhound/packages/go/storage/TestLocalStore_PathSafety","TestLocalStore_PathSafety"
"Test cases for TestInvalidValueError","0","TestInvalidValueError","","Wed Jul 08 14:30:08 UTC 2026","passed","Wed Jul 08 14:30:08 UTC 2026","","Go Test","github.com/specterops/bloodhound/packages/go/cache/TestInvalidValueError","TestInvalidValueError"
"","341","renders headers","CommonSearches","Wed Jul 08 14:32:00 UTC 2026","passed","Wed Jul 08 14:32:00 UTC 2026","","","",""
"","0","reports a Cypher-specific error when ruleType is SeedTypeCypher and seeds are required","handleError","Wed Jul 08 14:31:34 UTC 2026","passed","Wed Jul 08 14:31:34 UTC 2026","","","",""
"Test cases for Test_ApplyTimeoutReduction","0","Test_ApplyTimeoutReduction","","Wed Jul 08 14:29:48 UTC 2026","passed","Wed Jul 08 14:29:48 UTC 2026","","Go Test","github.com/specterops/bloodhound/cmd/api/src/queries/Test_ApplyTimeoutReduction","Test_ApplyTimeoutReduction"
"","1","will return a list of values","Formatting list properties","Wed Jul 08 14:32:04 UTC 2026","passed","Wed Jul 08 14:32:04 UTC 2026","","","",""
"Test cases for TestResources_GetShortestPath","8","TestResources_GetShortestPath","","Wed Jul 08 14:29:40 UTC 2026","passed","Wed Jul 08 14:29:40 UTC 2026","","Go Test","github.com/specterops/bloodhound/cmd/api/src/api/v2/TestResources_GetShortestPath","TestResources_GetShortestPath"
"","15","throws when used outside of AnnouncementProvider","useAnnounce","Wed Jul 08 14:32:57 UTC 2026","passed","Wed Jul 08 14:32:57 UTC 2026","","","",""
"Test cases for TestResources_DeleteSavedQuery_DBError","0","TestResources_DeleteSavedQuery_DBError","","Wed Jul 08 14:29:40 UTC 2026","passed","Wed Jul 08 14:29:40 UTC 2026","","Go Test","github.com/specterops/bloodhound/cmd/api/src/api/v2/TestResources_DeleteSavedQuery_DBError","TestResources_DeleteSavedQuery_DBError"
"","232","filters unselected columns when typing in the filter input","ManageColumnsComboBox","Wed Jul 08 14:32:00 UTC 2026","passed","Wed Jul 08 14:32:00 UTC 2026","","","",""
"","11","keeps callbacks stable across renders","useObjectState","Wed Jul 08 14:34:05 UTC 2026","passed","Wed Jul 08 14:34:05 UTC 2026","","","",""
"","182","on clicking switch shows modal and when clicking confirm closes it and switch changes to enabled","CitrixRDPConfiguration","Wed Jul 08 14:32:13 UTC 2026","passed","Wed Jul 08 14:32:14 UTC 2026","","Click on switch to enable","",""
"","333","has date range input filters","FileIngestFilterDialog","Wed Jul 08 14:31:40 UTC 2026","passed","Wed Jul 08 14:31:40 UTC 2026","","Date Range Inputs","",""
"Test cases for TestAnalysisPipelineStepResultString","1","TestAnalysisPipelineStepResultString","","Wed Jul 08 14:30:08 UTC 2026","passed","Wed Jul 08 14:30:08 UTC 2026","","Go Test","github.com/specterops/bloodhound/packages/go/analysis/TestAnalysisPipelineStepResultString","TestAnalysisPipelineStepResultString"
"","220","does not render an edit form for the selected asset group when a user does not have graph write permissions","GroupManagement","Wed Jul 08 14:35:29 UTC 2026","passed","Wed Jul 08 14:35:30 UTC 2026","","","",""
"","76","should should reflect the checked state for public query","SavedQueryPermissions","Wed Jul 08 14:33:22 UTC 2026","passed","Wed Jul 08 14:33:22 UTC 2026","","","",""
"Test cases for TestResources_GetEnterpriseCAEntityInfo","150","TestResources_GetEnterpriseCAEntityInfo","","Wed Jul 08 14:29:40 UTC 2026","passed","Wed Jul 08 14:29:40 UTC 2026","","Go Test","github.com/specterops/bloodhound/cmd/api/src/api/v2/TestResources_GetEnterpriseCAEntityInfo","TestResources_GetEnterpriseCAEntityInfo"
"","152","onCancel is called when cancel is clicked","Enable2FADialog","Wed Jul 08 14:32:55 UTC 2026","passed","Wed Jul 08 14:32:56 UTC 2026","","","",""
"","133","shows ""Expired"" in red when the expiration date has already passed","UserTokenManagementDialog - API Expiration Date column","Wed Jul 08 14:31:52 UTC 2026","passed","Wed Jul 08 14:31:52 UTC 2026","","","",""
"Test cases for TestResources_DeleteAssetGroupSelector","0","TestResources_DeleteAssetGroupSelector","","Wed Jul 08 14:29:40 UTC 2026","passed","Wed Jul 08 14:29:40 UTC 2026","","Go Test","github.com/specterops/bloodhound/cmd/api/src/api/v2/TestResources_DeleteAssetGroupSelector","TestResources_DeleteAssetGroupSelector"
"Test cases for TestUnmarshalBool","0","TestUnmarshalBool","","Wed Jul 08 14:29:46 UTC 2026","passed","Wed Jul 08 14:29:46 UTC 2026","","Go Test","github.com/specterops/bloodhound/cmd/api/src/database/types/null/TestUnmarshalBool","TestUnmarshalBool"
"","90","renders a single item when items is an object","<DetailsAccordion />","Wed Jul 08 14:31:58 UTC 2026","passed","Wed Jul 08 14:31:58 UTC 2026","","","",""
"Test cases for TestResources_SearchAssetGroupTags","2","TestResources_SearchAssetGroupTags","","Wed Jul 08 14:29:40 UTC 2026","passed","Wed Jul 08 14:29:40 UTC 2026","","Go Test","github.com/specterops/bloodhound/cmd/api/src/api/v2/TestResources_SearchAssetGroupTags","TestResources_SearchAssetGroupTags"
"","1","handles null or empty madeBy","createHistoryParams","Wed Jul 08 14:34:03 UTC 2026","passed","Wed Jul 08 14:34:03 UTC 2026","","","",""
"Test cases for TestGetAzureDataQualityStats_Failure","0","TestGetAzureDataQualityStats_Failure","","Wed Jul 08 14:29:40 UTC 2026","passed","Wed Jul 08 14:29:40 UTC 2026","","Go Test","github.com/specterops/bloodhound/cmd/api/src/api/v2/TestGetAzureDataQualityStats_Failure","TestGetAzureDataQualityStats_Failure"
"Test cases for Test_HarnessTeardown","0","Test_HarnessTeardown","","Wed Jul 08 14:30:10 UTC 2026","passed","Wed Jul 08 14:30:10 UTC 2026","","Go Test","github.com/specterops/bloodhound/packages/go/lab/Test_HarnessTeardown","Test_HarnessTeardown"
"","1423","when user performs a pathfinding search, the selection for the start node is carried over to the `search` tab","ExploreSearch interaction","Wed Jul 08 14:35:15 UTC 2026","passed","Wed Jul 08 14:35:17 UTC 2026","","","",""
"","2594","subcategory with duplicate name does not show indeterminate when all its children are unchecked","Pathfinding","Wed Jul 08 14:31:42 UTC 2026","passed","Wed Jul 08 14:31:45 UTC 2026","","","",""
"","193","displays expected results when searching by objectid","SearchCurrentNodes","Wed Jul 08 14:33:07 UTC 2026","passed","Wed Jul 08 14:33:08 UTC 2026","","","",""
"","1","returns query config when searchType is relationship and all required params are passed","useExploreGraph","Wed Jul 08 14:31:33 UTC 2026","passed","Wed Jul 08 14:31:33 UTC 2026","relationship search queries","exploreGraphQueryFactory","",""
"Test cases for TestResources_ListADDomainForeignAdmins","1","TestResources_ListADDomainForeignAdmins","","Wed Jul 08 14:29:40 UTC 2026","passed","Wed Jul 08 14:29:40 UTC 2026","","Go Test","github.com/specterops/bloodhound/cmd/api/src/api/v2/TestResources_ListADDomainForeignAdmins","TestResources_ListADDomainForeignAdmins"
"Test cases for TestParseAndValidate_IgnoredParameters","0","TestParseAndValidate_IgnoredParameters","","Wed Jul 08 14:30:09 UTC 2026","passed","Wed Jul 08 14:30:09 UTC 2026","","Go Test","github.com/specterops/bloodhound/packages/go/filters/TestParseAndValidate_IgnoredParameters","TestParseAndValidate_IgnoredParameters"
"","92","initializes search tab to the exploreSearchTab on initial render","ExploreSearch sets searchType on tab changing","Wed Jul 08 14:35:14 UTC 2026","passed","Wed Jul 08 14:35:14 UTC 2026","","","",""
