"DESCRIPTION","DURATION IN MS","NAME","PARENT SUITE","START TIME","STATUS","STOP TIME","SUB SUITE","SUITE","TEST CLASS","TEST METHOD"
"Test cases for TestMarshalBool","0","TestMarshalBool","","Wed Jul 08 14:29:46 UTC 2026","passed","Wed Jul 08 14:29:46 UTC 2026","","Go Test","github.com/specterops/bloodhound/cmd/api/src/database/types/null/TestMarshalBool","TestMarshalBool"
"Test cases for TestStore_GetAllFlags","1","TestStore_GetAllFlags","","Wed Jul 08 14:30:34 UTC 2026","passed","Wed Jul 08 14:30:34 UTC 2026","","Go Test","github.com/specterops/bloodhound/server/featureflags/internal/appdb/TestStore_GetAllFlags","TestStore_GetAllFlags"
"","61","renders the title","ProcessingIndicator","Wed Jul 08 14:34:46 UTC 2026","passed","Wed Jul 08 14:34:46 UTC 2026","","","",""
"Test cases for TestResources_ListADComputerPSRemoteUsers","6","TestResources_ListADComputerPSRemoteUsers","","Wed Jul 08 14:29:40 UTC 2026","passed","Wed Jul 08 14:29:40 UTC 2026","","Go Test","github.com/specterops/bloodhound/cmd/api/src/api/v2/TestResources_ListADComputerPSRemoteUsers","TestResources_ListADComputerPSRemoteUsers"
"","1","reports an API error when Cypher is not run first","handleError","Wed Jul 08 14:31:34 UTC 2026","passed","Wed Jul 08 14:31:34 UTC 2026","","","",""
"","0","properly displays bitwise integers","Formatting number properties","Wed Jul 08 14:32:04 UTC 2026","passed","Wed Jul 08 14:32:04 UTC 2026","","","",""
"","81","should call onCancel when cancel button clicked","LoginViaSSOForm","Wed Jul 08 14:33:27 UTC 2026","passed","Wed Jul 08 14:33:27 UTC 2026","","","",""
"Test cases for TestRewriter_Enter_NoShortcut_PreservesKinds","0","TestRewriter_Enter_NoShortcut_PreservesKinds","","Wed Jul 08 14:29:48 UTC 2026","passed","Wed Jul 08 14:29:48 UTC 2026","","Go Test","github.com/specterops/bloodhound/cmd/api/src/queries/TestRewriter_Enter_NoShortcut_PreservesKinds","TestRewriter_Enter_NoShortcut_PreservesKinds"
"Test cases for TestService_GetNode","2","TestService_GetNode","","Wed Jul 08 14:30:36 UTC 2026","passed","Wed Jul 08 14:30:36 UTC 2026","","Go Test","github.com/specterops/bloodhound/server/graphdb/internal/services/TestService_GetNode","TestService_GetNode"
"Test cases for TestResources_ListCAPKIHierarchy","1","TestResources_ListCAPKIHierarchy","","Wed Jul 08 14:29:40 UTC 2026","passed","Wed Jul 08 14:29:40 UTC 2026","","Go Test","github.com/specterops/bloodhound/cmd/api/src/api/v2/TestResources_ListCAPKIHierarchy","TestResources_ListCAPKIHierarchy"
"","591","renders a filter search and platform dropdown menu","CommonSearches","Wed Jul 08 14:32:01 UTC 2026","passed","Wed Jul 08 14:32:01 UTC 2026","","","",""
"Test cases for TestJSONFloat_MarshalJSON","0","TestJSONFloat_MarshalJSON","","Wed Jul 08 14:29:45 UTC 2026","passed","Wed Jul 08 14:29:45 UTC 2026","","Go Test","github.com/specterops/bloodhound/cmd/api/src/database/types/nan/TestJSONFloat_MarshalJSON","TestJSONFloat_MarshalJSON"
"Test cases for TestConvertOUToNode_InheritanceHashes","0","TestConvertOUToNode_InheritanceHashes","","Wed Jul 08 14:30:09 UTC 2026","passed","Wed Jul 08 14:30:09 UTC 2026","","Go Test","github.com/specterops/bloodhound/packages/go/ein/TestConvertOUToNode_InheritanceHashes","TestConvertOUToNode_InheritanceHashes"
"Test cases for TestTimeScanValue","0","TestTimeScanValue","","Wed Jul 08 14:29:46 UTC 2026","passed","Wed Jul 08 14:29:46 UTC 2026","","Go Test","github.com/specterops/bloodhound/cmd/api/src/database/types/null/TestTimeScanValue","TestTimeScanValue"
"Test cases for Test_parseAuthorizationHeader","0","Test_parseAuthorizationHeader","","Wed Jul 08 14:29:32 UTC 2026","passed","Wed Jul 08 14:29:32 UTC 2026","","Go Test","github.com/specterops/bloodhound/cmd/api/src/api/middleware/Test_parseAuthorizationHeader","Test_parseAuthorizationHeader"
"Test cases for TestFlatMap","0","TestFlatMap","","Wed Jul 08 14:30:26 UTC 2026","passed","Wed Jul 08 14:30:26 UTC 2026","","Go Test","github.com/specterops/bloodhound/packages/go/slicesext/TestFlatMap","TestFlatMap"
"","229","opens the dropdown when the Columns button is clicked","ManageColumnsComboBox","Wed Jul 08 14:31:58 UTC 2026","passed","Wed Jul 08 14:31:59 UTC 2026","","","",""
"Test cases for TestHeaderMatches","0","TestHeaderMatches","","Wed Jul 08 14:30:08 UTC 2026","passed","Wed Jul 08 14:30:08 UTC 2026","","Go Test","github.com/specterops/bloodhound/cmd/api/src/utils/TestHeaderMatches","TestHeaderMatches"
"Test cases for Test_parseLatestVersion","1","Test_parseLatestVersion","","Wed Jul 08 14:30:29 UTC 2026","passed","Wed Jul 08 14:30:29 UTC 2026","","Go Test","github.com/specterops/bloodhound/packages/go/stbernard/git/Test_parseLatestVersion","Test_parseLatestVersion"
"","1","does not change the day, month, or year value of the DateTime object","floorToNearestMinute","Wed Jul 08 14:34:06 UTC 2026","passed","Wed Jul 08 14:34:06 UTC 2026","","","",""
"Test cases for TestLoginFailure","1","TestLoginFailure","","Wed Jul 08 14:29:40 UTC 2026","passed","Wed Jul 08 14:29:40 UTC 2026","","Go Test","github.com/specterops/bloodhound/cmd/api/src/api/v2/auth/TestLoginFailure","TestLoginFailure"
"Test cases for TestTimeIsZero","0","TestTimeIsZero","","Wed Jul 08 14:29:46 UTC 2026","passed","Wed Jul 08 14:29:46 UTC 2026","","Go Test","github.com/specterops/bloodhound/cmd/api/src/database/types/null/TestTimeIsZero","TestTimeIsZero"
"","1","returns propertyKeys from all three kind property enums","graphSchema","Wed Jul 08 14:34:17 UTC 2026","passed","Wed Jul 08 14:34:17 UTC 2026","","","",""
"","44","has no checked boxes by default","GraphDataCheckboxes","Wed Jul 08 14:31:27 UTC 2026","passed","Wed Jul 08 14:31:27 UTC 2026","","","",""
"","2802","categories default to expanded","Pathfinding","Wed Jul 08 14:30:58 UTC 2026","passed","Wed Jul 08 14:31:00 UTC 2026","","","",""
"","2683","checking a single edge type updates its parent and grandparent","Pathfinding","Wed Jul 08 14:31:18 UTC 2026","passed","Wed Jul 08 14:31:20 UTC 2026","","","",""
"Test cases for TestResources_GetShortestPath_ETAC","24","TestResources_GetShortestPath_ETAC","","Wed Jul 08 14:29:40 UTC 2026","passed","Wed Jul 08 14:29:40 UTC 2026","","Go Test","github.com/specterops/bloodhound/cmd/api/src/api/v2/TestResources_GetShortestPath_ETAC","TestResources_GetShortestPath_ETAC"
"","265","toggles a source kind off from all selected nested graph data options","GraphDataCheckboxes","Wed Jul 08 14:31:29 UTC 2026","passed","Wed Jul 08 14:31:30 UTC 2026","","","",""
"","0","returns disabled if relationshipQueryItemId does not have a matching sourceId, edgeType, targetId","useExploreGraph","Wed Jul 08 14:31:33 UTC 2026","passed","Wed Jul 08 14:31:33 UTC 2026","composition search queries","exploreGraphQueryFactory","",""
"Test cases for TestResources_GetCollectorManifest","0","TestResources_GetCollectorManifest","","Wed Jul 08 14:29:40 UTC 2026","passed","Wed Jul 08 14:29:40 UTC 2026","","Go Test","github.com/specterops/bloodhound/cmd/api/src/api/v2/TestResources_GetCollectorManifest","TestResources_GetCollectorManifest"
"Test cases for TestSeekToKey","0","TestSeekToKey","","Wed Jul 08 14:29:53 UTC 2026","passed","Wed Jul 08 14:29:53 UTC 2026","","Go Test","github.com/specterops/bloodhound/cmd/api/src/services/graphify/TestSeekToKey","TestSeekToKey"
"","13","renders nothing if flag is disabled and disabled prop is not provided","FeatureFlag","Wed Jul 08 14:33:53 UTC 2026","passed","Wed Jul 08 14:33:53 UTC 2026","","","",""
"","117","buttons are disabled while loading","PasswordResetForm","Wed Jul 08 14:32:44 UTC 2026","passed","Wed Jul 08 14:32:44 UTC 2026","","","",""
"Test cases for TestIngestControl_writeRetainedFileToTar","14","TestIngestControl_writeRetainedFileToTar","","Wed Jul 08 14:29:33 UTC 2026","passed","Wed Jul 08 14:29:33 UTC 2026","","Go Test","github.com/specterops/bloodhound/cmd/api/src/api/tools/TestIngestControl_writeRetainedFileToTar","TestIngestControl_writeRetainedFileToTar"
"","194","navigates to all rules when clicking ""All Rules""","RulesAccordion","Wed Jul 08 14:33:03 UTC 2026","passed","Wed Jul 08 14:33:03 UTC 2026","","","",""
"","144","opens the dialog when the button is clicked","SchemaUploadDialog","Wed Jul 08 14:31:31 UTC 2026","passed","Wed Jul 08 14:31:31 UTC 2026","","","",""
"","3868","does not close explore search tab menu or entity info panel when search returns zero nodes","CypherSearch","Wed Jul 08 14:31:11 UTC 2026","passed","Wed Jul 08 14:31:15 UTC 2026","","Minimize explorer page elements when multiple nodes are returned","",""
"","306","Displays a modal after clicking Analyze Now button and run analysis after clicking confirm","AnalyzeNowConfiguration","Wed Jul 08 14:32:25 UTC 2026","passed","Wed Jul 08 14:32:25 UTC 2026","","","",""
"","77","calls onSort when clicked with a tooltip","ColumnHeaders","Wed Jul 08 14:32:54 UTC 2026","passed","Wed Jul 08 14:32:54 UTC 2026","","SortableHeader with Tooltip","",""
"Helper to verify that encodeAnyValue handles standard types correctly","1","TestEncodeAnyValue","","Wed Jul 08 14:29:53 UTC 2026","passed","Wed Jul 08 14:29:53 UTC 2026","","Go Test","github.com/specterops/bloodhound/cmd/api/src/services/graphify/endpoint/TestEncodeAnyValue","TestEncodeAnyValue"
"","65","should display the logged in user's email address","UserProfile","Wed Jul 08 14:32:19 UTC 2026","passed","Wed Jul 08 14:32:19 UTC 2026","","","",""
"Test cases for TestBuildErrorResponseInternalServerError","0","TestBuildErrorResponseInternalServerError","","Wed Jul 08 14:29:29 UTC 2026","passed","Wed Jul 08 14:29:29 UTC 2026","","Go Test","github.com/specterops/bloodhound/cmd/api/src/api/TestBuildErrorResponseInternalServerError","TestBuildErrorResponseInternalServerError"
"Test cases for TestConvertDomainToNode_DomainInvalidProperties","0","TestConvertDomainToNode_DomainInvalidProperties","","Wed Jul 08 14:30:09 UTC 2026","passed","Wed Jul 08 14:30:09 UTC 2026","","Go Test","github.com/specterops/bloodhound/packages/go/ein/TestConvertDomainToNode_DomainInvalidProperties","TestConvertDomainToNode_DomainInvalidProperties"
"Test cases for TestGenericMap","0","TestGenericMap","","Wed Jul 08 14:30:08 UTC 2026","passed","Wed Jul 08 14:30:08 UTC 2026","","Go Test","github.com/specterops/bloodhound/cmd/api/src/utils/TestGenericMap","TestGenericMap"
"","603","displays validation error messages when password does not match confirmation","PasswordDialog","Wed Jul 08 14:30:56 UTC 2026","passed","Wed Jul 08 14:30:56 UTC 2026","","","",""
"","0","fails for password with control characters","testPassword","Wed Jul 08 14:34:43 UTC 2026","passed","Wed Jul 08 14:34:43 UTC 2026","","","",""
"","412","navigates to object details when clicking an object row","ObjectsAccordion","Wed Jul 08 14:33:58 UTC 2026","passed","Wed Jul 08 14:33:58 UTC 2026","","","",""
"","1","floors DateTime objects to the nearest minute","floorToNearestMinute","Wed Jul 08 14:34:06 UTC 2026","passed","Wed Jul 08 14:34:06 UTC 2026","","","",""
"","30","should display hidden label for hidden edge","EdgeInfoHeader","Wed Jul 08 14:33:36 UTC 2026","passed","Wed Jul 08 14:33:36 UTC 2026","","","",""
"Test cases for TestResources_GetEdgeRelayTargets","58","TestResources_GetEdgeRelayTargets","","Wed Jul 08 14:29:40 UTC 2026","passed","Wed Jul 08 14:29:40 UTC 2026","","Go Test","github.com/specterops/bloodhound/cmd/api/src/api/v2/TestResources_GetEdgeRelayTargets","TestResources_GetEdgeRelayTargets"
"Test cases for TestAnalysisPipelineResultString","1","TestAnalysisPipelineResultString","","Wed Jul 08 14:30:08 UTC 2026","passed","Wed Jul 08 14:30:08 UTC 2026","","Go Test","github.com/specterops/bloodhound/packages/go/analysis/TestAnalysisPipelineResultString","TestAnalysisPipelineResultString"
"","0","should exclude operations within a tag when only the path matches but not all paths","opsFilter","Wed Jul 08 14:33:55 UTC 2026","passed","Wed Jul 08 14:33:55 UTC 2026","","","",""
"Test cases for Test_signedRequestDate","0","Test_signedRequestDate","","Wed Jul 08 14:29:32 UTC 2026","passed","Wed Jul 08 14:29:32 UTC 2026","","Go Test","github.com/specterops/bloodhound/cmd/api/src/api/middleware/Test_signedRequestDate","Test_signedRequestDate"
"","0","escapes a backslash","escapeCypherString","Wed Jul 08 14:34:37 UTC 2026","passed","Wed Jul 08 14:34:37 UTC 2026","","","",""
"","1","should compute coordinates along a quadratic bezier curve for a given t value","bezier","Wed Jul 08 14:35:28 UTC 2026","passed","Wed Jul 08 14:35:28 UTC 2026","","","",""
"Test cases for TestHandlers_IsEnabled","0","TestHandlers_IsEnabled","","Wed Jul 08 14:30:34 UTC 2026","passed","Wed Jul 08 14:30:34 UTC 2026","","Go Test","github.com/specterops/bloodhound/server/featureflags/internal/handlers/TestHandlers_IsEnabled","TestHandlers_IsEnabled"
"Test cases for TestManagementResource_ListAuthTokens_InvalidFilterPredicate","0","TestManagementResource_ListAuthTokens_InvalidFilterPredicate","","Wed Jul 08 14:30:11 UTC 2026","passed","Wed Jul 08 14:30:11 UTC 2026","","Go Test","github.com/specterops/bloodhound/cmd/api/src/api/v2/auth/TestManagementResource_ListAuthTokens_InvalidFilterPredicate","TestManagementResource_ListAuthTokens_InvalidFilterPredicate"
"Test cases for TestRegister_PanicsOnNilRateLimitMiddleware","0","TestRegister_PanicsOnNilRateLimitMiddleware","","Wed Jul 08 14:30:37 UTC 2026","passed","Wed Jul 08 14:30:37 UTC 2026","","Go Test","github.com/specterops/bloodhound/server/modules/TestRegister_PanicsOnNilRateLimitMiddleware","TestRegister_PanicsOnNilRateLimitMiddleware"
"Test cases for TestMarshalString","0","TestMarshalString","","Wed Jul 08 14:29:46 UTC 2026","passed","Wed Jul 08 14:29:46 UTC 2026","","Go Test","github.com/specterops/bloodhound/cmd/api/src/database/types/null/TestMarshalString","TestMarshalString"
"","393","displays an error when unable to fetch data","EarlyAccessFeatures","Wed Jul 08 14:35:29 UTC 2026","passed","Wed Jul 08 14:35:29 UTC 2026","","","",""
"","17","renders custom icon overlap correctly","NodeIcon","Wed Jul 08 14:34:09 UTC 2026","passed","Wed Jul 08 14:34:09 UTC 2026","","","",""
"Test cases for TestResources_ImportSavedQuery","7","TestResources_ImportSavedQuery","","Wed Jul 08 14:29:40 UTC 2026","passed","Wed Jul 08 14:29:40 UTC 2026","","Go Test","github.com/specterops/bloodhound/cmd/api/src/api/v2/TestResources_ImportSavedQuery","TestResources_ImportSavedQuery"
"","653","shows indeterminate states when some graph data is selected","GraphDataCheckboxes","Wed Jul 08 14:31:27 UTC 2026","passed","Wed Jul 08 14:31:28 UTC 2026","","","",""
"Test cases for TestInt64Pointer","0","TestInt64Pointer","","Wed Jul 08 14:29:46 UTC 2026","passed","Wed Jul 08 14:29:46 UTC 2026","","Go Test","github.com/specterops/bloodhound/cmd/api/src/database/types/null/TestInt64Pointer","TestInt64Pointer"
"","0","should compute offset vertices for bezier curves at a given intersection","bezier","Wed Jul 08 14:35:28 UTC 2026","passed","Wed Jul 08 14:35:28 UTC 2026","","","",""
"","1810","shows the ""Disable MFA"" context menu option for users with MFA enabled","Users","Wed Jul 08 14:31:44 UTC 2026","passed","Wed Jul 08 14:31:46 UTC 2026","","","",""
"","269","toggles parent from some to all","GraphDataCheckboxes","Wed Jul 08 14:31:29 UTC 2026","passed","Wed Jul 08 14:31:29 UTC 2026","","","",""
"","413","should not allow leading or trailing empty spaces","CreateUserForm","Wed Jul 08 14:30:51 UTC 2026","passed","Wed Jul 08 14:30:52 UTC 2026","","","",""
"","24","does not render the tooltip icon when tooltipText prop is not passed","ColumnHeaders","Wed Jul 08 14:32:53 UTC 2026","passed","Wed Jul 08 14:32:53 UTC 2026","","SortableHeader with Tooltip","",""
"Test cases for TestNewDefaultFileServices_ReturnsError","1","TestNewDefaultFileServices_ReturnsError","","Wed Jul 08 14:29:54 UTC 2026","passed","Wed Jul 08 14:29:54 UTC 2026","","Go Test","github.com/specterops/bloodhound/cmd/api/src/services/storage/TestNewDefaultFileServices_ReturnsError","TestNewDefaultFileServices_ReturnsError"
"Test cases for TestFloatEqual","0","TestFloatEqual","","Wed Jul 08 14:29:46 UTC 2026","passed","Wed Jul 08 14:29:46 UTC 2026","","Go Test","github.com/specterops/bloodhound/cmd/api/src/database/types/null/TestFloatEqual","TestFloatEqual"
"Test cases for TestPredefinedNodeNamePrefixes","1","TestPredefinedNodeNamePrefixes","","Wed Jul 08 14:30:08 UTC 2026","passed","Wed Jul 08 14:30:08 UTC 2026","","Go Test","github.com/specterops/bloodhound/packages/go/analysis/ad/wellknown/TestPredefinedNodeNamePrefixes","TestPredefinedNodeNamePrefixes"
"Test cases for TestAssetGroupMembers_SortBy","0","TestAssetGroupMembers_SortBy","","Wed Jul 08 14:29:29 UTC 2026","passed","Wed Jul 08 14:29:29 UTC 2026","","Go Test","github.com/specterops/bloodhound/cmd/api/src/api/TestAssetGroupMembers_SortBy","TestAssetGroupMembers_SortBy"
"","86","enables the user actions menu for a user with the administrator role","User Actions Menu","Wed Jul 08 14:32:43 UTC 2026","passed","Wed Jul 08 14:32:43 UTC 2026","","Button Menu State","",""
"Test cases for TestStringFromPtr","0","TestStringFromPtr","","Wed Jul 08 14:29:46 UTC 2026","passed","Wed Jul 08 14:29:46 UTC 2026","","Go Test","github.com/specterops/bloodhound/cmd/api/src/database/types/null/TestStringFromPtr","TestStringFromPtr"
"","297","renders","EarlyAccessFeaturesWarningDialog","Wed Jul 08 14:35:43 UTC 2026","passed","Wed Jul 08 14:35:44 UTC 2026","","","",""
"","3603","should render","Pathfinding","Wed Jul 08 14:30:50 UTC 2026","passed","Wed Jul 08 14:30:53 UTC 2026","","","",""
"","170","closes the dialog when the ""Cancel"" button is clicked","SchemaUploadDialog","Wed Jul 08 14:31:31 UTC 2026","passed","Wed Jul 08 14:31:31 UTC 2026","","","",""
"","665","renders group and tenant dropdown selectors","GroupManagement","Wed Jul 08 14:35:28 UTC 2026","passed","Wed Jul 08 14:35:29 UTC 2026","","","",""
"","574","adds node to asset group tag with confirmation","AssetGroupMenuItem","Wed Jul 08 14:32:04 UTC 2026","passed","Wed Jul 08 14:32:05 UTC 2026","","","",""
"Test cases for TestResources_CreateSavedQuery_NotAUserAuth","0","TestResources_CreateSavedQuery_NotAUserAuth","","Wed Jul 08 14:29:40 UTC 2026","passed","Wed Jul 08 14:29:40 UTC 2026","","Go Test","github.com/specterops/bloodhound/cmd/api/src/api/v2/TestResources_CreateSavedQuery_NotAUserAuth","TestResources_CreateSavedQuery_NotAUserAuth"
"","3","returns the node_keys from the graphData with duplicate keys removed and known keys added","getExploreTableData","Wed Jul 08 14:32:59 UTC 2026","passed","Wed Jul 08 14:32:59 UTC 2026","","","",""
"","66","sets primarySearch, searchType, exploreSearchTab in URL params when the click handler is executed","useEdgeInfoItems","Wed Jul 08 14:33:17 UTC 2026","passed","Wed Jul 08 14:33:17 UTC 2026","","","",""
"Test cases for TestFloatFrom","0","TestFloatFrom","","Wed Jul 08 14:29:46 UTC 2026","passed","Wed Jul 08 14:29:46 UTC 2026","","Go Test","github.com/specterops/bloodhound/cmd/api/src/database/types/null/TestFloatFrom","TestFloatFrom"
"","321","should render a SaveQueryDialog","SaveQueryDialog","Wed Jul 08 14:30:21 UTC 2026","passed","Wed Jul 08 14:30:21 UTC 2026","","","",""
"Test cases for TestNewRewriter","0","TestNewRewriter","","Wed Jul 08 14:29:48 UTC 2026","passed","Wed Jul 08 14:29:48 UTC 2026","","Go Test","github.com/specterops/bloodhound/cmd/api/src/queries/TestNewRewriter","TestNewRewriter"
"","53","adds a notification - checks values","AppNotifications","Wed Jul 08 14:33:44 UTC 2026","passed","Wed Jul 08 14:33:44 UTC 2026","","","",""
"","138","renders a button for opening the dialog","SchemaUploadDialog","Wed Jul 08 14:31:30 UTC 2026","passed","Wed Jul 08 14:31:31 UTC 2026","","","",""
"","1","handles percent values by multiplying by 100, truncating to an integer, and adding a ""%"" to the end","Formatting number properties","Wed Jul 08 14:32:04 UTC 2026","passed","Wed Jul 08 14:32:04 UTC 2026","","","",""
"","271","AZRole information panel will not display a section for PIM Assignments","EntityInfoContent","Wed Jul 08 14:32:49 UTC 2026","passed","Wed Jul 08 14:32:50 UTC 2026","","","",""
"Test cases for TestIsErrorResponse","0","TestIsErrorResponse","","Wed Jul 08 14:29:29 UTC 2026","passed","Wed Jul 08 14:29:29 UTC 2026","","Go Test","github.com/specterops/bloodhound/cmd/api/src/api/TestIsErrorResponse","TestIsErrorResponse"
"","124","disables the Columns button when the disabled prop is true","ManageColumnsComboBox","Wed Jul 08 14:31:58 UTC 2026","passed","Wed Jul 08 14:31:58 UTC 2026","","","",""
"","8","displays a pulsing indicator","StatusIndicator","Wed Jul 08 14:34:36 UTC 2026","passed","Wed Jul 08 14:34:36 UTC 2026","","","",""
"","4642","closes explore search tab menu when search returns one node, entity info panel remains open","CypherSearch","Wed Jul 08 14:31:15 UTC 2026","passed","Wed Jul 08 14:31:20 UTC 2026","","Minimize explorer page elements when multiple nodes are returned","",""
"Test cases for TestResources_GetDatabaseCompleteness","58","TestResources_GetDatabaseCompleteness","","Wed Jul 08 14:29:40 UTC 2026","passed","Wed Jul 08 14:29:40 UTC 2026","","Go Test","github.com/specterops/bloodhound/cmd/api/src/api/v2/TestResources_GetDatabaseCompleteness","TestResources_GetDatabaseCompleteness"
"Test cases for TestWriteBinaryResponse","0","TestWriteBinaryResponse","","Wed Jul 08 14:29:29 UTC 2026","passed","Wed Jul 08 14:29:29 UTC 2026","","Go Test","github.com/specterops/bloodhound/cmd/api/src/api/TestWriteBinaryResponse","TestWriteBinaryResponse"
"Test cases for TestResources_ListADDomainContainedOUs","0","TestResources_ListADDomainContainedOUs","","Wed Jul 08 14:29:40 UTC 2026","passed","Wed Jul 08 14:29:40 UTC 2026","","Go Test","github.com/specterops/bloodhound/cmd/api/src/api/v2/TestResources_ListADDomainContainedOUs","TestResources_ListADDomainContainedOUs"
"","13","should recognize active directory properties","validating a node property against the shared generated schema","Wed Jul 08 14:32:04 UTC 2026","passed","Wed Jul 08 14:32:04 UTC 2026","","","",""
"","502","calls onSave without current password when requireCurrentPassword is false","PasswordDialog","Wed Jul 08 14:30:59 UTC 2026","passed","Wed Jul 08 14:30:59 UTC 2026","","","",""
"","0","Origin label and sizing are used when specified","copySigmaNodesToGraphlibGraph","Wed Jul 08 14:35:31 UTC 2026","passed","Wed Jul 08 14:35:31 UTC 2026","","","",""
"Test cases for TestTextUnmarshalInt","0","TestTextUnmarshalInt","","Wed Jul 08 14:29:46 UTC 2026","passed","Wed Jul 08 14:29:46 UTC 2026","","Go Test","github.com/specterops/bloodhound/cmd/api/src/database/types/null/TestTextUnmarshalInt","TestTextUnmarshalInt"
"","117","calls onConfirm when confirm button clicked","EarlyAccessFeaturesWarningDialog","Wed Jul 08 14:35:44 UTC 2026","passed","Wed Jul 08 14:35:44 UTC 2026","","","",""
"","24","upon selecting a source and destination node, updates the URL with a searchType of 'pathfinding' and the object ids for the source and destination nodes","usePathfindingSearch","Wed Jul 08 14:32:36 UTC 2026","passed","Wed Jul 08 14:32:36 UTC 2026","","","",""
"","51","Gets focus on keyboard shortcut","SearchBar","Wed Jul 08 14:34:33 UTC 2026","passed","Wed Jul 08 14:34:33 UTC 2026","","","",""
"TestIsValidateGooseTimeStamp to validate different cases of this prefix requirement","1","TestIsValidateGooseTimeStamp","","Wed Jul 08 14:29:45 UTC 2026","passed","Wed Jul 08 14:29:45 UTC 2026","","Go Test","github.com/specterops/bloodhound/cmd/api/src/database/migration/TestIsValidateGooseTimeStamp","TestIsValidateGooseTimeStamp"
"Test cases for TestManagementResource_ListPermissions_SortingError","0","TestManagementResource_ListPermissions_SortingError","","Wed Jul 08 14:29:47 UTC 2026","passed","Wed Jul 08 14:29:47 UTC 2026","","Go Test","github.com/specterops/bloodhound/cmd/api/src/api/v2/auth/TestManagementResource_ListPermissions_SortingError","TestManagementResource_ListPermissions_SortingError"
"Test cases for TestConvertAzureResourceGroupContributorToRels","0","TestConvertAzureResourceGroupContributorToRels","","Wed Jul 08 14:30:09 UTC 2026","passed","Wed Jul 08 14:30:09 UTC 2026","","Go Test","github.com/specterops/bloodhound/packages/go/ein/TestConvertAzureResourceGroupContributorToRels","TestConvertAzureResourceGroupContributorToRels"
"","35","renders highlight for the active tag","SelectedHighlight","Wed Jul 08 14:34:01 UTC 2026","passed","Wed Jul 08 14:34:01 UTC 2026","","","",""
"","3","returns true when WebGL is available in the current browser context","WebGL compatibility check","Wed Jul 08 14:34:51 UTC 2026","passed","Wed Jul 08 14:34:51 UTC 2026","","","",""
"Test cases for TestWriteResultRawJson","0","TestWriteResultRawJson","","Wed Jul 08 14:30:08 UTC 2026","passed","Wed Jul 08 14:30:08 UTC 2026","","Go Test","github.com/specterops/bloodhound/cmd/api/src/utils/TestWriteResultRawJson","TestWriteResultRawJson"
"Test cases for TestResources_CreateAssetGroup","0","TestResources_CreateAssetGroup","","Wed Jul 08 14:29:40 UTC 2026","passed","Wed Jul 08 14:29:40 UTC 2026","","Go Test","github.com/specterops/bloodhound/cmd/api/src/api/v2/TestResources_CreateAssetGroup","TestResources_CreateAssetGroup"
"","29","renders correctly when an unexpected nodeType is passed","NodeIcon","Wed Jul 08 14:34:09 UTC 2026","passed","Wed Jul 08 14:34:09 UTC 2026","","","",""
"","882","displays validation error messages when password does not meet requirements","PasswordDialog","Wed Jul 08 14:30:55 UTC 2026","passed","Wed Jul 08 14:30:56 UTC 2026","","","",""
"","139","respects openIndex (default opened panel)","<DetailsAccordion />","Wed Jul 08 14:31:58 UTC 2026","passed","Wed Jul 08 14:31:58 UTC 2026","","","",""
"","90","indicates the code container is scrollable when the code is unwrapped","CodeController","Wed Jul 08 14:34:28 UTC 2026","passed","Wed Jul 08 14:34:28 UTC 2026","","","",""
